,TreeID,qLegalStatus,qSpecies,qAddress,SiteOrder,qSiteInfo,qCaretaker,PlantDate,DBH,PlotSize,Latitude,Longitude,Genus,ScientificName,CommonName,Year,Date,Age
2,43163,DPW Maintained,Acacia melanoxylon :: Blackwood Acacia,222 Madison St,1.0,Sidewalk: Curb side : Cutout,Private,7/11/00 0:00,8,,37.72603642,-122.4226902,Acacia,Acacia melanoxylon,Blackwood Acacia,2000,2000-07-11 00:00:00,24
10,94792,DPW Maintained,Maytenus boaria :: Mayten,2 Laurel St,4.0,Sidewalk: Curb side : Cutout,Private,11/8/10 0:00,13,,37.79098842,-122.4508487,Maytenus,Maytenus boaria,Mayten,2010,2010-11-08 00:00:00,14
13,29149,DPW Maintained,Lophostemon confertus :: Brisbane Box,301X Jones St,1.0,Sidewalk: Curb side : Cutout,DPW,6/13/15 0:00,3,3x3,37.7839498,-122.4126863,Lophostemon,Lophostemon confertus,Brisbane Box,2015,2015-06-13 00:00:00,9
14,82688,DPW Maintained,Crataegus laevigata :: English Hawthorn,1875 38th Ave,1.0,Sidewalk: Curb side : Cutout,Private,6/30/08 0:00,2,3x3,37.75197824,-122.4968327,Crataegus,Crataegus laevigata,English Hawthorn,2008,2008-06-30 00:00:00,16
18,30326,DPW Maintained,Tristaniopsis laurina :: Swamp Myrtle,946 Capitol Ave,1.0,Sidewalk: Curb side : Cutout,Private,10/13/17 11:13,3,,37.71906925,-122.4591242,Tristaniopsis,Tristaniopsis laurina,Swamp Myrtle,2017,2017-10-13 11:13:00,7
21,106947,DPW Maintained,Prunus cerasifera :: Cherry Plum,2710 Baker St,2.0,Sidewalk: Curb side : Cutout,Private,7/2/14 0:00,1,3x3,37.79606292,-122.4453857,Prunus,Prunus cerasifera,Cherry Plum,2014,2014-07-02 00:00:00,10
27,46353,DPW Maintained,Magnolia grandiflora :: Southern Magnolia,2900 Washington St,2.0,Sidewalk: Curb side : Cutout,Private,2/27/02 0:00,8,,37.79078673,-122.4412931,Magnolia,Magnolia grandiflora,Southern Magnolia,2002,2002-02-27 00:00:00,22
28,41683,Permitted Site,Pyrus kawakamii :: Evergreen Pear,68 Mars St,1.0,Sidewalk: Curb side : Cutout,Private,6/19/00 0:00,10,,37.76097966,-122.4446096,Pyrus,Pyrus kawakamii,Evergreen Pear,2000,2000-06-19 00:00:00,24
29,89070,DPW Maintained,Laurus nobilis :: Sweet Bay: Grecian Laurel,610 18th Ave,1.0,Sidewalk: Curb side : Cutout,DPW,3/3/08 0:00,2,3x3,37.77639009,-122.4768635,Laurus,Laurus nobilis,Sweet Bay: Grecian Laurel,2008,2008-03-03 00:00:00,16
31,89610,DPW Maintained,Tristaniopsis laurina 'Elegant' :: Small-leaf Tristania 'Elegant',4201X Anza St,2.0,Sidewalk: Curb side : Cutout,DPW,11/5/15 7:01,3,3x3,37.77769248,-122.4933791,Tristaniopsis,Tristaniopsis laurina,Small-leaf Tristania 'Elegant',2015,2015-11-05 07:01:00,9
42,167503,Permitted Site,Leptospermum laevigatum :: Australian Tea Tree,3512 16th St,1.0,Sidewalk: Curb side : Cutout,Private,8/16/18 0:00,3,3x3,37.76441456,-122.4314733,Leptospermum,Leptospermum laevigatum,Australian Tea Tree,2018,2018-08-16 00:00:00,6
44,84674,Permitted Site,Prunus serrulata 'Kwanzan' :: Kwanzan Flowering Cherry,4045 24th St,1.0,Sidewalk: Curb side : Cutout,Private,12/27/12 0:00,4,3x3,37.75130564,-122.4328702,Prunus,Prunus serrulata,Kwanzan Flowering Cherry,2012,2012-12-27 00:00:00,12
46,10331,Permitted Site,Prunus serrulata 'Kwanzan' :: Kwanzan Flowering Cherry,838 Haight St,1.0,Sidewalk: Curb side : Cutout,Private,4/12/07 0:00,8,5x5,37.77167675,-122.4361039,Prunus,Prunus serrulata,Kwanzan Flowering Cherry,2007,2007-04-12 00:00:00,17
47,57298,Permitted Site,Ficus nitida :: Laurel Fig,3120 16th St,1.0,Sidewalk: Curb side : Cutout,Private,8/27/76 0:00,20,5x5,37.76495791,-122.4224007,Ficus,Ficus nitida,Laurel Fig,1976,1976-08-27 00:00:00,48
49,108783,DPW Maintained,Arbutus unedo :: Strawberry Tree,2055 Sunnydale Ave,5.0,Sidewalk: Curb side : Cutout,SFUSD,1/6/15 0:00,3,3x3,37.71364778,-122.4224308,Arbutus,Arbutus unedo,Strawberry Tree,2015,2015-01-06 00:00:00,9
50,55091,DPW Maintained,Callistemon citrinus :: Lemon Bottlebrush,526 16th Ave,1.0,Sidewalk: Curb side : Cutout,Private,9/12/72 0:00,9,,37.77806161,-122.4748418,Callistemon,Callistemon citrinus,Lemon Bottlebrush,1972,2072-09-12 00:00:00,-48
52,88336,DPW Maintained,Pyrus calleryana :: Ornamental Pear,554 Naples St,2.0,Sidewalk: Curb side : Cutout,Private,7/10/08 0:00,8,3x3,37.72000186,-122.4319386,Pyrus,Pyrus calleryana,Ornamental Pear,2008,2008-07-10 00:00:00,16
54,266554,Section 806 (d),Melaleuca quinquenervia :: Cajeput,2775 Market St,2.0,Sidewalk: Curb side : Cutout,Private,10/13/21 0:00,3,3x3,37.76136095,-122.4392648,Melaleuca,Melaleuca quinquenervia,Cajeput,2021,2021-10-13 00:00:00,3
59,43663,DPW Maintained,Callistemon citrinus :: Lemon Bottlebrush,646 11th Ave,1.0,Sidewalk: Curb side : Cutout,Private,7/25/00 0:00,3,,37.77608334,-122.4692206,Callistemon,Callistemon citrinus,Lemon Bottlebrush,2000,2000-07-25 00:00:00,24
62,6843,Permitted Site,Hymenosporum flavum :: Sweet Shade,1445 FAIRFAX AVE,1.0,Sidewalk: Curb side : Cutout,Private,3/14/07 0:00,6,3X3,37.74047206,-122.3865874,Hymenosporum,Hymenosporum flavum,Sweet Shade,2007,2007-03-14 00:00:00,17
68,90708,DPW Maintained,Yucca elephantipes :: Giant Yucca,4400 Cabrillo St,1.0,Sidewalk: Curb side : Cutout,DPW,4/7/08 0:00,3,3x3,37.77350962,-122.5057833,Yucca,Yucca elephantipes,Giant Yucca,2008,2008-04-07 00:00:00,16
70,26049,DPW Maintained,Tristaniopsis laurina :: Swamp Myrtle,136 Broad St,1.0,Sidewalk: Curb side : Cutout,Private,3/10/07 0:00,3,3X3,37.71326115,-122.4573902,Tristaniopsis,Tristaniopsis laurina,Swamp Myrtle,2007,2007-03-10 00:00:00,17
75,111742,DPW Maintained,Eriobotrya deflexa :: Bronze Loquat,1751 Balboa St,3.0,Sidewalk: Curb side : Cutout,Private,1/28/16 0:00,3,3x3,37.77653303,-122.4777297,Eriobotrya,Eriobotrya deflexa,Bronze Loquat,2016,2016-01-28 00:00:00,8
93,258210,Permitted Site,Cordyline australis :: Dracena Palm,1847 43rd Ave,,Sidewalk: Curb side : Cutout,Private,4/17/19 0:00,3,3x3,37.75222364,-122.5021985,Cordyline,Cordyline australis,Dracena Palm,2019,2019-04-17 00:00:00,5
94,86344,DPW Maintained,Arbutus 'Marina' :: Hybrid Strawberry Tree,2363 25th Ave,1.0,Sidewalk: Curb side : Cutout,DPW,12/18/06 0:00,3,3x3,37.74347936,-122.4822505,Arbutus,Arbutus 'Marina',Hybrid Strawberry Tree,2006,2006-12-18 00:00:00,18
97,5922,Permitted Site,Lophostemon confertus :: Brisbane Box,1300X Eddy St,5.0,Sidewalk: Curb side : Cutout,Private,5/7/92 0:00,12,4X4,37.78206203,-122.4296075,Lophostemon,Lophostemon confertus,Brisbane Box,1992,1992-05-07 00:00:00,32
100,110156,DPW Maintained,Ginkgo biloba :: Maidenhair Tree,1041 Broadway,2.0,Sidewalk: Curb side : Cutout,Private,3/25/15 0:00,3,3x3,37.79683937,-122.4142918,Ginkgo,Ginkgo biloba,Maidenhair Tree,2015,2015-03-25 00:00:00,9
108,16957,DPW Maintained,Tristaniopsis laurina :: Swamp Myrtle,673 Oak St,2.0,Sidewalk: Curb side : Cutout,DPW,1/25/08 0:00,3,3X3,37.77398518,-122.4301281,Tristaniopsis,Tristaniopsis laurina,Swamp Myrtle,2008,2008-01-25 00:00:00,16
110,67486,DPW Maintained,Pittosporum undulatum :: Victorian Box,617 Wisconsin St,1.0,Sidewalk: Curb side : Cutout,Private,9/8/92 0:00,6,,37.75926202,-122.3990347,Pittosporum,Pittosporum undulatum,Victorian Box,1992,1992-09-08 00:00:00,32
111,92244,DPW Maintained,Tristaniopsis laurina :: Swamp Myrtle,1510 32nd Ave,2.0,Sidewalk: Curb side : Cutout,Private,7/23/09 0:00,1,3x3,37.75896284,-122.4907049,Tristaniopsis,Tristaniopsis laurina,Swamp Myrtle,2009,2009-07-23 00:00:00,15
112,15201,DPW Maintained,Lophostemon confertus :: Brisbane Box,1120 Mission St,4.0,Sidewalk: Curb side : Cutout,DPW,4/12/95 0:00,6,3X3,37.77888219,-122.4114764,Lophostemon,Lophostemon confertus,Brisbane Box,1995,1995-04-12 00:00:00,29
120,1509,DPW Maintained,Pittosporum undulatum :: Victorian Box,364 Arguello Blvd,1.0,Sidewalk: Curb side : Cutout,DPW,10/15/96 0:00,9,3X3,37.78454089,-122.4587286,Pittosporum,Pittosporum undulatum,Victorian Box,1996,1996-10-15 00:00:00,28
124,22038,DPW Maintained,Lophostemon confertus :: Brisbane Box,2895 03rd St,6.0,Sidewalk: Curb side : Cutout,DPW,2/14/95 0:00,3,3X3,37.75340073,-122.3876708,Lophostemon,Lophostemon confertus,Brisbane Box,1995,1995-02-14 00:00:00,29
125,93324,DPW Maintained,Fraxinus americana 'Autumn Purple' :: American Autumn Purple Ash,2100X Turk Blvd,7.0,Sidewalk: Curb side : Cutout,DPW,11/20/08 0:00,3,3x3,37.77931477,-122.4437504,Fraxinus,Fraxinus americana,American Autumn Purple Ash,2008,2008-11-20 00:00:00,16
126,68331,DPW Maintained,Acacia melanoxylon :: Blackwood Acacia,2338 Anza St,1.0,Sidewalk: Curb side : Cutout,Private,8/9/93 0:00,9,,37.77874487,-122.4734554,Acacia,Acacia melanoxylon,Blackwood Acacia,1993,1993-08-09 00:00:00,31
133,57164,DPW Maintained,Pittosporum undulatum :: Victorian Box,2989 Jackson St,1.0,Sidewalk: Curb side : Cutout,Private,10/26/74 0:00,15,,37.79116984,-122.4443019,Pittosporum,Pittosporum undulatum,Victorian Box,1974,1974-10-26 00:00:00,50
135,10479,DPW Maintained,Lophostemon confertus :: Brisbane Box,1654 Haight St,1.0,Sidewalk: Curb side : Cutout,DPW,12/2/07 0:00,12,3X3,37.769751,-122.4494797,Lophostemon,Lophostemon confertus,Brisbane Box,2007,2007-12-02 00:00:00,17
141,31815,DPW Maintained,Ginkgo biloba :: Maidenhair Tree,47 Scott St,1.0,Sidewalk: Curb side : Cutout,Private,6/19/95 0:00,3,,37.7697757,-122.435117,Ginkgo,Ginkgo biloba,Maidenhair Tree,1995,1995-06-19 00:00:00,29
144,136801,DPW Maintained,Tristaniopsis laurina 'Elegant' :: Small-leaf Tristania 'Elegant',1908 Baker St,1.0,Sidewalk: Curb side : Cutout,Private,2/16/18 0:00,3,Width 4ft,37.78893725,-122.4439304,Tristaniopsis,Tristaniopsis laurina,Small-leaf Tristania 'Elegant',2018,2018-02-16 00:00:00,6
150,63002,DPW Maintained,Magnolia grandiflora :: Southern Magnolia,1247 42nd Ave,1.0,Sidewalk: Curb side : Cutout,Private,9/22/86 0:00,2,,37.76335092,-122.5019086,Magnolia,Magnolia grandiflora,Southern Magnolia,1986,1986-09-22 00:00:00,38
159,256115,Planning Code 138.1 required,Arbutus 'Marina' :: Hybrid Strawberry Tree,503 Anderson St,1.0,Sidewalk: Curb side : Cutout,Private,9/12/18 0:00,3,3x3,37.73711377,-122.4152742,Arbutus,Arbutus 'Marina',Hybrid Strawberry Tree,2018,2018-09-12 00:00:00,6
160,8671,DPW Maintained,Tristaniopsis laurina :: Swamp Myrtle,2900 Geary Blvd,3.0,Sidewalk: Curb side : Cutout,Private,2/22/96 0:00,7,3X3,37.78220247,-122.4504931,Tristaniopsis,Tristaniopsis laurina,Swamp Myrtle,1996,1996-02-22 00:00:00,28
171,56411,DPW Maintained,Ficus microcarpa nitida 'Green Gem' :: Indian Laurel Fig Tree 'Green Gem',118 18th Ave,1.0,Sidewalk: Curb side : Cutout,Private,8/20/73 0:00,14,,37.78564138,-122.4775333,Ficus,Ficus microcarpa,Indian Laurel Fig Tree 'Green Gem',1973,2073-08-20 00:00:00,-49
177,86439,DPW Maintained,Prunus serrulata :: Ornamental Cherry,2550 27th Ave,1.0,Sidewalk: Curb side : Cutout,DPW,12/29/06 0:00,3,3x3,37.73986094,-122.4839842,Prunus,Prunus serrulata,Ornamental Cherry,2006,2006-12-29 00:00:00,18
178,235870,Permitted Site,Prunus cerasifera :: Cherry Plum,619 York St,1.0,Sidewalk: Curb side : Cutout,Private,5/10/94 0:00,7,Width 3ft,37.76124092,-122.4089886,Prunus,Prunus cerasifera,Cherry Plum,1994,1994-05-10 00:00:00,30
183,86159,DPW Maintained,Arbutus 'Marina' :: Hybrid Strawberry Tree,1235 24th Ave,1.0,Sidewalk: Curb side : Cutout,DPW,1/19/07 0:00,3,3x3,37.7644623,-122.4826285,Arbutus,Arbutus 'Marina',Hybrid Strawberry Tree,2007,2007-01-19 00:00:00,17
192,37189,DPW Maintained,Pittosporum undulatum :: Victorian Box,1486 30th Ave,1.0,Sidewalk: Curb side : Cutout,Private,4/12/01 0:00,5,,37.75957389,-122.488576,Pittosporum,Pittosporum undulatum,Victorian Box,2001,2001-04-12 00:00:00,23
199,209652,Permitted Site,Maytenus boaria :: Mayten,542 Moraga St,1.0,Sidewalk: Curb side : Cutout,Private,5/17/73 0:00,10,Width 3ft,37.75653473,-122.4686951,Maytenus,Maytenus boaria,Mayten,1973,2073-05-17 00:00:00,-49
208,113643,Planning Code 138.1 required,Lophostemon confertus :: Brisbane Box,1400 MISSION ST,5.0,Sidewalk: Curb side : Cutout,Private,2/9/16 0:00,3,4x6,37.77527096,-122.4159838,Lophostemon,Lophostemon confertus,Brisbane Box,2016,2016-02-09 00:00:00,8
214,5026,DPW Maintained,Metrosideros excelsa :: New Zealand Xmas Tree,5320 Diamond Heights Blvd,10.0,Sidewalk: Curb side : Cutout,Private,1/6/92 0:00,3,2X2,37.74277322,-122.436671,Metrosideros,Metrosideros excelsa,New Zealand Xmas Tree,1992,1992-01-06 00:00:00,32
218,184542,Permitted Site,Metrosideros excelsa :: New Zealand Xmas Tree,1701 40th Ave,1.0,Sidewalk: Curb side : Cutout,Private,2/13/18 0:00,3,3x3,37.75497106,-122.4991718,Metrosideros,Metrosideros excelsa,New Zealand Xmas Tree,2018,2018-02-13 00:00:00,6
226,24492,Permitted Site,Lophostemon confertus :: Brisbane Box,495X Fell St,6.0,Sidewalk: Curb side : Cutout,Private,6/24/95 0:00,6,3X3,37.77560902,-122.4249888,Lophostemon,Lophostemon confertus,Brisbane Box,1995,1995-06-24 00:00:00,29
227,177596,DPW Maintained,Metrosideros excelsa :: New Zealand Xmas Tree,2969 Alemany Blvd,1.0,Sidewalk: Curb side : Cutout,DPW,1/30/18 0:00,17,Width 2ft,37.71136852,-122.4526619,Metrosideros,Metrosideros excelsa,New Zealand Xmas Tree,2018,2018-01-30 00:00:00,6
231,45763,DPW Maintained,Liquidambar styraciflua :: American Sweet Gum,3954 Washington St,1.0,Sidewalk: Curb side : Cutout,Private,10/23/01 0:00,5,,37.78861457,-122.4583124,Liquidambar,Liquidambar styraciflua,American Sweet Gum,2001,2001-10-23 00:00:00,23
237,49525,DPW Maintained,Lophostemon confertus :: Brisbane Box,575@ DIVISION 10th St,4.0,Sidewalk: Curb side : Cutout,Private,4/23/03 0:00,7,,37.76969642,-122.4087483,Lophostemon,Lophostemon confertus,Brisbane Box,2003,2003-04-23 00:00:00,21
250,40189,DPW Maintained,Acacia baileyana :: Bailey's Acacia,600 Silliman St,2.0,Sidewalk: Curb side : Cutout,Private,4/30/99 0:00,8,,37.72969602,-122.4112413,Acacia,Acacia baileyana,Bailey's Acacia,1999,1999-04-30 00:00:00,25
262,175507,DPW Maintained,Arbutus 'Marina' :: Hybrid Strawberry Tree,95 Gladstone Dr,3.0,Sidewalk: Property side : Yard,Private,6/16/21 0:00,3,Width 3ft,37.72939087,-122.4210958,Arbutus,Arbutus 'Marina',Hybrid Strawberry Tree,2021,2021-06-16 00:00:00,3
263,13795,DPW Maintained,Platanus x hispanica :: Sycamore: London Plane,929 Market St,4.0,Sidewalk: Curb side : Cutout,DPW,9/12/93 0:00,30,3X3,37.78339759,-122.4085601,Platanus,Platanus x,Sycamore: London Plane,1993,1993-09-12 00:00:00,31
264,30362,DPW Maintained,Pittosporum undulatum :: Victorian Box,606 Arkansas St,1.0,Sidewalk: Curb side : Cutout,Private,3/2/56 0:00,11,,37.75852471,-122.3981897,Pittosporum,Pittosporum undulatum,Victorian Box,1956,2056-03-02 00:00:00,-32
269,253547,DPW Maintained,Olea europaea :: Olive Tree,1000 Cayuga Ave,15.0,Back Yard : Yard,DPW,9/27/17 11:40,3,3x3,37.72207681,-122.4398369,Olea,Olea europaea,Olive Tree,2017,2017-09-27 11:40:00,7
270,52707,DPW Maintained,Prunus x yedoensis :: Yoshino Cherry,1@ JACKSON Cherry St,4.0,Sidewalk: Curb side : Cutout,Private,3/31/06 0:00,7,,37.7898597,-122.4575512,Prunus,Prunus x,Yoshino Cherry,2006,2006-03-31 00:00:00,18
271,83366,DPW Maintained,Magnolia grandiflora 'Little Gem' :: Little Gem Magnolia,618 Athens St,2.0,Sidewalk: Curb side : Cutout,Private,7/1/09 0:00,3,3x3,37.71820238,-122.4311201,Magnolia,Magnolia grandiflora,Little Gem Magnolia,2009,2009-07-01 00:00:00,15
272,43761,DPW Maintained,Liquidambar styraciflua :: American Sweet Gum,364 17th Ave,1.0,Sidewalk: Curb side : Cutout,Private,7/26/00 0:00,5,,37.78122955,-122.4761315,Liquidambar,Liquidambar styraciflua,American Sweet Gum,2000,2000-07-26 00:00:00,24
275,25779,DPW Maintained,Arbutus 'Marina' :: Hybrid Strawberry Tree,1711 Geneva Ave,1.0,Sidewalk: Curb side : Cutout,DPW,4/18/97 0:00,18,2X3,37.7111607,-122.426399,Arbutus,Arbutus 'Marina',Hybrid Strawberry Tree,1997,1997-04-18 00:00:00,27
279,10545,DPW Maintained,Lophostemon confertus :: Brisbane Box,165 Harbor Rd,2.0,Sidewalk: Curb side : Cutout,DPW,2/12/92 0:00,12,3X4,37.732451,-122.3785079,Lophostemon,Lophostemon confertus,Brisbane Box,1992,1992-02-12 00:00:00,32
280,51059,DPW Maintained,Magnolia grandiflora :: Southern Magnolia,1751 Newcomb Ave,1.0,Sidewalk: Curb side : Cutout,Private,7/9/04 0:00,6,,37.73679169,-122.3926933,Magnolia,Magnolia grandiflora,Southern Magnolia,2004,2004-07-09 00:00:00,20
282,45648,DPW Maintained,Prunus cerasifera :: Cherry Plum,161 Naples St,1.0,Sidewalk: Curb side : Cutout,Private,10/27/05 0:00,3,,37.7261072,-122.4271553,Prunus,Prunus cerasifera,Cherry Plum,2005,2005-10-27 00:00:00,19
286,92462,DPW Maintained,Arbutus 'Marina' :: Hybrid Strawberry Tree,3445 Lawton St,4.0,Sidewalk: Curb side : Cutout,Private,7/30/09 0:00,2,3x3,37.75686541,-122.4999649,Arbutus,Arbutus 'Marina',Hybrid Strawberry Tree,2009,2009-07-30 00:00:00,15
291,23044,DPW Maintained,Metrosideros excelsa :: New Zealand Xmas Tree,1000 Valencia St,3.0,Sidewalk: Curb side : Cutout,DPW,2/1/95 0:00,18,3x3,37.75668817,-122.4212589,Metrosideros,Metrosideros excelsa,New Zealand Xmas Tree,1995,1995-02-01 00:00:00,29
293,119272,Permitted Site,Arbutus unedo :: Strawberry Tree,1101 Clay St,2.0,Sidewalk: Curb side : Cutout,Private,7/27/16 0:00,3,3x3,37.79356851,-122.4111998,Arbutus,Arbutus unedo,Strawberry Tree,2016,2016-07-27 00:00:00,8
296,42162,DPW Maintained,Olea europaea :: Olive Tree,1407 Cabrillo St,1.0,Sidewalk: Curb side : Cutout,Private,6/21/00 0:00,8,,37.77484119,-122.4737999,Olea,Olea europaea,Olive Tree,2000,2000-06-21 00:00:00,24
314,138948,DPW Maintained,Platanus x hispanica :: Sycamore: London Plane,738 HAYES ST,1.0,Sidewalk: Curb side : Cutout,Private,8/7/08 0:00,4,Width 0ft,37.7762322,-122.4286181,Platanus,Platanus x,Sycamore: London Plane,2008,2008-08-07 00:00:00,16
315,44181,DPW Maintained,Pittosporum undulatum :: Victorian Box,3731 Scott St,1.0,Sidewalk: Curb side : Cutout,Private,12/15/00 0:00,8,,37.80435416,-122.4421061,Pittosporum,Pittosporum undulatum,Victorian Box,2000,2000-12-15 00:00:00,24
327,91747,DPW Maintained,Pistacia chinensis :: Chinese Pistache,2600 Harrison St,2.0,Sidewalk: Curb side : Cutout,DPW,3/7/07 0:00,3,3x3,37.75578034,-122.4122624,Pistacia,Pistacia chinensis,Chinese Pistache,2007,2007-03-07 00:00:00,17
329,43773,DPW Maintained,Pittosporum undulatum :: Victorian Box,103 19th Ave,5.0,Sidewalk: Curb side : Cutout,Private,7/26/00 0:00,6,,37.78567623,-122.478781,Pittosporum,Pittosporum undulatum,Victorian Box,2000,2000-07-26 00:00:00,24
331,102923,DPW Maintained,Pittosporum undulatum :: Victorian Box,1461 Pine St,1.0,Sidewalk: Curb side : Cutout,Private,3/12/13 0:00,1,3x3,37.78962626,-122.4198788,Pittosporum,Pittosporum undulatum,Victorian Box,2013,2013-03-12 00:00:00,11
334,66134,DPW Maintained,Magnolia grandiflora 'Little Gem' :: Little Gem Magnolia,3259 Baker St,1.0,Sidewalk: Curb side : Cutout,Private,11/17/11 0:00,3,,37.80126871,-122.4465906,Magnolia,Magnolia grandiflora,Little Gem Magnolia,2011,2011-11-17 00:00:00,13
335,32556,DPW Maintained,Agonis flexuosa :: Peppermint Willow,233 Liberty St,1.0,Sidewalk: Curb side : Cutout,Private,10/22/96 0:00,7,,37.75731405,-122.4265636,Agonis,Agonis flexuosa,Peppermint Willow,1996,1996-10-22 00:00:00,28
337,92291,DPW Maintained,Prunus serrulata :: Ornamental Cherry,2541 21st Ave,2.0,Sidewalk: Curb side : Cutout,Private,7/27/09 0:00,2,3x3,37.74023949,-122.4777217,Prunus,Prunus serrulata,Ornamental Cherry,2009,2009-07-27 00:00:00,15
339,44312,DPW Maintained,Prunus cerasifera :: Cherry Plum,2574 Broadway,1.0,Sidewalk: Curb side : Cutout,Private,3/2/01 0:00,5,,37.79379946,-122.4393364,Prunus,Prunus cerasifera,Cherry Plum,2001,2001-03-02 00:00:00,23
342,94213,DPW Maintained,Citrus aurantifolia 'Bearss' :: Seedless Lime,465 Missouri St,8.0,Sidewalk: Curb side : Cutout,Private,6/22/10 0:00,2,3x3,37.76055798,-122.3962357,Citrus,Citrus aurantifolia,Seedless Lime,2010,2010-06-22 00:00:00,14
343,160846,DPW Maintained,Eriobotrya deflexa :: Bronze Loquat,669 Vienna St,2.0,Sidewalk: Curb side : Cutout,Private,10/24/17 12:20,3,Width 0ft,37.7177707,-122.4323633,Eriobotrya,Eriobotrya deflexa,Bronze Loquat,2017,2017-10-24 12:20:00,7
344,103764,DPW Maintained,Prunus serrulata 'Kwanzan' :: Kwanzan Flowering Cherry,90X Frank Norris St,3.0,Sidewalk: Curb side : Cutout,DPW,11/1/09 0:00,3,3x3,37.78927035,-122.4195758,Prunus,Prunus serrulata,Kwanzan Flowering Cherry,2009,2009-11-01 00:00:00,15
351,95337,Permitted Site,Platanus x hispanica :: Sycamore: London Plane,855@Broadway Battery St,2.0,Sidewalk: Curb side : Cutout,Private,8/17/11 0:00,4,3x3,37.79909187,-122.4012351,Platanus,Platanus x,Sycamore: London Plane,2011,2011-08-17 00:00:00,13
354,42979,DPW Maintained,Syagrus romanzoffianum :: Queen Palm,308 Oxford St,1.0,Sidewalk: Curb side : Cutout,Private,7/5/00 0:00,10,,37.72596423,-122.4193796,Syagrus,Syagrus romanzoffianum,Queen Palm,2000,2000-07-05 00:00:00,24
355,35587,DPW Maintained,Prunus blireiana :: Flowering Plum,3600 Fillmore St,1.0,Sidewalk: Curb side : Cutout,Private,3/25/98 0:00,5,,37.80287197,-122.4365902,Prunus,Prunus blireiana,Flowering Plum,1998,1998-03-25 00:00:00,26
358,95966,DPW Maintained,Pittosporum undulatum :: Victorian Box,5500 Geary Blvd,1.0,Median :,DPW,3/12/11 0:00,2,,37.7805919,-122.4785275,Pittosporum,Pittosporum undulatum,Victorian Box,2011,2011-03-12 00:00:00,13
366,76145,DPW Maintained,Lophostemon confertus :: Brisbane Box,2999X Polk St,3.0,Sidewalk: Curb side : Cutout,SFUSD,11/16/96 0:00,6,4x4,37.8033776,-122.4241268,Lophostemon,Lophostemon confertus,Brisbane Box,1996,1996-11-16 00:00:00,28
370,48433,DPW Maintained,Ficus microcarpa nitida 'Green Gem' :: Indian Laurel Fig Tree 'Green Gem',1190 Sacramento St,2.0,Sidewalk: Curb side : Cutout,Private,7/26/02 0:00,10,,37.79262622,-122.4124182,Ficus,Ficus microcarpa,Indian Laurel Fig Tree 'Green Gem',2002,2002-07-26 00:00:00,22
382,86403,DPW Maintained,Tristaniopsis laurina :: Swamp Myrtle,1719 26th Ave,1.0,Sidewalk: Curb side : Cutout,DPW,12/19/06 0:00,3,3x3,37.75532907,-122.4841614,Tristaniopsis,Tristaniopsis laurina,Swamp Myrtle,2006,2006-12-19 00:00:00,18
386,90182,DPW Maintained,Eriobotrya deflexa :: Bronze Loquat,1650 Balboa St,1.0,Sidewalk: Curb side : Cutout,DPW,2/26/08 0:00,3,3x3,37.77673728,-122.4766866,Eriobotrya,Eriobotrya deflexa,Bronze Loquat,2008,2008-02-26 00:00:00,16
395,38826,DPW Maintained,Pyrus calleryana :: Ornamental Pear,35 06th Ave,2.0,Sidewalk: Curb side : Cutout,Private,10/30/98 0:00,7,,37.78789632,-122.4648636,Pyrus,Pyrus calleryana,Ornamental Pear,1998,1998-10-30 00:00:00,26
396,10385,DPW Maintained,Schinus terebinthifolius :: Brazilian Pepper,1330 Haight St,1.0,Sidewalk: Curb side : Cutout,DPW,7/17/17 0:00,24,3X3,37.77042397,-122.4441921,Schinus,Schinus terebinthifolius,Brazilian Pepper,2017,2017-07-17 00:00:00,7
403,184160,DPW Maintained,Lagunaria patersonii :: Primrose Tree,3538 Lawton St,1.0,Sidewalk: Curb side : Yard,Private,2/28/18 0:00,3,Width 0ft,37.75696922,-122.5010564,Lagunaria,Lagunaria patersonii,Primrose Tree,2018,2018-02-28 00:00:00,6
404,30985,DPW Maintained,Magnolia grandiflora :: Southern Magnolia,2021 Pacific Ave,1.0,Sidewalk: Curb side : Cutout,Private,7/7/09 0:00,4,3x3,37.7940157,-122.4289981,Magnolia,Magnolia grandiflora,Southern Magnolia,2009,2009-07-07 00:00:00,15
405,115881,DPW Maintained,Geijera parviflora :: Australian Willow,1663 La Salle Ave,1.0,Sidewalk: Curb side : Cutout,Private,3/1/16 0:00,3,,37.73741063,-122.3904598,Geijera,Geijera parviflora,Australian Willow,2016,2016-03-01 00:00:00,8
407,51372,DPW Maintained,Maytenus boaria :: Mayten,668 18th Ave,1.0,Sidewalk: Curb side : Cutout,Private,10/12/04 0:00,4,,37.77559066,-122.4768156,Maytenus,Maytenus boaria,Mayten,2004,2004-10-12 00:00:00,20
414,62400,DPW Maintained,Metrosideros excelsa :: New Zealand Xmas Tree,1080 Chestnut St,1.0,Sidewalk: Curb side : Cutout,Private,10/25/85 0:00,7,,37.80285682,-122.4208902,Metrosideros,Metrosideros excelsa,New Zealand Xmas Tree,1985,1985-10-25 00:00:00,39
416,87408,DPW Maintained,Eucalyptus sideroxylon :: Red Ironbark,2400X Van Ness Ave,2.0,Median : Cutout,DPW,4/18/08 0:00,3,3x3,37.79791069,-122.4238515,Eucalyptus,Eucalyptus sideroxylon,Red Ironbark,2008,2008-04-18 00:00:00,16
417,63523,DPW Maintained,Acacia baileyana 'Purpurea' :: Purple-leaf Acacia,929 VALENCIA ST,1.0,Sidewalk: Curb side : Cutout,DPW,9/12/15 15:22,3,3x3,37.75799017,-122.4210418,Acacia,Acacia baileyana,Purple-leaf Acacia,2015,2015-09-12 15:22:00,9
418,211747,DPW Maintained,Pittosporum undulatum :: Victorian Box,70 Forest Side Ave,1.0,Sidewalk: Curb side : Cutout,Private,3/6/17 0:00,3,Width 3ft,37.74210344,-122.4683732,Pittosporum,Pittosporum undulatum,Victorian Box,2017,2017-03-06 00:00:00,7
425,28305,DPW Maintained,Tristaniopsis laurina 'Elegant' :: Small-leaf Tristania 'Elegant',1818 San Jose Ave,1.0,Sidewalk: Curb side : Cutout,DPW,3/5/03 0:00,3,,37.72869458,-122.4403899,Tristaniopsis,Tristaniopsis laurina,Small-leaf Tristania 'Elegant',2003,2003-03-05 00:00:00,21
426,33535,Permitted Site,Schinus molle :: California Pepper,189 Bocana St,1.0,Sidewalk: Curb side : Cutout,Private,11/25/96 0:00,14,4x4,37.74083857,-122.4174927,Schinus,Schinus molle,California Pepper,1996,1996-11-25 00:00:00,28
433,42729,DPW Maintained,Pittosporum undulatum :: Victorian Box,1790 Yosemite Ave,4.0,Sidewalk: Curb side : Cutout,Private,6/26/00 0:00,9,,37.7287859,-122.3949019,Pittosporum,Pittosporum undulatum,Victorian Box,2000,2000-06-26 00:00:00,24
437,13321,Permitted Site,Ulmus parvifolia :: Chinese Elm,435X Persia Ave,1.0,Sidewalk: Curb side : Cutout,Private,12/23/97 0:00,5,3X3,37.72149258,-122.4324059,Ulmus,Ulmus parvifolia,Chinese Elm,1997,1997-12-23 00:00:00,27
439,33778,Permitted Site,Magnolia grandiflora :: Southern Magnolia,77 Beale St,9.0,Sidewalk: Curb side : Cutout,Private,1/5/15 0:00,3,3x3,37.79150508,-122.396128,Magnolia,Magnolia grandiflora,Southern Magnolia,2015,2015-01-05 00:00:00,9
450,220490,DPW Maintained,Acer rubrum :: Red Maple,3040 24th St,1.0,Sidewalk: Curb side : Cutout,DPW,12/26/12 0:00,3,Width 3ft,37.75265016,-122.4126766,Acer,Acer rubrum,Red Maple,2012,2012-12-26 00:00:00,12
460,121650,Undocumented,Arbutus 'Marina' :: Hybrid Strawberry Tree,90 Fernwood Dr,5.0,Sidewalk: Curb side : Cutout,Private,1/3/17 0:00,3,2x2,37.73291821,-122.460606,Arbutus,Arbutus 'Marina',Hybrid Strawberry Tree,2017,2017-01-03 00:00:00,7
464,30064,DPW Maintained,Pinus radiata :: Monterey Pine,510X Brotherhood Way,9.0,Median : Cutout,DPW,3/10/07 0:00,6,M,37.71247053,-122.4674296,Pinus,Pinus radiata,Monterey Pine,2007,2007-03-10 00:00:00,17
468,160336,DPW Maintained,Podocarpus gracilor :: Fern Pine,90 Italy Ave,3.0,Sidewalk: Curb side : Cutout,Private,5/22/21 0:00,3,Width 0ft,37.71814853,-122.4389831,Podocarpus,Podocarpus gracilor,Fern Pine,2021,2021-05-22 00:00:00,3
470,125408,Permitted Site,Acer rubrum :: Red Maple,830 Eddy St,2.0,Sidewalk: Curb side : Cutout,Private,11/17/15 0:00,4,Width 4ft,37.78285833,-122.4216659,Acer,Acer rubrum,Red Maple,2015,2015-11-17 00:00:00,9
475,41171,DPW Maintained,Olea europaea :: Olive Tree,14 Avila St,1.0,Sidewalk: Curb side : Cutout,Private,11/23/99 0:00,7,,37.80053798,-122.4403048,Olea,Olea europaea,Olive Tree,1999,1999-11-23 00:00:00,25
477,16686,DPW Maintained,Syagrus romanzoffianum :: Queen Palm,250X Noe St,2.0,Median : Cutout,DPW,6/6/98 0:00,3,3X3,37.76508484,-122.4331811,Syagrus,Syagrus romanzoffianum,Queen Palm,1998,1998-06-06 00:00:00,26
483,12728,DPW Maintained,Quercus agrifolia :: Coast Live Oak,1600 Lake St,2.0,Sidewalk: Curb side : Cutout,DPW,1/19/05 0:00,2,4X4,37.78624859,-122.4768032,Quercus,Quercus agrifolia,Coast Live Oak,2005,2005-01-19 00:00:00,19
493,138535,DPW Maintained,Maytenus boaria :: Mayten,1840 Post St,2.0,Sidewalk: Curb side : Cutout,DPW,4/7/98 0:00,11,Width 0ft,37.78527855,-122.4327587,Maytenus,Maytenus boaria,Mayten,1998,1998-04-07 00:00:00,26
494,92336,DPW Maintained,Tristaniopsis laurina :: Swamp Myrtle,2570 32nd Ave,1.0,Sidewalk: Curb side : Cutout,Private,7/28/09 0:00,1,3x3,37.73928609,-122.4893228,Tristaniopsis,Tristaniopsis laurina,Swamp Myrtle,2009,2009-07-28 00:00:00,15
495,35339,DPW Maintained,Syagrus romanzoffianum :: Queen Palm,740 Arkansas St,1.0,Sidewalk: Curb side : Cutout,Private,2/23/98 0:00,9,,37.75663725,-122.3979702,Syagrus,Syagrus romanzoffianum,Queen Palm,1998,1998-02-23 00:00:00,26
499,13438,DPW Maintained,Platanus x hispanica :: Sycamore: London Plane,2X Market St,6.0,Sidewalk: Curb side : Cutout,DPW,12/12/02 0:00,6,4x4,37.79432565,-122.3952546,Platanus,Platanus x,Sycamore: London Plane,2002,2002-12-12 00:00:00,22
505,23045,DPW Maintained,Ficus microcarpa nitida 'Green Gem' :: Indian Laurel Fig Tree 'Green Gem',1009 Valencia St,1.0,Sidewalk: Curb side : Cutout,Private,7/19/94 0:00,20,3X3,37.75664963,-122.4209814,Ficus,Ficus microcarpa,Indian Laurel Fig Tree 'Green Gem',1994,1994-07-19 00:00:00,30
519,5020,DPW Maintained,Metrosideros excelsa :: New Zealand Xmas Tree,5320 Diamond Heights Blvd,4.0,Sidewalk: Curb side : Cutout,Private,1/6/92 0:00,3,2X2,37.74301859,-122.4370193,Metrosideros,Metrosideros excelsa,New Zealand Xmas Tree,1992,1992-01-06 00:00:00,32
520,10865,DPW Maintained,Ulmus 'Prospector' :: Prospector Elm,1275X HUDSON AVE,4.0,Sidewalk: Curb side : Cutout,DPW,3/23/06 0:00,6,3X4,37.73410745,-122.3826385,Ulmus,Ulmus 'Prospector',Prospector Elm,2006,2006-03-23 00:00:00,18
521,82793,DPW Maintained,Arbutus 'Marina' :: Hybrid Strawberry Tree,1650 Moraga St,1.0,Sidewalk: Curb side : Cutout,Private,10/30/07 0:00,5,3x3,37.75601024,-122.4805368,Arbutus,Arbutus 'Marina',Hybrid Strawberry Tree,2007,2007-10-30 00:00:00,17
523,32714,DPW Maintained,Cupressus sempervirens :: Italian Cypress,1105 Larkin St,1.0,Sidewalk: Curb side : Cutout,Private,10/29/96 0:00,14,,37.78834369,-122.4186211,Cupressus,Cupressus sempervirens,Italian Cypress,1996,1996-10-29 00:00:00,28
526,255306,Planning Code 138.1 required,Olea europaea :: Olive Tree,1163 Shotwell St,1.0,Sidewalk: Curb side : Cutout,Private,5/8/18 0:00,3,3x6,37.74984217,-122.4148497,Olea,Olea europaea,Olive Tree,2018,2018-05-08 00:00:00,6
528,82263,Permitted Site,Pyrus calleryana 'Chanticleer' :: Ornamental Pear Tree 'Chanticleer',850 South Van Ness Ave,1.0,Sidewalk: Curb side : Cutout,Private,12/23/11 0:00,5,4x4,37.75954483,-122.4170374,Pyrus,Pyrus calleryana,Ornamental Pear Tree 'Chanticleer',2011,2011-12-23 00:00:00,13
540,45683,DPW Maintained,Ligustrum lucidum :: Glossy Privet,107 Bernard St,1.0,Sidewalk: Curb side : Cutout,Private,9/19/01 0:00,4,,37.79625956,-122.4153283,Ligustrum,Ligustrum lucidum,Glossy Privet,2001,2001-09-19 00:00:00,23
544,39524,DPW Maintained,Melaleuca quinquenervia :: Cajeput,1330 16th St,3.0,Sidewalk: Curb side : Cutout,Private,12/28/98 0:00,10,,37.76630904,-122.4001582,Melaleuca,Melaleuca quinquenervia,Cajeput,1998,1998-12-28 00:00:00,26
546,43519,DPW Maintained,Prunus cerasifera :: Cherry Plum,534 Broderick St,1.0,Sidewalk: Curb side : Cutout,Private,7/19/00 0:00,5,,37.77529897,-122.4395004,Prunus,Prunus cerasifera,Cherry Plum,2000,2000-07-19 00:00:00,24
548,51292,DPW Maintained,Tristaniopsis laurina :: Swamp Myrtle,178 Delta St,1.0,Sidewalk: Curb side : Cutout,Private,8/26/04 0:00,4,,37.71616097,-122.4082335,Tristaniopsis,Tristaniopsis laurina,Swamp Myrtle,2004,2004-08-26 00:00:00,20
549,63559,DPW Maintained,Metrosideros excelsa :: New Zealand Xmas Tree,3655 Lawton St,1.0,Sidewalk: Curb side : Cutout,Private,4/27/87 0:00,7,,37.75676603,-122.5022953,Metrosideros,Metrosideros excelsa,New Zealand Xmas Tree,1987,1987-04-27 00:00:00,37
550,97763,DPW Maintained,Prunus cerasifera :: Cherry Plum,115 Commonwealth Ave,1.0,Sidewalk: Curb side : Cutout,Private,11/8/11 0:00,1,,37.78356468,-122.4557769,Prunus,Prunus cerasifera,Cherry Plum,2011,2011-11-08 00:00:00,13
555,20175,DPW Maintained,Pittosporum undulatum :: Victorian Box,1200X Steiner St,4.0,Sidewalk: Curb side : Cutout,DPW,1/2/91 0:00,6,3X3,37.7807144,-122.4337918,Pittosporum,Pittosporum undulatum,Victorian Box,1991,1991-01-02 00:00:00,33
559,60371,DPW Maintained,Metrosideros excelsa :: New Zealand Xmas Tree,1443 Palou Ave,1.0,Sidewalk: Curb side : Cutout,Private,10/26/82 0:00,9,3x3,37.73225439,-122.3880436,Metrosideros,Metrosideros excelsa,New Zealand Xmas Tree,1982,1982-10-26 00:00:00,42
568,2782,DPW Maintained,Eriobotrya deflexa :: Bronze Loquat,410 Cabrillo St,4.0,Sidewalk: Curb side : Cutout,DPW,6/22/11 0:00,3,3x3,37.77548159,-122.4631878,Eriobotrya,Eriobotrya deflexa,Bronze Loquat,2011,2011-06-22 00:00:00,13
573,190562,DPW Maintained,Ginkgo biloba :: Maidenhair Tree,1748 Alameda St,1.0,Sidewalk: Curb side : Cutout,Private,11/3/17 0:00,3,Width 3ft,37.76869733,-122.403221,Ginkgo,Ginkgo biloba,Maidenhair Tree,2017,2017-11-03 00:00:00,7
576,37261,Permitted Site,Ceanothus 'Ray Hartman' :: California Lilac 'Ray Hartman',801X Church St,1.0,Sidewalk: Curb side : Cutout,Private,6/12/98 0:00,3,3x3,37.7603813,-122.3840185,Ceanothus,Ceanothus 'Ray,California Lilac 'Ray Hartman',1998,1998-06-12 00:00:00,26
579,31387,DPW Maintained,Tristaniopsis laurina :: Swamp Myrtle,1314 Ulloa St,1.0,Sidewalk: Curb side : Cutout,Private,4/21/95 0:00,12,3x3,37.74147654,-122.4705383,Tristaniopsis,Tristaniopsis laurina,Swamp Myrtle,1995,1995-04-21 00:00:00,29
585,1956,Permitted Site,Melaleuca quinquenervia :: Cajeput,28 Bertha Ln,1.0,Sidewalk: Curb side : Cutout,Private,8/17/95 0:00,12,3X3,37.73364252,-122.3815241,Melaleuca,Melaleuca quinquenervia,Cajeput,1995,1995-08-17 00:00:00,29
590,21914,DPW Maintained,Lophostemon confertus :: Brisbane Box,2190 03rd St,4.0,Sidewalk: Curb side : Cutout,DPW,10/10/17 12:13,3,3X3,37.76215959,-122.3888532,Lophostemon,Lophostemon confertus,Brisbane Box,2017,2017-10-10 12:13:00,7
592,68534,DPW Maintained,Melaleuca styphelliodes :: Paperbark Tree,783 06th Ave,1.0,Sidewalk: Curb side : Cutout,Private,10/18/93 0:00,11,,37.77404149,-122.4638548,Melaleuca,Melaleuca styphelliodes,Paperbark Tree,1993,1993-10-18 00:00:00,31
599,52724,DPW Maintained,Ceratonia siliqua :: Carob,160@ HOWARD Spear St,1.0,Sidewalk: Curb side : Cutout,Private,4/18/06 0:00,7,,37.79177256,-122.393248,Ceratonia,Ceratonia siliqua,Carob,2006,2006-04-18 00:00:00,18
600,29321,DPW Maintained,Lophostemon confertus :: Brisbane Box,1250X Portola Dr,10.0,Median : Cutout,DPW,10/14/05 0:00,3,3X3,37.74005199,-122.4632537,Lophostemon,Lophostemon confertus,Brisbane Box,2005,2005-10-14 00:00:00,19
602,11222,DPW Maintained,Arbutus 'Marina' :: Hybrid Strawberry Tree,1050X Ingalls St,8.0,Sidewalk: Curb side : Cutout,Private,12/22/15 0:00,3,3X4,37.73286112,-122.3796919,Arbutus,Arbutus 'Marina',Hybrid Strawberry Tree,2015,2015-12-22 00:00:00,9
604,86611,DPW Maintained,Acer rubrum 'Red Sunset' :: Red Swamp Maple,1102 Bryant St,1.0,Sidewalk: Curb side : Cutout,DPW,4/13/07 0:00,3,3x3,37.77129741,-122.4086213,Acer,Acer rubrum,Red Swamp Maple,2007,2007-04-13 00:00:00,17
607,91651,DPW Maintained,Pyrus calleryana 'Aristocrat' :: Aristocrat Callery Pear,1245 South Van Ness Ave,4.0,Sidewalk: Curb side : Cutout,DPW,3/1/07 0:00,5,3x3,37.75325079,-122.4162776,Pyrus,Pyrus calleryana,Aristocrat Callery Pear,2007,2007-03-01 00:00:00,17
608,38052,DPW Maintained,Arbutus unedo :: Strawberry Tree,2721 Bush St,2.0,Sidewalk: Curb side : Cutout,Private,7/10/98 0:00,11,,37.78582729,-122.4422075,Arbutus,Arbutus unedo,Strawberry Tree,1998,1998-07-10 00:00:00,26
631,50236,DPW Maintained,Tristaniopsis laurina :: Swamp Myrtle,1450 32nd Ave,1.0,Sidewalk: Curb side : Cutout,Private,8/27/03 0:00,5,,37.76012011,-122.4907854,Tristaniopsis,Tristaniopsis laurina,Swamp Myrtle,2003,2003-08-27 00:00:00,21
633,93481,DPW Maintained,Magnolia grandiflora :: Southern Magnolia,1514 Jerrold Ave,1.0,Sidewalk: Curb side : Cutout,Private,8/11/10 0:00,1,3x3,37.73805455,-122.3879314,Magnolia,Magnolia grandiflora,Southern Magnolia,2010,2010-08-11 00:00:00,14
634,51921,DPW Maintained,Ficus microcarpa nitida 'Green Gem' :: Indian Laurel Fig Tree 'Green Gem',101 Walnut St,1.0,Sidewalk: Curb side : Cutout,Private,7/20/05 0:00,8,,37.79047913,-122.4492422,Ficus,Ficus microcarpa,Indian Laurel Fig Tree 'Green Gem',2005,2005-07-20 00:00:00,19
635,90542,DPW Maintained,Eriobotrya deflexa :: Bronze Loquat,632 Cabrillo St,1.0,Sidewalk: Curb side : Cutout,DPW,2/14/08 0:00,4,3x3,37.77535813,-122.4653295,Eriobotrya,Eriobotrya deflexa,Bronze Loquat,2008,2008-02-14 00:00:00,16
638,9861,Permitted Site,Pyrus calleryana :: Ornamental Pear,1350X Gough St,3.0,Sidewalk: Curb side : Cutout,Private,12/29/09 0:00,3,4X4,37.78578432,-122.4246889,Pyrus,Pyrus calleryana,Ornamental Pear,2009,2009-12-29 00:00:00,15
640,85869,DPW Maintained,Ulmus parvifolia 'Drake' :: Drake's Chinese Elm,2270 Folsom St,5.0,Sidewalk: Curb side : Cutout,DPW,5/22/07 0:00,3,3x3,37.76204688,-122.4150629,Ulmus,Ulmus parvifolia,Drake's Chinese Elm,2007,2007-05-22 00:00:00,17
642,50001,Permitted Site,Palm (unknown Genus) :: Palm Spp,1101X 19th St,4.0,Sidewalk: Curb side : Cutout,Private,7/25/03 0:00,12,3x3,37.76141633,-122.3934961,Palm,Palm (unknown,Palm Spp,2003,2003-07-25 00:00:00,21
644,29273,DPW Maintained,Lophostemon confertus :: Brisbane Box,300X Portola Dr,17.0,Median : Cutout,DPW,10/14/05 0:00,3,3X3,37.74666796,-122.4469037,Lophostemon,Lophostemon confertus,Brisbane Box,2005,2005-10-14 00:00:00,19
646,90937,DPW Maintained,Dracaena draco :: Dragon Tree,4100X Balboa St,2.0,Sidewalk: Curb side : Cutout,DPW,11/11/08 0:00,3,3x3,37.77553511,-122.5029084,Dracaena,Dracaena draco,Dragon Tree,2008,2008-11-11 00:00:00,16
647,43667,DPW Maintained,Ginkgo biloba :: Maidenhair Tree,335 12th Ave,1.0,Sidewalk: Curb side : Cutout,Private,7/25/00 0:00,3,,37.78186896,-122.4708721,Ginkgo,Ginkgo biloba,Maidenhair Tree,2000,2000-07-25 00:00:00,24
649,38849,DPW Maintained,Pittosporum undulatum :: Victorian Box,1567 20th Ave,2.0,Sidewalk: Curb side : Cutout,Private,11/2/98 0:00,7,,37.75852933,-122.4779354,Pittosporum,Pittosporum undulatum,Victorian Box,1998,1998-11-02 00:00:00,26
657,2120,DPW Maintained,Arbutus 'Marina' :: Hybrid Strawberry Tree,1100X Bosworth St,9.0,Sidewalk: Curb side : Cutout,DPW,7/6/05 0:00,3,3X3,37.73462174,-122.4388132,Arbutus,Arbutus 'Marina',Hybrid Strawberry Tree,2005,2005-07-06 00:00:00,19
661,265132,DPW Maintained,Tristaniopsis laurina 'Elegant' :: Small-leaf Tristania 'Elegant',582 Minna St,4.0,Sidewalk: Curb side : Cutout,Private,1/11/21 0:00,3,Width 3ft,37.77900403,-122.4101882,Tristaniopsis,Tristaniopsis laurina,Small-leaf Tristania 'Elegant',2021,2021-01-11 00:00:00,3
673,17750,DPW Maintained,Lophostemon confertus :: Brisbane Box,1661 Pine St,2.0,Sidewalk: Curb side : Cutout,Private,1/20/00 0:00,4,3X3,37.7891686,-122.4234991,Lophostemon,Lophostemon confertus,Brisbane Box,2000,2000-01-20 00:00:00,24
674,42734,DPW Maintained,Magnolia grandiflora :: Southern Magnolia,2155 Bay Shore Blvd,6.0,Sidewalk: Curb side : Cutout,Private,6/26/00 0:00,24,,37.71273501,-122.4007401,Magnolia,Magnolia grandiflora,Southern Magnolia,2000,2000-06-26 00:00:00,24
675,264722,DPW Maintained,Arbutus 'Marina' :: Hybrid Strawberry Tree,1301 16th St,9.0,Sidewalk: Curb side : Cutout,Private,9/17/20 0:00,3,,37.7658429,-122.4002422,Arbutus,Arbutus 'Marina',Hybrid Strawberry Tree,2020,2020-09-17 00:00:00,4
677,90187,DPW Maintained,Eriobotrya deflexa :: Bronze Loquat,1826 Balboa St,1.0,Sidewalk: Curb side : Cutout,DPW,2/26/08 0:00,3,3x3,37.77664953,-122.4785567,Eriobotrya,Eriobotrya deflexa,Bronze Loquat,2008,2008-02-26 00:00:00,16
686,37548,DPW Maintained,Ficus microcarpa nitida 'Green Gem' :: Indian Laurel Fig Tree 'Green Gem',952 Sutter St,1.0,Sidewalk: Curb side : Cutout,Private,6/22/98 0:00,13,,37.78834369,-122.4160206,Ficus,Ficus microcarpa,Indian Laurel Fig Tree 'Green Gem',1998,1998-06-22 00:00:00,26
687,9479,Permitted Site,Maytenus boaria :: Mayten,800X Golden Gate Ave,35.0,Sidewalk: Curb side : Cutout,Rec/Park,4/28/98 0:00,3,3X3,37.78066684,-122.4238433,Maytenus,Maytenus boaria,Mayten,1998,1998-04-28 00:00:00,26
688,95931,DPW Maintained,Prunus serrulata 'Kwanzan' :: Kwanzan Flowering Cherry,691 27th Ave,1.0,Sidewalk: Curb side : Cutout,Private,7/29/11 0:00,2,3x3,37.77638849,-122.4866995,Prunus,Prunus serrulata,Kwanzan Flowering Cherry,2011,2011-07-29 00:00:00,13
689,29621,DPW Maintained,Pittosporum tenuifolium :: Tawhiwhi Pittosporum,900X Junipero Serra Blvd,30.0,Median : Cutout,DPW,3/9/13 0:00,3,3X3,37.72056391,-122.4726276,Pittosporum,Pittosporum tenuifolium,Tawhiwhi Pittosporum,2013,2013-03-09 00:00:00,11
703,28341,DPW Maintained,Platanus x hispanica :: Sycamore: London Plane,3119 Mission St,3.0,Sidewalk: Curb side : Cutout,DPW,1/12/04 0:00,6,3X3,37.74755461,-122.4184944,Platanus,Platanus x,Sycamore: London Plane,2004,2004-01-12 00:00:00,20
706,66091,DPW Maintained,Ficus microcarpa nitida 'Green Gem' :: Indian Laurel Fig Tree 'Green Gem',1034 Filbert St,1.0,Sidewalk: Curb side : Cutout,Private,8/8/90 0:00,14,,37.8005368,-122.4165516,Ficus,Ficus microcarpa,Indian Laurel Fig Tree 'Green Gem',1990,1990-08-08 00:00:00,34
711,14988,DPW Maintained,Quercus suber :: Cork Oak,500 Mendell St,4.0,Sidewalk: Curb side : Cutout,DPW,4/11/13 0:00,3,3x3,37.7400007,-122.3856708,Quercus,Quercus suber,Cork Oak,2013,2013-04-11 00:00:00,11
722,88161,DPW Maintained,Pyrus calleryana :: Ornamental Pear,361 Clementina St,3.0,Sidewalk: Curb side : Cutout,Private,7/8/08 0:00,3,3x3,37.78140686,-122.4029601,Pyrus,Pyrus calleryana,Ornamental Pear,2008,2008-07-08 00:00:00,16
724,27836,Permitted Site,Platanus x hispanica :: Sycamore: London Plane,900X The Embarcadero,9.0,Sidewalk: Curb side : Cutout,Port,12/20/00 0:00,24,,37.80288457,-122.4006465,Platanus,Platanus x,Sycamore: London Plane,2000,2000-12-20 00:00:00,24
730,7715,DPW Maintained,Lophostemon confertus :: Brisbane Box,101X Franklin St,3.0,Sidewalk: Curb side : Cutout,DPW,2/15/05 0:00,7,3X3,37.77523536,-122.4210481,Lophostemon,Lophostemon confertus,Brisbane Box,2005,2005-02-15 00:00:00,19
731,110033,DPW Maintained,Tristaniopsis laurina 'Elegant' :: Small-leaf Tristania 'Elegant',206 Lisbon St,1.0,Sidewalk: Curb side : Cutout,Private,3/19/15 0:00,3,3x3,37.72499974,-122.4314389,Tristaniopsis,Tristaniopsis laurina,Small-leaf Tristania 'Elegant',2015,2015-03-19 00:00:00,9
744,46092,DPW Maintained,Magnolia grandiflora :: Southern Magnolia,100 19th Ave,2.0,Sidewalk: Curb side : Cutout,Private,12/10/01 0:00,2,,37.78579691,-122.478625,Magnolia,Magnolia grandiflora,Southern Magnolia,2001,2001-12-10 00:00:00,23
749,51123,DPW Maintained,Koelreuteria paniculata :: Golden Rain Tree,420@  6TH ST Berry St,2.0,Sidewalk: Curb side : Cutout,Private,7/27/04 0:00,10,,37.77162403,-122.3987245,Koelreuteria,Koelreuteria paniculata,Golden Rain Tree,2004,2004-07-27 00:00:00,20
756,2724,Permitted Site,Pittosporum undulatum :: Victorian Box,2205X Bush St,3.0,Sidewalk: Curb side : Cutout,Private,5/12/92 0:00,12,3x3,37.78693847,-122.433559,Pittosporum,Pittosporum undulatum,Victorian Box,1992,1992-05-12 00:00:00,32
765,37383,Permitted Site,Leptospermum scoparium 'Ruby Glow' :: New Zealand Ruby Glow Tea Tree,755 Morse St,17.0,Sidewalk: Property side : Cutout,Private,6/15/98 0:00,3,3x3,37.71055643,-122.4473251,Leptospermum,Leptospermum scoparium,New Zealand Ruby Glow Tea Tree,1998,1998-06-15 00:00:00,26
773,169719,DPW Maintained,Agonis flexuosa 'After Dark' :: Peppermint willow 'After Dark',163 Laidley St,1.0,Sidewalk: Curb side : Cutout,Private,6/5/18 0:00,3,Width 3ft,37.73920347,-122.4285018,Agonis,Agonis flexuosa,Peppermint willow 'After Dark',2018,2018-06-05 00:00:00,6
790,83533,DPW Maintained,Lagunaria patersonii :: Primrose Tree,242 Lisbon St,1.0,Sidewalk: Curb side : Cutout,Private,12/29/12 0:00,5,3x3,37.72444662,-122.4318527,Lagunaria,Lagunaria patersonii,Primrose Tree,2012,2012-12-29 00:00:00,12
792,27922,Permitted Site,Platanus x hispanica :: Sycamore: London Plane,100 The Embarcadero,16.0,Sidewalk: Curb side : Cutout,Port,2/1/01 0:00,12,3X3,37.78063781,-122.3889473,Platanus,Platanus x,Sycamore: London Plane,2001,2001-02-01 00:00:00,23
794,24947,DPW Maintained,Acer x freemanii :: Freeman Maple,3055 San Bruno Ave,1.0,Sidewalk: Curb side : Cutout,Private,3/15/96 0:00,3,3X3,37.72303388,-122.4015908,Acer,Acer x,Freeman Maple,1996,1996-03-15 00:00:00,28
796,25349,DPW Maintained,Arbutus 'Marina' :: Hybrid Strawberry Tree,40X Geneva Ave,1.0,Sidewalk: Curb side : Cutout,DPW,3/18/03 0:00,3,3X3,37.72253177,-122.4515453,Arbutus,Arbutus 'Marina',Hybrid Strawberry Tree,2003,2003-03-18 00:00:00,21
797,17034,DPW Maintained,Tristaniopsis laurina :: Swamp Myrtle,1160X Oak St,3.0,Sidewalk: Curb side : Cutout,DPW,9/30/14 13:41,3,,37.77307325,-122.4384448,Tristaniopsis,Tristaniopsis laurina,Swamp Myrtle,2014,2014-09-30 13:41:00,10
799,27055,DPW Maintained,Arbutus 'Marina' :: Hybrid Strawberry Tree,1045 Silver Ave,1.0,Sidewalk: Curb side : Cutout,DPW,3/21/05 0:00,3,2X3,37.7292434,-122.4153641,Arbutus,Arbutus 'Marina',Hybrid Strawberry Tree,2005,2005-03-21 00:00:00,19
804,89567,DPW Maintained,Cordyline australis :: Dracena Palm,4949X Anza St,1.0,Sidewalk: Curb side : Cutout,DPW,3/27/08 0:00,3,3x3,37.77735577,-122.501182,Cordyline,Cordyline australis,Dracena Palm,2008,2008-03-27 00:00:00,16
809,63575,DPW Maintained,Pittosporum undulatum :: Victorian Box,1335 Filbert St,1.0,Sidewalk: Curb side : Cutout,Private,4/30/87 0:00,9,,37.79974906,-122.4215562,Pittosporum,Pittosporum undulatum,Victorian Box,1987,1987-04-30 00:00:00,37
810,52390,Permitted Site,Prunus cerasifera :: Cherry Plum,99X Park St,2.0,Sidewalk: Curb side : Cutout,Private,12/14/05 0:00,5,3x3,37.73687737,-122.4240941,Prunus,Prunus cerasifera,Cherry Plum,2005,2005-12-14 00:00:00,19
818,6821,Permitted Site,Hymenosporum flavum :: Sweet Shade,1450X Fairfax Ave,2.0,Sidewalk: Curb side : Cutout,Fire Dept,12/19/00 0:00,3,3X3,37.74083447,-122.3861797,Hymenosporum,Hymenosporum flavum,Sweet Shade,2000,2000-12-19 00:00:00,24
823,40822,DPW Maintained,Prunus cerasifera :: Cherry Plum,695 05th St,3.0,Sidewalk: Curb side : Cutout,Private,8/26/99 0:00,3,3x3,37.77560444,-122.3973872,Prunus,Prunus cerasifera,Cherry Plum,1999,1999-08-26 00:00:00,25
825,48879,DPW Maintained,Bambusa spp :: Bamboo Species,508 (Revised) Missouri St,2.0,Sidewalk: Curb side : Cutout,Private,11/19/02 0:00,18,,37.75967614,-122.3963089,Bambusa,Bambusa spp,Bamboo Species,2002,2002-11-19 00:00:00,22
830,65528,DPW Maintained,Magnolia grandiflora :: Southern Magnolia,1406 Polk St,1.0,Sidewalk: Curb side : Cutout,Private,2/20/90 0:00,3,,37.78980257,-122.4204439,Magnolia,Magnolia grandiflora,Southern Magnolia,1990,1990-02-20 00:00:00,34
833,9168,DPW Maintained,Olea europaea :: Olive Tree,6039 Geary Blvd,1.0,Sidewalk: Curb side : Cutout,DPW,11/14/12 0:00,3,3X3,37.77990438,-122.4843601,Olea,Olea europaea,Olive Tree,2012,2012-11-14 00:00:00,12
837,26852,DPW Maintained,Eriobotrya deflexa :: Bronze Loquat,1201 Guerrero St,2.0,Sidewalk: Curb side : Cutout,DPW,7/19/16 5:13,3,2X2,37.75181744,-122.4227446,Eriobotrya,Eriobotrya deflexa,Bronze Loquat,2016,2016-07-19 05:13:00,8
839,25926,DPW Maintained,Melaleuca quinquenervia :: Cajeput,1900 Oakdale Ave,7.0,Sidewalk: Curb side : Cutout,Private,7/1/97 0:00,14,3x3,37.73816969,-122.3964667,Melaleuca,Melaleuca quinquenervia,Cajeput,1997,1997-07-01 00:00:00,27
841,95591,DPW Maintained,Prunus serrulata :: Ornamental Cherry,2925 Lincoln Way,2.0,Sidewalk: Curb side : Cutout,Private,3/1/11 0:00,2,3x3,37.76481632,-122.489484,Prunus,Prunus serrulata,Ornamental Cherry,2011,2011-03-01 00:00:00,13
846,262152,Private,Lagunaria patersonii :: Primrose Tree,1295 47th Ave,3.0,Sidewalk: Curb side : Cutout,Private,5/11/20 0:00,3,3x3,37.76236296,-122.5072083,Lagunaria,Lagunaria patersonii,Primrose Tree,2020,2020-05-11 00:00:00,4
848,24434,Permitted Site,Melaleuca quinquenervia :: Cajeput,99X Peter Yorke Way,2.0,Sidewalk: Curb side : Cutout,Private,4/29/02 0:00,3,3X3,37.78645014,-122.4233015,Melaleuca,Melaleuca quinquenervia,Cajeput,2002,2002-04-29 00:00:00,22
853,104038,Permitted Site,Arbutus 'Marina' :: Hybrid Strawberry Tree,881 Shotwell St,1.0,Sidewalk: Curb side : Cutout,Private,12/19/14 0:00,3,3x3,37.75435143,-122.4152118,Arbutus,Arbutus 'Marina',Hybrid Strawberry Tree,2014,2014-12-19 00:00:00,10
855,60308,DPW Maintained,Platanus x hispanica :: Sycamore: London Plane,1748 Grove St,1.0,Sidewalk: Curb side : Cutout,Private,10/7/82 0:00,9,,37.77504909,-122.4454422,Platanus,Platanus x,Sycamore: London Plane,1982,1982-10-07 00:00:00,42
857,260400,Private,Tristaniopsis laurina :: Swamp Myrtle,190 Parker Ave,4.0,Sidewalk: Curb side : Cutout,Private,8/21/19 0:00,3,,37.78186647,-122.4541596,Tristaniopsis,Tristaniopsis laurina,Swamp Myrtle,2019,2019-08-21 00:00:00,5
860,65934,DPW Maintained,Ligustrum lucidum :: Glossy Privet,150 Palm Ave,1.0,Sidewalk: Curb side : Cutout,Private,5/31/90 0:00,7,,37.78267647,-122.4577259,Ligustrum,Ligustrum lucidum,Glossy Privet,1990,1990-05-31 00:00:00,34
861,86277,DPW Maintained,Melaleuca quinquenervia :: Cajeput,1390 25th Ave,1.0,Sidewalk: Curb side : Cutout,DPW,12/12/06 0:00,3,3x3,37.76161397,-122.4833634,Melaleuca,Melaleuca quinquenervia,Cajeput,2006,2006-12-12 00:00:00,18
867,29335,DPW Maintained,Lophostemon confertus :: Brisbane Box,1500X Portola Dr,1.0,Median : Cutout,DPW,1/16/06 0:00,3,3X3,37.73667874,-122.4693298,Lophostemon,Lophostemon confertus,Brisbane Box,2006,2006-01-16 00:00:00,18
877,265841,Section 806 (d),Ginkgo biloba :: Maidenhair Tree,480 Warren Dr,6.0,Sidewalk: Curb side : Cutout,Private,6/30/21 0:00,3,3x3,37.75842124,-122.4624035,Ginkgo,Ginkgo biloba,Maidenhair Tree,2021,2021-06-30 00:00:00,3
880,45509,DPW Maintained,Prunus serrulata 'Kwanzan' :: Kwanzan Flowering Cherry,2929 25th Ave,3.0,Sidewalk: Curb side : Cutout,Private,7/20/01 0:00,3,,37.73381042,-122.4811566,Prunus,Prunus serrulata,Kwanzan Flowering Cherry,2001,2001-07-20 00:00:00,23
885,22633,DPW Maintained,Melaleuca quinquenervia :: Cajeput,1171 Turk St,2.0,Sidewalk: Curb side : Cutout,DPW,12/12/90 0:00,10,3X3,37.78086976,-122.428338,Melaleuca,Melaleuca quinquenervia,Cajeput,1990,1990-12-12 00:00:00,34
891,89728,DPW Maintained,Arbutus 'Marina' :: Hybrid Strawberry Tree,1453 Anza St,3.0,Sidewalk: Curb side : Cutout,DPW,2/8/08 0:00,3,3x3,37.77905844,-122.4636374,Arbutus,Arbutus 'Marina',Hybrid Strawberry Tree,2008,2008-02-08 00:00:00,16
892,10760,DPW Maintained,Quercus suber :: Cork Oak,1120X Hudson Ave,30.0,Sidewalk: Curb side : Cutout,DPW,3/10/07 0:00,3,3X4,37.73252507,-122.3804241,Quercus,Quercus suber,Cork Oak,2007,2007-03-10 00:00:00,17
893,265469,DPW Maintained,Aesculus californica :: California Buckeye,700x Mansell St,9.0,Median : Cutout,DPW,6/4/21 0:00,3,Width 0ft,37.71969378,-122.4082091,Aesculus,Aesculus californica,California Buckeye,2021,2021-06-04 00:00:00,3
894,42633,DPW Maintained,Tristania conferta ::,1651 Union St,1.0,Sidewalk: Curb side : Cutout,SFUSD,6/22/16 14:56,3,5x5,37.79815054,-122.4266093,Tristania,Tristania conferta,,2016,2016-06-22 14:56:00,8
895,87749,DPW Maintained,Tristaniopsis laurina 'Elegant' :: Small-leaf Tristania 'Elegant',301 14th Ave,6.0,Sidewalk: Curb side : Cutout,Private,5/27/08 0:00,3,3x3,37.78213565,-122.4730342,Tristaniopsis,Tristaniopsis laurina,Small-leaf Tristania 'Elegant',2008,2008-05-27 00:00:00,16
896,88184,Permitted Site,Olea europaea 'Wilsonii' :: Wilson Olive Semi-fruitless,489 Clementina St,,Sidewalk: Curb side : Cutout,Private,8/29/11 0:00,1,3x3,37.7790648,-122.4058102,Olea,Olea europaea,Wilson Olive Semi-fruitless,2011,2011-08-29 00:00:00,13
906,24691,DPW Maintained,Melaleuca spp :: Melaleuca spp,7049X Geary Blvd,1.0,Sidewalk: Curb side : Cutout,Private,6/28/01 0:00,5,3X3,37.77949191,-122.4952221,Melaleuca,Melaleuca spp,Melaleuca spp,2001,2001-06-28 00:00:00,23
907,100131,DPW Maintained,Tristaniopsis laurina :: Swamp Myrtle,155 05th St,3.0,Sidewalk: Curb side : Cutout,Private,10/2/12 0:00,3,3x3,37.78198244,-122.405412,Tristaniopsis,Tristaniopsis laurina,Swamp Myrtle,2012,2012-10-02 00:00:00,12
920,26028,Permitted Site,Phoenix canariensis :: Canary Island Date Palm,599X The Embarcadero,4.0,Median : Cutout,Port,12/1/00 0:00,36,4X4,37.8008488,-122.3992317,Phoenix,Phoenix canariensis,Canary Island Date Palm,2000,2000-12-01 00:00:00,24
936,21777,Permitted Site,Ceratonia siliqua :: Carob,2500X Taylor St,2.0,Sidewalk: Curb side : Cutout,Private,12/15/92 0:00,3,3x3,37.80545598,-122.4151618,Ceratonia,Ceratonia siliqua,Carob,1992,1992-12-15 00:00:00,32
937,63395,DPW Maintained,Metrosideros excelsa :: New Zealand Xmas Tree,345 Taylor St,1.0,Sidewalk: Curb side : Cutout,Private,2/18/87 0:00,6,,37.78564369,-122.411357,Metrosideros,Metrosideros excelsa,New Zealand Xmas Tree,1987,1987-02-18 00:00:00,37
946,115438,Permitted Site,Olea europaea 'Fruitless' :: Fruitless Olive,2500X Larkin St,4.0,Sidewalk: Curb side : Cutout,Private,2/1/16 0:00,3,,37.80087045,-122.4210009,Olea,Olea europaea,Fruitless Olive,2016,2016-02-01 00:00:00,8
951,62223,DPW Maintained,Callistemon citrinus :: Lemon Bottlebrush,101 Capistrano Ave,1.0,Sidewalk: Curb side : Cutout,Private,4/19/10 0:00,3,,37.72892718,-122.4372143,Callistemon,Callistemon citrinus,Lemon Bottlebrush,2010,2010-04-19 00:00:00,14
955,164229,Section 806 (d),Lophostemon confertus :: Brisbane Box,2401 17th Ave,2.0,Sidewalk: Curb side : Cutout,Private,8/12/20 0:00,3,3x3,37.74282422,-122.4736131,Lophostemon,Lophostemon confertus,Brisbane Box,2020,2020-08-12 00:00:00,4
959,22431,Permitted Site,Lophostemon confertus :: Brisbane Box,5945 03rd St,2.0,Sidewalk: Curb side : Cutout,Private,1/18/08 0:00,3,3X3,37.72396111,-122.394868,Lophostemon,Lophostemon confertus,Brisbane Box,2008,2008-01-18 00:00:00,16
960,85616,DPW Maintained,Pyrus kawakamii :: Evergreen Pear,1258 Quesada Ave,1.0,Sidewalk: Curb side : Cutout,DPW,3/30/07 0:00,3,3x3,37.72875388,-122.3831887,Pyrus,Pyrus kawakamii,Evergreen Pear,2007,2007-03-30 00:00:00,17
963,253496,Planning Code 138.1 required,Trachycarpus fortunei :: Windmill Palm,1x Gordon St,14.0,Sidewalk: Curb side : Cutout,Private,9/12/17 0:00,3,3x3,37.77369248,-122.4096587,Trachycarpus,Trachycarpus fortunei,Windmill Palm,2017,2017-09-12 00:00:00,7
969,2695,DPW Maintained,Metrosideros excelsa :: New Zealand Xmas Tree,2111 Bush St,1.0,Sidewalk: Curb side : Cutout,DPW,11/17/03 0:00,3,3x3,37.7872832,-122.431948,Metrosideros,Metrosideros excelsa,New Zealand Xmas Tree,2003,2003-11-17 00:00:00,21
975,67949,DPW Maintained,Ficus microcarpa nitida 'Green Gem' :: Indian Laurel Fig Tree 'Green Gem',650 23rd Ave,1.0,Sidewalk: Curb side : Cutout,Private,3/22/93 0:00,10,,37.77541192,-122.4821757,Ficus,Ficus microcarpa,Indian Laurel Fig Tree 'Green Gem',1993,1993-03-22 00:00:00,31
985,60881,DPW Maintained,Maytenus boaria :: Mayten,1944 Mason St,1.0,Sidewalk: Curb side : Cutout,Private,5/12/83 0:00,10,3x3,37.80152202,-122.4126935,Maytenus,Maytenus boaria,Mayten,1983,1983-05-12 00:00:00,41
988,90420,DPW Maintained,Tristaniopsis laurina :: Swamp Myrtle,170 Duboce Ave,1.0,Sidewalk: Curb side : Cutout,DPW,2/22/08 0:00,3,3x3,37.76982832,-122.4239387,Tristaniopsis,Tristaniopsis laurina,Swamp Myrtle,2008,2008-02-22 00:00:00,16
993,160555,DPW Maintained,Zelkova serrata :: Sawleaf Zelkova,500 France Ave,3.0,Sidewalk: Curb side : Cutout,Private,10/18/17 15:28,3,Width 0ft,37.71795401,-122.4341293,Zelkova,Zelkova serrata,Sawleaf Zelkova,2017,2017-10-18 15:28:00,7
998,52614,DPW Maintained,Acacia melanoxylon :: Blackwood Acacia,230@ AVILA Cervantes Blvd,1.0,Sidewalk: Curb side : Cutout,Private,4/18/06 0:00,10,,37.80523249,-122.441243,Acacia,Acacia melanoxylon,Blackwood Acacia,2006,2006-04-18 00:00:00,18
1004,28920,DPW Maintained,Tristaniopsis laurina :: Swamp Myrtle,310 07th St,1.0,Sidewalk: Curb side : Cutout,Private,2/11/06 0:00,3,3x3,37.7763267,-122.4074736,Tristaniopsis,Tristaniopsis laurina,Swamp Myrtle,2006,2006-02-11 00:00:00,18
1009,53295,Permitted Site,Prunus cerasifera :: Cherry Plum,4109 23rd St,1.0,Sidewalk: Curb side : Cutout,Private,5/26/11 0:00,6,3x3,37.75280601,-122.4344694,Prunus,Prunus cerasifera,Cherry Plum,2011,2011-05-26 00:00:00,13
1012,91016,DPW Maintained,Metrosideros excelsa :: New Zealand Xmas Tree,4045 Cabrillo St,1.0,Sidewalk: Curb side : Cutout,DPW,11/24/08 0:00,3,3x3,37.77354162,-122.5023333,Metrosideros,Metrosideros excelsa,New Zealand Xmas Tree,2008,2008-11-24 00:00:00,16
1013,92258,DPW Maintained,Olea europaea :: Olive Tree,891 47th Ave,1.0,Sidewalk: Curb side : Cutout,Private,7/23/09 0:00,5,3x3,37.77168316,-122.5078482,Olea,Olea europaea,Olive Tree,2009,2009-07-23 00:00:00,15
1014,34683,DPW Maintained,Eriobotrya deflexa :: Bronze Loquat,1901X Filbert St,2.0,Sidewalk: Curb side : Cutout,Private,5/14/13 0:00,2,,37.79855341,-122.4310048,Eriobotrya,Eriobotrya deflexa,Bronze Loquat,2013,2013-05-14 00:00:00,11
1015,6754,Permitted Site,Ligustrum lucidum :: Glossy Privet,1215 Fairfax Ave,8.0,Sidewalk: Curb side : Cutout,Private,12/29/92 0:00,8,3x3,37.73824043,-122.3819127,Ligustrum,Ligustrum lucidum,Glossy Privet,1992,1992-12-29 00:00:00,32
1024,58942,DPW Maintained,Robinia x ambigua 'Purple Robe' :: Purple Robe Locust,1372 Rhode Island St,1.0,Sidewalk: Curb side : Cutout,Private,3/28/80 0:00,10,,37.75234513,-122.4014906,Robinia,Robinia x,Purple Robe Locust,1980,1980-03-28 00:00:00,44
1025,108170,Private,Ginkgo biloba :: Maidenhair Tree,1645 ALABAMA ST,1.0,Sidewalk: Curb side : Cutout,Private,2/3/15 0:00,3,3x3,37.74643584,-122.4103924,Ginkgo,Ginkgo biloba,Maidenhair Tree,2015,2015-02-03 00:00:00,9
1026,98154,DPW Maintained,Laurus nobilis :: Sweet Bay: Grecian Laurel,466 15th Ave,2.0,Sidewalk: Curb side : Cutout,Private,5/9/12 0:00,1,,37.77937774,-122.4738029,Laurus,Laurus nobilis,Sweet Bay: Grecian Laurel,2012,2012-05-09 00:00:00,12
1028,68172,DPW Maintained,Prunus cerasifera :: Cherry Plum,183 Beaumont Ave,1.0,Sidewalk: Curb side : Cutout,Private,6/3/93 0:00,5,,37.77814366,-122.4544834,Prunus,Prunus cerasifera,Cherry Plum,1993,1993-06-03 00:00:00,31
1029,84069,DPW Maintained,Fraxinus oxycarpa 'Raywood' :: Raywood Ash,817 Masonic Ave,1.0,Sidewalk: Curb side : Cutout,Private,6/19/08 0:00,3,3x3,37.77375163,-122.4461458,Fraxinus,Fraxinus oxycarpa,Raywood Ash,2008,2008-06-19 00:00:00,16
1031,60884,DPW Maintained,Prunus serrulata :: Ornamental Cherry,811 Filbert St,1.0,Sidewalk: Curb side : Cutout,Private,10/31/13 0:00,4,,37.80085834,-122.4129595,Prunus,Prunus serrulata,Ornamental Cherry,2013,2013-10-31 00:00:00,11
1034,103621,DPW Maintained,Prunus cerasifera :: Cherry Plum,3982 Sacramento St,1.0,Sidewalk: Curb side : Cutout,Private,12/11/13 0:00,12,3x3,37.78678057,-122.4585398,Prunus,Prunus cerasifera,Cherry Plum,2013,2013-12-11 00:00:00,11
1035,4080,DPW Maintained,Lyonothamnus floribundus subsp. asplenifolius :: Santa Cruz Ironwood,3200X Cesar Chavez St,4.0,Sidewalk: Curb side : Cutout,DPW,5/9/17 0:00,3,3X6,37.74835479,-122.4141205,Lyonothamnus,Lyonothamnus floribundus,Santa Cruz Ironwood,2017,2017-05-09 00:00:00,7
1036,92438,DPW Maintained,Arbutus 'Marina' :: Hybrid Strawberry Tree,2290 44th Ave,1.0,Sidewalk: Curb side : Cutout,Private,7/30/09 0:00,2,3x3,37.74392407,-122.5025493,Arbutus,Arbutus 'Marina',Hybrid Strawberry Tree,2009,2009-07-30 00:00:00,15
1039,90468,DPW Maintained,Pyrus calleryana 'Capital' :: Ornamental Pear Tree 'Capital',600 25th Ave,3.0,Sidewalk: Curb side : Cutout,DPW,3/17/08 0:00,3,3x3,37.77811305,-122.4845221,Pyrus,Pyrus calleryana,Ornamental Pear Tree 'Capital',2008,2008-03-17 00:00:00,16
1044,90800,DPW Maintained,Agonis flexuosa :: Peppermint Willow,3501 Cabrillo St,1.0,Sidewalk: Curb side : Cutout,DPW,4/7/08 0:00,3,3x3,37.77380748,-122.4964892,Agonis,Agonis flexuosa,Peppermint Willow,2008,2008-04-07 00:00:00,16
1051,66427,DPW Maintained,Olea europaea :: Olive Tree,95 Carr St,1.0,Sidewalk: Curb side : Cutout,Private,1/9/91 0:00,8,,37.72100686,-122.3971777,Olea,Olea europaea,Olive Tree,1991,1991-01-09 00:00:00,33
1053,29340,DPW Maintained,Lophostemon confertus :: Brisbane Box,1500X Portola Dr,6.0,Median : Cutout,DPW,1/16/06 0:00,3,3X3,37.73667874,-122.4693298,Lophostemon,Lophostemon confertus,Brisbane Box,2006,2006-01-16 00:00:00,18
1059,93327,DPW Maintained,Fraxinus americana 'Autumn Purple' :: American Autumn Purple Ash,2100X Turk Blvd,10.0,Sidewalk: Curb side : Cutout,DPW,11/20/08 0:00,3,3x3,37.77931477,-122.4437504,Fraxinus,Fraxinus americana,American Autumn Purple Ash,2008,2008-11-20 00:00:00,16
1061,103896,DPW Maintained,Arbutus 'Marina' :: Hybrid Strawberry Tree,17 17th Ave,1.0,Sidewalk: Curb side : Cutout,Private,6/15/13 0:00,2,3x3,37.78669442,-122.4766904,Arbutus,Arbutus 'Marina',Hybrid Strawberry Tree,2013,2013-06-15 00:00:00,11
1064,8051,Permitted Site,Pittosporum undulatum :: Victorian Box,601X Fulton St,2.0,Sidewalk: Curb side : Cutout,Private,5/7/90 0:00,12,3x3,37.77824291,-122.4267982,Pittosporum,Pittosporum undulatum,Victorian Box,1990,1990-05-07 00:00:00,34
1065,90959,DPW Maintained,Dracaena draco :: Dragon Tree,4545X Balboa St,1.0,Sidewalk: Curb side : Cutout,DPW,11/12/08 0:00,3,3x3,37.77519758,-122.5074358,Dracaena,Dracaena draco,Dragon Tree,2008,2008-11-12 00:00:00,16
1068,90844,DPW Maintained,Arbutus 'Marina' :: Hybrid Strawberry Tree,2551X Cabrillo St,1.0,Sidewalk: Curb side : Cutout,DPW,2/19/08 0:00,3,3x3,37.77426859,-122.4862726,Arbutus,Arbutus 'Marina',Hybrid Strawberry Tree,2008,2008-02-19 00:00:00,16
1078,27822,Permitted Site,Platanus x hispanica :: Sycamore: London Plane,350X The Embarcadero,21.0,Sidewalk: Curb side : Cutout,Port,7/15/94 0:00,12,4x4,37.79806025,-122.3963595,Platanus,Platanus x,Sycamore: London Plane,1994,1994-07-15 00:00:00,30
1082,253392,Planning Code 138.1 required,Ulmus parvifolia :: Chinese Elm,115 Steuart St,1.0,Sidewalk: Curb side : Cutout,Private,8/30/17 0:00,3,3x3,37.793068,-122.39288,Ulmus,Ulmus parvifolia,Chinese Elm,2017,2017-08-30 00:00:00,7
1084,117721,DPW Maintained,Magnolia grandiflora 'Samuel Sommer' :: Samuel Sommer Magnolia,471 40th Ave,1.0,Sidewalk: Curb side : Yard,Private,1/25/20 11:12,3,Width 3ft,37.77998531,-122.5009317,Magnolia,Magnolia grandiflora,Samuel Sommer Magnolia,2020,2020-01-25 11:12:00,4
1085,171288,DPW Maintained,Geijera parviflora :: Australian Willow,337 Avalon Ave,1.0,Sidewalk: Curb side : Cutout,Private,11/27/19 0:00,3,Width 3ft,37.72642492,-122.429448,Geijera,Geijera parviflora,Australian Willow,2019,2019-11-27 00:00:00,5
1088,55973,DPW Maintained,Prunus cerasifera :: Cherry Plum,2221 Webster St,1.0,Sidewalk: Curb side : Cutout,Private,6/10/19 0:00,3,,37.79125875,-122.4327195,Prunus,Prunus cerasifera,Cherry Plum,2019,2019-06-10 00:00:00,5
1092,18879,DPW Maintained,Melaleuca quinquenervia :: Cajeput,2315 Sacramento St,1.0,Sidewalk: Curb side : Cutout,Private,6/9/98 0:00,3,3X3,37.79009783,-122.4313873,Melaleuca,Melaleuca quinquenervia,Cajeput,1998,1998-06-09 00:00:00,26
1094,38381,DPW Maintained,Jacaranda mimosifolia :: Jacaranda,1464 Rhode Island St,1.0,Sidewalk: Curb side : Cutout,Private,10/17/05 0:00,5,,37.75113859,-122.4013742,Jacaranda,Jacaranda mimosifolia,Jacaranda,2005,2005-10-17 00:00:00,19
1099,43145,DPW Maintained,Olea europaea :: Olive Tree,236 Gambier St,1.0,Sidewalk: Curb side : Cutout,Private,7/11/00 0:00,8,,37.72631551,-122.4217074,Olea,Olea europaea,Olive Tree,2000,2000-07-11 00:00:00,24
1113,67378,DPW Maintained,Magnolia grandiflora :: Southern Magnolia,815 Balboa St,1.0,Sidewalk: Curb side : Cutout,Private,7/27/92 0:00,5,,37.77699344,-122.4675438,Magnolia,Magnolia grandiflora,Southern Magnolia,1992,1992-07-27 00:00:00,32
1119,44731,DPW Maintained,Tristaniopsis laurina :: Swamp Myrtle,1250 Quintara St,3.0,Sidewalk: Curb side : Cutout,Private,4/3/01 0:00,4,,37.74860367,-122.4789302,Tristaniopsis,Tristaniopsis laurina,Swamp Myrtle,2001,2001-04-03 00:00:00,23
1120,21891,DPW Maintained,Lophostemon confertus :: Brisbane Box,2030 03rd St,1.0,Sidewalk: Curb side : Cutout,Private,11/22/99 0:00,3,2X3,37.76374553,-122.3889508,Lophostemon,Lophostemon confertus,Brisbane Box,1999,1999-11-22 00:00:00,25
1121,102636,DPW Maintained,Pittosporum undulatum :: Victorian Box,2176 Mission St,2.0,Sidewalk: Curb side : Cutout,Private,2/8/13 0:00,3,5x5,37.76220528,-122.4194426,Pittosporum,Pittosporum undulatum,Victorian Box,2013,2013-02-08 00:00:00,11
1124,60874,DPW Maintained,Lophostemon confertus :: Brisbane Box,801 Greenwich St,1.0,Sidewalk: Curb side : Cutout,Private,3/21/02 0:00,7,,37.80179415,-122.4131496,Lophostemon,Lophostemon confertus,Brisbane Box,2002,2002-03-21 00:00:00,22
1125,33324,DPW Maintained,Magnolia grandiflora :: Southern Magnolia,3118 Gough St,1.0,Sidewalk: Curb side : Cutout,Private,11/14/96 0:00,4,,37.80223212,-122.4280103,Magnolia,Magnolia grandiflora,Southern Magnolia,1996,1996-11-14 00:00:00,28
1142,50212,DPW Maintained,Prunus cerasifera :: Cherry Plum,773@ CABRILLO 28th Ave,1.0,Sidewalk: Curb side : Cutout,Private,8/21/03 0:00,5,,37.77484103,-122.4876698,Prunus,Prunus cerasifera,Cherry Plum,2003,2003-08-21 00:00:00,21
1143,22475,DPW Maintained,Tristania conferta ::,6245 03rd St,1.0,Sidewalk: Curb side : Cutout,DPW,1/12/95 0:00,3,3x3,37.72179576,-122.3957486,Tristania,Tristania conferta,,1995,1995-01-12 00:00:00,29
1145,140449,DPW Maintained,Fraxinus oxycarpa :: Ash,1499 Eddy St,1.0,Sidewalk: Curb side : Cutout,DPW,12/15/05 0:00,3,Width 0ft,37.78138477,-122.4321346,Fraxinus,Fraxinus oxycarpa,Ash,2005,2005-12-15 00:00:00,19
1146,27795,DPW Maintained,Platanus x hispanica :: Sycamore: London Plane,900X The Embarcadero,1.0,Sidewalk: Curb side : Cutout,Port,12/18/00 0:00,24,,37.80019555,-122.3987633,Platanus,Platanus x,Sycamore: London Plane,2000,2000-12-18 00:00:00,24
1152,109948,Section 143,Pyrus calleryana 'Chanticleer' :: Ornamental Pear Tree 'Chanticleer',400x CLEMENTINA ST,8.0,Sidewalk: Curb side : Cutout,Private,3/12/15 0:00,3,3x3,37.78068362,-122.4040379,Pyrus,Pyrus calleryana,Ornamental Pear Tree 'Chanticleer',2015,2015-03-12 00:00:00,9
1153,159211,DPW Maintained,Melaleuca linariifolia :: Flaxleaf Paperbark,209 Foote Ave,1.0,Sidewalk: Curb side : Cutout,Private,10/5/17 9:04,3,Width 0ft,37.71433373,-122.4469744,Melaleuca,Melaleuca linariifolia,Flaxleaf Paperbark,2017,2017-10-05 09:04:00,7
1159,66412,DPW Maintained,Ficus microcarpa nitida 'Green Gem' :: Indian Laurel Fig Tree 'Green Gem',33 Dashiell Hammett St,1.0,Sidewalk: Curb side : Cutout,Private,2/11/91 0:00,12,,37.79076208,-122.4080194,Ficus,Ficus microcarpa,Indian Laurel Fig Tree 'Green Gem',1991,1991-02-11 00:00:00,33
1160,48429,DPW Maintained,Ulmus parvifolia :: Chinese Elm,2460 Union St,1.0,Sidewalk: Curb side : Cutout,Private,7/25/02 0:00,10,,37.79661051,-122.439786,Ulmus,Ulmus parvifolia,Chinese Elm,2002,2002-07-25 00:00:00,22
1163,29942,DPW Maintained,Tristaniopsis laurina :: Swamp Myrtle,206 Broad St,1.0,Sidewalk: Curb side : Cutout,Private,3/10/07 0:00,3,3x3,37.7132593,-122.4593678,Tristaniopsis,Tristaniopsis laurina,Swamp Myrtle,2007,2007-03-10 00:00:00,17
1164,67254,DPW Maintained,Metrosideros excelsa :: New Zealand Xmas Tree,2107 47th Ave,1.0,Sidewalk: Curb side : Cutout,Private,1/4/94 0:00,4,,37.7470841,-122.5061415,Metrosideros,Metrosideros excelsa,New Zealand Xmas Tree,1994,1994-01-04 00:00:00,30
1168,253625,DPW Maintained,Magnolia grandiflora 'Little Gem' :: Little Gem Magnolia,701 Broderick St,1.0,Sidewalk: Curb side : Cutout,Private,3/31/21 0:00,3,3x3,37.77676248,-122.4400054,Magnolia,Magnolia grandiflora,Little Gem Magnolia,2021,2021-03-31 00:00:00,3
1169,86524,DPW Maintained,Tristaniopsis laurina :: Swamp Myrtle,1419 27th Ave,1.0,Sidewalk: Curb side : Cutout,DPW,12/26/06 0:00,3,3x3,37.76088472,-122.4856059,Tristaniopsis,Tristaniopsis laurina,Swamp Myrtle,2006,2006-12-26 00:00:00,18
1174,92300,DPW Maintained,Olea europaea :: Olive Tree,2336 22nd Ave,1.0,Sidewalk: Curb side : Cutout,Private,7/27/09 0:00,1,3x3,37.74408917,-122.4789062,Olea,Olea europaea,Olive Tree,2009,2009-07-27 00:00:00,15
1178,22539,Permitted Site,Acer rubrum :: Red Maple,1441X Alemany Blvd,2.0,Sidewalk: Curb side : Cutout,Private,3/6/06 0:00,3,3X6,37.72883794,-122.4341931,Acer,Acer rubrum,Red Maple,2006,2006-03-06 00:00:00,18
1179,29508,Permitted Site,Lophostemon confertus :: Brisbane Box,1850X Ingalls St,2.0,Sidewalk: Curb side : Cutout,Fire Dept,2/28/06 0:00,3,3x3,37.72775297,-122.3851088,Lophostemon,Lophostemon confertus,Brisbane Box,2006,2006-02-28 00:00:00,18
1181,16012,DPW Maintained,Pyrus calleryana :: Ornamental Pear,100X Monterey Blvd,6.0,Median : Cutout,DPW,4/6/98 0:00,3,4,37.73158853,-122.4381892,Pyrus,Pyrus calleryana,Ornamental Pear,1998,1998-04-06 00:00:00,26
1185,200925,DPW Maintained,Tristania conferta ::,4100 03rd St,3.0,Sidewalk: Curb side : Cutout,Private,4/26/17 0:00,3,Width 0ft,37.74003262,-122.3890239,Tristania,Tristania conferta,,2017,2017-04-26 00:00:00,7
1187,90546,DPW Maintained,Eriobotrya deflexa :: Bronze Loquat,826 Cabrillo St,1.0,Sidewalk: Curb side : Cutout,DPW,2/14/08 0:00,2,3x3,37.77527387,-122.4675928,Eriobotrya,Eriobotrya deflexa,Bronze Loquat,2008,2008-02-14 00:00:00,16
1189,51217,DPW Maintained,Pittosporum undulatum :: Victorian Box,148 Hamilton St,1.0,Sidewalk: Curb side : Cutout,Private,8/11/04 0:00,5,,37.72898889,-122.4108148,Pittosporum,Pittosporum undulatum,Victorian Box,2004,2004-08-11 00:00:00,20
1191,65843,DPW Maintained,Maytenus boaria :: Mayten,3525 Pierce St,1.0,Sidewalk: Curb side : Cutout,Private,5/7/90 0:00,10,,37.80310459,-122.4400879,Maytenus,Maytenus boaria,Mayten,1990,1990-05-07 00:00:00,34
1192,13280,DPW Maintained,Ficus retusa nitida :: Banyan Fig,2524 Lombard St,1.0,Sidewalk: Curb side : Cutout,DPW,8/15/93 0:00,40,3X3,37.7990441,-122.443221,Ficus,Ficus retusa,Banyan Fig,1993,1993-08-15 00:00:00,31
1200,21628,DPW Maintained,Ficus retusa nitida :: Banyan Fig,1615 Sutter St,2.0,Sidewalk: Curb side : Cutout,DPW,6/29/94 0:00,6,4X4,37.7867283,-122.4276749,Ficus,Ficus retusa,Banyan Fig,1994,1994-06-29 00:00:00,30
1203,262267,Section 806 (d),Tristaniopsis laurina :: Swamp Myrtle,10X Restani Stwy,1.0,Unaccepted Street : Yard,Private,6/19/20 0:00,3,3x3,37.71849332,-122.443402,Tristaniopsis,Tristaniopsis laurina,Swamp Myrtle,2020,2020-06-19 00:00:00,4
1204,5129,DPW Maintained,Metrosideros excelsa :: New Zealand Xmas Tree,2775 Diamond St,1.0,Sidewalk: Curb side : Cutout,DPW,7/18/83 0:00,10,3X3,37.73520158,-122.4337483,Metrosideros,Metrosideros excelsa,New Zealand Xmas Tree,1983,1983-07-18 00:00:00,41
1206,15223,DPW Maintained,Lophostemon confertus :: Brisbane Box,1201 Mission St,2.0,Sidewalk: Curb side : Cutout,DPW,3/7/95 0:00,12,3X3,37.77718866,-122.4133326,Lophostemon,Lophostemon confertus,Brisbane Box,1995,1995-03-07 00:00:00,29
1208,27384,Permitted Site,Lophostemon confertus :: Brisbane Box,2200 Hyde St,1.0,Sidewalk: Curb side : Cutout,Private,11/20/18 0:00,3,3X3,37.80119183,-122.4193687,Lophostemon,Lophostemon confertus,Brisbane Box,2018,2018-11-20 00:00:00,6
1210,86265,DPW Maintained,Tristaniopsis laurina :: Swamp Myrtle,1686 25th Ave,1.0,Sidewalk: Curb side : Cutout,DPW,12/12/06 0:00,3,3x3,37.7560768,-122.4829805,Tristaniopsis,Tristaniopsis laurina,Swamp Myrtle,2006,2006-12-12 00:00:00,18
1212,14801,DPW Maintained,Tristania conferta ::,1140 McAllister St,1.0,Sidewalk: Curb side : Cutout,DPW,6/30/94 0:00,12,4X4,37.7788254,-122.4307507,Tristania,Tristania conferta,,1994,1994-06-30 00:00:00,30
1213,22650,DPW Maintained,Melaleuca linariifolia :: Flaxleaf Paperbark,1251 Turk St,4.0,Sidewalk: Curb side : Cutout,Private,1/2/14 0:00,30,5x6,37.78070821,-122.4299047,Melaleuca,Melaleuca linariifolia,Flaxleaf Paperbark,2014,2014-01-02 00:00:00,10
1216,48575,DPW Maintained,Prunus serrulata 'Kwanzan' :: Kwanzan Flowering Cherry,2275 Beach St,1.0,Sidewalk: Curb side : Cutout,Private,8/27/02 0:00,6,,37.80328244,-122.4464662,Prunus,Prunus serrulata,Kwanzan Flowering Cherry,2002,2002-08-27 00:00:00,22
1217,101517,DPW Maintained,Magnolia x soulangiana :: Saucer Magnolia,170 Pfeiffer St,1.0,Sidewalk: Curb side : Cutout,Private,12/21/12 0:00,15,3x3,37.80477935,-122.4095633,Magnolia,Magnolia x,Saucer Magnolia,2012,2012-12-21 00:00:00,12
1219,15759,DPW Maintained,Tristaniopsis laurina :: Swamp Myrtle,4723 Mission St,1.0,Sidewalk: Curb side : Cutout,DPW,8/5/19 0:00,1,3x3,37.72263968,-122.4362275,Tristaniopsis,Tristaniopsis laurina,Swamp Myrtle,2019,2019-08-05 00:00:00,5
1223,29409,DPW Maintained,Tristania conferta ::,2715X Ingalls St,2.0,Sidewalk: Curb side : Cutout,Private,2/28/06 0:00,6,3x3,37.72205242,-122.3902582,Tristania,Tristania conferta,,2006,2006-02-28 00:00:00,18
1226,94816,DPW Maintained,Arbutus 'Marina' :: Hybrid Strawberry Tree,3837 Clay St,3.0,Sidewalk: Curb side : Cutout,Private,11/9/10 0:00,3,3x3,37.78787566,-122.4560508,Arbutus,Arbutus 'Marina',Hybrid Strawberry Tree,2010,2010-11-09 00:00:00,14
1228,65220,DPW Maintained,Prunus cerasifera :: Cherry Plum,438 Paris St,1.0,Sidewalk: Curb side : Cutout,Private,7/24/89 0:00,15,,37.7218238,-122.434908,Prunus,Prunus cerasifera,Cherry Plum,1989,1989-07-24 00:00:00,35
1233,91273,DPW Maintained,Acacia stenophylla :: Shoestring Acacia,1140x Guerrero St,1.0,Median : Cutout,DPW,11/20/09 0:00,3,,37.7529047,-122.4231186,Acacia,Acacia stenophylla,Shoestring Acacia,2009,2009-11-20 00:00:00,15
1241,5366,DPW Maintained,Magnolia grandiflora :: Southern Magnolia,241 Dolores St,1.0,Sidewalk: Curb side : Cutout,Private,8/3/11 0:00,3,3x3,37.76559531,-122.4263203,Magnolia,Magnolia grandiflora,Southern Magnolia,2011,2011-08-03 00:00:00,13
1247,111972,DPW Maintained,Olea europaea :: Olive Tree,240 Bridgeview Dr,1.0,Sidewalk: Curb side : Cutout,Private,9/22/15 0:00,1,3x3,37.73433034,-122.3975641,Olea,Olea europaea,Olive Tree,2015,2015-09-22 00:00:00,9
1252,89379,DPW Maintained,Arbutus 'Marina' :: Hybrid Strawberry Tree,1144 Anza St,1.0,Sidewalk: Curb side : Cutout,DPW,2/6/08 0:00,3,3x3,37.7793356,-122.4606356,Arbutus,Arbutus 'Marina',Hybrid Strawberry Tree,2008,2008-02-06 00:00:00,16
1254,31645,DPW Maintained,Metrosideros excelsa :: New Zealand Xmas Tree,4500 Ulloa St,1.0,Sidewalk: Curb side : Cutout,Private,10/31/05 0:00,4,,37.73997613,-122.5046881,Metrosideros,Metrosideros excelsa,New Zealand Xmas Tree,2005,2005-10-31 00:00:00,19
1257,182218,DPW Maintained,Magnolia champaca :: Champa,2998 Lawton St,3.0,Sidewalk: Curb side : Yard,Private,3/30/21 0:00,3,Width 0ft,37.75724961,-122.4946551,Magnolia,Magnolia champaca,Champa,2021,2021-03-30 00:00:00,3
1263,62192,DPW Maintained,Pittosporum undulatum :: Victorian Box,129 Santa Ynez Ave,1.0,Sidewalk: Curb side : Cutout,Private,9/20/85 0:00,14,,37.72485103,-122.4407694,Pittosporum,Pittosporum undulatum,Victorian Box,1985,1985-09-20 00:00:00,39
1266,67578,DPW Maintained,Prunus blireiana :: Flowering Plum,118 Connecticut St,1.0,Sidewalk: Curb side : Cutout,Private,10/5/92 0:00,6,,37.76462442,-122.3977958,Prunus,Prunus blireiana,Flowering Plum,1992,1992-10-05 00:00:00,32
1273,95740,DPW Maintained,Rhamnus alaternus :: Italian Buckthorn,61 Ina Ct,1.0,Sidewalk: Curb side : Cutout,Private,9/7/11 0:00,4,3x3,37.7232063,-122.4250296,Rhamnus,Rhamnus alaternus,Italian Buckthorn,2011,2011-09-07 00:00:00,13
1275,201699,Planning Code 138.1 required,Lophostemon confertus :: Brisbane Box,342 08th St,7.0,Sidewalk: Curb side : Cutout,Private,9/12/17 0:00,3,3x6,37.77384185,-122.4087909,Lophostemon,Lophostemon confertus,Brisbane Box,2017,2017-09-12 00:00:00,7
1283,32721,Permitted Site,Magnolia grandiflora 'Samuel Sommer' :: Samuel Sommer Magnolia,644 Hyde St,2.0,Sidewalk: Curb side : Cutout,Private,10/29/96 0:00,3,3x3,37.78719696,-122.4164491,Magnolia,Magnolia grandiflora,Samuel Sommer Magnolia,1996,1996-10-29 00:00:00,28
1287,35214,DPW Maintained,Arbutus 'Marina' :: Hybrid Strawberry Tree,3835 Clement St,1.0,Sidewalk: Curb side : Cutout,Private,3/3/98 0:00,12,,37.7812297,-122.5005324,Arbutus,Arbutus 'Marina',Hybrid Strawberry Tree,1998,1998-03-03 00:00:00,26
1289,65641,DPW Maintained,Metrosideros excelsa :: New Zealand Xmas Tree,510 46th Ave,1.0,Sidewalk: Curb side : Cutout,Private,3/22/90 0:00,12,,37.77874774,-122.507135,Metrosideros,Metrosideros excelsa,New Zealand Xmas Tree,1990,1990-03-22 00:00:00,34
1291,52673,DPW Maintained,Arbutus unedo :: Strawberry Tree,700  REVISED 37th Ave,5.0,Sidewalk: Curb side : Cutout,Private,4/26/06 0:00,7,,37.77537319,-122.4972174,Arbutus,Arbutus unedo,Strawberry Tree,2006,2006-04-26 00:00:00,18
1295,54243,DPW Maintained,Tristania conferta ::,35 Kittredge Ter,1.0,Sidewalk: Curb side : Cutout,Private,5/16/72 0:00,26,,37.77760274,-122.450611,Tristania,Tristania conferta,,1972,2072-05-16 00:00:00,-48
1298,41831,Permitted Site,Prunus spp 'Purpurea' :: Cherry Plum,1359 15th Ave,2.0,Sidewalk: Curb side : Cutout,Private,6/20/00 0:00,5,3x3,37.76265678,-122.4728032,Prunus,Prunus spp,Cherry Plum,2000,2000-06-20 00:00:00,24
1302,91009,Permitted Site,Pittosporum undulatum :: Victorian Box,251 Balboa St,3.0,Sidewalk: Curb side : Cutout,Private,7/10/13 0:00,3,3x3,37.77730075,-122.4613386,Pittosporum,Pittosporum undulatum,Victorian Box,2013,2013-07-10 00:00:00,11
1309,90794,DPW Maintained,Agonis flexuosa :: Peppermint Willow,3549 Cabrillo St,1.0,Sidewalk: Curb side : Cutout,DPW,4/7/08 0:00,3,3x3,37.7737857,-122.4970042,Agonis,Agonis flexuosa,Peppermint Willow,2008,2008-04-07 00:00:00,16
1313,30079,DPW Maintained,Pinus radiata :: Monterey Pine,410X Brotherhood Way,14.0,Median : Cutout,DPW,3/10/07 0:00,6,M,37.71172889,-122.4634421,Pinus,Pinus radiata,Monterey Pine,2007,2007-03-10 00:00:00,17
1323,233361,DPW Maintained,Pistacia chinensis :: Chinese Pistache,28 Camp St,1.0,Sidewalk: Curb side : Cutout,Private,5/30/17 0:00,3,Width 3ft,37.76405861,-122.4233516,Pistacia,Pistacia chinensis,Chinese Pistache,2017,2017-05-30 00:00:00,7
1325,86229,DPW Maintained,Arbutus 'Marina' :: Hybrid Strawberry Tree,2442 25th Ave,1.0,Sidewalk: Curb side : Cutout,DPW,12/15/06 0:00,3,3x3,37.74196254,-122.4819811,Arbutus,Arbutus 'Marina',Hybrid Strawberry Tree,2006,2006-12-15 00:00:00,18
1327,265206,Private,Lophostemon confertus :: Brisbane Box,1200 Franklin St,5.0,Sidewalk: Curb side : Cutout,Private,1/21/21 0:00,3,,37.78551855,-122.4229648,Lophostemon,Lophostemon confertus,Brisbane Box,2021,2021-01-21 00:00:00,3
1328,53157,DPW Maintained,Tristaniopsis laurina :: Swamp Myrtle,1783@ NEWHALL Quesada Ave,2.0,Sidewalk: Curb side : Cutout,Private,11/2/06 0:00,4,,37.7341302,-122.3930448,Tristaniopsis,Tristaniopsis laurina,Swamp Myrtle,2006,2006-11-02 00:00:00,18
1332,61561,DPW Maintained,Ligustrum lucidum :: Glossy Privet,2018 23rd St,1.0,Sidewalk: Curb side : Cutout,Private,8/23/84 0:00,13,,37.75472558,-122.4001415,Ligustrum,Ligustrum lucidum,Glossy Privet,1984,1984-08-23 00:00:00,40
1336,27915,Permitted Site,Platanus x hispanica :: Sycamore: London Plane,100 The Embarcadero,9.0,Sidewalk: Curb side : Cutout,Port,2/1/01 0:00,12,3X3,37.78105676,-122.3886575,Platanus,Platanus x,Sycamore: London Plane,2001,2001-02-01 00:00:00,23
1339,40829,DPW Maintained,Pyrus calleryana :: Ornamental Pear,150 Spear St,3.0,Sidewalk: Curb side : Cutout,Private,8/30/99 0:00,5,,37.79182353,-122.3933191,Pyrus,Pyrus calleryana,Ornamental Pear,1999,1999-08-30 00:00:00,25
1341,242614,DPW Maintained,Ulmus parvifolia :: Chinese Elm,195 Virginia Ave,4.0,Sidewalk: Curb side : Cutout,Private,4/7/05 0:00,8,Width 3ft,37.74243187,-122.4196282,Ulmus,Ulmus parvifolia,Chinese Elm,2005,2005-04-07 00:00:00,19
1344,51039,DPW Maintained,Prunus cerasifera :: Cherry Plum,926 Grove St,3.0,Sidewalk: Curb side : Cutout,Private,7/8/04 0:00,4,,37.7767218,-122.432202,Prunus,Prunus cerasifera,Cherry Plum,2004,2004-07-08 00:00:00,20
1345,91962,DPW Maintained,Pittosporum undulatum :: Victorian Box,145 Irving St,2.0,Sidewalk: Curb side : Cutout,DPW,2/19/09 0:00,3,3x3,37.76428975,-122.4592961,Pittosporum,Pittosporum undulatum,Victorian Box,2009,2009-02-19 00:00:00,15
1348,60784,DPW Maintained,Prunus cerasifera :: Cherry Plum,114 Ewing Ter,1.0,Sidewalk: Curb side : Cutout,Private,3/14/83 0:00,3,,37.78030327,-122.4481586,Prunus,Prunus cerasifera,Cherry Plum,1983,1983-03-14 00:00:00,41
1350,109113,Permitted Site,Podocarpus macrophyllus :: Yew Pine,3301x 19TH ST,2.0,Sidewalk: Curb side : Cutout,Private,8/2/16 0:00,3,3x3,37.76021162,-122.4172113,Podocarpus,Podocarpus macrophyllus,Yew Pine,2016,2016-08-02 00:00:00,8
1357,30866,DPW Maintained,Ficus microcarpa nitida 'Green Gem' :: Indian Laurel Fig Tree 'Green Gem',8 Tioga Ave,1.0,Sidewalk: Curb side : Cutout,Private,2/16/95 0:00,13,,37.71570284,-122.4027874,Ficus,Ficus microcarpa,Indian Laurel Fig Tree 'Green Gem',1995,1995-02-16 00:00:00,29
1358,34511,DPW Maintained,Lophostemon confertus :: Brisbane Box,18 Lansing St,2.0,Sidewalk: Curb side : Cutout,Private,7/17/97 0:00,2,,37.78619932,-122.393859,Lophostemon,Lophostemon confertus,Brisbane Box,1997,1997-07-17 00:00:00,27
1370,29194,DPW Maintained,Arbutus 'Marina' :: Hybrid Strawberry Tree,3001X Ortega St,7.0,Sidewalk: Curb side : Cutout,DPW,3/18/06 0:00,3,3X3,37.75145675,-122.4956573,Arbutus,Arbutus 'Marina',Hybrid Strawberry Tree,2006,2006-03-18 00:00:00,18
1373,28905,Permitted Site,Pittosporum undulatum :: Victorian Box,360X 05th St,2.0,Sidewalk: Curb side : Cutout,Private,2/11/06 0:00,7,3X3,37.77958336,-122.4026556,Pittosporum,Pittosporum undulatum,Victorian Box,2006,2006-02-11 00:00:00,18
1374,146932,DPW Maintained,Magnolia grandiflora 'Little Gem' :: Little Gem Magnolia,619 43rd Ave,1.0,Sidewalk: Curb side : Cutout,Private,1/25/20 12:30,0,Width 3ft,37.77691039,-122.5039316,Magnolia,Magnolia grandiflora,Little Gem Magnolia,2020,2020-01-25 12:30:00,4
1376,38890,DPW Maintained,Pittosporum undulatum :: Victorian Box,633 Palm Ave,2.0,Sidewalk: Curb side : Cutout,Private,11/2/98 0:00,7,,37.78449769,-122.4580563,Pittosporum,Pittosporum undulatum,Victorian Box,1998,1998-11-02 00:00:00,26
1377,61668,Permitted Site,Prunus cerasifera :: Cherry Plum,271 Church St,1.0,Sidewalk: Curb side : Cutout,Private,11/21/84 0:00,10,,37.76654569,-122.4287681,Prunus,Prunus cerasifera,Cherry Plum,1984,1984-11-21 00:00:00,40
1385,91571,DPW Maintained,Prunus serrulata :: Ornamental Cherry,511 Campbell Ave,1.0,Sidewalk: Curb side : Cutout,Private,5/14/09 0:00,3,3x3,37.71527729,-122.4064887,Prunus,Prunus serrulata,Ornamental Cherry,2009,2009-05-14 00:00:00,15
1390,91238,DPW Maintained,Acacia stenophylla :: Shoestring Acacia,812x Guerrero St,1.0,Median : Cutout,DPW,11/20/08 0:00,3,,37.75815412,-122.4236212,Acacia,Acacia stenophylla,Shoestring Acacia,2008,2008-11-20 00:00:00,16
1392,25871,Permitted Site,Platanus x hispanica :: Sycamore: London Plane,800X The Embarcadero,35.0,Sidewalk: Curb side : Cutout,Port,10/30/95 0:00,6,4X4,37.8020255,-122.4003557,Platanus,Platanus x,Sycamore: London Plane,1995,1995-10-30 00:00:00,29
1397,60799,DPW Maintained,Prunus cerasifera :: Cherry Plum,275 Ewing Ter,1.0,Sidewalk: Curb side : Cutout,Private,3/14/83 0:00,5,,37.77983262,-122.4488171,Prunus,Prunus cerasifera,Cherry Plum,1983,1983-03-14 00:00:00,41
1399,1781,DPW Maintained,Lophostemon confertus :: Brisbane Box,2001X Bay Shore Blvd,3.0,Sidewalk: Curb side : Cutout,DPW,12/30/91 0:00,5,3x3,37.71530726,-122.3988921,Lophostemon,Lophostemon confertus,Brisbane Box,1991,1991-12-30 00:00:00,33
1406,28991,DPW Maintained,Fraxinus oxycarpa 'Raywood' :: Raywood Ash,455 10th St,1.0,Sidewalk: Curb side : Cutout,DPW,12/27/05 0:00,6,3x3,37.77095304,-122.4103717,Fraxinus,Fraxinus oxycarpa,Raywood Ash,2005,2005-12-27 00:00:00,19
1408,117138,Section 143,Eriobotrya deflexa :: Bronze Loquat,2203x NEWCOMB AVE,3.0,Sidewalk: Curb side : Cutout,Private,7/13/16 0:00,3,3x3,37.74161138,-122.4011549,Eriobotrya,Eriobotrya deflexa,Bronze Loquat,2016,2016-07-13 00:00:00,8
1412,68358,DPW Maintained,Prunus cerasifera :: Cherry Plum,655 21st Ave,1.0,Sidewalk: Curb side : Cutout,Private,8/9/93 0:00,7,,37.77547343,-122.4801866,Prunus,Prunus cerasifera,Cherry Plum,1993,1993-08-09 00:00:00,31
1413,107918,DPW Maintained,Tristaniopsis laurina 'Elegant' :: Small-leaf Tristania 'Elegant',495 09th Ave,1.0,Sidewalk: Curb side : Cutout,Private,11/5/14 0:00,3,3x3,37.77937256,-122.4674661,Tristaniopsis,Tristaniopsis laurina,Small-leaf Tristania 'Elegant',2014,2014-11-05 00:00:00,10
1414,28413,DPW Maintained,Washingtonia robusta :: Mexican Fan Palm,530X Monterey Blvd,3.0,Median : Cutout,DPW,2/2/03 0:00,12,5,37.7316257,-122.4472915,Washingtonia,Washingtonia robusta,Mexican Fan Palm,2003,2003-02-02 00:00:00,21
1417,39935,DPW Maintained,Corymbia ficifolia :: Red Flowering Gum,601X Rutland St,1.0,Sidewalk: Curb side : Cutout,Private,9/25/13 0:00,12,3x3,37.71366064,-122.4068173,Corymbia,Corymbia ficifolia,Red Flowering Gum,2013,2013-09-25 00:00:00,11
1418,61789,DPW Maintained,Pittosporum undulatum :: Victorian Box,1261 Rhode Island St,1.0,Sidewalk: Curb side : Cutout,Private,1/24/85 0:00,12,,37.75378399,-122.4014073,Pittosporum,Pittosporum undulatum,Victorian Box,1985,1985-01-24 00:00:00,39
1419,10049,Permitted Site,Callistemon citrinus :: Lemon Bottlebrush,389 Guerrero St,1.0,Sidewalk: Curb side : Cutout,Private,9/9/03 0:00,3,3X3,37.76499148,-122.4239873,Callistemon,Callistemon citrinus,Lemon Bottlebrush,2003,2003-09-09 00:00:00,21
1422,30445,DPW Maintained,Ficus microcarpa nitida 'Green Gem' :: Indian Laurel Fig Tree 'Green Gem',350 Union St,3.0,Sidewalk: Curb side : Cutout,Private,5/11/56 0:00,15,,37.80101957,-122.4051033,Ficus,Ficus microcarpa,Indian Laurel Fig Tree 'Green Gem',1956,2056-05-11 00:00:00,-32
1427,86381,DPW Maintained,Prunus serrulata :: Ornamental Cherry,1449 26th Ave,1.0,Sidewalk: Curb side : Cutout,DPW,12/20/06 0:00,3,3x3,37.76043152,-122.4845031,Prunus,Prunus serrulata,Ornamental Cherry,2006,2006-12-20 00:00:00,18
1428,87879,DPW Maintained,Metrosideros excelsa :: New Zealand Xmas Tree,255 Marina Blvd,1.0,Sidewalk: Curb side : Cutout,Private,6/13/08 0:00,5,3x3,37.80642835,-122.4365086,Metrosideros,Metrosideros excelsa,New Zealand Xmas Tree,2008,2008-06-13 00:00:00,16
1432,35924,Permitted Site,Arbutus 'Marina' :: Hybrid Strawberry Tree,2660 Pacific Ave,3.0,Sidewalk: Curb side : Cutout,Private,4/24/98 0:00,14,3x3,37.79287383,-122.4390314,Arbutus,Arbutus 'Marina',Hybrid Strawberry Tree,1998,1998-04-24 00:00:00,26
1438,47781,DPW Maintained,Pyrus calleryana :: Ornamental Pear,2230 Mason St,3.0,Sidewalk: Curb side : Cutout,Private,6/11/02 0:00,3,3x3,37.80435257,-122.4132736,Pyrus,Pyrus calleryana,Ornamental Pear,2002,2002-06-11 00:00:00,22
1441,28733,DPW Maintained,Magnolia grandiflora :: Southern Magnolia,1795X Evans Ave,23.0,Sidewalk: Curb side : Cutout,DPW,10/29/11 0:00,3,3x3,37.74497286,-122.3921056,Magnolia,Magnolia grandiflora,Southern Magnolia,2011,2011-10-29 00:00:00,13
1444,97689,DPW Maintained,Washingtonia robusta :: Mexican Fan Palm,290X Granada Ave,2.0,Sidewalk: Curb side : Cutout,DPW,4/1/03 0:00,15,3x3,37.723789,-122.4570913,Washingtonia,Washingtonia robusta,Mexican Fan Palm,2003,2003-04-01 00:00:00,21
1445,162926,DPW Maintained,Acer buergeranum :: Trident Maple,53 Granada Ave,1.0,Sidewalk: Curb side : Cutout,Private,6/15/21 0:00,3,Width 0ft,37.71913277,-122.4572289,Acer,Acer buergeranum,Trident Maple,2021,2021-06-15 00:00:00,3
1447,180665,DPW Maintained,Pittosporum crassifolium :: Karo Tree,316 Chicago Way,1.0,Sidewalk: Curb side : Yard,Private,10/10/17 14:13,3,Width 6ft,37.70970068,-122.4326309,Pittosporum,Pittosporum crassifolium,Karo Tree,2017,2017-10-10 14:13:00,7
1449,28119,DPW Maintained,Acer rubrum :: Red Maple,1640 Valencia St,2.0,Sidewalk: Curb side : Cutout,Private,6/14/05 0:00,6,3X3,37.74623968,-122.4202202,Acer,Acer rubrum,Red Maple,2005,2005-06-14 00:00:00,19
1451,262230,Section 806 (d),Lophostemon confertus :: Brisbane Box,42 Dorantes Ave,1.0,Sidewalk: Curb side : Cutout,Private,6/10/20 0:00,3,3x3,37.7460272,-122.4628529,Lophostemon,Lophostemon confertus,Brisbane Box,2020,2020-06-10 00:00:00,4
1454,62205,DPW Maintained,Melaleuca linariifolia :: Flaxleaf Paperbark,220 Santa Rosa Ave,1.0,Sidewalk: Curb side : Cutout,Private,9/30/85 0:00,24,,37.72809039,-122.4384016,Melaleuca,Melaleuca linariifolia,Flaxleaf Paperbark,1985,1985-09-30 00:00:00,39
1458,91814,DPW Maintained,Platanus x hispanica 'Yarwood' :: Yarwood Sycamore,2621 Harrison St,1.0,Sidewalk: Curb side : Cutout,DPW,3/7/07 0:00,3,3x3,37.75549819,-122.4121214,Platanus,Platanus x,Yarwood Sycamore,2007,2007-03-07 00:00:00,17
1460,11436,DPW Maintained,Pyrus calleryana :: Ornamental Pear,2100X Franklin St,2.0,Sidewalk: Curb side : Cutout,DPW,5/21/98 0:00,3,3X3,37.79390727,-122.4246516,Pyrus,Pyrus calleryana,Ornamental Pear,1998,1998-05-21 00:00:00,26
1461,160201,DPW Maintained,Ginkgo biloba :: Maidenhair Tree,600 Amazon Ave,1.0,Sidewalk: Curb side : Cutout,Private,4/24/21 0:00,3,Width 0ft,37.71521239,-122.4350489,Ginkgo,Ginkgo biloba,Maidenhair Tree,2021,2021-04-24 00:00:00,3
1462,332,DPW Maintained,Corymbia ficifolia :: Red Flowering Gum,3402X 19th Ave,2.0,Sidewalk: Curb side : Cutout,DPW,2/24/08 0:00,80,2X3,37.72504926,-122.474754,Corymbia,Corymbia ficifolia,Red Flowering Gum,2008,2008-02-24 00:00:00,16
1463,67478,DPW Maintained,Prunus cerasifera :: Cherry Plum,1567 McAllister St,1.0,Sidewalk: Curb side : Cutout,Private,9/8/92 0:00,5,,37.77780502,-122.4377485,Prunus,Prunus cerasifera,Cherry Plum,1992,1992-09-08 00:00:00,32
1465,43183,DPW Maintained,Tristaniopsis laurina 'Elegant' :: Small-leaf Tristania 'Elegant',350 University St,1.0,Sidewalk: Curb side : Cutout,Private,7/11/00 0:00,6,,37.72567569,-122.4138083,Tristaniopsis,Tristaniopsis laurina,Small-leaf Tristania 'Elegant',2000,2000-07-11 00:00:00,24
1468,3904,DPW Maintained,Magnolia grandiflora 'Samuel Sommer' :: Samuel Sommer Magnolia,84 Castro St,2.0,Sidewalk: Curb side : Cutout,DPW,10/13/14 11:00,3,2X2,37.76761201,-122.4357388,Magnolia,Magnolia grandiflora,Samuel Sommer Magnolia,2014,2014-10-13 11:00:00,10
1475,206965,DPW Maintained,Lagerstroemia indica :: Crape Myrtle,428 Flood Ave,2.0,Sidewalk: Curb side : Cutout,Private,4/17/09 0:00,1,Width 2ft,37.72992472,-122.4495917,Lagerstroemia,Lagerstroemia indica,Crape Myrtle,2009,2009-04-17 00:00:00,15
1488,20147,DPW Maintained,Ficus retusa nitida :: Banyan Fig,1025 Steiner St,1.0,Sidewalk: Curb side : Cutout,DPW,9/13/89 0:00,12,3x3,37.77882774,-122.4335644,Ficus,Ficus retusa,Banyan Fig,1989,1989-09-13 00:00:00,35
1492,115733,Significant Tree,Acer rubrum :: Red Maple,50 Yerba Buena Ave,1.0,Sidewalk: Curb side : Cutout,Private,2/24/16 0:00,3,,37.73751531,-122.4643135,Acer,Acer rubrum,Red Maple,2016,2016-02-24 00:00:00,8
1508,31050,DPW Maintained,Prunus serrulata :: Ornamental Cherry,25 South Hill Blvd,1.0,Sidewalk: Curb side : Cutout,Private,8/1/08 0:00,1,3x3,37.71189586,-122.4320257,Prunus,Prunus serrulata,Ornamental Cherry,2008,2008-08-01 00:00:00,16
1509,5971,Permitted Site,Pittosporum undulatum :: Victorian Box,1545X Eddy St,4.0,Sidewalk: Curb side : Cutout,Private,2/23/05 0:00,3,3X3,37.78122548,-122.4330478,Pittosporum,Pittosporum undulatum,Victorian Box,2005,2005-02-23 00:00:00,19
1511,52766,DPW Maintained,Tristaniopsis laurina 'Elegant' :: Small-leaf Tristania 'Elegant',117 Trenton St,1.0,Sidewalk: Curb side : Cutout,Private,5/4/06 0:00,4,,37.79602705,-122.4091642,Tristaniopsis,Tristaniopsis laurina,Small-leaf Tristania 'Elegant',2006,2006-05-04 00:00:00,18
1515,62043,DPW Maintained,Afrocarpus gracilior :: Fern Pine,453 Bryant St,1.0,Sidewalk: Curb side : Cutout,Private,6/29/93 0:00,3,,37.78203198,-122.3947823,Afrocarpus,Afrocarpus gracilior,Fern Pine,1993,1993-06-29 00:00:00,31
1518,84321,DPW Maintained,Olea europaea :: Olive Tree,749 27th Ave,1.0,Sidewalk: Curb side : Cutout,Private,1/11/08 0:00,5,3x3,37.77536097,-122.4866245,Olea,Olea europaea,Olive Tree,2008,2008-01-11 00:00:00,16
1527,92261,DPW Maintained,Schinus terebinthifolius :: Brazilian Pepper,4545 Anza St,9.0,Sidewalk: Curb side : Cutout,DPW,7/23/09 0:00,12,3x3,37.77753355,-122.4967066,Schinus,Schinus terebinthifolius,Brazilian Pepper,2009,2009-07-23 00:00:00,15
1533,91630,DPW Maintained,Pyrus calleryana 'Aristocrat' :: Aristocrat Callery Pear,1490x South Van Ness Ave,,Sidewalk: Curb side : Cutout,DPW,3/1/07 0:00,8,3x3,37.74933867,-122.4160399,Pyrus,Pyrus calleryana,Aristocrat Callery Pear,2007,2007-03-01 00:00:00,17
1535,54983,DPW Maintained,Tristaniopsis laurina :: Swamp Myrtle,606 16th Ave,1.0,Sidewalk: Curb side : Cutout,Private,9/12/72 0:00,1,,37.77651145,-122.4747234,Tristaniopsis,Tristaniopsis laurina,Swamp Myrtle,1972,2072-09-12 00:00:00,-48
1538,113645,Planning Code 138.1 required,Lophostemon confertus :: Brisbane Box,1400 MISSION ST,2.0,Sidewalk: Curb side : Cutout,Private,2/9/16 0:00,3,4x6,37.77527096,-122.4159838,Lophostemon,Lophostemon confertus,Brisbane Box,2016,2016-02-09 00:00:00,8
1540,87774,Permitted Site,Tristaniopsis laurina :: Swamp Myrtle,89 Surrey St,,Sidewalk: Curb side : Cutout,Private,6/7/16 0:00,3,3x3,37.73600479,-122.4342086,Tristaniopsis,Tristaniopsis laurina,Swamp Myrtle,2016,2016-06-07 00:00:00,8
1542,108161,DPW Maintained,Platanus x hispanica :: Sycamore: London Plane,2559 Van Ness Ave,4.0,Sidewalk: Curb side : Cutout,Private,11/26/14 0:00,3,3x3,37.79916793,-122.4242774,Platanus,Platanus x,Sycamore: London Plane,2014,2014-11-26 00:00:00,10
1550,86438,DPW Maintained,Prunus serrulata :: Ornamental Cherry,2558 27th Ave,1.0,Sidewalk: Curb side : Cutout,DPW,12/29/06 0:00,3,3x3,37.7397251,-122.4839751,Prunus,Prunus serrulata,Ornamental Cherry,2006,2006-12-29 00:00:00,18
1553,258063,DPW Maintained,Ceanothus 'Ray Hartman' :: California Lilac 'Ray Hartman',727 Delano Ave,2.0,Sidewalk: Property side : Yard,Private,5/15/19 0:00,3,Width 10ft,37.71966907,-122.4452847,Ceanothus,Ceanothus 'Ray,California Lilac 'Ray Hartman',2019,2019-05-15 00:00:00,5
1564,29575,DPW Maintained,Cotoneaster SPP :: Cotoneaster,400X Junipero Serra Blvd,4.0,Median : Cutout,DPW,4/1/07 0:00,3,3X3,37.72991183,-122.4721256,Cotoneaster,Cotoneaster SPP,Cotoneaster,2007,2007-04-01 00:00:00,17
1569,52911,DPW Maintained,Prunus cerasifera :: Cherry Plum,843@ 20th ST Vermont St,1.0,Sidewalk: Curb side : Cutout,Private,7/27/06 0:00,3,,37.75894444,-122.4038309,Prunus,Prunus cerasifera,Cherry Plum,2006,2006-07-27 00:00:00,18
1573,37150,Permitted Site,Cercis occidentalis :: Western Redbud,114 27th St,1.0,Sidewalk: Curb side : Cutout,Private,6/9/15 0:00,3,,37.74722035,-122.4227692,Cercis,Cercis occidentalis,Western Redbud,2015,2015-06-09 00:00:00,9
1574,46284,DPW Maintained,Metrosideros excelsa :: New Zealand Xmas Tree,711 La Playa,1.0,Sidewalk: Curb side : Cutout,Private,1/31/02 0:00,7,,37.77470346,-122.5102284,Metrosideros,Metrosideros excelsa,New Zealand Xmas Tree,2002,2002-01-31 00:00:00,22
1575,47191,DPW Maintained,Magnolia grandiflora :: Southern Magnolia,451 27th Ave,1.0,Sidewalk: Curb side : Cutout,Private,5/8/02 0:00,5,,37.78096707,-122.4870396,Magnolia,Magnolia grandiflora,Southern Magnolia,2002,2002-05-08 00:00:00,22
1576,97605,DPW Maintained,Pyrus kawakamii :: Evergreen Pear,445 Hayes St,2.0,Sidewalk: Curb side : Cutout,Private,10/27/11 0:00,2,3x3,37.77673269,-122.4237009,Pyrus,Pyrus kawakamii,Evergreen Pear,2011,2011-10-27 00:00:00,13
1580,97391,Permitted Site,Platanus x hispanica :: Sycamore: London Plane,3816 22nd St,1.0,Sidewalk: Curb side : Cutout,Private,9/30/11 0:00,10,3x3,37.75468559,-122.4329046,Platanus,Platanus x,Sycamore: London Plane,2011,2011-09-30 00:00:00,13
1583,68938,DPW Maintained,Ginkgo biloba :: Maidenhair Tree,521 11th Ave,1.0,Sidewalk: Curb side : Cutout,Private,12/29/93 0:00,4,,37.77841691,-122.469545,Ginkgo,Ginkgo biloba,Maidenhair Tree,1993,1993-12-29 00:00:00,31
1584,69002,DPW Maintained,Metrosideros excelsa :: New Zealand Xmas Tree,2031 44th Ave,1.0,Sidewalk: Curb side : Cutout,Private,1/5/94 0:00,8,,37.74872807,-122.5030324,Metrosideros,Metrosideros excelsa,New Zealand Xmas Tree,1994,1994-01-05 00:00:00,30
1585,72489,Permitted Site,Ulmus parvifolia 'Drake' :: Drake's Chinese Elm,410 Fair Oaks St,1.0,Sidewalk: Curb side : Cutout,Private,4/3/13 0:00,3,4x4,37.7500984,-122.4239003,Ulmus,Ulmus parvifolia,Drake's Chinese Elm,2013,2013-04-03 00:00:00,11
1586,32091,DPW Maintained,Prunus cerasifera :: Cherry Plum,4017 19th St,1.0,Sidewalk: Curb side : Cutout,Private,8/9/95 0:00,6,,37.75932685,-122.4330876,Prunus,Prunus cerasifera,Cherry Plum,1995,1995-08-09 00:00:00,29
1590,108907,Permitted Site,Tristaniopsis laurina :: Swamp Myrtle,95 Coleridge St,1.0,Sidewalk: Curb side : Cutout,Private,1/9/15 0:00,3,3x3,37.7441872,-122.4192507,Tristaniopsis,Tristaniopsis laurina,Swamp Myrtle,2015,2015-01-09 00:00:00,9
1595,5549,DPW Maintained,Magnolia grandiflora :: Southern Magnolia,951 Dolores St,1.0,Sidewalk: Curb side : Cutout,DPW,11/20/13 0:00,3,3x3,37.75413287,-122.4252342,Magnolia,Magnolia grandiflora,Southern Magnolia,2013,2013-11-20 00:00:00,11
1603,65898,DPW Maintained,Magnolia grandiflora 'Russet' :: Russet Magnolia,160 Palm Ave,1.0,Sidewalk: Curb side : Cutout,Private,4/16/14 0:00,1,3x3,37.78233538,-122.4577032,Magnolia,Magnolia grandiflora,Russet Magnolia,2014,2014-04-16 00:00:00,10
1609,89533,DPW Maintained,Quercus ilex :: Holly Oak,5140 Anza St,1.0,Sidewalk: Curb side : Cutout,DPW,3/26/08 0:00,3,3x3,37.77738305,-122.5034679,Quercus,Quercus ilex,Holly Oak,2008,2008-03-26 00:00:00,16
1614,53081,DPW Maintained,Arbutus 'Marina' :: Hybrid Strawberry Tree,1874 40th Ave,1.0,Sidewalk: Curb side : Cutout,Private,11/6/06 0:00,3,,37.75187146,-122.4987992,Arbutus,Arbutus 'Marina',Hybrid Strawberry Tree,2006,2006-11-06 00:00:00,18
1619,16382,DPW Maintained,Acer rubrum :: Red Maple,2413X Alemany Blvd,1.0,Sidewalk: Curb side : Cutout,Private,3/6/06 0:00,3,3X3,37.71579627,-122.444717,Acer,Acer rubrum,Red Maple,2006,2006-03-06 00:00:00,18
1627,5106,DPW Maintained,Magnolia grandiflora :: Southern Magnolia,2660 Diamond St,1.0,Sidewalk: Curb side : Cutout,Private,6/29/07 0:00,6,3X3,37.73652863,-122.4345491,Magnolia,Magnolia grandiflora,Southern Magnolia,2007,2007-06-29 00:00:00,17
1634,41382,Permitted Site,Pyrus kawakamii :: Evergreen Pear,365 San Jose Ave,1.0,Sidewalk: Curb side : Cutout,Private,3/15/00 0:00,8,,37.74934485,-122.4212416,Pyrus,Pyrus kawakamii,Evergreen Pear,2000,2000-03-15 00:00:00,24
1635,29365,DPW Maintained,Lophostemon confertus :: Brisbane Box,1600X Portola Dr,1.0,Median : Cutout,DPW,1/16/06 0:00,3,3X3,37.73617309,-122.4699605,Lophostemon,Lophostemon confertus,Brisbane Box,2006,2006-01-16 00:00:00,18
1646,90819,DPW Maintained,Arbutus 'Marina' :: Hybrid Strawberry Tree,3045 Cabrillo St,1.0,Sidewalk: Curb side : Cutout,DPW,4/7/08 0:00,3,3x3,37.77403053,-122.4916275,Arbutus,Arbutus 'Marina',Hybrid Strawberry Tree,2008,2008-04-07 00:00:00,16
1648,51043,DPW Maintained,Pittosporum crassifolium :: Karo Tree,1559 40th Ave,1.0,Sidewalk: Curb side : Cutout,Private,1/12/06 0:00,1,,37.75771992,-122.4993586,Pittosporum,Pittosporum crassifolium,Karo Tree,2006,2006-01-12 00:00:00,18
1649,43037,DPW Maintained,Tristaniopsis laurina :: Swamp Myrtle,150 California St,4.0,Sidewalk: Curb side : Cutout,Private,7/6/00 0:00,4,,37.79348068,-122.3986094,Tristaniopsis,Tristaniopsis laurina,Swamp Myrtle,2000,2000-07-06 00:00:00,24
1666,82912,DPW Maintained,Arbutus 'Marina' :: Hybrid Strawberry Tree,40 Tulane St,1.0,Sidewalk: Curb side : Cutout,Private,7/8/09 0:00,7,3x3,37.72958287,-122.4168967,Arbutus,Arbutus 'Marina',Hybrid Strawberry Tree,2009,2009-07-08 00:00:00,15
1667,36678,Permitted Site,Arecastrum romanzoffianum :: Queen Palm,99X ALBION ST,2.0,Sidewalk: Curb side : Cutout,Private,5/22/98 0:00,16,3x3,37.76565186,-122.4231995,Arecastrum,Arecastrum romanzoffianum,Queen Palm,1998,1998-05-22 00:00:00,26
1670,3623,DPW Maintained,Metrosideros excelsa :: New Zealand Xmas Tree,100X Cargo Way,59.0,Sidewalk: Curb side : Cutout,Port,3/7/06 0:00,3,3X3,37.74269484,-122.381014,Metrosideros,Metrosideros excelsa,New Zealand Xmas Tree,2006,2006-03-07 00:00:00,18
1671,46415,DPW Maintained,Magnolia grandiflora 'Saint Mary' :: Saint Mary Magnolia,700 Illinois St,1.0,Sidewalk: Curb side : Cutout,Private,3/11/02 0:00,5,3x3,37.76296775,-122.3878878,Magnolia,Magnolia grandiflora,Saint Mary Magnolia,2002,2002-03-11 00:00:00,22
1682,62715,DPW Maintained,Prunus cerasifera :: Cherry Plum,1941 Leavenworth St,1.0,Sidewalk: Curb side : Cutout,Private,5/20/86 0:00,6,,37.79909767,-122.4174367,Prunus,Prunus cerasifera,Cherry Plum,1986,1986-05-20 00:00:00,38
1685,32989,DPW Maintained,Ulmus parvifolia :: Chinese Elm,666 Folsom St,6.0,Sidewalk: Curb side : Cutout,Private,11/1/96 0:00,3,,37.78432408,-122.3984229,Ulmus,Ulmus parvifolia,Chinese Elm,1996,1996-11-01 00:00:00,28
1687,41930,DPW Maintained,Crataegus phaenopyrum :: Washington Hawthorn,556 04th Ave,1.0,Sidewalk: Curb side : Cutout,Private,6/20/00 0:00,5,,37.7782207,-122.4618447,Crataegus,Crataegus phaenopyrum,Washington Hawthorn,2000,2000-06-20 00:00:00,24
1691,256899,Permitted Site,Tristaniopsis laurina :: Swamp Myrtle,2051 34th Ave,,Sidewalk: Curb side : Cutout,Private,12/31/18 0:00,3,3x3,37.74884719,-122.4922883,Tristaniopsis,Tristaniopsis laurina,Swamp Myrtle,2018,2018-12-31 00:00:00,6
1693,49957,DPW Maintained,Magnolia grandiflora :: Southern Magnolia,31 Loyola Ter,1.0,Sidewalk: Curb side : Cutout,Private,7/3/03 0:00,3,,37.77610415,-122.4490334,Magnolia,Magnolia grandiflora,Southern Magnolia,2003,2003-07-03 00:00:00,21
1700,32590,DPW Maintained,Tristaniopsis laurina :: Swamp Myrtle,1327 34th Ave,1.0,Sidewalk: Curb side : Cutout,Private,10/22/96 0:00,7,,37.76229475,-122.4932331,Tristaniopsis,Tristaniopsis laurina,Swamp Myrtle,1996,1996-10-22 00:00:00,28
1703,26376,Permitted Site,Tristaniopsis laurina :: Swamp Myrtle,2641 San Jose Ave,1.0,Sidewalk: Curb side : Cutout,Private,12/17/97 0:00,3,3X3,37.71570628,-122.4506697,Tristaniopsis,Tristaniopsis laurina,Swamp Myrtle,1997,1997-12-17 00:00:00,27
1704,27687,DPW Maintained,Lophostemon confertus :: Brisbane Box,450 Guerrero St,2.0,Sidewalk: Curb side : Cutout,Private,12/22/00 0:00,6,3X3,37.76383757,-122.4241278,Lophostemon,Lophostemon confertus,Brisbane Box,2000,2000-12-22 00:00:00,24
1711,32271,DPW Maintained,Platanus x hispanica :: Sycamore: London Plane,2512 Pacific Ave,1.0,Sidewalk: Curb side : Cutout,Private,7/25/02 0:00,8,,37.7931159,-122.4370785,Platanus,Platanus x,Sycamore: London Plane,2002,2002-07-25 00:00:00,22
1714,3067,DPW Maintained,Platanus x hispanica :: Sycamore: London Plane,2847 California St,1.0,Sidewalk: Curb side : Cutout,DPW,10/3/15 14:54,3,3X3,37.78784301,-122.4414591,Platanus,Platanus x,Sycamore: London Plane,2015,2015-10-03 14:54:00,9
1715,26612,DPW Maintained,Eriobotrya deflexa :: Bronze Loquat,1365 Bay Shore Blvd,1.0,Sidewalk: Curb side : Cutout,DPW,4/11/16 0:00,3,3X3,37.72729125,-122.4018776,Eriobotrya,Eriobotrya deflexa,Bronze Loquat,2016,2016-04-11 00:00:00,8
1717,12273,DPW Maintained,Tristania conferta ::,721 Laguna St,1.0,Sidewalk: Curb side : Cutout,Private,2/2/91 0:00,12,3X3,37.77765573,-122.4266051,Tristania,Tristania conferta,,1991,1991-02-02 00:00:00,33
1720,15659,DPW Maintained,Tristaniopsis laurina :: Swamp Myrtle,3779 Mission St,1.0,Sidewalk: Curb side : Cutout,Private,2/2/07 0:00,3,3X3,37.73622897,-122.4242911,Tristaniopsis,Tristaniopsis laurina,Swamp Myrtle,2007,2007-02-02 00:00:00,17
1723,43159,DPW Maintained,Pittosporum crassifolium :: Karo Tree,252 Harvard St,1.0,Sidewalk: Curb side : Cutout,Private,7/28/03 0:00,7,,37.7264149,-122.4206699,Pittosporum,Pittosporum crassifolium,Karo Tree,2003,2003-07-28 00:00:00,21
1724,26348,DPW Maintained,Tristaniopsis laurina :: Swamp Myrtle,2668 San Jose Ave,1.0,Sidewalk: Curb side : Cutout,DPW,6/26/97 0:00,3,3X3,37.71481946,-122.4516584,Tristaniopsis,Tristaniopsis laurina,Swamp Myrtle,1997,1997-06-26 00:00:00,27
1726,6601,DPW Maintained,Ginkgo biloba :: Maidenhair Tree,1400 Evans Ave,8.0,Sidewalk: Curb side : Cutout,DPW,2/3/00 0:00,18,3X3,37.74139607,-122.3853059,Ginkgo,Ginkgo biloba,Maidenhair Tree,2000,2000-02-03 00:00:00,24
1728,50729,DPW Maintained,Platanus x hispanica :: Sycamore: London Plane,3107 Washington St,3.0,Sidewalk: Curb side : Cutout,Private,1/28/04 0:00,6,,37.79022448,-122.4445839,Platanus,Platanus x,Sycamore: London Plane,2004,2004-01-28 00:00:00,20
1731,32574,DPW Maintained,Lophostemon confertus :: Brisbane Box,1010 South Van Ness Ave,1.0,Sidewalk: Curb side : Cutout,Private,10/22/96 0:00,8,3x3,37.75700092,-122.416837,Lophostemon,Lophostemon confertus,Brisbane Box,1996,1996-10-22 00:00:00,28
1736,59260,DPW Maintained,Syagrus romanzoffianum :: Queen Palm,1400 Polk St,1.0,Sidewalk: Curb side : Cutout,Private,3/13/90 0:00,8,,37.78974814,-122.4204377,Syagrus,Syagrus romanzoffianum,Queen Palm,1990,1990-03-13 00:00:00,34
1743,38823,DPW Maintained,Magnolia grandiflora :: Southern Magnolia,163 05th Ave,1.0,Sidewalk: Curb side : Cutout,Private,7/10/13 0:00,3,3x3,37.78575196,-122.4636356,Magnolia,Magnolia grandiflora,Southern Magnolia,2013,2013-07-10 00:00:00,11
1751,45068,DPW Maintained,Schinus molle :: California Pepper,2227 27th Ave,1.0,Sidewalk: Curb side : Cutout,Private,5/8/01 0:00,4,,37.74586082,-122.4845648,Schinus,Schinus molle,California Pepper,2001,2001-05-08 00:00:00,23
1754,44489,DPW Maintained,Melaleuca ericifolia :: Heath Melaleuca,16 Madison St,1.0,Sidewalk: Curb side : Cutout,Private,3/26/01 0:00,8,,37.728486,-122.4237101,Melaleuca,Melaleuca ericifolia,Heath Melaleuca,2001,2001-03-26 00:00:00,23
1758,43685,DPW Maintained,Arbutus 'Marina' :: Hybrid Strawberry Tree,619 07th Ave,1.0,Sidewalk: Curb side : Cutout,Private,7/25/00 0:00,12,6x6,37.7767623,-122.4651247,Arbutus,Arbutus 'Marina',Hybrid Strawberry Tree,2000,2000-07-25 00:00:00,24
1766,15863,DPW Maintained,Tristaniopsis laurina :: Swamp Myrtle,5388 Mission St,1.0,Sidewalk: Curb side : Cutout,DPW,12/26/12 0:00,3,3x3,37.71380826,-122.4436183,Tristaniopsis,Tristaniopsis laurina,Swamp Myrtle,2012,2012-12-26 00:00:00,12
1769,66515,DPW Maintained,Prunus serrulata 'Kwanzan' :: Kwanzan Flowering Cherry,1173 Vallejo St,1.0,Sidewalk: Curb side : Cutout,Private,3/20/91 0:00,7,,37.7975502,-122.4165042,Prunus,Prunus serrulata,Kwanzan Flowering Cherry,1991,1991-03-20 00:00:00,33
1773,192153,DPW Maintained,Ficus microcarpa nitida 'Green Gem' :: Indian Laurel Fig Tree 'Green Gem',1404 Mission St,1.0,Sidewalk: Curb side : Cutout,Private,9/10/18 0:00,3,Width 3ft,37.77484316,-122.4166098,Ficus,Ficus microcarpa,Indian Laurel Fig Tree 'Green Gem',2018,2018-09-10 00:00:00,6
1775,367,DPW Maintained,Tristaniopsis laurina :: Swamp Myrtle,3690X 19th Ave,15.0,Sidewalk: Curb side : Cutout,DPW,5/12/94 0:00,12,2,37.72122463,-122.4749612,Tristaniopsis,Tristaniopsis laurina,Swamp Myrtle,1994,1994-05-12 00:00:00,30
1780,258202,Permitted Site,Arbutus 'Marina' :: Hybrid Strawberry Tree,2422 41st Ave,,Sidewalk: Curb side : Cutout,Private,4/16/19 0:00,3,3x3,37.74156102,-122.4991615,Arbutus,Arbutus 'Marina',Hybrid Strawberry Tree,2019,2019-04-16 00:00:00,5
1783,10575,DPW Maintained,Lophostemon confertus :: Brisbane Box,1005X Harrison St,1.0,Sidewalk: Curb side : Cutout,DPW,2/22/14 0:00,3,3x3,37.77713827,-122.4041178,Lophostemon,Lophostemon confertus,Brisbane Box,2014,2014-02-22 00:00:00,10
1787,31299,DPW Maintained,Prunus serrulata :: Ornamental Cherry,519 Birch St,1.0,Sidewalk: Curb side : Cutout,Private,4/12/95 0:00,8,,37.77798759,-122.4253836,Prunus,Prunus serrulata,Ornamental Cherry,1995,1995-04-12 00:00:00,29
1790,47337,Permitted Site,Magnolia grandiflora :: Southern Magnolia,415 Garfield St,1.0,Sidewalk: Curb side : Cutout,Private,12/27/16 0:00,3,3x3,37.7196061,-122.4664011,Magnolia,Magnolia grandiflora,Southern Magnolia,2016,2016-12-27 00:00:00,8
1793,236398,DPW Maintained,Magnolia grandiflora 'Little Gem' :: Little Gem Magnolia,1304 Cole St,1.0,Sidewalk: Curb side : Cutout,Private,7/27/21 0:00,3,Width 3ft,37.76240876,-122.4491994,Magnolia,Magnolia grandiflora,Little Gem Magnolia,2021,2021-07-27 00:00:00,3
1804,115390,Permitted Site,Acer buergeranum :: Trident Maple,431 Prentiss St,1.0,Sidewalk: Curb side : Cutout,Private,1/28/16 0:00,3,,37.73780239,-122.4120604,Acer,Acer buergeranum,Trident Maple,2016,2016-01-28 00:00:00,8
1808,43440,DPW Maintained,Quercus agrifolia :: Coast Live Oak,241 Oneida Ave,14.0,Sidewalk: Curb side : Cutout,DPW,7/18/00 0:00,2,,37.72201758,-122.4433786,Quercus,Quercus agrifolia,Coast Live Oak,2000,2000-07-18 00:00:00,24
1813,12417,DPW Maintained,Prunus blireiana :: Flowering Plum,1691 Laguna St,1.0,Sidewalk: Curb side : Cutout,Private,9/13/89 0:00,6,4X4,37.78657602,-122.4283897,Prunus,Prunus blireiana,Flowering Plum,1989,1989-09-13 00:00:00,35
1815,254683,Undocumented,Tristaniopsis laurina :: Swamp Myrtle,1985 San Jose Ave,1.0,Sidewalk: Curb side : Cutout,Private,10/5/18 14:28,3,4x6,37.72519152,-122.4426676,Tristaniopsis,Tristaniopsis laurina,Swamp Myrtle,2018,2018-10-05 14:28:00,6
1817,26401,DPW Maintained,Tristaniopsis laurina :: Swamp Myrtle,684 San Jose Ave,1.0,Sidewalk: Curb side : Cutout,DPW,6/26/97 0:00,6,3x3,37.74449277,-122.4226197,Tristaniopsis,Tristaniopsis laurina,Swamp Myrtle,1997,1997-06-26 00:00:00,27
1819,523,DPW Maintained,Acer rubrum :: Red Maple,2813 24th St,1.0,Side Yard : Cutout,Private,6/8/21 11:16,3,3x3,37.75276989,-122.408544,Acer,Acer rubrum,Red Maple,2021,2021-06-08 11:16:00,3
1826,117300,DPW Maintained,Magnolia grandiflora 'Saint Mary' :: Saint Mary Magnolia,2238 34th Ave,1.0,Sidewalk: Curb side : Cutout,Private,6/24/21 0:00,3,,37.74532163,-122.4918207,Magnolia,Magnolia grandiflora,Saint Mary Magnolia,2021,2021-06-24 00:00:00,3
1830,115618,DPW Maintained,Arbutus unedo :: Strawberry Tree,1400 16th St,8.0,Sidewalk: Curb side : Cutout,Private,2/17/16 0:00,3,4x4,37.76625994,-122.4007908,Arbutus,Arbutus unedo,Strawberry Tree,2016,2016-02-17 00:00:00,8
1832,5918,DPW Maintained,Lophostemon confertus :: Brisbane Box,1295 Eddy St,2.0,Sidewalk: Curb side : Cutout,DPW,10/24/15 9:40,3,3X3,37.78177117,-122.4287659,Lophostemon,Lophostemon confertus,Brisbane Box,2015,2015-10-24 09:40:00,9
1834,33142,DPW Maintained,Prunus serrulata 'Kwanzan' :: Kwanzan Flowering Cherry,3148 Steiner St,1.0,Sidewalk: Curb side : Cutout,Private,11/5/96 0:00,8,,37.79854358,-122.4373973,Prunus,Prunus serrulata,Kwanzan Flowering Cherry,1996,1996-11-05 00:00:00,28
1838,260887,DPW Maintained,Acer buergeranum :: Trident Maple,811 41st Ave,,Sidewalk: Curb side : Cutout,DPW,5/18/19 0:00,3,,37.77341464,-122.5015148,Acer,Acer buergeranum,Trident Maple,2019,2019-05-18 00:00:00,5
1839,223107,Permitted Site,Crataegus phaenopyrum :: Washington Hawthorn,600 Gates St,1.0,Sidewalk: Curb side : Cutout,Private,6/12/01 0:00,6,Width 3ft,37.73583805,-122.4142708,Crataegus,Crataegus phaenopyrum,Washington Hawthorn,2001,2001-06-12 00:00:00,23
1843,84779,DPW Maintained,Magnolia grandiflora 'Little Gem' :: Little Gem Magnolia,224 Mississippi St,1.0,Sidewalk: Curb side : Cutout,Private,4/18/07 0:00,3,,37.76359969,-122.3947849,Magnolia,Magnolia grandiflora,Little Gem Magnolia,2007,2007-04-18 00:00:00,17
1845,86339,DPW Maintained,Arbutus 'Marina' :: Hybrid Strawberry Tree,2327 25th Ave,1.0,Sidewalk: Curb side : Cutout,DPW,12/18/06 0:00,3,3x3,37.74408187,-122.4822993,Arbutus,Arbutus 'Marina',Hybrid Strawberry Tree,2006,2006-12-18 00:00:00,18
1846,36685,Permitted Site,Magnolia grandiflora :: Southern Magnolia,3425 19th St,2.0,Sidewalk: Curb side : Cutout,Private,5/10/16 0:00,3,3x3,37.76013193,-122.4197325,Magnolia,Magnolia grandiflora,Southern Magnolia,2016,2016-05-10 00:00:00,8
1847,62971,DPW Maintained,Liriodendron tulipifera :: Tulip Tree,1833 Jones St,1.0,Sidewalk: Curb side : Cutout,Private,8/21/86 0:00,6,,37.79824673,-122.4155768,Liriodendron,Liriodendron tulipifera,Tulip Tree,1986,1986-08-21 00:00:00,38
1864,58973,DPW Maintained,Metrosideros excelsa :: New Zealand Xmas Tree,248 03rd Ave,1.0,Sidewalk: Curb side : Cutout,Private,4/2/80 0:00,12,6x4,37.78400934,-122.4611954,Metrosideros,Metrosideros excelsa,New Zealand Xmas Tree,1980,1980-04-02 00:00:00,44
1869,46263,DPW Maintained,Lophostemon confertus :: Brisbane Box,2546 03rd St,1.0,Sidewalk: Curb side : Cutout,DPW,1/30/02 0:00,6,3x3,37.75728452,-122.3883658,Lophostemon,Lophostemon confertus,Brisbane Box,2002,2002-01-30 00:00:00,22
1874,87176,DPW Maintained,Prunus cerasifera :: Cherry Plum,1784 Revere Ave,1.0,Sidewalk: Curb side : Cutout,Private,1/22/08 0:00,5,3x3,37.73364592,-122.3935463,Prunus,Prunus cerasifera,Cherry Plum,2008,2008-01-22 00:00:00,16
1876,116935,DPW Maintained,Magnolia grandiflora 'Little Gem' :: Little Gem Magnolia,1275 Minnesota St,3.0,Sidewalk: Curb side : Cutout,Private,11/22/16 0:00,3,5x5,37.75430539,-122.3897675,Magnolia,Magnolia grandiflora,Little Gem Magnolia,2016,2016-11-22 00:00:00,8
1881,68083,DPW Maintained,Syagrus romanzoffianum :: Queen Palm,406 Capistrano Ave,1.0,Sidewalk: Curb side : Cutout,Private,5/24/94 0:00,14,,37.72538232,-122.4389067,Syagrus,Syagrus romanzoffianum,Queen Palm,1994,1994-05-24 00:00:00,30
1882,33792,DPW Maintained,Magnolia grandiflora 'Little Gem' :: Little Gem Magnolia,77 Beale St,2.0,Sidewalk: Curb side : Cutout,Private,1/5/15 0:00,3,3x3,37.79138852,-122.3959442,Magnolia,Magnolia grandiflora,Little Gem Magnolia,2015,2015-01-05 00:00:00,9
1883,64510,DPW Maintained,Acacia baileyana :: Bailey's Acacia,838 Baker St,1.0,Sidewalk: Curb side : Cutout,Private,7/21/88 0:00,12,,37.77883128,-122.4418583,Acacia,Acacia baileyana,Bailey's Acacia,1988,1988-07-21 00:00:00,36
1885,94082,DPW Maintained,Pyrus calleryana 'Aristocrat' :: Aristocrat Callery Pear,1355 Pacific Ave,2.0,Sidewalk: Curb side : Cutout,Private,6/2/10 0:00,3,3x3,37.79551111,-122.4175431,Pyrus,Pyrus calleryana,Aristocrat Callery Pear,2010,2010-06-02 00:00:00,14
1887,86507,DPW Maintained,Tristaniopsis laurina :: Swamp Myrtle,1338 27th Ave,2.0,Sidewalk: Curb side : Cutout,DPW,12/21/06 0:00,3,3x3,37.76238847,-122.4855653,Tristaniopsis,Tristaniopsis laurina,Swamp Myrtle,2006,2006-12-21 00:00:00,18
1890,107511,DPW Maintained,Tristaniopsis laurina :: Swamp Myrtle,2141 Chestnut St,2.0,Sidewalk: Curb side : Cutout,Private,9/18/14 0:00,3,3x3,37.80046371,-122.4385175,Tristaniopsis,Tristaniopsis laurina,Swamp Myrtle,2014,2014-09-18 00:00:00,10
1895,264744,Permitted Site,Melaleuca linariifolia :: Flaxleaf Paperbark,72 Vernon St,1.0,Sidewalk: Curb side : Cutout,Private,9/29/20 0:00,3,3x3,37.71379438,-122.4679225,Melaleuca,Melaleuca linariifolia,Flaxleaf Paperbark,2020,2020-09-29 00:00:00,4
1898,49244,DPW Maintained,Maytenus boaria :: Mayten,340 Presidio Ave,1.0,Sidewalk: Curb side : Cutout,Private,3/13/03 0:00,6,3x3,37.7883376,-122.4469118,Maytenus,Maytenus boaria,Mayten,2003,2003-03-13 00:00:00,21
1902,115382,Permitted Site,Eriobotrya deflexa :: Bronze Loquat,625 Moultrie St,1.0,Side Yard : Cutout,Private,1/28/16 0:00,3,,37.73682254,-122.4158832,Eriobotrya,Eriobotrya deflexa,Bronze Loquat,2016,2016-01-28 00:00:00,8
1904,44171,DPW Maintained,Pittosporum undulatum :: Victorian Box,2100 Vallejo St,1.0,Sidewalk: Curb side : Cutout,Private,3/2/01 0:00,6,3x3,37.79568234,-122.4319949,Pittosporum,Pittosporum undulatum,Victorian Box,2001,2001-03-02 00:00:00,23
1912,68570,DPW Maintained,Tristaniopsis laurina :: Swamp Myrtle,871 45th Ave,1.0,Sidewalk: Curb side : Cutout,Private,10/18/93 0:00,7,,37.77211634,-122.5057384,Tristaniopsis,Tristaniopsis laurina,Swamp Myrtle,1993,1993-10-18 00:00:00,31
1924,56147,DPW Maintained,Ficus nitida :: Laurel Fig,2311 Scott St,1.0,Sidewalk: Curb side : Cutout,Private,6/21/73 0:00,16,,37.79140446,-122.439486,Ficus,Ficus nitida,Laurel Fig,1973,2073-06-21 00:00:00,-49
1926,32299,DPW Maintained,Pittosporum crassifolium :: Karo Tree,2367 32nd Ave,1.0,Sidewalk: Curb side : Cutout,Private,8/19/96 0:00,4,,37.74307934,-122.489741,Pittosporum,Pittosporum crassifolium,Karo Tree,1996,1996-08-19 00:00:00,28
1929,46282,DPW Maintained,Metrosideros excelsa :: New Zealand Xmas Tree,705 La Playa,1.0,Sidewalk: Curb side : Cutout,Private,1/31/02 0:00,5,,37.77482121,-122.5102347,Metrosideros,Metrosideros excelsa,New Zealand Xmas Tree,2002,2002-01-31 00:00:00,22
1930,22987,DPW Maintained,Lophostemon confertus :: Brisbane Box,661 Valencia St,1.0,Sidewalk: Curb side : Cutout,Private,7/4/10 0:00,3,3x3,37.76218235,-122.4215148,Lophostemon,Lophostemon confertus,Brisbane Box,2010,2010-07-04 00:00:00,14
1939,88207,DPW Maintained,Lagunaria patersonii :: Primrose Tree,187 Beaumont Ave,2.0,Sidewalk: Curb side : Cutout,Private,7/8/08 0:00,1,3x3,37.77806305,-122.4544672,Lagunaria,Lagunaria patersonii,Primrose Tree,2008,2008-07-08 00:00:00,16
1942,3538,DPW Maintained,Lagunaria patersonii :: Primrose Tree,201X Cargo Way,48.0,Sidewalk: Curb side : Cutout,DPW,4/10/17 10:28,3,3X3,37.74110625,-122.3787022,Lagunaria,Lagunaria patersonii,Primrose Tree,2017,2017-04-10 10:28:00,7
1946,17857,DPW Maintained,Olea europaea :: Olive Tree,2121 Pine St,2.0,Sidewalk: Curb side : Cutout,DPW,2/21/01 0:00,6,3X3,37.78816453,-122.4312997,Olea,Olea europaea,Olive Tree,2001,2001-02-21 00:00:00,23
1949,60229,DPW Maintained,Platanus x hispanica :: Sycamore: London Plane,6242 California St,2.0,Sidewalk: Curb side : Cutout,Private,7/26/82 0:00,13,,37.78397723,-122.4847445,Platanus,Platanus x,Sycamore: London Plane,1982,1982-07-26 00:00:00,42
1954,90924,DPW Maintained,Tristaniopsis laurina :: Swamp Myrtle,4233 Anza St,1.0,Sidewalk: Curb side : Cutout,DPW,11/10/08 0:00,3,3x3,37.77767504,-122.4937536,Tristaniopsis,Tristaniopsis laurina,Swamp Myrtle,2008,2008-11-10 00:00:00,16
1959,85928,DPW Maintained,Melaleuca quinquenervia :: Cajeput,1714 26th Ave,1.0,Sidewalk: Curb side : Cutout,DPW,12/20/06 0:00,3,3x3,37.75547343,-122.4840137,Melaleuca,Melaleuca quinquenervia,Cajeput,2006,2006-12-20 00:00:00,18
1968,122858,DPW Maintained,Tristaniopsis laurina :: Swamp Myrtle,3000X Alemany Blvd,5.0,Median : Cutout,DPW,12/8/16 13:48,3,3x3,37.71088011,-122.4537839,Tristaniopsis,Tristaniopsis laurina,Swamp Myrtle,2016,2016-12-08 13:48:00,8
1970,261035,DPW Maintained,Cupressus macrocarpa :: Monterey Cypress,1601 Sunset Blvd,78.0,Median : Yard,Private,3/25/20 0:00,3,3x3,37.7571202,-122.4953904,Cupressus,Cupressus macrocarpa,Monterey Cypress,2020,2020-03-25 00:00:00,4
1973,60547,DPW Maintained,Lyonothamnus floribundus subsp. asplenifolius :: Santa Cruz Ironwood,507 35th Ave,1.0,Sidewalk: Curb side : Cutout,Private,1/30/20 0:00,3,,37.77934063,-122.4955085,Lyonothamnus,Lyonothamnus floribundus,Santa Cruz Ironwood,2020,2020-01-30 00:00:00,4
1974,74759,DPW Maintained,Acacia melanoxylon :: Blackwood Acacia,250 Foerster St,13.0,Sidewalk: Property side : Cutout,SFUSD,5/15/99 0:00,30,5x7,37.73029437,-122.4487679,Acacia,Acacia melanoxylon,Blackwood Acacia,1999,1999-05-15 00:00:00,25
1981,12040,DPW Maintained,Tristaniopsis laurina :: Swamp Myrtle,1250X La Salle Ave,22.0,Sidewalk: Curb side : Cutout,DPW,4/5/11 0:00,0,3x3,37.73211505,-122.3828043,Tristaniopsis,Tristaniopsis laurina,Swamp Myrtle,2011,2011-04-05 00:00:00,13
1982,884,Permitted Site,Ulmus pumila :: Siberian Elm,1100X ALEMANY BLVD,2.0,Sidewalk: Curb side : Cutout,Private,4/22/08 0:00,24,3X6,37.73090566,-122.4304385,Ulmus,Ulmus pumila,Siberian Elm,2008,2008-04-22 00:00:00,16
1984,25537,DPW Maintained,Phoenix canariensis :: Canary Island Date Palm,2200X Market St,3.0,Median : Cutout,DPW,4/1/93 0:00,36,20,37.76522364,-122.4318009,Phoenix,Phoenix canariensis,Canary Island Date Palm,1993,1993-04-01 00:00:00,31
1990,59112,DPW Maintained,Liquidambar styraciflua :: American Sweet Gum,671 09th Ave,1.0,Sidewalk: Curb side : Cutout,Private,4/23/80 0:00,23,4x4,37.77577237,-122.4672086,Liquidambar,Liquidambar styraciflua,American Sweet Gum,1980,1980-04-23 00:00:00,44
1993,40027,DPW Maintained,Magnolia grandiflora :: Southern Magnolia,1454 Newcomb Ave,1.0,Sidewalk: Curb side : Cutout,Private,2/3/99 0:00,5,,37.7337668,-122.3870293,Magnolia,Magnolia grandiflora,Southern Magnolia,1999,1999-02-03 00:00:00,25
1995,55101,DPW Maintained,Ficus microcarpa nitida 'Green Gem' :: Indian Laurel Fig Tree 'Green Gem',2660 Chestnut St,1.0,Sidewalk: Curb side : Cutout,Private,9/12/72 0:00,18,,37.79949763,-122.447183,Ficus,Ficus microcarpa,Indian Laurel Fig Tree 'Green Gem',1972,2072-09-12 00:00:00,-48
1996,55001,DPW Maintained,Ligustrum lucidum :: Glossy Privet,546 16th Ave,1.0,Sidewalk: Curb side : Cutout,Private,9/12/72 0:00,12,,37.77770638,-122.4748107,Ligustrum,Ligustrum lucidum,Glossy Privet,1972,2072-09-12 00:00:00,-48
1999,69500,DPW Maintained,Maytenus boaria :: Mayten,215 Santa Rosa Ave,1.0,Sidewalk: Curb side : Cutout,Private,5/24/94 0:00,5,,37.7280276,-122.4385341,Maytenus,Maytenus boaria,Mayten,1994,1994-05-24 00:00:00,30
2000,109703,DPW Maintained,Acacia stenophylla :: Shoestring Acacia,600x GUERRERO ST,11.0,Median : Cutout,DPW,2/21/15 23:05,3,3x3,37.76131443,-122.4243127,Acacia,Acacia stenophylla,Shoestring Acacia,2015,2015-02-21 23:05:00,9
2002,262401,DPW Maintained,Agonis flexuosa :: Peppermint Willow,1X Benton Ave,2.0,Sidewalk: Curb side : Cutout,DPW,7/21/20 0:00,3,3x3,37.73226499,-122.4266035,Agonis,Agonis flexuosa,Peppermint Willow,2020,2020-07-21 00:00:00,4
2008,90972,DPW Maintained,Tristaniopsis laurina 'Elegant' :: Small-leaf Tristania 'Elegant',3227 Balboa St,1.0,Sidewalk: Curb side : Cutout,DPW,11/13/08 0:00,3,3x3,37.77584217,-122.4933363,Tristaniopsis,Tristaniopsis laurina,Small-leaf Tristania 'Elegant',2008,2008-11-13 00:00:00,16
2010,115829,DPW Maintained,Olea europaea :: Olive Tree,5851 Geary Blvd,1.0,Sidewalk: Curb side : Cutout,Private,2/26/16 0:00,3,3x3,37.78008745,-122.4820611,Olea,Olea europaea,Olive Tree,2016,2016-02-26 00:00:00,8
2012,32,DPW Maintained,Rhamnus alaternus :: Italian Buckthorn,753 14th St,2.0,Sidewalk: Curb side : Cutout,DPW,6/8/16 6:10,3,3X3,37.76757792,-122.4300641,Rhamnus,Rhamnus alaternus,Italian Buckthorn,2016,2016-06-08 06:10:00,8
2017,68150,Permitted Site,Prunus cerasifera :: Cherry Plum,93 Carmel St,1.0,Sidewalk: Curb side : Cutout,Private,8/9/93 0:00,6,3x3,37.7607918,-122.448762,Prunus,Prunus cerasifera,Cherry Plum,1993,1993-08-09 00:00:00,31
2034,15211,DPW Maintained,Lophostemon confertus :: Brisbane Box,1142 Mission St,6.0,Sidewalk: Curb side : Cutout,DPW,1/16/95 0:00,12,3X3,37.77850613,-122.4119525,Lophostemon,Lophostemon confertus,Brisbane Box,1995,1995-01-16 00:00:00,29
2035,4099,DPW Maintained,Platanus x hispanica :: Sycamore: London Plane,3314X Cesar Chavez St,2.0,Sidewalk: Curb side : Cutout,DPW,2/19/98 0:00,3,3X3,37.74831053,-122.4165846,Platanus,Platanus x,Sycamore: London Plane,1998,1998-02-19 00:00:00,26
2040,89710,DPW Maintained,Tristaniopsis laurina 'Elegant' :: Small-leaf Tristania 'Elegant',1909 Anza St,3.0,Sidewalk: Curb side : Cutout,DPW,2/8/08 0:00,3,3x3,37.77883736,-122.4685364,Tristaniopsis,Tristaniopsis laurina,Small-leaf Tristania 'Elegant',2008,2008-02-08 00:00:00,16
2046,219931,Permitted Site,Arbutus 'Marina' :: Hybrid Strawberry Tree,3861 22nd St,1.0,Sidewalk: Curb side : Cutout,Private,7/27/16 0:00,10,Width 3ft,37.75448342,-122.4335811,Arbutus,Arbutus 'Marina',Hybrid Strawberry Tree,2016,2016-07-27 00:00:00,8
2050,1405,DPW Maintained,Magnolia grandiflora :: Southern Magnolia,63 Ardath Ct,2.0,Sidewalk: Curb side : Cutout,DPW,3/11/06 0:00,3,3X4,37.73431089,-122.3822707,Magnolia,Magnolia grandiflora,Southern Magnolia,2006,2006-03-11 00:00:00,18
2055,136839,DPW Maintained,Tristaniopsis laurina :: Swamp Myrtle,1911 Green St,2.0,Sidewalk: Curb side : Cutout,Private,7/2/09 0:00,4,Width 4ft,37.79668522,-122.4306019,Tristaniopsis,Tristaniopsis laurina,Swamp Myrtle,2009,2009-07-02 00:00:00,15
2058,86514,DPW Maintained,Tristaniopsis laurina :: Swamp Myrtle,1240 27th Ave,1.0,Sidewalk: Curb side : Cutout,DPW,12/21/06 0:00,3,3x3,37.76426744,-122.4856875,Tristaniopsis,Tristaniopsis laurina,Swamp Myrtle,2006,2006-12-21 00:00:00,18
2059,15886,DPW Maintained,Tristaniopsis laurina :: Swamp Myrtle,5615 Mission St,1.0,Sidewalk: Curb side : Cutout,Private,3/1/95 0:00,12,3X3,37.71119651,-122.4466358,Tristaniopsis,Tristaniopsis laurina,Swamp Myrtle,1995,1995-03-01 00:00:00,29
2060,4164,DPW Maintained,Maytenus boaria :: Mayten,3760-3762 Cesar Chavez St,1.0,Sidewalk: Curb side : Cutout,Private,12/17/03 0:00,3,3X3,37.74795899,-122.4236885,Maytenus,Maytenus boaria,Mayten,2003,2003-12-17 00:00:00,21
2061,39286,Permitted Site,Arbutus 'Marina' :: Hybrid Strawberry Tree,399X Treat Ave,1.0,Sidewalk: Curb side : Cutout,Private,12/21/98 0:00,8,3x3,37.76460553,-122.4131317,Arbutus,Arbutus 'Marina',Hybrid Strawberry Tree,1998,1998-12-21 00:00:00,26
2066,29581,DPW Maintained,Liquidambar styraciflua :: American Sweet Gum,500X Junipero Serra Blvd,3.0,Median : Cutout,DPW,3/9/13 0:00,3,3X3,37.72749637,-122.4720126,Liquidambar,Liquidambar styraciflua,American Sweet Gum,2013,2013-03-09 00:00:00,11
2068,28452,DPW Maintained,Washingtonia robusta :: Mexican Fan Palm,2070X Ocean Ave,1.0,Sidewalk: Curb side : Cutout,DPW,4/1/03 0:00,12,3x3,37.72661404,-122.4655582,Washingtonia,Washingtonia robusta,Mexican Fan Palm,2003,2003-04-01 00:00:00,21
2079,9458,DPW Maintained,Pistacia chinensis :: Chinese Pistache,800X Golden Gate Ave,14.0,Sidewalk: Curb side : Cutout,Rec/Park,12/15/05 0:00,3,3X3,37.78054951,-122.4249663,Pistacia,Pistacia chinensis,Chinese Pistache,2005,2005-12-15 00:00:00,19
2081,40688,DPW Maintained,Prunus cerasifera :: Cherry Plum,154 Ney St,1.0,Sidewalk: Curb side : Cutout,Private,8/10/99 0:00,7,,37.73003525,-122.4269924,Prunus,Prunus cerasifera,Cherry Plum,1999,1999-08-10 00:00:00,25
2084,182083,DPW Maintained,Lagunaria patersonii :: Primrose Tree,1101 Taraval St,1.0,Sidewalk: Curb side : Cutout,DPW,3/28/17 12:33,3,Width 0ft,37.74285808,-122.4780077,Lagunaria,Lagunaria patersonii,Primrose Tree,2017,2017-03-28 12:33:00,7
2085,13221,DPW Maintained,Tristania conferta ::,2240 Lombard St,1.0,Sidewalk: Curb side : Cutout,Private,2/14/97 0:00,12,3X3,37.79963854,-122.4385181,Tristania,Tristania conferta,,1997,1997-02-14 00:00:00,27
2087,53025,DPW Maintained,Lophostemon confertus :: Brisbane Box,362 Brannan St,1.0,Sidewalk: Curb side : Cutout,Private,9/6/06 0:00,12,3x3,37.7807745,-122.3936079,Lophostemon,Lophostemon confertus,Brisbane Box,2006,2006-09-06 00:00:00,18
2088,22451,DPW Maintained,Lophostemon confertus :: Brisbane Box,6199 03rd St,2.0,Sidewalk: Curb side : Cutout,DPW,1/18/08 0:00,6,3x3,37.72269063,-122.3953419,Lophostemon,Lophostemon confertus,Brisbane Box,2008,2008-01-18 00:00:00,16
2092,43453,DPW Maintained,Quercus agrifolia :: Coast Live Oak,241 Oneida Ave,15.0,Sidewalk: Curb side : Cutout,DPW,7/18/00 0:00,1,,37.72200454,-122.4433435,Quercus,Quercus agrifolia,Coast Live Oak,2000,2000-07-18 00:00:00,24
2099,103769,DPW Maintained,Syagrus romanzoffianum :: Queen Palm,1301 Polk St,1.0,Sidewalk: Curb side : Pot,DPW,11/1/09 0:00,3,3x3,37.78893866,-122.420532,Syagrus,Syagrus romanzoffianum,Queen Palm,2009,2009-11-01 00:00:00,15
2102,28260,Permitted Site,Prunus serrulata 'Kwanzan' :: Kwanzan Flowering Cherry,3562 San Bruno Ave,1.0,Sidewalk: Curb side : Cutout,Private,3/20/03 0:00,12,3x3,37.71707558,-122.4000189,Prunus,Prunus serrulata,Kwanzan Flowering Cherry,2003,2003-03-20 00:00:00,21
2104,44203,DPW Maintained,Magnolia grandiflora :: Southern Magnolia,590 Funston Ave,1.0,Sidewalk: Curb side : Cutout,Private,12/28/00 0:00,3,,37.77711577,-122.4714023,Magnolia,Magnolia grandiflora,Southern Magnolia,2000,2000-12-28 00:00:00,24
2108,11320,DPW Maintained,Eucalyptus Spp :: Eucalyptus,1216X Ingalls St,11.0,Sidewalk: Curb side : Cutout,DPW,7/22/99 0:00,3,3X3,37.73066535,-122.3815802,Eucalyptus,Eucalyptus Spp,Eucalyptus,1999,1999-07-22 00:00:00,25
2120,134277,Permitted Site,Platanus x hispanica :: Sycamore: London Plane,1999 Van Ness Ave,5.0,Sidewalk: Curb side : Cutout,Private,5/6/02 0:00,8,Width 4ft,37.7933114,-122.4230907,Platanus,Platanus x,Sycamore: London Plane,2002,2002-05-06 00:00:00,22
2123,35881,DPW Maintained,Pistacia chinensis :: Chinese Pistache,50 Elmira St,3.0,Sidewalk: Curb side : Cutout,Private,4/24/98 0:00,7,,37.73755662,-122.4039477,Pistacia,Pistacia chinensis,Chinese Pistache,1998,1998-04-24 00:00:00,26
2132,110781,DPW Maintained,Acacia stenophylla :: Shoestring Acacia,1000X GUERRERO ST,10.0,Median : Cutout,DPW,5/26/15 14:26,3,3x3,37.7549774,-122.4233625,Acacia,Acacia stenophylla,Shoestring Acacia,2015,2015-05-26 14:26:00,9
2141,159947,DPW Maintained,Eriobotrya deflexa :: Bronze Loquat,157 Bertita St,1.0,Sidewalk: Curb side : Cutout,Private,11/27/19 0:00,3,Width 0ft,37.71877949,-122.440192,Eriobotrya,Eriobotrya deflexa,Bronze Loquat,2019,2019-11-27 00:00:00,5
2142,68959,DPW Maintained,Olea europaea :: Olive Tree,1802 Balboa St,1.0,Sidewalk: Curb side : Cutout,Private,12/29/93 0:00,8,,37.77665804,-122.4783284,Olea,Olea europaea,Olive Tree,1993,1993-12-29 00:00:00,31
2149,142563,DPW Maintained,Geijera parviflora :: Australian Willow,555 FRANCISCO ST,1.0,Sidewalk: Curb side : Cutout,Private,1/17/20 12:42,3,Width 0ft,37.80451387,-122.4143374,Geijera,Geijera parviflora,Australian Willow,2020,2020-01-17 12:42:00,4
2154,95677,DPW Maintained,Lagunaria patersonii :: Primrose Tree,231 Harvard St,1.0,Sidewalk: Curb side : Cutout,Private,3/8/11 0:00,6,3x3,37.72667649,-122.4206152,Lagunaria,Lagunaria patersonii,Primrose Tree,2011,2011-03-08 00:00:00,13
2166,9266,DPW Maintained,Pittosporum undulatum :: Victorian Box,6700 Geary Blvd,1.0,Median : Cutout,DPW,3/12/11 0:00,1,8M,37.77978468,-122.4916455,Pittosporum,Pittosporum undulatum,Victorian Box,2011,2011-03-12 00:00:00,13
2171,67873,DPW Maintained,Pyrus calleryana :: Ornamental Pear,57 Parker Ave,1.0,Sidewalk: Curb side : Cutout,Private,2/9/93 0:00,1,,37.78503562,-122.4547796,Pyrus,Pyrus calleryana,Ornamental Pear,1993,1993-02-09 00:00:00,31
2177,40203,DPW Maintained,Magnolia grandiflora :: Southern Magnolia,567 42nd Ave,1.0,Sidewalk: Curb side : Cutout,Private,5/5/99 0:00,7,,37.77797527,-122.5029341,Magnolia,Magnolia grandiflora,Southern Magnolia,1999,1999-05-05 00:00:00,25
2179,27131,DPW Maintained,Callistemon viminalis :: Weeping Bottlebrush,2015 Silver Ave,1.0,Sidewalk: Curb side : Cutout,Private,6/16/99 0:00,6,2X3,37.73577476,-122.4000802,Callistemon,Callistemon viminalis,Weeping Bottlebrush,1999,1999-06-16 00:00:00,25
2180,40149,Permitted Site,Schinus terebinthifolius :: Brazilian Pepper,580X Stanyan St,5.0,Sidewalk: Curb side : Cutout,Private,4/1/99 0:00,10,3x3,37.77542231,-122.4274254,Schinus,Schinus terebinthifolius,Brazilian Pepper,1999,1999-04-01 00:00:00,25
2185,41798,DPW Maintained,Arbutus 'Marina' :: Hybrid Strawberry Tree,101 Henry Adams St,6.0,Sidewalk: Curb side : Cutout,Private,6/20/00 0:00,20,,37.76817744,-122.4037678,Arbutus,Arbutus 'Marina',Hybrid Strawberry Tree,2000,2000-06-20 00:00:00,24
2189,63561,DPW Maintained,Metrosideros excelsa :: New Zealand Xmas Tree,1678 41st Ave,1.0,Sidewalk: Curb side : Cutout,Private,4/27/87 0:00,14,,37.7554779,-122.5001281,Metrosideros,Metrosideros excelsa,New Zealand Xmas Tree,1987,1987-04-27 00:00:00,37
2199,29325,DPW Maintained,Lophostemon confertus :: Brisbane Box,1250X Portola Dr,14.0,Median : Cutout,DPW,2/22/12 0:00,3,3X3,37.74000331,-122.4636956,Lophostemon,Lophostemon confertus,Brisbane Box,2012,2012-02-22 00:00:00,12
2200,69365,DPW Maintained,Corymbia ficifolia :: Red Flowering Gum,3536 Webster St,1.0,Sidewalk: Curb side : Cutout,Private,4/18/94 0:00,15,4.5x6,37.80342036,-122.43501,Corymbia,Corymbia ficifolia,Red Flowering Gum,1994,1994-04-18 00:00:00,30
2203,30746,DPW Maintained,Callistemon viminalis :: Weeping Bottlebrush,490X Page St,7.0,Sidewalk: Curb side : Cutout,SFUSD,1/31/95 0:00,6,3x3,37.7733556,-122.4287072,Callistemon,Callistemon viminalis,Weeping Bottlebrush,1995,1995-01-31 00:00:00,29
2216,93305,DPW Maintained,Hymenosporum flavum :: Sweet Shade,489 Church St,1.0,Sidewalk: Curb side : Cutout,DPW,12/12/08 0:00,3,3x3,37.76309478,-122.4283425,Hymenosporum,Hymenosporum flavum,Sweet Shade,2008,2008-12-12 00:00:00,16
2220,76250,Undocumented,Arbutus 'Marina' :: Hybrid Strawberry Tree,2111 Harrison St,7.0,Sidewalk: Curb side : Cutout,Private,3/19/94 0:00,8,,37.76382069,-122.4128895,Arbutus,Arbutus 'Marina',Hybrid Strawberry Tree,1994,1994-03-19 00:00:00,30
2221,43527,DPW Maintained,Prunus cerasifera :: Cherry Plum,1341 Hayes St,1.0,Sidewalk: Curb side : Cutout,Private,7/19/00 0:00,0,,37.77477655,-122.4384966,Prunus,Prunus cerasifera,Cherry Plum,2000,2000-07-19 00:00:00,24
2224,162946,Section 806 (d),Magnolia grandiflora 'Little Gem' :: Little Gem Magnolia,76 Bruce Ave,1.0,Sidewalk: Curb side : Cutout,Private,9/8/21 0:00,3,3x3,37.72217592,-122.452554,Magnolia,Magnolia grandiflora,Little Gem Magnolia,2021,2021-09-08 00:00:00,3
2228,231035,DPW Maintained,Maytenus boaria :: Mayten,3050 19th St,2.0,Sidewalk: Curb side : Cutout,Private,1/14/03 0:00,7,Width 3ft,37.76042022,-122.4122567,Maytenus,Maytenus boaria,Mayten,2003,2003-01-14 00:00:00,21
2242,91588,DPW Maintained,Pyrus calleryana 'Aristocrat' :: Aristocrat Callery Pear,400x South Van Ness Ave,,Sidewalk: Curb side : Cutout,DPW,3/1/07 0:00,3,3x3,37.76676938,-122.4177113,Pyrus,Pyrus calleryana,Aristocrat Callery Pear,2007,2007-03-01 00:00:00,17
2243,27492,DPW Maintained,Pyrus calleryana :: Ornamental Pear,1360 Valencia St,1.0,Sidewalk: Curb side : Cutout,Private,8/2/16 0:00,3,3X3,37.75109192,-122.4206809,Pyrus,Pyrus calleryana,Ornamental Pear,2016,2016-08-02 00:00:00,8
2245,15130,Permitted Site,Lophostemon confertus :: Brisbane Box,628 Mission St,3.0,Sidewalk: Curb side : Cutout,Private,4/11/95 0:00,6,3X3,37.78726786,-122.4008767,Lophostemon,Lophostemon confertus,Brisbane Box,1995,1995-04-11 00:00:00,29
2246,34081,Permitted Site,Trachycarpus fortunei :: Windmill Palm,240 SHOTWELL ST,4.0,Sidewalk: Curb side : Cutout,Private,7/5/97 0:00,6,3x3,37.76475112,-122.4164385,Trachycarpus,Trachycarpus fortunei,Windmill Palm,1997,1997-07-05 00:00:00,27
2248,95910,DPW Maintained,Crataegus laevigata :: English Hawthorn,1863 32nd Ave,1.0,Sidewalk: Curb side : Cutout,Private,7/27/11 0:00,2,3x3,37.75246796,-122.4903968,Crataegus,Crataegus laevigata,English Hawthorn,2011,2011-07-27 00:00:00,13
2249,67972,DPW Maintained,Pittosporum undulatum :: Victorian Box,2127 Cabrillo St,1.0,Sidewalk: Curb side : Cutout,Private,5/28/09 0:00,2,3x3,37.77448037,-122.4816655,Pittosporum,Pittosporum undulatum,Victorian Box,2009,2009-05-28 00:00:00,15
2264,34268,DPW Maintained,Melaleuca ericifolia :: Heath Melaleuca,166 27th Ave,1.0,Sidewalk: Curb side : Cutout,Private,7/14/97 0:00,3,,37.78624036,-122.4872576,Melaleuca,Melaleuca ericifolia,Heath Melaleuca,1997,1997-07-14 00:00:00,27
2266,91827,Permitted Site,Platanus x hispanica 'Yarwood' :: Yarwood Sycamore,1941 Harrison St,1.0,Sidewalk: Curb side : Cutout,MTA,3/7/07 0:00,3,3x3,37.7664314,-122.4131296,Platanus,Platanus x,Yarwood Sycamore,2007,2007-03-07 00:00:00,17
2272,102177,Permitted Site,Jacaranda mimosifolia :: Jacaranda,267 Diamond St,1.0,Sidewalk: Curb side : Cutout,Private,12/31/12 0:00,5,6x9,37.75815347,-122.4367941,Jacaranda,Jacaranda mimosifolia,Jacaranda,2012,2012-12-31 00:00:00,12
2273,218494,Permitted Site,Tristaniopsis laurina :: Swamp Myrtle,248 Minerva St,1.0,Sidewalk: Curb side : Cutout,Private,2/1/16 0:00,1,Width 3ft,37.71578871,-122.4608313,Tristaniopsis,Tristaniopsis laurina,Swamp Myrtle,2016,2016-02-01 00:00:00,8
2278,68966,DPW Maintained,Metrosideros excelsa :: New Zealand Xmas Tree,2221 Beach St,1.0,Sidewalk: Curb side : Cutout,Private,1/4/94 0:00,12,,37.80338916,-122.445645,Metrosideros,Metrosideros excelsa,New Zealand Xmas Tree,1994,1994-01-04 00:00:00,30
2282,216718,DPW Maintained,Lagunaria patersonii :: Primrose Tree,978 Capitol Ave,2.0,Sidewalk: Curb side : Yard,Private,10/13/17 11:36,3,Width 3ft,37.71961528,-122.4591242,Lagunaria,Lagunaria patersonii,Primrose Tree,2017,2017-10-13 11:36:00,7
2287,266892,Section 806 (d),Arbutus 'Marina' :: Hybrid Strawberry Tree,2031 20th Ave,1.0,Sidewalk: Curb side : Cutout,Private,12/17/21 0:00,3,3x3,37.74986731,-122.4773111,Arbutus,Arbutus 'Marina',Hybrid Strawberry Tree,2021,2021-12-17 00:00:00,3
2288,115613,DPW Maintained,Arbutus unedo :: Strawberry Tree,1400 16th St,3.0,Sidewalk: Curb side : Cutout,Private,2/17/16 0:00,3,4x4,37.76625994,-122.4007908,Arbutus,Arbutus unedo,Strawberry Tree,2016,2016-02-17 00:00:00,8
2289,52314,Permitted Site,Magnolia grandiflora 'Little Gem' :: Little Gem Magnolia,4284 23rd St,1.0,Sidewalk: Curb side : Cutout,Private,2/12/08 0:00,3,3x3,37.75272067,-122.4382896,Magnolia,Magnolia grandiflora,Little Gem Magnolia,2008,2008-02-12 00:00:00,16
2291,61824,DPW Maintained,Jacaranda mimosifolia :: Jacaranda,568 Hayes St,1.0,Sidewalk: Curb side : Cutout,Private,11/1/20 0:00,3,,37.77661036,-122.425733,Jacaranda,Jacaranda mimosifolia,Jacaranda,2020,2020-11-01 00:00:00,4
2293,91646,DPW Maintained,Pyrus calleryana 'Aristocrat' :: Aristocrat Callery Pear,1271 South Van Ness Ave,1.0,Sidewalk: Curb side : Cutout,DPW,3/1/07 0:00,7,3x3,37.75285303,-122.4162407,Pyrus,Pyrus calleryana,Aristocrat Callery Pear,2007,2007-03-01 00:00:00,17
2297,33171,DPW Maintained,Rhaphiolepis Majestic Beauty :: Indian Hawthorn  'Majestic Beau',2311 Taraval St,2.0,Sidewalk: Curb side : Cutout,Private,11/5/96 0:00,6,,37.74231298,-122.4908225,Rhaphiolepis,Rhaphiolepis Majestic,Indian Hawthorn  'Majestic Beau',1996,1996-11-05 00:00:00,28
2298,85685,DPW Maintained,Acer rubrum 'Red Sunset' :: Red Swamp Maple,690X Bryant St,3.0,Sidewalk: Curb side : Cutout,DPW,4/23/07 0:00,3,3x3,37.77802662,-122.4001077,Acer,Acer rubrum,Red Swamp Maple,2007,2007-04-23 00:00:00,17
2299,26011,Permitted Site,Eriobotrya deflexa :: Bronze Loquat,1618X Oakdale Ave,1.0,Sidewalk: Curb side : Cutout,Arts Commission,1/2/98 0:00,6,3X3,37.7348472,-122.390633,Eriobotrya,Eriobotrya deflexa,Bronze Loquat,1998,1998-01-02 00:00:00,26
2305,42653,DPW Maintained,Pittosporum crassifolium :: Karo Tree,2535 40th Ave,2.0,Sidewalk: Curb side : Cutout,Private,6/26/00 0:00,3,,37.73999573,-122.4981204,Pittosporum,Pittosporum crassifolium,Karo Tree,2000,2000-06-26 00:00:00,24
2309,15056,DPW Maintained,Magnolia grandiflora 'Samuel Sommer' :: Samuel Sommer Magnolia,1441 Mendell St,1.0,Sidewalk: Curb side : Cutout,DPW,6/26/12 0:00,3,4x4,37.73431078,-122.3905262,Magnolia,Magnolia grandiflora,Samuel Sommer Magnolia,2012,2012-06-26 00:00:00,12
2311,59284,DPW Maintained,Magnolia grandiflora :: Southern Magnolia,1524 Polk St,1.0,Sidewalk: Curb side : Cutout,Private,8/20/80 0:00,3,,37.79092115,-122.4206762,Magnolia,Magnolia grandiflora,Southern Magnolia,1980,1980-08-20 00:00:00,44
2319,83000,DPW Maintained,Arbutus 'Marina' :: Hybrid Strawberry Tree,1468 Thomas Ave,1.0,Sidewalk: Curb side : Cutout,Private,7/2/09 0:00,5,3x3,37.72905986,-122.3886919,Arbutus,Arbutus 'Marina',Hybrid Strawberry Tree,2009,2009-07-02 00:00:00,15
2321,16400,Permitted Site,Afrocarpus gracilior :: Fern Pine,299X Myrtle St,6.0,Sidewalk: Curb side : Cutout,Private,4/13/05 0:00,3,3X3,37.78495261,-122.4228729,Afrocarpus,Afrocarpus gracilior,Fern Pine,2005,2005-04-13 00:00:00,19
2327,9423,DPW Maintained,Lophostemon confertus :: Brisbane Box,701X Golden Gate Ave,3.0,Sidewalk: Curb side : Cutout,DPW,2/8/11 0:00,12,3x3,37.78068756,-122.4225248,Lophostemon,Lophostemon confertus,Brisbane Box,2011,2011-02-08 00:00:00,13
2328,61499,DPW Maintained,Eriobotrya japonica :: Edible Loquat,154 20th Ave,1.0,Sidewalk: Curb side : Cutout,Private,8/27/84 0:00,7,,37.78494975,-122.4796331,Eriobotrya,Eriobotrya japonica,Edible Loquat,1984,1984-08-27 00:00:00,40
2329,90804,DPW Maintained,Agonis flexuosa :: Peppermint Willow,3431 Cabrillo St,1.0,Sidewalk: Curb side : Cutout,DPW,3/9/16 0:00,3,3x3,37.77384954,-122.4956141,Agonis,Agonis flexuosa,Peppermint Willow,2016,2016-03-09 00:00:00,8
2330,5222,DPW Maintained,Pyrus kawakamii :: Evergreen Pear,1010 Divisadero St,1.0,Sidewalk: Curb side : Cutout,DPW,5/24/14 0:00,3,4x4,37.77885189,-122.4384376,Pyrus,Pyrus kawakamii,Evergreen Pear,2014,2014-05-24 00:00:00,10
2332,83407,DPW Maintained,Metrosideros excelsa :: New Zealand Xmas Tree,745 Polk St,1.0,Sidewalk: Curb side : Cutout,Private,7/10/09 0:00,3,3x3,37.78382364,-122.4194087,Metrosideros,Metrosideros excelsa,New Zealand Xmas Tree,2009,2009-07-10 00:00:00,15
2334,34812,DPW Maintained,Magnolia grandiflora :: Southern Magnolia,400 38th Ave,1.0,Sidewalk: Curb side : Cutout,Private,2/10/98 0:00,3,,37.78110669,-122.4987053,Magnolia,Magnolia grandiflora,Southern Magnolia,1998,1998-02-10 00:00:00,26
2340,102196,Permitted Site,Ginkgo biloba 'Fairmont' :: Fairmont Ginkgo,195 Eureka St,1.0,Sidewalk: Curb side : Cutout,Private,1/2/13 0:00,3,3x3,37.75927966,-122.4379836,Ginkgo,Ginkgo biloba,Fairmont Ginkgo,2013,2013-01-02 00:00:00,11
2348,89701,DPW Maintained,Tristaniopsis laurina 'Elegant' :: Small-leaf Tristania 'Elegant',2015 Anza St,1.0,Sidewalk: Curb side : Cutout,DPW,2/8/08 0:00,3,3x3,37.77878628,-122.469667,Tristaniopsis,Tristaniopsis laurina,Small-leaf Tristania 'Elegant',2008,2008-02-08 00:00:00,16
2354,38610,DPW Maintained,Ficus retusa nitida :: Banyan Fig,1570 Revere Ave,3.0,Sidewalk: Curb side : Cutout,Private,5/15/02 0:00,6,,37.73141126,-122.3895467,Ficus,Ficus retusa,Banyan Fig,2002,2002-05-15 00:00:00,22
2358,5474,DPW Maintained,Magnolia grandiflora :: Southern Magnolia,601 Dolores St,2.0,Sidewalk: Curb side : Cutout,DPW,7/3/15 14:01,3,9x12,37.75957284,-122.4257521,Magnolia,Magnolia grandiflora,Southern Magnolia,2015,2015-07-03 14:01:00,9
2359,34865,DPW Maintained,Tristaniopsis laurina :: Swamp Myrtle,2029 Kirkham St,1.0,Sidewalk: Curb side : Cutout,Private,8/22/97 0:00,7,,37.75949922,-122.4827912,Tristaniopsis,Tristaniopsis laurina,Swamp Myrtle,1997,1997-08-22 00:00:00,27
2360,253127,DPW Maintained,Cordyline australis :: Dracena Palm,1639 45th Ave,1.0,Sidewalk: Curb side : Cutout,Private,7/20/17 0:00,3,3x3,37.75600282,-122.5046115,Cordyline,Cordyline australis,Dracena Palm,2017,2017-07-20 00:00:00,7
2361,48932,Permitted Site,Prunus serrulata :: Ornamental Cherry,2417 HARRISON ST,1.0,Sidewalk: Curb side : Cutout,Private,11/25/02 0:00,8,3x3,37.75838825,-122.4122719,Prunus,Prunus serrulata,Ornamental Cherry,2002,2002-11-25 00:00:00,22
2364,23461,DPW Maintained,Platanus x hispanica :: Sycamore: London Plane,2300 Van Ness Ave,2.0,Sidewalk: Curb side : Cutout,DPW,7/2/11 0:00,4,3x3,37.79689813,-122.4234735,Platanus,Platanus x,Sycamore: London Plane,2011,2011-07-02 00:00:00,13
2371,89549,DPW Maintained,Cordyline australis :: Dracena Palm,5601 Anza St,2.0,Sidewalk: Curb side : Cutout,DPW,3/27/08 0:00,3,3x3,37.77700759,-122.5085059,Cordyline,Cordyline australis,Dracena Palm,2008,2008-03-27 00:00:00,16
2382,37957,DPW Maintained,Platanus x hispanica :: Sycamore: London Plane,701 Minnesota St,3.0,Sidewalk: Curb side : Cutout,Private,7/8/98 0:00,6,,37.76120699,-122.39043,Platanus,Platanus x,Sycamore: London Plane,1998,1998-07-08 00:00:00,26
2383,104693,DPW Maintained,Agonis flexuosa :: Peppermint Willow,2132 Clement St,1.0,Sidewalk: Curb side : Cutout,Private,10/31/13 0:00,2,3x3,37.78221728,-122.4822639,Agonis,Agonis flexuosa,Peppermint Willow,2013,2013-10-31 00:00:00,11
2384,76762,DPW Maintained,Metrosideros excelsa :: New Zealand Xmas Tree,200X Farallones St,3.0,Sidewalk: Curb side : Cutout,SFUSD,11/20/89 0:00,10,3x3,37.71432563,-122.4591287,Metrosideros,Metrosideros excelsa,New Zealand Xmas Tree,1989,1989-11-20 00:00:00,35
2386,53948,DPW Maintained,Juniperus chinensis :: Juniper,106 Gaven St,1.0,Sidewalk: Curb side : Cutout,Private,8/15/12 0:00,10,,37.73370417,-122.4078165,Juniperus,Juniperus chinensis,Juniper,2012,2012-08-15 00:00:00,12
2389,82872,DPW Maintained,Metrosideros excelsa :: New Zealand Xmas Tree,96 Gladstone Dr,1.0,Sidewalk: Curb side : Cutout,Private,7/8/09 0:00,6,3x3,37.72944931,-122.4205697,Metrosideros,Metrosideros excelsa,New Zealand Xmas Tree,2009,2009-07-08 00:00:00,15
2394,37717,DPW Maintained,Lagunaria patersonii :: Primrose Tree,3001 Taraval St,1.0,Sidewalk: Curb side : Cutout,Private,3/27/15 16:45,3,3x3,37.74195251,-122.4985929,Lagunaria,Lagunaria patersonii,Primrose Tree,2015,2015-03-27 16:45:00,9
2396,86397,DPW Maintained,Prunus serrulata :: Ornamental Cherry,1623 26th Ave,1.0,Sidewalk: Curb side : Cutout,DPW,12/15/06 0:00,3,3x3,37.75712885,-122.484271,Prunus,Prunus serrulata,Ornamental Cherry,2006,2006-12-15 00:00:00,18
2400,58091,DPW Maintained,Pyrus kawakamii :: Evergreen Pear,1750 Polk St,1.0,Sidewalk: Curb side : Cutout,Private,10/8/10 0:00,2,,37.79284026,-122.4210543,Pyrus,Pyrus kawakamii,Evergreen Pear,2010,2010-10-08 00:00:00,14
2413,54989,DPW Maintained,Fraxinus uhdei :: Shamel Ash: Evergreen Ash,639 16th Ave,1.0,Sidewalk: Curb side : Cutout,Private,9/12/72 0:00,8,,37.77593288,-122.4748536,Fraxinus,Fraxinus uhdei,Shamel Ash: Evergreen Ash,1972,2072-09-12 00:00:00,-48
2423,5751,DPW Maintained,Platanus x hispanica :: Sycamore: London Plane,1790 Dolores St,1.0,Sidewalk: Curb side : Cutout,DPW,2/14/08 0:00,12,3X3,37.74086297,-122.4242638,Platanus,Platanus x,Sycamore: London Plane,2008,2008-02-14 00:00:00,16
2427,218225,DPW Maintained,Citrus  meyeri 'Improved' :: Improved Meyer Lemon,100 Claremont Blvd,1.0,Sidewalk: Property side : Yard,Private,4/14/20 0:00,3,Width 8ft,37.7428649,-122.4639348,Citrus,Citrus ,Improved Meyer Lemon,2020,2020-04-14 00:00:00,4
2428,27464,DPW Maintained,Lophostemon confertus :: Brisbane Box,2945 03rd St,1.0,Sidewalk: Curb side : Cutout,Private,3/1/00 0:00,3,3x3,37.75255602,-122.3875828,Lophostemon,Lophostemon confertus,Brisbane Box,2000,2000-03-01 00:00:00,24
2430,90162,DPW Maintained,Eriobotrya deflexa :: Bronze Loquat,1000X Balboa St,2.0,Sidewalk: Curb side : Cutout,DPW,2/12/08 0:00,3,3x3,37.77705513,-122.4695909,Eriobotrya,Eriobotrya deflexa,Bronze Loquat,2008,2008-02-12 00:00:00,16
2432,24286,DPW Maintained,Lagunaria patersonii :: Primrose Tree,336 Winding Way,1.0,Sidewalk: Curb side : Cutout,DPW,8/19/21 0:00,3,3X10,37.70931026,-122.4370788,Lagunaria,Lagunaria patersonii,Primrose Tree,2021,2021-08-19 00:00:00,3
2433,1959,Permitted Site,Melaleuca quinquenervia :: Cajeput,35 Bertha Ln,1.0,Sidewalk: Curb side : Cutout,Private,2/5/99 0:00,6,3X4,37.7336183,-122.3813073,Melaleuca,Melaleuca quinquenervia,Cajeput,1999,1999-02-05 00:00:00,25
2436,59661,DPW Maintained,Ficus retusa nitida :: Banyan Fig,950 Steiner St,1.0,Sidewalk: Curb side : Cutout,Private,3/30/81 0:00,16,,37.77811498,-122.4332667,Ficus,Ficus retusa,Banyan Fig,1981,1981-03-30 00:00:00,43
2438,65755,DPW Maintained,Pyrus calleryana 'Aristocrat' :: Aristocrat Callery Pear,3036 Octavia St,1.0,Sidewalk: Curb side : Cutout,Private,4/20/90 0:00,14,,37.80034415,-122.429323,Pyrus,Pyrus calleryana,Aristocrat Callery Pear,1990,1990-04-20 00:00:00,34
2446,107404,DPW Maintained,Magnolia grandiflora :: Southern Magnolia,1440 Clement St,1.0,Sidewalk: Curb side : Cutout,Private,9/8/14 0:00,3,3x3,37.7825638,-122.4748233,Magnolia,Magnolia grandiflora,Southern Magnolia,2014,2014-09-08 00:00:00,10
2447,15599,DPW Maintained,Maytenus boaria :: Mayten,3322 Mission St,1.0,Sidewalk: Curb side : Cutout,Private,7/28/95 0:00,3,3X3,37.74359638,-122.4212873,Maytenus,Maytenus boaria,Mayten,1995,1995-07-28 00:00:00,29
2449,113491,Significant Tree,Dodonaea viscosa :: Hop Bush,366x 07TH AVE,1.0,Sidewalk: Property side : Cutout,Private,12/7/15 0:00,6,3x3,37.78192599,-122.4654231,Dodonaea,Dodonaea viscosa,Hop Bush,2015,2015-12-07 00:00:00,9
2457,47277,Permitted Site,Prunus serrulata 'Kwanzan' :: Kwanzan Flowering Cherry,2633 20th St,1.0,Sidewalk: Curb side : Cutout,Private,12/22/14 0:00,3,,37.75927396,-122.4072746,Prunus,Prunus serrulata,Kwanzan Flowering Cherry,2014,2014-12-22 00:00:00,10
2458,25346,DPW Maintained,Metrosideros excelsa :: New Zealand Xmas Tree,1603X Sunset Blvd,1.0,Sidewalk: Curb side : Cutout,DPW,5/22/97 0:00,3,10,37.75709778,-122.4953518,Metrosideros,Metrosideros excelsa,New Zealand Xmas Tree,1997,1997-05-22 00:00:00,27
2460,89485,DPW Maintained,Tristaniopsis laurina :: Swamp Myrtle,4220 Anza St,1.0,Sidewalk: Curb side : Cutout,DPW,3/26/08 0:00,3,3x3,37.77783348,-122.4936096,Tristaniopsis,Tristaniopsis laurina,Swamp Myrtle,2008,2008-03-26 00:00:00,16
2461,253156,DPW Maintained,Prunus cerasifera :: Cherry Plum,654 Hampshire St,1.0,Sidewalk: Curb side : Cutout,Private,7/25/17 0:00,3,3x3,37.76112306,-122.4082733,Prunus,Prunus cerasifera,Cherry Plum,2017,2017-07-25 00:00:00,7
2463,29275,DPW Maintained,Lophostemon confertus :: Brisbane Box,300X Portola Dr,19.0,Median : Cutout,DPW,10/14/05 0:00,3,3X3,37.7466225,-122.4470948,Lophostemon,Lophostemon confertus,Brisbane Box,2005,2005-10-14 00:00:00,19
2464,44274,DPW Maintained,Prunus x yedoensis :: Yoshino Cherry,730 Vermont St,1.0,Sidewalk: Curb side : Cutout,Private,2/22/01 0:00,4,,37.75985386,-122.4041404,Prunus,Prunus x,Yoshino Cherry,2001,2001-02-22 00:00:00,23
2471,108393,Permitted Site,Magnolia grandiflora 'Saint Mary' :: Saint Mary Magnolia,321 San Carlos St,1.0,Sidewalk: Curb side : Cutout,Private,12/19/14 0:00,3,3x3,37.75823479,-122.4197386,Magnolia,Magnolia grandiflora,Saint Mary Magnolia,2014,2014-12-19 00:00:00,10
2478,31991,DPW Maintained,Liquidambar styraciflua :: American Sweet Gum,215 04th Ave,1.0,Sidewalk: Curb side : Cutout,Private,6/30/95 0:00,12,,37.78432448,-122.4624572,Liquidambar,Liquidambar styraciflua,American Sweet Gum,1995,1995-06-30 00:00:00,29
2479,34815,DPW Maintained,Metrosideros excelsa :: New Zealand Xmas Tree,400 40th Ave,3.0,Sidewalk: Curb side : Cutout,Private,6/13/02 0:00,6,,37.78103308,-122.5008613,Metrosideros,Metrosideros excelsa,New Zealand Xmas Tree,2002,2002-06-13 00:00:00,22
2481,104315,DPW Maintained,Olea europaea :: Olive Tree,501X 25th Ave,3.0,Sidewalk: Curb side : Cutout,Private,6/6/15 0:00,18,3x3,37.77975033,-122.4848076,Olea,Olea europaea,Olive Tree,2015,2015-06-06 00:00:00,9
2486,264669,Section 806 (d),Prunus subhirtella 'autumnalis' :: Higan Cherry,1890 Church St,2.0,Sidewalk: Curb side : Cutout,Private,9/11/20 0:00,3,4x4,37.74000475,-122.4267155,Prunus,Prunus subhirtella,Higan Cherry,2020,2020-09-11 00:00:00,4
2497,29587,DPW Maintained,Corymbia ficifolia :: Red Flowering Gum,610X Junipero Serra Blvd,1.0,Median : Cutout,DPW,4/1/07 0:00,3,3X3,37.72770032,-122.4722031,Corymbia,Corymbia ficifolia,Red Flowering Gum,2007,2007-04-01 00:00:00,17
2507,30745,DPW Maintained,Callistemon viminalis :: Weeping Bottlebrush,486X Page St,6.0,Sidewalk: Curb side : Cutout,SFUSD,1/31/95 0:00,6,3x3,37.77336882,-122.4286428,Callistemon,Callistemon viminalis,Weeping Bottlebrush,1995,1995-01-31 00:00:00,29
2510,39694,DPW Maintained,Prunus cerasifera :: Cherry Plum,1770 Quesada Ave,1.0,Sidewalk: Curb side : Cutout,Private,1/5/99 0:00,8,,37.73418945,-122.39274,Prunus,Prunus cerasifera,Cherry Plum,1999,1999-01-05 00:00:00,25
2512,90173,DPW Maintained,Eriobotrya deflexa :: Bronze Loquat,1500X Balboa St,2.0,Sidewalk: Curb side : Cutout,DPW,2/26/08 0:00,3,3x3,37.77680973,-122.4750441,Eriobotrya,Eriobotrya deflexa,Bronze Loquat,2008,2008-02-26 00:00:00,16
2531,31373,DPW Maintained,Arbutus unedo :: Strawberry Tree,616 Taraval St,1.0,Sidewalk: Curb side : Cutout,Private,4/21/95 0:00,17,,37.74327146,-122.4729094,Arbutus,Arbutus unedo,Strawberry Tree,1995,1995-04-21 00:00:00,29
2532,39491,Permitted Site,Lyonothamnus floribundus subsp. asplenifolius :: Santa Cruz Ironwood,4028 25th St,1.0,Sidewalk: Curb side : Cutout,Private,12/28/98 0:00,2,3x3,37.74999547,-122.4301688,Lyonothamnus,Lyonothamnus floribundus,Santa Cruz Ironwood,1998,1998-12-28 00:00:00,26
2543,12956,DPW Maintained,Prunus serrulata 'Kwanzan' :: Kwanzan Flowering Cherry,50 Lippard Ave,1.0,Sidewalk: Curb side : Cutout,Private,6/1/98 0:00,3,5x5,37.73468802,-122.4356388,Prunus,Prunus serrulata,Kwanzan Flowering Cherry,1998,1998-06-01 00:00:00,26
2544,93368,DPW Maintained,Tristaniopsis laurina 'Elegant' :: Small-leaf Tristania 'Elegant',2800 Turk Blvd,14.0,Sidewalk: Curb side : Cutout,DPW,11/24/08 0:00,3,3x3,37.77808943,-122.4515779,Tristaniopsis,Tristaniopsis laurina,Small-leaf Tristania 'Elegant',2008,2008-11-24 00:00:00,16
2545,29055,DPW Maintained,Magnolia grandiflora :: Southern Magnolia,400X 11th St,1.0,Sidewalk: Curb side : Cutout,DPW,12/27/05 0:00,3,3x3,37.77054452,-122.4124944,Magnolia,Magnolia grandiflora,Southern Magnolia,2005,2005-12-27 00:00:00,19
2548,6007,Permitted Site,Maytenus boaria :: Mayten,1700X Eddy St,4.0,Sidewalk: Curb side : Cutout,Private,5/7/92 0:00,3,4X4,37.78107091,-122.4356792,Maytenus,Maytenus boaria,Mayten,1992,1992-05-07 00:00:00,32
2549,239457,Planning Code 138.1 required,Prunus serrulata 'Kwanzan' :: Kwanzan Flowering Cherry,165 Sussex St,2.0,Sidewalk: Curb side : Cutout,DPW,10/11/17 0:00,3,Width 3ft,37.73666532,-122.435698,Prunus,Prunus serrulata,Kwanzan Flowering Cherry,2017,2017-10-11 00:00:00,7
2555,62189,DPW Maintained,Pittosporum undulatum :: Victorian Box,159 Santa Ynez Ave,1.0,Sidewalk: Curb side : Cutout,Private,9/20/85 0:00,12,,37.72504292,-122.4411124,Pittosporum,Pittosporum undulatum,Victorian Box,1985,1985-09-20 00:00:00,39
2556,264798,Undocumented,Tristaniopsis laurina :: Swamp Myrtle,698 Dwight St,1.0,Sidewalk: Curb side : Cutout,Private,10/13/20 0:00,3,3x3,37.72235705,-122.4085299,Tristaniopsis,Tristaniopsis laurina,Swamp Myrtle,2020,2020-10-13 00:00:00,4
2557,83702,DPW Maintained,Arbutus 'Marina' :: Hybrid Strawberry Tree,1610 Quesada Ave,1.0,Sidewalk: Curb side : Cutout,Private,7/1/09 0:00,2,3x3,37.73252553,-122.389835,Arbutus,Arbutus 'Marina',Hybrid Strawberry Tree,2009,2009-07-01 00:00:00,15
2559,31303,DPW Maintained,Prunus serrulata :: Ornamental Cherry,535 Birch St,1.0,Sidewalk: Curb side : Cutout,Private,4/12/95 0:00,7,,37.77795126,-122.4256715,Prunus,Prunus serrulata,Ornamental Cherry,1995,1995-04-12 00:00:00,29
2560,8000,DPW Maintained,Pittosporum undulatum :: Victorian Box,350X Fulton St,2.0,Sidewalk: Curb side : Cutout,DPW,5/26/92 0:00,12,,37.77891793,-122.4225608,Pittosporum,Pittosporum undulatum,Victorian Box,1992,1992-05-26 00:00:00,32
2566,67657,DPW Maintained,Magnolia grandiflora :: Southern Magnolia,1789 McKinnon Ave,1.0,Sidewalk: Curb side : Cutout,Private,11/5/92 0:00,9,,37.73781588,-122.392815,Magnolia,Magnolia grandiflora,Southern Magnolia,1992,1992-11-05 00:00:00,32
2570,109967,DPW Maintained,Olea europaea :: Olive Tree,1019 Hollister Ave,1.0,Front Yard : Yard,Private,3/13/15 0:00,3,12x17,37.71878022,-122.3910748,Olea,Olea europaea,Olive Tree,2015,2015-03-13 00:00:00,9
2571,90371,DPW Maintained,Tristaniopsis laurina 'Elegant' :: Small-leaf Tristania 'Elegant',399X Balboa St,1.0,Sidewalk: Curb side : Cutout,DPW,2/12/08 0:00,3,3x3,37.77721499,-122.462735,Tristaniopsis,Tristaniopsis laurina,Small-leaf Tristania 'Elegant',2008,2008-02-12 00:00:00,16
2573,76344,DPW Maintained,Metrosideros excelsa :: New Zealand Xmas Tree,3899X Kirkham St,12.0,Sidewalk: Curb side : Cutout,SFUSD,5/14/94 0:00,12,3x30,37.75811133,-122.5024502,Metrosideros,Metrosideros excelsa,New Zealand Xmas Tree,1994,1994-05-14 00:00:00,30
2577,43178,DPW Maintained,Olea europaea :: Olive Tree,1537 Silliman St,1.0,Sidewalk: Curb side : Cutout,Private,7/11/00 0:00,8,,37.72715451,-122.4204514,Olea,Olea europaea,Olive Tree,2000,2000-07-11 00:00:00,24
2578,214549,DPW Maintained,Prunus serrulata 'Kwanzan' :: Kwanzan Flowering Cherry,820 Irving St,1.0,Sidewalk: Curb side : Cutout,DPW,1/12/16 6:37,1,Width 3ft,37.76410952,-122.4667554,Prunus,Prunus serrulata,Kwanzan Flowering Cherry,2016,2016-01-12 06:37:00,8
2579,5588,DPW Maintained,Aesculus x carnea :: Red Horse Chestnut,1077 Dolores St,1.0,Sidewalk: Curb side : Cutout,DPW,5/7/90 0:00,6,3x3,37.75221988,-122.4250494,Aesculus,Aesculus x,Red Horse Chestnut,1990,1990-05-07 00:00:00,34
2580,30543,DPW Maintained,Tristaniopsis laurina :: Swamp Myrtle,401 Tunnel Ave,14.0,Sidewalk: Curb side : Cutout,Private,1/25/95 0:00,5,,37.70957841,-122.4012648,Tristaniopsis,Tristaniopsis laurina,Swamp Myrtle,1995,1995-01-25 00:00:00,29
2581,11922,DPW Maintained,Eriobotrya deflexa :: Bronze Loquat,620X Keith St,6.0,Sidewalk: Curb side : Cutout,DPW,5/10/16 0:00,3,3X4,37.73725421,-122.3824772,Eriobotrya,Eriobotrya deflexa,Bronze Loquat,2016,2016-05-10 00:00:00,8
2582,69303,DPW Maintained,Prunus serrulata 'Kwanzan' :: Kwanzan Flowering Cherry,813 Lyon St,1.0,Sidewalk: Curb side : Cutout,Private,1/8/14 0:00,6,,37.77860184,-122.4436812,Prunus,Prunus serrulata,Kwanzan Flowering Cherry,2014,2014-01-08 00:00:00,10
2584,86528,DPW Maintained,Tristaniopsis laurina :: Swamp Myrtle,1475 27th Ave,1.0,Sidewalk: Curb side : Cutout,DPW,12/26/06 0:00,3,3x3,37.75993715,-122.4855405,Tristaniopsis,Tristaniopsis laurina,Swamp Myrtle,2006,2006-12-26 00:00:00,18
2590,33275,DPW Maintained,Rhaphiolepis Majestic Beauty :: Indian Hawthorn  'Majestic Beau',1200 Clay St,1.0,Sidewalk: Curb side : Cutout,Private,11/13/96 0:00,5,,37.79344861,-122.4130337,Rhaphiolepis,Rhaphiolepis Majestic,Indian Hawthorn  'Majestic Beau',1996,1996-11-13 00:00:00,28
2593,34259,DPW Maintained,Pyrus calleryana 'Aristocrat' :: Aristocrat Callery Pear,164 06th Ave,1.0,Sidewalk: Curb side : Cutout,Private,5/29/98 0:00,12,,37.78559278,-122.4645345,Pyrus,Pyrus calleryana,Aristocrat Callery Pear,1998,1998-05-29 00:00:00,26
2594,63992,DPW Maintained,Pistacia chinensis :: Chinese Pistache,880 Lombard St,1.0,Sidewalk: Curb side : Cutout,Private,10/6/87 0:00,10,,37.80252057,-122.4160233,Pistacia,Pistacia chinensis,Chinese Pistache,1987,1987-10-06 00:00:00,37
2595,83916,DPW Maintained,Metrosideros excelsa :: New Zealand Xmas Tree,1474 47th Ave,1.0,Sidewalk: Curb side : Cutout,Private,1/24/08 0:00,3,3x3,37.75900019,-122.5068287,Metrosideros,Metrosideros excelsa,New Zealand Xmas Tree,2008,2008-01-24 00:00:00,16
2598,251682,DPW Maintained,Eriobotrya deflexa :: Bronze Loquat,40 Lee Ave,1.0,Sidewalk: Curb side : Cutout,Private,10/4/17 14:02,3,3x3,37.71897017,-122.4539305,Eriobotrya,Eriobotrya deflexa,Bronze Loquat,2017,2017-10-04 14:02:00,7
2603,84466,Permitted Site,Pyrus calleryana :: Ornamental Pear,400x CAPP ST,2.0,Sidewalk: Curb side : Cutout,Private,6/2/08 0:00,4,3x3,37.7601684,-122.4183485,Pyrus,Pyrus calleryana,Ornamental Pear,2008,2008-06-02 00:00:00,16
2604,106161,DPW Maintained,Prunus cerasifera :: Cherry Plum,827 North Point St,1.0,Sidewalk: Curb side : Cutout,Private,3/31/14 0:00,3,3x3,37.80558939,-122.4208842,Prunus,Prunus cerasifera,Cherry Plum,2014,2014-03-31 00:00:00,10
2618,110624,DPW Maintained,Acacia stenophylla :: Shoestring Acacia,400X GUERRERO ST,7.0,Median : Cutout,DPW,4/29/15 10:16,3,3x3,37.76449805,-122.4243841,Acacia,Acacia stenophylla,Shoestring Acacia,2015,2015-04-29 10:16:00,9
2625,248880,DPW Maintained,Corymbia ficifolia :: Red Flowering Gum,3180 18th St,2.0,Sidewalk: Curb side : Cutout,Private,5/22/20 0:00,3,Width 3ft,37.76218755,-122.4145157,Corymbia,Corymbia ficifolia,Red Flowering Gum,2020,2020-05-22 00:00:00,4
2626,37386,Permitted Site,Leptospermum scoparium 'Ruby Glow' :: New Zealand Ruby Glow Tea Tree,755 Morse St,20.0,Sidewalk: Property side : Cutout,Private,6/15/98 0:00,3,3x3,37.71055643,-122.4473251,Leptospermum,Leptospermum scoparium,New Zealand Ruby Glow Tea Tree,1998,1998-06-15 00:00:00,26
2628,13428,DPW Maintained,Platanus x hispanica :: Sycamore: London Plane,1 Market St,12.0,Sidewalk: Curb side : Cutout,DPW,10/29/03 0:00,6,4x4,37.79423991,-122.3948965,Platanus,Platanus x,Sycamore: London Plane,2003,2003-10-29 00:00:00,21
2639,90717,DPW Maintained,Yucca gloriosa :: Spanish Dagger,4600X Cabrillo St,1.0,Sidewalk: Curb side : Cutout,DPW,4/7/08 0:00,3,3x3,37.77343516,-122.5080693,Yucca,Yucca gloriosa,Spanish Dagger,2008,2008-04-07 00:00:00,16
2640,6477,DPW Maintained,Ginkgo biloba 'Autumn Gold' :: Ginkgo: Autumn Gold,1200X Evans Ave,19.0,Sidewalk: Curb side : Cutout,DPW,1/26/04 0:00,3,3x3,37.73959878,-122.3821173,Ginkgo,Ginkgo biloba,Ginkgo: Autumn Gold,2004,2004-01-26 00:00:00,20
2642,90349,DPW Maintained,Eriobotrya deflexa :: Bronze Loquat,1045 Balboa St,1.0,Sidewalk: Curb side : Cutout,DPW,2/12/08 0:00,3,3x3,37.77688078,-122.4701229,Eriobotrya,Eriobotrya deflexa,Bronze Loquat,2008,2008-02-12 00:00:00,16
2643,5029,DPW Maintained,Metrosideros excelsa :: New Zealand Xmas Tree,5320 Diamond Heights Blvd,13.0,Sidewalk: Curb side : Cutout,DPW,6/4/92 0:00,9,9x3,37.74265102,-122.4365079,Metrosideros,Metrosideros excelsa,New Zealand Xmas Tree,1992,1992-06-04 00:00:00,32
2644,25472,DPW Maintained,Prunus serrulata :: Ornamental Cherry,205X Randolph St,1.0,Sidewalk: Curb side : Cutout,Private,12/18/19 0:00,6,3X3,37.71420876,-122.4645991,Prunus,Prunus serrulata,Ornamental Cherry,2019,2019-12-18 00:00:00,5
2646,5095,DPW Maintained,Prunus cerasifera :: Cherry Plum,2611 Diamond St,1.0,Sidewalk: Curb side : Cutout,DPW,2/4/04 0:00,6,3X3,37.73684598,-122.4345195,Prunus,Prunus cerasifera,Cherry Plum,2004,2004-02-04 00:00:00,20
2649,4106,DPW Maintained,Prunus serrulata 'Kwanzan' :: Kwanzan Flowering Cherry,3359 Cesar Chavez St,1.0,Sidewalk: Curb side : Cutout,Private,12/17/03 0:00,3,3X3,37.74806142,-122.4172465,Prunus,Prunus serrulata,Kwanzan Flowering Cherry,2003,2003-12-17 00:00:00,21
2652,90821,DPW Maintained,Arbutus 'Marina' :: Hybrid Strawberry Tree,3031 Cabrillo St,1.0,Sidewalk: Curb side : Cutout,DPW,4/7/08 0:00,3,3x3,37.77404254,-122.4913462,Arbutus,Arbutus 'Marina',Hybrid Strawberry Tree,2008,2008-04-07 00:00:00,16
2654,234784,Permitted Site,Magnolia grandiflora :: Southern Magnolia,11 Surrey St,1.0,Sidewalk: Curb side : Cutout,Private,12/2/19 0:00,3,3x5,37.73503901,-122.4329583,Magnolia,Magnolia grandiflora,Southern Magnolia,2019,2019-12-02 00:00:00,5
2655,30635,DPW Maintained,Pyrus kawakamii :: Evergreen Pear,1690 Folsom St,2.0,Sidewalk: Curb side : Cutout,Private,1/30/95 0:00,3,3x3,37.77038836,-122.4154127,Pyrus,Pyrus kawakamii,Evergreen Pear,1995,1995-01-30 00:00:00,29
2656,265043,Section 806 (d),Ginkgo biloba :: Maidenhair Tree,1250 Eucalyptus Dr,1.0,Sidewalk: Property side : Yard,Private,12/17/20 0:00,3,5x10,37.73105825,-122.4850651,Ginkgo,Ginkgo biloba,Maidenhair Tree,2020,2020-12-17 00:00:00,4
2663,22251,DPW Maintained,Pyrus calleryana :: Ornamental Pear,4522 03rd St,1.0,Sidewalk: Curb side : Cutout,DPW,3/31/95 0:00,6,3x3,37.73688244,-122.3901315,Pyrus,Pyrus calleryana,Ornamental Pear,1995,1995-03-31 00:00:00,29
2664,68958,DPW Maintained,Rhaphiolepis Majestic Beauty :: Indian Hawthorn  'Majestic Beau',2914 Anza St,1.0,Sidewalk: Curb side : Cutout,Private,12/29/93 0:00,5,,37.77846868,-122.4796244,Rhaphiolepis,Rhaphiolepis Majestic,Indian Hawthorn  'Majestic Beau',1993,1993-12-29 00:00:00,31
2667,88553,DPW Maintained,Olea europaea :: Olive Tree,734 15th Ave,,Sidewalk: Curb side : Cutout,Private,7/24/08 0:00,4,3x3,37.77422975,-122.4734342,Olea,Olea europaea,Olive Tree,2008,2008-07-24 00:00:00,16
2669,85613,DPW Maintained,Pyrus kawakamii :: Evergreen Pear,1190 Quesada Ave,1.0,Sidewalk: Curb side : Cutout,DPW,3/30/07 0:00,3,3x3,37.72802001,-122.3818716,Pyrus,Pyrus kawakamii,Evergreen Pear,2007,2007-03-30 00:00:00,17
2671,53290,DPW Maintained,Pittosporum undulatum :: Victorian Box,2722 Franklin St,1.0,Sidewalk: Curb side : Cutout,Private,8/25/69 0:00,13,,37.79963861,-122.4257974,Pittosporum,Pittosporum undulatum,Victorian Box,1969,2069-08-25 00:00:00,-45
2675,10517,DPW Maintained,Schinus terebinthifolius :: Brazilian Pepper,1827 Haight St,1.0,Sidewalk: Curb side : Cutout,Private,8/9/96 0:00,20,3X3,37.76924622,-122.4523728,Schinus,Schinus terebinthifolius,Brazilian Pepper,1996,1996-08-09 00:00:00,28
2678,85716,DPW Maintained,Magnolia grandiflora :: Southern Magnolia,1187X Howard St,1.0,Sidewalk: Curb side : Cutout,Private,4/30/07 0:00,3,3x3,37.77634648,-122.4112808,Magnolia,Magnolia grandiflora,Southern Magnolia,2007,2007-04-30 00:00:00,17
2679,48441,DPW Maintained,Callistemon viminalis :: Weeping Bottlebrush,2399 Post St,1.0,Sidewalk: Curb side : Cutout,Private,7/29/02 0:00,5,,37.78406214,-122.4411678,Callistemon,Callistemon viminalis,Weeping Bottlebrush,2002,2002-07-29 00:00:00,22
2688,109142,Permitted Site,Magnolia grandiflora 'Samuel Sommer' :: Samuel Sommer Magnolia,342 29th Ave,1.0,Sidewalk: Curb side : Cutout,Private,1/29/15 0:00,3,3x3,37.7828773,-122.489072,Magnolia,Magnolia grandiflora,Samuel Sommer Magnolia,2015,2015-01-29 00:00:00,9
2689,92418,DPW Maintained,Cordyline australis :: Dracena Palm,1242 38th Ave,1.0,Sidewalk: Curb side : Cutout,Private,7/29/09 0:00,3,3x3,37.76372021,-122.4974864,Cordyline,Cordyline australis,Dracena Palm,2009,2009-07-29 00:00:00,15
2698,49522,DPW Maintained,Lophostemon confertus :: Brisbane Box,575@ DIVISION 10th St,1.0,Sidewalk: Curb side : Cutout,Private,4/23/03 0:00,6,,37.76956142,-122.4085883,Lophostemon,Lophostemon confertus,Brisbane Box,2003,2003-04-23 00:00:00,21
2710,71451,Undocumented,Corymbia ficifolia :: Red Flowering Gum,1329 South Van Ness Ave,1.0,Sidewalk: Curb side : Cutout,Private,9/25/82 0:00,14,3x3,37.75190012,-122.4161287,Corymbia,Corymbia ficifolia,Red Flowering Gum,1982,1982-09-25 00:00:00,42
2712,89598,DPW Maintained,Tristaniopsis laurina 'Elegant' :: Small-leaf Tristania 'Elegant',4417 Anza St,1.0,Sidewalk: Curb side : Cutout,DPW,3/27/08 0:00,3,3x3,37.77758733,-122.4956553,Tristaniopsis,Tristaniopsis laurina,Small-leaf Tristania 'Elegant',2008,2008-03-27 00:00:00,16
2721,29152,DPW Maintained,Lophostemon confertus :: Brisbane Box,300X Jones St,3.0,Sidewalk: Curb side : Cutout,DPW,11/19/05 0:00,3,3x3,37.7842411,-122.4125871,Lophostemon,Lophostemon confertus,Brisbane Box,2005,2005-11-19 00:00:00,19
2724,259756,DPW Maintained,Crataegus phaenopyrum :: Washington Hawthorn,1523 Innes Ave,,Sidewalk: Curb side : Cutout,DPW,10/13/18 0:00,3,,37.73857036,-122.3874533,Crataegus,Crataegus phaenopyrum,Washington Hawthorn,2018,2018-10-13 00:00:00,6
2726,244,DPW Maintained,Platanus x hispanica :: Sycamore: London Plane,3027 19th Ave,2.0,Sidewalk: Curb side : Cutout,DPW,11/15/95 0:00,20,2,37.73193736,-122.4750651,Platanus,Platanus x,Sycamore: London Plane,1995,1995-11-15 00:00:00,29
2727,39592,DPW Maintained,Melaleuca quinquenervia :: Cajeput,45 Southern Heights Ave,3.0,Sidewalk: Curb side : Cutout,Private,12/29/98 0:00,6,,37.75791372,-122.4006365,Melaleuca,Melaleuca quinquenervia,Cajeput,1998,1998-12-29 00:00:00,26
2733,15227,DPW Maintained,Lophostemon confertus :: Brisbane Box,1254 Mission St,1.0,Sidewalk: Curb side : Cutout,Private,12/11/09 0:00,3,3x3,37.77689859,-122.4140007,Lophostemon,Lophostemon confertus,Brisbane Box,2009,2009-12-11 00:00:00,15
2735,65883,DPW Maintained,Ceratonia siliqua :: Carob,3100X Fillmore St,1.0,Sidewalk: Curb side : Cutout,Private,4/23/13 0:00,3,,37.79817478,-122.4356373,Ceratonia,Ceratonia siliqua,Carob,2013,2013-04-23 00:00:00,11
2736,254217,DPW Maintained,Arbutus 'Marina' :: Hybrid Strawberry Tree,2335 17th Ave,1.0,Sidewalk: Curb side : Cutout,Private,1/23/18 0:00,3,3x3,37.74434327,-122.4737068,Arbutus,Arbutus 'Marina',Hybrid Strawberry Tree,2018,2018-01-23 00:00:00,6
2739,137822,DPW Maintained,Pyrus kawakamii :: Evergreen Pear,2188 Pine St,1.0,Sidewalk: Curb side : Cutout,DPW,6/21/11 0:00,2,Width 0ft,37.78827652,-122.4317037,Pyrus,Pyrus kawakamii,Evergreen Pear,2011,2011-06-21 00:00:00,13
2742,30713,DPW Maintained,Ginkgo biloba :: Maidenhair Tree,111 Page St,1.0,Sidewalk: Curb side : Cutout,Private,1/31/95 0:00,3,,37.77393927,-122.4231429,Ginkgo,Ginkgo biloba,Maidenhair Tree,1995,1995-01-31 00:00:00,29
2746,83178,DPW Maintained,Pyrus kawakamii :: Evergreen Pear,743 19th Ave,1.0,Sidewalk: Curb side : Cutout,Private,12/31/19 0:00,3,3x3,37.77388002,-122.477927,Pyrus,Pyrus kawakamii,Evergreen Pear,2019,2019-12-31 00:00:00,5
2749,253426,DPW Maintained,Cordyline australis :: Dracena Palm,2 09th Ave,4.0,Sidewalk: Curb side : Cutout,Private,3/27/18 0:00,3,3x3,37.78669472,-122.4677265,Cordyline,Cordyline australis,Dracena Palm,2018,2018-03-27 00:00:00,6
2751,21660,DPW Maintained,Prunus serrulata 'Kwanzan' :: Kwanzan Flowering Cherry,1750 Sutter St,2.0,Sidewalk: Curb side : Cutout,Private,3/26/15 0:00,3,4x4,37.7866978,-122.4290145,Prunus,Prunus serrulata,Kwanzan Flowering Cherry,2015,2015-03-26 00:00:00,9
2756,250074,Planning Code 138.1 required,Pittosporum undulatum :: Victorian Box,1599X Bush St,3.0,Sidewalk: Curb side : Cutout,Private,4/5/17 0:00,3,Width 4ft,37.78838405,-122.422774,Pittosporum,Pittosporum undulatum,Victorian Box,2017,2017-04-05 00:00:00,7
2757,141402,DPW Maintained,Platanus x hispanica :: Sycamore: London Plane,651 GROVE ST,17.0,Sidewalk: Curb side : Cutout,Private,7/5/16 0:00,10,Width 0ft,37.77732675,-122.4265918,Platanus,Platanus x,Sycamore: London Plane,2016,2016-07-05 00:00:00,8
2761,161275,DPW Maintained,Crataegus phaenopyrum :: Washington Hawthorn,574 Naples St,1.0,Sidewalk: Curb side : Cutout,Private,10/25/17 12:26,3,Width 0ft,37.7197211,-122.4321453,Crataegus,Crataegus phaenopyrum,Washington Hawthorn,2017,2017-10-25 12:26:00,7
2765,102184,DPW Maintained,Metrosideros excelsa :: New Zealand Xmas Tree,1840X Webster St,2.0,Sidewalk: Curb side : Cutout,Private,8/19/15 0:00,12,3x3,37.78797965,-122.4315836,Metrosideros,Metrosideros excelsa,New Zealand Xmas Tree,2015,2015-08-19 00:00:00,9
2767,37140,DPW Maintained,Arbutus 'Marina' :: Hybrid Strawberry Tree,650 41st Ave,1.0,Sidewalk: Curb side : Cutout,Private,6/3/98 0:00,6,,37.77643107,-122.501593,Arbutus,Arbutus 'Marina',Hybrid Strawberry Tree,1998,1998-06-03 00:00:00,26
2769,27855,DPW Maintained,Lophostemon confertus :: Brisbane Box,350 Masonic Ave,4.0,Sidewalk: Curb side : Cutout,DPW,12/14/07 0:00,3,3X3,37.77803015,-122.4467037,Lophostemon,Lophostemon confertus,Brisbane Box,2007,2007-12-14 00:00:00,17
2770,85676,DPW Maintained,Acer rubrum 'Red Sunset' :: Red Swamp Maple,704 Bryant St,1.0,Sidewalk: Curb side : Cutout,DPW,4/23/07 0:00,3,3x3,37.77775038,-122.4004573,Acer,Acer rubrum,Red Swamp Maple,2007,2007-04-23 00:00:00,17
2773,22708,Permitted Site,Tristaniopsis laurina 'Elegant' :: Small-leaf Tristania 'Elegant',1420 Turk St,5.0,Sidewalk: Curb side : Cutout,Private,1/19/01 0:00,6,3X3,37.78040107,-122.4333526,Tristaniopsis,Tristaniopsis laurina,Small-leaf Tristania 'Elegant',2001,2001-01-19 00:00:00,23
2774,90260,DPW Maintained,Metrosideros excelsa :: New Zealand Xmas Tree,3816 Balboa St,1.0,Sidewalk: Curb side : Cutout,DPW,4/22/08 0:00,3,3x3,37.77566375,-122.4996534,Metrosideros,Metrosideros excelsa,New Zealand Xmas Tree,2008,2008-04-22 00:00:00,16
2779,85439,,Platanus x hispanica 'Yarwood' :: Yarwood Sycamore,360Y5 Valencia St,,Sidewalk: Curb side : Cutout,DPW,8/22/07 0:00,6,4x4,37.76709713,-122.4232093,Platanus,Platanus x,Yarwood Sycamore,2007,2007-08-22 00:00:00,17
2783,80919,Permitted Site,Lophostemon confertus :: Brisbane Box,742-744 Moultrie St,1.0,Sidewalk: Curb side : Cutout,Private,12/24/07 0:00,4,3x3,37.73553059,-122.4161999,Lophostemon,Lophostemon confertus,Brisbane Box,2007,2007-12-24 00:00:00,17
2786,115731,Significant Tree,Acer rubrum :: Red Maple,15 Yerba Buena Ave,2.0,Sidewalk: Curb side : Cutout,Private,2/24/16 0:00,3,,37.73820528,-122.465108,Acer,Acer rubrum,Red Maple,2016,2016-02-24 00:00:00,8
2791,4024,Permitted Site,Maytenus boaria :: Mayten,1900 Cesar Chavez St,2.0,Sidewalk: Curb side : Cutout,Private,4/1/95 0:00,3,3X3,37.74981222,-122.3963104,Maytenus,Maytenus boaria,Mayten,1995,1995-04-01 00:00:00,29
2792,23152,Permitted Site,Lophostemon confertus :: Brisbane Box,50 Van Ness Ave,3.0,Sidewalk: Curb side : Cutout,Dept of Real Estate,10/3/00 0:00,12,,37.7755838,-122.4191768,Lophostemon,Lophostemon confertus,Brisbane Box,2000,2000-10-03 00:00:00,24
2793,88387,DPW Maintained,Arbutus 'Marina' :: Hybrid Strawberry Tree,328 19th Ave,,Sidewalk: Curb side : Cutout,Private,7/10/08 0:00,7,3x3,37.78175812,-122.4783296,Arbutus,Arbutus 'Marina',Hybrid Strawberry Tree,2008,2008-07-10 00:00:00,16
2798,68160,DPW Maintained,Metrosideros excelsa :: New Zealand Xmas Tree,2937 Scott St,1.0,Sidewalk: Curb side : Cutout,Private,6/3/93 0:00,13,,37.79705948,-122.4406212,Metrosideros,Metrosideros excelsa,New Zealand Xmas Tree,1993,1993-06-03 00:00:00,31
2799,35869,DPW Maintained,Rhamnus alaternus :: Italian Buckthorn,1 Boutwell St,1.0,Sidewalk: Curb side : Cutout,Private,4/24/98 0:00,6,,37.73812661,-122.405618,Rhamnus,Rhamnus alaternus,Italian Buckthorn,1998,1998-04-24 00:00:00,26
2800,89685,DPW Maintained,Laurus nobilis :: Sweet Bay: Grecian Laurel,2439X Anza St,4.0,Sidewalk: Curb side : Cutout,DPW,4/8/08 0:00,3,3x3,37.77854559,-122.4745393,Laurus,Laurus nobilis,Sweet Bay: Grecian Laurel,2008,2008-04-08 00:00:00,16
2809,101866,DPW Maintained,Ligustrum lucidum :: Glossy Privet,851 Lisbon St,1.0,Sidewalk: Curb side : Cutout,Private,1/9/13 0:00,2,3x3,37.71575775,-122.4382057,Ligustrum,Ligustrum lucidum,Glossy Privet,2013,2013-01-09 00:00:00,11
2811,61822,DPW Maintained,Ficus macrophylla :: Morton Bay Fig,2749 Union St,1.0,Sidewalk: Curb side : Cutout,Private,2/4/85 0:00,88,,37.79584626,-122.4445316,Ficus,Ficus macrophylla,Morton Bay Fig,1985,1985-02-04 00:00:00,39
2813,6822,Permitted Site,Hymenosporum flavum :: Sweet Shade,1450X Fairfax Ave,3.0,Sidewalk: Curb side : Cutout,Fire Dept,3/30/06 0:00,3,3X3,37.74083447,-122.3861797,Hymenosporum,Hymenosporum flavum,Sweet Shade,2006,2006-03-30 00:00:00,18
2816,230479,Permitted Site,Pyrus calleryana :: Ornamental Pear,1160 Florida St,1.0,Sidewalk: Curb side : Cutout,Private,11/26/02 0:00,7,Width 3ft,37.75337448,-122.4101995,Pyrus,Pyrus calleryana,Ornamental Pear,2002,2002-11-26 00:00:00,22
2817,170290,DPW Maintained,Eriobotrya deflexa :: Bronze Loquat,112 Judson Ave,1.0,Sidewalk: Curb side : Cutout,Private,8/22/17 0:00,3,Width 3ft,37.72834291,-122.4446788,Eriobotrya,Eriobotrya deflexa,Bronze Loquat,2017,2017-08-22 00:00:00,7
2818,60865,DPW Maintained,Magnolia grandiflora :: Southern Magnolia,2190 Broadway,1.0,Sidewalk: Curb side : Cutout,Private,4/25/83 0:00,18,,37.79461764,-122.4329043,Magnolia,Magnolia grandiflora,Southern Magnolia,1983,1983-04-25 00:00:00,41
2825,87880,DPW Maintained,Magnolia grandiflora :: Southern Magnolia,1756 North Point St,1.0,Sidewalk: Curb side : Cutout,Private,6/13/08 0:00,5,3x3,37.80375883,-122.4361601,Magnolia,Magnolia grandiflora,Southern Magnolia,2008,2008-06-13 00:00:00,16
2827,31990,DPW Maintained,Ginkgo biloba :: Maidenhair Tree,166 04th Ave,1.0,Sidewalk: Curb side : Cutout,Private,6/30/95 0:00,6,,37.78576668,-122.4623935,Ginkgo,Ginkgo biloba,Maidenhair Tree,1995,1995-06-30 00:00:00,29
2828,8520,DPW Maintained,Prunus serrulata :: Ornamental Cherry,1901 Geary Blvd,2.0,Sidewalk: Curb side : Cutout,DPW,2/17/99 0:00,3,3x3,37.783617,-122.437806,Prunus,Prunus serrulata,Ornamental Cherry,1999,1999-02-17 00:00:00,25
2831,15571,Permitted Site,Pittosporum undulatum :: Victorian Box,2893 Mission St,2.0,Sidewalk: Curb side : Cutout,Private,9/2/15 0:00,3,4X4,37.75083164,-122.4182212,Pittosporum,Pittosporum undulatum,Victorian Box,2015,2015-09-02 00:00:00,9
2837,68660,DPW Maintained,Prunus cerasifera :: Cherry Plum,259 07th Ave,1.0,Sidewalk: Curb side : Cutout,Private,11/2/93 0:00,7,,37.78364032,-122.4656255,Prunus,Prunus cerasifera,Cherry Plum,1993,1993-11-02 00:00:00,31
2839,27575,Permitted Site,Melaleuca quinquenervia :: Cajeput,1299X Illinois St,26.0,Sidewalk: Curb side : Cutout,Port,2/12/03 0:00,12,3x3,37.7554914,-122.3869835,Melaleuca,Melaleuca quinquenervia,Cajeput,2003,2003-02-12 00:00:00,21
2843,107887,DPW Maintained,Ginkgo biloba :: Maidenhair Tree,941 Washington St,5.0,Sidewalk: Curb side : Cutout,SFUSD,11/3/14 0:00,3,3x3,37.79440464,-122.4087995,Ginkgo,Ginkgo biloba,Maidenhair Tree,2014,2014-11-03 00:00:00,10
2844,2287,DPW Maintained,Cupressus macrocarpa :: Monterey Cypress,800X Brotherhood Way,2.0,Median : Cutout,DPW,8/30/16 0:00,3,14M,37.71451517,-122.479498,Cupressus,Cupressus macrocarpa,Monterey Cypress,2016,2016-08-30 00:00:00,8
2847,250419,DPW Maintained,Metrosideros excelsa :: New Zealand Xmas Tree,49 Seacliff Ave,1.0,Sidewalk: Curb side : Yard,Private,7/14/97 0:00,8,Width 4ft,37.78885679,-122.4858999,Metrosideros,Metrosideros excelsa,New Zealand Xmas Tree,1997,1997-07-14 00:00:00,27
2852,81725,Permitted Site,Pyrus kawakamii :: Evergreen Pear,1111X 23rd St,1.0,Sidewalk: Curb side : Cutout,Private,6/6/12 0:00,7,4x4,37.75513169,-122.3910044,Pyrus,Pyrus kawakamii,Evergreen Pear,2012,2012-06-06 00:00:00,12
2854,253533,DPW Maintained,Olea europaea 'Majestic Beauty' :: Majestic Beauty Fruitless Olive,1000 Cayuga Ave,1.0,Back Yard : Yard,DPW,9/22/17 13:57,3,3x3,37.72207681,-122.4398369,Olea,Olea europaea,Majestic Beauty Fruitless Olive,2017,2017-09-22 13:57:00,7
2870,15196,DPW Maintained,Lophostemon confertus :: Brisbane Box,1110 Mission St,2.0,Sidewalk: Curb side : Cutout,DPW,3/8/95 0:00,6,3X3,37.77905432,-122.4112584,Lophostemon,Lophostemon confertus,Brisbane Box,1995,1995-03-08 00:00:00,29
2871,261750,Permitted Site,Magnolia grandiflora :: Southern Magnolia,127 Edgehill Way,2.0,Sidewalk: Curb side : Cutout,Private,2/25/20 0:00,3,,37.7430691,-122.4604604,Magnolia,Magnolia grandiflora,Southern Magnolia,2020,2020-02-25 00:00:00,4
2880,87618,DPW Maintained,Arbutus 'Marina' :: Hybrid Strawberry Tree,800X Junipero Serra Blvd,21.0,Sidewalk: Curb side : Cutout,DPW,1/18/08 0:00,3,3x3,37.72420094,-122.4723634,Arbutus,Arbutus 'Marina',Hybrid Strawberry Tree,2008,2008-01-18 00:00:00,16
2884,255397,Permitted Site,Melaleuca quinquenervia :: Cajeput,28 Williams Ave,1.0,Sidewalk: Curb side : Cutout,Private,6/26/18 0:00,3,3x3,37.72943465,-122.393422,Melaleuca,Melaleuca quinquenervia,Cajeput,2018,2018-06-26 00:00:00,6
2887,162839,DPW Maintained,Tristaniopsis laurina :: Swamp Myrtle,93 Lee Ave,3.0,Sidewalk: Curb side : Cutout,Private,10/4/17 13:47,3,Width 0ft,37.71970151,-122.4541741,Tristaniopsis,Tristaniopsis laurina,Swamp Myrtle,2017,2017-10-04 13:47:00,7
2888,201837,DPW Maintained,Lagunaria patersonii :: Primrose Tree,350 Friedell St,7.0,Sidewalk: Curb side : Cutout,Private,7/12/17 0:00,3,Width 5ft,37.72748785,-122.3707274,Lagunaria,Lagunaria patersonii,Primrose Tree,2017,2017-07-12 00:00:00,7
2893,110774,DPW Maintained,Acacia stenophylla :: Shoestring Acacia,1000X GUERRERO ST,3.0,Median : Cutout,DPW,5/26/15 15:02,3,3x3,37.7549774,-122.4233625,Acacia,Acacia stenophylla,Shoestring Acacia,2015,2015-05-26 15:02:00,9
2896,9490,DPW Maintained,Maytenus boaria :: Mayten,871 Golden Gate Ave,1.0,Sidewalk: Curb side : Cutout,Private,5/6/02 0:00,3,3X3,37.78038905,-122.4249261,Maytenus,Maytenus boaria,Mayten,2002,2002-05-06 00:00:00,22
2900,111864,Significant Tree,Callistemon citrinus :: Lemon Bottlebrush,45 Allston Way,1.0,Front Yard : Yard,Private,6/26/15 0:00,3,,37.74152473,-122.4625682,Callistemon,Callistemon citrinus,Lemon Bottlebrush,2015,2015-06-26 00:00:00,9
2901,261511,DPW Maintained,Acer x freemanii :: Freeman Maple,2695 San Bruno Ave,2.0,Sidewalk: Curb side : Cutout,DPW,1/15/20 0:00,3,4x4,37.72782555,-122.4035824,Acer,Acer x,Freeman Maple,2020,2020-01-15 00:00:00,4
2902,94865,DPW Maintained,Arbutus 'Marina' :: Hybrid Strawberry Tree,30 Gladstone Dr,1.0,Sidewalk: Curb side : Cutout,Private,11/19/10 0:00,2,3x2,37.73087902,-122.4202556,Arbutus,Arbutus 'Marina',Hybrid Strawberry Tree,2010,2010-11-19 00:00:00,14
2910,86899,DPW Maintained,Tristaniopsis laurina 'Elegant' :: Small-leaf Tristania 'Elegant',1515 Greenwich St,4.0,Sidewalk: Curb side : Cutout,Private,10/26/07 0:00,5,3x3,37.80028455,-122.4249152,Tristaniopsis,Tristaniopsis laurina,Small-leaf Tristania 'Elegant',2007,2007-10-26 00:00:00,17
2913,65784,DPW Maintained,Prunus cerasifera :: Cherry Plum,121 03rd Ave,1.0,Sidewalk: Curb side : Cutout,Private,4/23/90 0:00,13,,37.78635065,-122.4615308,Prunus,Prunus cerasifera,Cherry Plum,1990,1990-04-23 00:00:00,34
2914,41940,DPW Maintained,Leptospermum scoparium :: New Zealand Tea Tree,642 05th Ave,2.0,Sidewalk: Curb side : Cutout,Private,5/9/11 0:00,3,3x3,37.77645528,-122.4627682,Leptospermum,Leptospermum scoparium,New Zealand Tea Tree,2011,2011-05-09 00:00:00,13
2918,4160,DPW Maintained,Prunus serrulata 'Kwanzan' :: Kwanzan Flowering Cherry,3739 Cesar Chavez St,1.0,Sidewalk: Curb side : Cutout,DPW,12/17/03 0:00,3,4X4,37.74784972,-122.423377,Prunus,Prunus serrulata,Kwanzan Flowering Cherry,2003,2003-12-17 00:00:00,21
2921,62035,DPW Maintained,Prunus serrulata 'Kwanzan' :: Kwanzan Flowering Cherry,526 22nd Ave,1.0,Sidewalk: Curb side : Cutout,Private,6/18/85 0:00,3,,37.77778439,-122.481271,Prunus,Prunus serrulata,Kwanzan Flowering Cherry,1985,1985-06-18 00:00:00,39
2932,86200,DPW Maintained,Prunus serrulata 'Kwanzan' :: Kwanzan Flowering Cherry,2379 24th Ave,1.0,Sidewalk: Curb side : Cutout,DPW,1/19/07 0:00,3,3x3,37.74322544,-122.4811478,Prunus,Prunus serrulata,Kwanzan Flowering Cherry,2007,2007-01-19 00:00:00,17
2933,63185,DPW Maintained,Callistemon citrinus :: Lemon Bottlebrush,422 36th Ave,1.0,Sidewalk: Curb side : Cutout,Private,12/18/86 0:00,10,,37.78097483,-122.4965387,Callistemon,Callistemon citrinus,Lemon Bottlebrush,1986,1986-12-18 00:00:00,38
2935,87097,DPW Maintained,Tristaniopsis laurina :: Swamp Myrtle,1158 Sutter St,2.0,Sidewalk: Curb side : Cutout,Private,12/24/07 0:00,5,3x3,37.78790268,-122.4195883,Tristaniopsis,Tristaniopsis laurina,Swamp Myrtle,2007,2007-12-24 00:00:00,17
2936,14764,DPW Maintained,Ligustrum lucidum :: Glossy Privet,979 McAllister St,1.0,Sidewalk: Curb side : Cutout,Private,5/21/92 0:00,6,4X4,37.77902627,-122.4280339,Ligustrum,Ligustrum lucidum,Glossy Privet,1992,1992-05-21 00:00:00,32
2945,35170,DPW Maintained,Myoporum laetum :: Myoporum,414 36th Ave,2.0,Sidewalk: Curb side : Cutout,Private,2/10/98 0:00,17,,37.78116598,-122.4965542,Myoporum,Myoporum laetum,Myoporum,1998,1998-02-10 00:00:00,26
2954,216859,DPW Maintained,Eriobotrya deflexa :: Bronze Loquat,249 Sadowa St,1.0,Sidewalk: Curb side : Cutout,Private,10/10/17 8:28,3,Width 3ft,37.71223273,-122.4608534,Eriobotrya,Eriobotrya deflexa,Bronze Loquat,2017,2017-10-10 08:28:00,7
2959,92080,DPW Maintained,Maytenus boaria :: Mayten,2950 Laguna St,2.0,Sidewalk: Curb side : Cutout,Private,6/23/09 0:00,4,3x3,37.79846593,-122.4306316,Maytenus,Maytenus boaria,Mayten,2009,2009-06-23 00:00:00,15
2965,37830,DPW Maintained,Prunus serrulata :: Ornamental Cherry,451 Athens St,1.0,Sidewalk: Curb side : Cutout,SFUSD,7/9/07 0:00,3,6x6,37.72014777,-122.4294714,Prunus,Prunus serrulata,Ornamental Cherry,2007,2007-07-09 00:00:00,17
2966,65769,DPW Maintained,Pittosporum undulatum :: Victorian Box,1840 Filbert St,1.0,Sidewalk: Curb side : Cutout,Private,4/23/90 0:00,16,,37.79883214,-122.4298119,Pittosporum,Pittosporum undulatum,Victorian Box,1990,1990-04-23 00:00:00,34
2972,6481,DPW Maintained,Ginkgo biloba :: Maidenhair Tree,1200X Evans Ave,24.0,Sidewalk: Curb side : Cutout,DPW,3/3/04 0:00,3,3X3,37.73980606,-122.3824732,Ginkgo,Ginkgo biloba,Maidenhair Tree,2004,2004-03-03 00:00:00,20
2976,24489,DPW Maintained,Tristania conferta ::,840 Fell St,1.0,Sidewalk: Curb side : Cutout,Private,3/8/06 0:00,3,3X3,37.77487417,-122.4317584,Tristania,Tristania conferta,,2006,2006-03-08 00:00:00,18
2977,102762,Permitted Site,Magnolia grandiflora 'Russet' :: Russet Magnolia,100X Russ St,4.0,Sidewalk: Curb side : Cutout,Private,2/26/13 0:00,3,3x3,37.77857591,-122.4082182,Magnolia,Magnolia grandiflora,Russet Magnolia,2013,2013-02-26 00:00:00,11
2982,104480,Permitted Site,Magnolia grandiflora :: Southern Magnolia,290x ARKANSAS ST,3.0,Sidewalk: Curb side : Cutout,Private,3/12/14 0:00,20,9x9,37.763099,-122.3985216,Magnolia,Magnolia grandiflora,Southern Magnolia,2014,2014-03-12 00:00:00,10
2984,91785,DPW Maintained,Platanus x hispanica 'Yarwood' :: Yarwood Sycamore,1020 Harrison St,,Sidewalk: Curb side : Cutout,DPW,3/7/07 0:00,3,3x3,37.77680109,-122.4047652,Platanus,Platanus x,Yarwood Sycamore,2007,2007-03-07 00:00:00,17
2985,66129,DPW Maintained,Pittosporum undulatum :: Victorian Box,3524 Pierce St,1.0,Sidewalk: Curb side : Cutout,Private,8/17/90 0:00,9,,37.80309124,-122.4399518,Pittosporum,Pittosporum undulatum,Victorian Box,1990,1990-08-17 00:00:00,34
2990,27034,Permitted Site,Callistemon viminalis :: Weeping Bottlebrush,1300X Silver Ave,2.0,Sidewalk: Curb side : Cutout,Private,5/27/99 0:00,6,3X3,37.73094428,-122.4100992,Callistemon,Callistemon viminalis,Weeping Bottlebrush,1999,1999-05-27 00:00:00,25
2992,69442,DPW Maintained,Ficus microcarpa nitida 'Green Gem' :: Indian Laurel Fig Tree 'Green Gem',601 04th St,1.0,Sidewalk: Curb side : Cutout,Private,10/6/16 0:00,3,,37.77781418,-122.3957118,Ficus,Ficus microcarpa,Indian Laurel Fig Tree 'Green Gem',2016,2016-10-06 00:00:00,8
2995,34614,DPW Maintained,Ginkgo biloba :: Maidenhair Tree,3248 Washington St,1.0,Sidewalk: Curb side : Cutout,Private,7/28/97 0:00,5,,37.7900882,-122.4467515,Ginkgo,Ginkgo biloba,Maidenhair Tree,1997,1997-07-28 00:00:00,27
2999,115231,DPW Maintained,Olea europaea :: Olive Tree,326 29th Ave,1.0,Sidewalk: Curb side : Cutout,DPW,3/29/18 0:00,3,,37.78315057,-122.4890918,Olea,Olea europaea,Olive Tree,2018,2018-03-29 00:00:00,6
3001,253944,DPW Maintained,Tristaniopsis laurina :: Swamp Myrtle,307 Detroit St,1.0,Sidewalk: Curb side : Cutout,Private,10/5/18 0:00,3,6x8,37.7299675,-122.4443611,Tristaniopsis,Tristaniopsis laurina,Swamp Myrtle,2018,2018-10-05 00:00:00,6
3005,32703,DPW Maintained,Arbutus unedo :: Strawberry Tree,890 Geary St,1.0,Sidewalk: Curb side : Cutout,Private,10/29/96 0:00,8,3x3,37.78620552,-122.4178898,Arbutus,Arbutus unedo,Strawberry Tree,1996,1996-10-29 00:00:00,28
3006,47438,DPW Maintained,Lyonothamnus floribundus subsp. asplenifolius :: Santa Cruz Ironwood,754 42nd Ave,1.0,Sidewalk: Curb side : Cutout,Private,1/25/20 12:23,6,,37.77444553,-122.5025279,Lyonothamnus,Lyonothamnus floribundus,Santa Cruz Ironwood,2020,2020-01-25 12:23:00,4
3007,215160,DPW Maintained,Ginkgo biloba 'Autumn Gold' :: Ginkgo: Autumn Gold,125 Arch St,1.0,Sidewalk: Property side : Yard,Private,3/26/18 0:00,3,Width 2ft,37.71304038,-122.4671733,Ginkgo,Ginkgo biloba,Ginkgo: Autumn Gold,2018,2018-03-26 00:00:00,6
3012,50645,DPW Maintained,Platanus x hispanica :: Sycamore: London Plane,650 King St,1.0,Sidewalk: Curb side : Cutout,Private,12/30/03 0:00,6,,37.77048225,-122.4017601,Platanus,Platanus x,Sycamore: London Plane,2003,2003-12-30 00:00:00,21
3020,151101,DPW Maintained,Tristaniopsis laurina :: Swamp Myrtle,522 Oak St,1.0,Sidewalk: Curb side : Cutout,Private,6/6/18 0:00,3,3x3,37.77433075,-122.4286459,Tristaniopsis,Tristaniopsis laurina,Swamp Myrtle,2018,2018-06-06 00:00:00,6
3026,1952,DPW Maintained,Melaleuca quinquenervia :: Cajeput,22 Bertha Ln,3.0,Sidewalk: Curb side : Cutout,DPW,2/8/99 0:00,6,3X4,37.73376248,-122.3815535,Melaleuca,Melaleuca quinquenervia,Cajeput,1999,1999-02-08 00:00:00,25
3031,85919,DPW Maintained,Melaleuca quinquenervia :: Cajeput,1792 26th Ave,1.0,Sidewalk: Curb side : Cutout,DPW,12/19/06 0:00,3,3x3,37.75410431,-122.4838998,Melaleuca,Melaleuca quinquenervia,Cajeput,2006,2006-12-19 00:00:00,18
3035,58774,DPW Maintained,Platanus x hispanica :: Sycamore: London Plane,1155 Rhode Island St,1.0,Sidewalk: Curb side : Cutout,Private,8/13/79 0:00,20,,37.75519426,-122.4015495,Platanus,Platanus x,Sycamore: London Plane,1979,1979-08-13 00:00:00,45
3037,17698,DPW Maintained,Pittosporum undulatum :: Victorian Box,1100X Pierce St,4.0,Sidewalk: Curb side : Cutout,DPW,5/20/92 0:00,12,3X3,37.78011664,-122.4353449,Pittosporum,Pittosporum undulatum,Victorian Box,1992,1992-05-20 00:00:00,32
3039,7961,DPW Maintained,Pittosporum undulatum :: Victorian Box,1801 Franklin St,1.0,Sidewalk: Curb side : Cutout,Private,5/15/97 0:00,3,3X3,37.79147574,-122.4243347,Pittosporum,Pittosporum undulatum,Victorian Box,1997,1997-05-15 00:00:00,27
3043,43062,DPW Maintained,Rhamnus alaternus :: Italian Buckthorn,490 34th Ave,1.0,Sidewalk: Curb side : Cutout,Private,2/10/17 0:00,3,3x3,37.77987138,-122.4943155,Rhamnus,Rhamnus alaternus,Italian Buckthorn,2017,2017-02-10 00:00:00,7
3045,28908,DPW Maintained,Tristaniopsis laurina :: Swamp Myrtle,285 07th St,1.0,Sidewalk: Curb side : Cutout,DPW,2/11/06 0:00,3,3x3,37.77699695,-122.4080348,Tristaniopsis,Tristaniopsis laurina,Swamp Myrtle,2006,2006-02-11 00:00:00,18
3046,1790,DPW Maintained,Lophostemon confertus :: Brisbane Box,2001X Bay Shore Blvd,11.0,Sidewalk: Curb side : Cutout,DPW,1/1/97 0:00,3,3X3,37.71530726,-122.3988921,Lophostemon,Lophostemon confertus,Brisbane Box,1997,1997-01-01 00:00:00,27
3058,50467,Permitted Site,Pyrus calleryana 'New Bradford' :: New Bradford Pear,3861 24th St,1.0,Sidewalk: Curb side : Cutout,Private,4/6/16 0:00,3,,37.75155147,-122.4287919,Pyrus,Pyrus calleryana,New Bradford Pear,2016,2016-04-06 00:00:00,8
3081,89750,DPW Maintained,Arbutus 'Marina' :: Hybrid Strawberry Tree,1037X Anza St,3.0,Sidewalk: Curb side : Cutout,DPW,2/11/08 0:00,3,3x3,37.77922405,-122.4597112,Arbutus,Arbutus 'Marina',Hybrid Strawberry Tree,2008,2008-02-11 00:00:00,16
3083,45054,DPW Maintained,Prunus cerasifera :: Cherry Plum,2279 26th Ave,1.0,Sidewalk: Curb side : Cutout,Private,5/8/01 0:00,4,,37.74501254,-122.4834261,Prunus,Prunus cerasifera,Cherry Plum,2001,2001-05-08 00:00:00,23
3087,10380,DPW Maintained,Pittosporum crassifolium :: Karo Tree,1317 Haight St,2.0,Sidewalk: Curb side : Cutout,DPW,2/2/91 0:00,20,3X3,37.77031499,-122.4439766,Pittosporum,Pittosporum crassifolium,Karo Tree,1991,1991-02-02 00:00:00,33
3088,5150,DPW Maintained,Pyrus calleryana 'Bradford' :: Ornamental Pear: Bradford,243 Divisadero St,1.0,Sidewalk: Curb side : Cutout,DPW,4/21/16 0:00,2,3x3,37.77093529,-122.4370904,Pyrus,Pyrus calleryana,Ornamental Pear: Bradford,2016,2016-04-21 00:00:00,8
3091,22076,DPW Maintained,Lophostemon confertus :: Brisbane Box,3101 03rd St,4.0,Sidewalk: Curb side : Cutout,DPW,12/23/97 0:00,3,3X3,37.7493654,-122.3873484,Lophostemon,Lophostemon confertus,Brisbane Box,1997,1997-12-23 00:00:00,27
3092,47117,Permitted Site,Ginkgo biloba :: Maidenhair Tree,111X Kingston St,3.0,Sidewalk: Curb side : Cutout,Private,5/3/02 0:00,3,3x3,37.74174096,-122.422278,Ginkgo,Ginkgo biloba,Maidenhair Tree,2002,2002-05-03 00:00:00,22
3095,24126,Permitted Site,Melaleuca quinquenervia :: Cajeput,140X Whitney Young Cir,5.0,Sidewalk: Curb side : Cutout,Private,5/7/97 0:00,9,3X3,37.7360811,-122.3859307,Melaleuca,Melaleuca quinquenervia,Cajeput,1997,1997-05-07 00:00:00,27
3099,90523,DPW Maintained,Pyrus calleryana :: Ornamental Pear,685 25th Ave,1.0,Sidewalk: Curb side : Cutout,DPW,3/18/08 0:00,3,3x3,37.77666819,-122.4845873,Pyrus,Pyrus calleryana,Ornamental Pear,2008,2008-03-18 00:00:00,16
3100,44019,DPW Maintained,Platanus x hispanica :: Sycamore: London Plane,350 Golden Gate Ave,6.0,Sidewalk: Curb side : Cutout,Private,9/18/00 0:00,5,,37.78160382,-122.4164752,Platanus,Platanus x,Sycamore: London Plane,2000,2000-09-18 00:00:00,24
3101,20504,DPW Maintained,Platanus x hispanica :: Sycamore: London Plane,1203X Sunset Blvd,13.0,Sidewalk: Curb side : Cutout,Rec/Park,3/2/91 0:00,18,10,37.76515572,-122.49588,Platanus,Platanus x,Sycamore: London Plane,1991,1991-03-02 00:00:00,33
3108,233017,DPW Maintained,Olea europaea :: Olive Tree,89 Elsie St,1.0,Sidewalk: Curb side : Cutout,Private,6/17/20 0:00,3,Width 3ft,37.74344062,-122.4172435,Olea,Olea europaea,Olive Tree,2020,2020-06-17 00:00:00,4
3109,45231,DPW Maintained,Arbutus 'Marina' :: Hybrid Strawberry Tree,901-999X Felton St,6.0,Sidewalk: Curb side : Cutout,Private,6/5/01 0:00,6,,37.7275686,-122.4137598,Arbutus,Arbutus 'Marina',Hybrid Strawberry Tree,2001,2001-06-05 00:00:00,23
3111,31001,DPW Maintained,Callistemon citrinus :: Lemon Bottlebrush,285 Chicago Way,1.0,Sidewalk: Curb side : Cutout,Private,3/13/95 0:00,9,,37.7097796,-122.4322766,Callistemon,Callistemon citrinus,Lemon Bottlebrush,1995,1995-03-13 00:00:00,29
3116,232623,Permitted Site,Metrosideros excelsa :: New Zealand Xmas Tree,9 Clarendon Ave,1.0,Sidewalk: Curb side : Yard,Private,12/18/97 0:00,8,Width 2ft,37.75885721,-122.4494271,Metrosideros,Metrosideros excelsa,New Zealand Xmas Tree,1997,1997-12-18 00:00:00,27
3131,216970,Permitted Site,Tristaniopsis laurina :: Swamp Myrtle,1595 15th Ave,2.0,Sidewalk: Curb side : Cutout,Private,2/13/18 0:00,3,3x3,37.75787363,-122.4717465,Tristaniopsis,Tristaniopsis laurina,Swamp Myrtle,2018,2018-02-13 00:00:00,6
3133,4717,DPW Maintained,Liquidambar styraciflua :: American Sweet Gum,1000X Columbus Ave,4.0,Median : Cutout,DPW,8/19/06 0:00,6,3,37.80412095,-122.415707,Liquidambar,Liquidambar styraciflua,American Sweet Gum,2006,2006-08-19 00:00:00,18
3136,109058,DPW Maintained,Ginkgo biloba :: Maidenhair Tree,130 Newton St,1.0,Sidewalk: Curb side : Cutout,Private,1/22/15 0:00,3,3x3,37.71280505,-122.4384601,Ginkgo,Ginkgo biloba,Maidenhair Tree,2015,2015-01-22 00:00:00,9
3143,49710,DPW Maintained,Ficus microcarpa nitida 'Green Gem' :: Indian Laurel Fig Tree 'Green Gem',2841GREENWICH Baker St,1.0,Sidewalk: Curb side : Cutout,Private,6/3/03 0:00,10,,37.79741996,-122.4458071,Ficus,Ficus microcarpa,Indian Laurel Fig Tree 'Green Gem',2003,2003-06-03 00:00:00,21
3147,124813,DPW Maintained,Acacia melanoxylon :: Blackwood Acacia,3434 Baker St,2.0,Sidewalk: Curb side : Yard,Private,5/22/19 0:00,3,Width 3ft,37.80278415,-122.4467427,Acacia,Acacia melanoxylon,Blackwood Acacia,2019,2019-05-22 00:00:00,5
3148,34814,DPW Maintained,Leptospermum scoparium :: New Zealand Tea Tree,485 39th Ave,1.0,Sidewalk: Curb side : Cutout,Private,2/10/98 0:00,5,,37.77978868,-122.4998264,Leptospermum,Leptospermum scoparium,New Zealand Tea Tree,1998,1998-02-10 00:00:00,26
3150,62606,DPW Maintained,Ficus microcarpa nitida 'Green Gem' :: Indian Laurel Fig Tree 'Green Gem',818 37th Ave,1.0,Sidewalk: Curb side : Cutout,Private,2/7/86 0:00,11,,37.77346381,-122.4970752,Ficus,Ficus microcarpa,Indian Laurel Fig Tree 'Green Gem',1986,1986-02-07 00:00:00,38
3158,108909,Permitted Site,Melaleuca quinquenervia :: Cajeput,463 Ellsworth St,1.0,Sidewalk: Curb side : Cutout,Private,1/9/15 0:00,3,3x3,37.73759977,-122.4145746,Melaleuca,Melaleuca quinquenervia,Cajeput,2015,2015-01-09 00:00:00,9
3166,24688,DPW Maintained,Tristaniopsis laurina 'Elegant' :: Small-leaf Tristania 'Elegant',6509 Geary Blvd,1.0,Sidewalk: Curb side : Cutout,DPW,3/12/11 0:00,3,3X3,37.77974201,-122.4892512,Tristaniopsis,Tristaniopsis laurina,Small-leaf Tristania 'Elegant',2011,2011-03-12 00:00:00,13
3175,115751,Significant Tree,Acer rubrum :: Red Maple,100 Yerba Buena Ave,3.0,Sidewalk: Curb side : Cutout,Private,5/10/16 0:00,3,,37.736647,-122.4627469,Acer,Acer rubrum,Red Maple,2016,2016-05-10 00:00:00,8
3177,65791,DPW Maintained,Prunus serrulata 'Kwanzan' :: Kwanzan Flowering Cherry,523 Paris St,1.0,Sidewalk: Curb side : Cutout,Private,5/1/90 0:00,7,,37.72041277,-122.435813,Prunus,Prunus serrulata,Kwanzan Flowering Cherry,1990,1990-05-01 00:00:00,34
3178,90460,DPW Maintained,Olea europaea :: Olive Tree,786 25th Ave,,Sidewalk: Curb side : Cutout,DPW,3/17/08 0:00,3,3x3,37.77476324,-122.484252,Olea,Olea europaea,Olive Tree,2008,2008-03-17 00:00:00,16
3181,37188,DPW Maintained,Pittosporum undulatum :: Victorian Box,1486 30th Ave,2.0,Sidewalk: Curb side : Cutout,Private,6/8/98 0:00,5,,37.75962533,-122.4885786,Pittosporum,Pittosporum undulatum,Victorian Box,1998,1998-06-08 00:00:00,26
3182,44327,Permitted Site,Acacia baileyana :: Bailey's Acacia,1586 Shrader St,1.0,Sidewalk: Curb side : Cutout,Private,3/5/01 0:00,8,2x3,37.7603454,-122.450243,Acacia,Acacia baileyana,Bailey's Acacia,2001,2001-03-05 00:00:00,23
3183,68690,DPW Maintained,Pyrus kawakamii :: Evergreen Pear,186 12th Ave,1.0,Sidewalk: Curb side : Cutout,Private,11/2/93 0:00,6,,37.7848182,-122.4709317,Pyrus,Pyrus kawakamii,Evergreen Pear,1993,1993-11-02 00:00:00,31
3187,66349,DPW Maintained,Magnolia grandiflora :: Southern Magnolia,201 Harrison St,1.0,Sidewalk: Curb side : Cutout,Private,10/6/92 0:00,3,,37.78759877,-122.3908531,Magnolia,Magnolia grandiflora,Southern Magnolia,1992,1992-10-06 00:00:00,32
3188,52945,DPW Maintained,Arbutus 'Marina' :: Hybrid Strawberry Tree,88 Rudden Ave,1.0,Sidewalk: Curb side : Cutout,Private,8/3/06 0:00,10,,37.7245575,-122.4421167,Arbutus,Arbutus 'Marina',Hybrid Strawberry Tree,2006,2006-08-03 00:00:00,18
3196,93455,DPW Maintained,Podocarpus macrophyllus :: Yew Pine,2109 Taraval St,2.0,Sidewalk: Curb side : Cutout,DPW,2/23/09 0:00,3,3x3,37.74238811,-122.48878,Podocarpus,Podocarpus macrophyllus,Yew Pine,2009,2009-02-23 00:00:00,15
3199,43681,DPW Maintained,Prunus cerasifera :: Cherry Plum,610 05th Ave,1.0,Sidewalk: Curb side : Cutout,Private,7/25/00 0:00,5,,37.77697613,-122.4628374,Prunus,Prunus cerasifera,Cherry Plum,2000,2000-07-25 00:00:00,24
3203,32294,DPW Maintained,Ficus retusa nitida :: Banyan Fig,1616 16th St,2.0,Sidewalk: Curb side : Cutout,Private,8/19/96 0:00,12,,37.76614147,-122.4030153,Ficus,Ficus retusa,Banyan Fig,1996,1996-08-19 00:00:00,28
3207,87608,DPW Maintained,Arbutus 'Marina' :: Hybrid Strawberry Tree,800X Junipero Serra Blvd,7.0,Sidewalk: Curb side : Cutout,DPW,1/18/08 0:00,3,3x3,37.72420094,-122.4723634,Arbutus,Arbutus 'Marina',Hybrid Strawberry Tree,2008,2008-01-18 00:00:00,16
3210,6826,Permitted Site,Hymenosporum flavum :: Sweet Shade,1450X Fairfax Ave,8.0,Sidewalk: Curb side : Cutout,Fire Dept,12/19/00 0:00,6,3X3,37.74083447,-122.3861797,Hymenosporum,Hymenosporum flavum,Sweet Shade,2000,2000-12-19 00:00:00,24
3212,26592,Permitted Site,Ulmus 'Prospector' :: Prospector Elm,1641 Bay Shore Blvd,1.0,Sidewalk: Curb side : Cutout,Private,1/8/98 0:00,6,3X3,37.72312451,-122.4004701,Ulmus,Ulmus 'Prospector',Prospector Elm,1998,1998-01-08 00:00:00,26
3215,28440,Permitted Site,Washingtonia robusta :: Mexican Fan Palm,2325 Ocean Ave,2.0,Sidewalk: Curb side : Cutout,Private,4/1/03 0:00,12,3X3,37.72953383,-122.468657,Washingtonia,Washingtonia robusta,Mexican Fan Palm,2003,2003-04-01 00:00:00,21
3216,32936,DPW Maintained,Magnolia grandiflora :: Southern Magnolia,1224 18th St,1.0,Sidewalk: Curb side : Cutout,Private,11/1/96 0:00,12,,37.7627328,-122.3951597,Magnolia,Magnolia grandiflora,Southern Magnolia,1996,1996-11-01 00:00:00,28
3218,160442,DPW Maintained,Geijera parviflora :: Australian Willow,201 France Ave,2.0,Sidewalk: Curb side : Cutout,Private,12/14/21 0:00,3,4x6,37.71916402,-122.4364214,Geijera,Geijera parviflora,Australian Willow,2021,2021-12-14 00:00:00,3
3224,52558,DPW Maintained,Hakea suaveolens :: Sweet Hakea Tree,1674 39th Ave,1.0,Sidewalk: Curb side : Cutout,Private,1/12/06 0:00,5,,37.75564295,-122.4979751,Hakea,Hakea suaveolens,Sweet Hakea Tree,2006,2006-01-12 00:00:00,18
3231,24839,Permitted Site,Casurina stricta :: Beefwood: Drooping She-Oak,200X Alemany Blvd,17.0,Sidewalk: Curb side : Cutout,Dept of Real Estate,1/12/96 0:00,30,3X3,37.73549043,-122.4098748,Casurina,Casurina stricta,Beefwood: Drooping She-Oak,1996,1996-01-12 00:00:00,28
3236,64840,DPW Maintained,Prunus cerasifera :: Cherry Plum,840 De Haro St,1.0,Sidewalk: Curb side : Cutout,Private,1/12/89 0:00,10,,37.7591387,-122.4011623,Prunus,Prunus cerasifera,Cherry Plum,1989,1989-01-12 00:00:00,35
3241,98801,DPW Maintained,Ginkgo biloba :: Maidenhair Tree,950@Washington Clay St,3.0,Sidewalk: Curb side : Cutout,DPW for City Agency,3/16/12 0:00,2,3x3,37.79402479,-122.4085402,Ginkgo,Ginkgo biloba,Maidenhair Tree,2012,2012-03-16 00:00:00,12
3243,265455,DPW Maintained,Quercus agrifolia :: Coast Live Oak,500x Mansell St,10.0,Median : Cutout,DPW,6/4/21 0:00,3,Width 0ft,37.72046253,-122.4052318,Quercus,Quercus agrifolia,Coast Live Oak,2021,2021-06-04 00:00:00,3
3244,29948,DPW Maintained,Tristaniopsis laurina :: Swamp Myrtle,227 Broad St,1.0,Sidewalk: Curb side : Cutout,Private,3/10/07 0:00,3,3x3,37.71308408,-122.460048,Tristaniopsis,Tristaniopsis laurina,Swamp Myrtle,2007,2007-03-10 00:00:00,17
3248,91820,DPW Maintained,Platanus x hispanica 'Yarwood' :: Yarwood Sycamore,2395x Harrison St,1.0,Sidewalk: Curb side : Cutout,DPW,3/7/07 0:00,3,3x3,37.75913575,-122.4124429,Platanus,Platanus x,Yarwood Sycamore,2007,2007-03-07 00:00:00,17
3257,62980,DPW Maintained,Pittosporum undulatum :: Victorian Box,1192 Vallejo St,1.0,Sidewalk: Curb side : Cutout,Private,8/21/86 0:00,12,,37.79762885,-122.4168598,Pittosporum,Pittosporum undulatum,Victorian Box,1986,1986-08-21 00:00:00,38
3258,43049,DPW Maintained,Olea europaea :: Olive Tree,2163 41st Ave,1.0,Sidewalk: Curb side : Cutout,Private,7/7/00 0:00,4,,37.74641919,-122.4996459,Olea,Olea europaea,Olive Tree,2000,2000-07-07 00:00:00,24
3259,60355,DPW Maintained,Metrosideros excelsa :: New Zealand Xmas Tree,1219 Palou Ave,1.0,Sidewalk: Curb side : Cutout,Private,10/26/82 0:00,15,3x3,37.72993619,-122.3839881,Metrosideros,Metrosideros excelsa,New Zealand Xmas Tree,1982,1982-10-26 00:00:00,42
3261,87806,Permitted Site,Magnolia grandiflora 'Saint Mary' :: Saint Mary Magnolia,291 28th Ave,1.0,Sidewalk: Curb side : Cutout,Private,6/2/08 0:00,3,3x12,37.78397358,-122.4883735,Magnolia,Magnolia grandiflora,Saint Mary Magnolia,2008,2008-06-02 00:00:00,16
3266,103274,DPW Maintained,Pittosporum undulatum :: Victorian Box,55 Waterville St,1.0,Sidewalk: Curb side : Cutout,Private,3/28/13 0:00,3,3x3,37.73530522,-122.402705,Pittosporum,Pittosporum undulatum,Victorian Box,2013,2013-03-28 00:00:00,11
3270,52941,DPW Maintained,Metrosideros excelsa :: New Zealand Xmas Tree,156 Onondaga Ave,1.0,Sidewalk: Curb side : Cutout,Private,8/3/06 0:00,7,,37.72251503,-122.4407366,Metrosideros,Metrosideros excelsa,New Zealand Xmas Tree,2006,2006-08-03 00:00:00,18
3273,26432,DPW Maintained,Platanus x hispanica :: Sycamore: London Plane,1450 Divisadero St,4.0,Sidewalk: Curb side : Cutout,Mayor Office of Housing,1/1/10 0:00,3,3X3,37.782838,-122.4392705,Platanus,Platanus x,Sycamore: London Plane,2010,2010-01-01 00:00:00,14
3275,192048,DPW Maintained,Tristaniopsis laurina :: Swamp Myrtle,405 Townsend St,4.0,Sidewalk: Property side : Yard,Private,8/14/17 0:00,3,Width 8ft,37.77487463,-122.3976157,Tristaniopsis,Tristaniopsis laurina,Swamp Myrtle,2017,2017-08-14 00:00:00,7
3276,28454,DPW Maintained,Tristaniopsis laurina :: Swamp Myrtle,2160X Ocean Ave,1.0,Sidewalk: Curb side : Cutout,DPW,4/1/03 0:00,3,3X3,37.7268285,-122.4660016,Tristaniopsis,Tristaniopsis laurina,Swamp Myrtle,2003,2003-04-01 00:00:00,21
3279,34758,Permitted Site,Acacia baileyana :: Bailey's Acacia,938 Shotwell St,1.0,Sidewalk: Curb side : Cutout,Private,7/28/97 0:00,8,,37.7533995,-122.4153515,Acacia,Acacia baileyana,Bailey's Acacia,1997,1997-07-28 00:00:00,27
3285,65762,DPW Maintained,Magnolia grandiflora :: Southern Magnolia,3002 Laguna St,1.0,Sidewalk: Curb side : Cutout,Private,4/23/90 0:00,13,,37.79885222,-122.4307114,Magnolia,Magnolia grandiflora,Southern Magnolia,1990,1990-04-23 00:00:00,34
3286,85062,DPW Maintained,Lophostemon confertus :: Brisbane Box,2604 03rd St,1.0,Sidewalk: Curb side : Cutout,DPW,8/8/15 15:32,3,3x3,37.75671209,-122.3882746,Lophostemon,Lophostemon confertus,Brisbane Box,2015,2015-08-08 15:32:00,9
3294,25840,DPW Maintained,Platanus x hispanica :: Sycamore: London Plane,800X The Embarcadero,4.0,Sidewalk: Curb side : Cutout,Port,10/30/95 0:00,6,4X4,37.79960871,-122.3982442,Platanus,Platanus x,Sycamore: London Plane,1995,1995-10-30 00:00:00,29
3297,20788,DPW Maintained,Metrosideros excelsa :: New Zealand Xmas Tree,1703X Sunset Blvd,1.0,Sidewalk: Curb side : Cutout,DPW,5/22/97 0:00,3,10,37.75521989,-122.495186,Metrosideros,Metrosideros excelsa,New Zealand Xmas Tree,1997,1997-05-22 00:00:00,27
3300,84207,DPW Maintained,Pyrus calleryana :: Ornamental Pear,655 Sunnydale Ave,4.0,Sidewalk: Curb side : Cutout,Private,6/5/08 0:00,8,3x3,37.70971457,-122.4083235,Pyrus,Pyrus calleryana,Ornamental Pear,2008,2008-06-05 00:00:00,16
3302,4175,DPW Maintained,Prunus x yedoensis :: Yoshino Cherry,3812X Cesar Chavez St,1.0,Sidewalk: Curb side : Cutout,DPW,4/1/95 0:00,6,3X3,37.74787399,-122.4250828,Prunus,Prunus x,Yoshino Cherry,1995,1995-04-01 00:00:00,29
3308,16231,DPW Maintained,Lophostemon confertus :: Brisbane Box,567 Monterey Blvd,2.0,Sidewalk: Curb side : Cutout,DPW,11/18/92 0:00,6,3X3,37.73143701,-122.448124,Lophostemon,Lophostemon confertus,Brisbane Box,1992,1992-11-18 00:00:00,32
3310,29993,DPW Maintained,Cordyline australis :: Dracena Palm,681X San Jose Ave,8.0,Median : Cutout,DPW,3/24/07 0:00,3,3x3,37.74483422,-122.4223472,Cordyline,Cordyline australis,Dracena Palm,2007,2007-03-24 00:00:00,17
3317,29171,DPW Maintained,Arbutus 'Marina' :: Hybrid Strawberry Tree,3311 Ortega St,6.0,Sidewalk: Curb side : Cutout,DPW,3/18/06 0:00,3,3x3,37.75130663,-122.4989724,Arbutus,Arbutus 'Marina',Hybrid Strawberry Tree,2006,2006-03-18 00:00:00,18
3325,117432,DPW Maintained,Tristaniopsis laurina :: Swamp Myrtle,670 Lisbon St,1.0,Sidewalk: Curb side : Cutout,Private,6/14/16 0:00,3,,37.71782463,-122.4368544,Tristaniopsis,Tristaniopsis laurina,Swamp Myrtle,2016,2016-06-14 00:00:00,8
3328,29605,DPW Maintained,Corymbia ficifolia :: Red Flowering Gum,910X Junipero Serra Blvd,14.0,Median : Cutout,DPW,3/30/06 0:00,3,3X3,37.72126685,-122.4725451,Corymbia,Corymbia ficifolia,Red Flowering Gum,2006,2006-03-30 00:00:00,18
3335,37797,DPW Maintained,Photinia fraseri :: Photinia: Chinese photinia,407 Somerset St,1.0,Sidewalk: Curb side : Cutout,Private,7/6/98 0:00,1,,37.72640475,-122.4073979,Photinia,Photinia fraseri,Photinia: Chinese photinia,1998,1998-07-06 00:00:00,26
3336,64843,DPW Maintained,Ficus retusa nitida :: Banyan Fig,618 Fillmore St,1.0,Sidewalk: Curb side : Cutout,Private,1/4/91 0:00,11,,37.77526618,-122.4310007,Ficus,Ficus retusa,Banyan Fig,1991,1991-01-04 00:00:00,33
3347,29342,DPW Maintained,Lophostemon confertus :: Brisbane Box,1500X Portola Dr,8.0,Median : Cutout,DPW,2/25/12 0:00,3,3X3,37.73667874,-122.4693298,Lophostemon,Lophostemon confertus,Brisbane Box,2012,2012-02-25 00:00:00,12
3351,40840,Permitted Site,Lophostemon confertus :: Brisbane Box,1100X HOWARD ST,1.0,Sidewalk: Curb side : Cutout,Private,7/7/09 0:00,8,3x3,37.77790804,-122.4097002,Lophostemon,Lophostemon confertus,Brisbane Box,2009,2009-07-07 00:00:00,15
3353,27286,Permitted Site,Lagunaria patersonii :: Primrose Tree,682 Silver Ave,1.0,Sidewalk: Curb side : Cutout,Private,1/30/09 0:00,3,3X3,37.72874891,-122.421914,Lagunaria,Lagunaria patersonii,Primrose Tree,2009,2009-01-30 00:00:00,15
3355,136907,DPW Maintained,Tristaniopsis laurina :: Swamp Myrtle,352 Vallejo St,1.0,Sidewalk: Curb side : Cutout,Private,1/6/17 0:00,3,Width 3ft,37.79933772,-122.4032988,Tristaniopsis,Tristaniopsis laurina,Swamp Myrtle,2017,2017-01-06 00:00:00,7
3356,101740,Significant Tree,Platanus x hispanica :: Sycamore: London Plane,1590 Broadway,3.0,Front Yard : Yard,Private,12/21/12 0:00,10,,37.7959313,-122.4226235,Platanus,Platanus x,Sycamore: London Plane,2012,2012-12-21 00:00:00,12
3360,29098,DPW Maintained,Lophostemon confertus :: Brisbane Box,750 Ellis St,1.0,Sidewalk: Curb side : Cutout,DPW,11/19/05 0:00,6,3x3,37.7841983,-122.4185645,Lophostemon,Lophostemon confertus,Brisbane Box,2005,2005-11-19 00:00:00,19
3363,115828,Undocumented,Myoporum laetum :: Myoporum,65 CHUMASERO DR,1.0,Sidewalk: Property side : Cutout,Private,8/30/16 0:00,3,3x3,37.71390973,-122.4724216,Myoporum,Myoporum laetum,Myoporum,2016,2016-08-30 00:00:00,8
3366,5557,DPW Maintained,Phoenix canariensis :: Canary Island Date Palm,977 Dolores St,1.0,Sidewalk: Curb side : Cutout,DPW,10/26/06 0:00,32,3x3,37.75378805,-122.4251927,Phoenix,Phoenix canariensis,Canary Island Date Palm,2006,2006-10-26 00:00:00,18
3368,30346,DPW Maintained,Pittosporum undulatum :: Victorian Box,410 Arkansas St,1.0,Sidewalk: Curb side : Cutout,Private,2/16/56 0:00,30,,37.76090077,-122.3984032,Pittosporum,Pittosporum undulatum,Victorian Box,1956,2056-02-16 00:00:00,-32
3371,245386,DPW Maintained,Maytenus boaria :: Mayten,3243 Mission St,1.0,Sidewalk: Curb side : Cutout,DPW,2/17/98 0:00,6,Width 0ft,37.7448968,-122.4202052,Maytenus,Maytenus boaria,Mayten,1998,1998-02-17 00:00:00,26
3372,108818,Permitted Site,Podocarpus gracilor :: Fern Pine,583 Naples St,,Sidewalk: Curb side : Cutout,Private,1/6/15 0:00,3,3x3,37.71955583,-122.4321094,Podocarpus,Podocarpus gracilor,Fern Pine,2015,2015-01-06 00:00:00,9
3375,22411,DPW Maintained,Lophostemon confertus :: Brisbane Box,5800 03rd St,10.0,Sidewalk: Curb side : Cutout,DPW,4/30/15 7:23,3,3X3,37.72494487,-122.394651,Lophostemon,Lophostemon confertus,Brisbane Box,2015,2015-04-30 07:23:00,9
3377,255501,Permitted Site,Ginkgo biloba 'Princeton Sentry' :: Princeton Sentry Maidenhair,1721 Church St,1.0,Sidewalk: Curb side : Cutout,Private,5/19/20 0:00,3,3x3,37.74334364,-122.4264203,Ginkgo,Ginkgo biloba,Princeton Sentry Maidenhair,2020,2020-05-19 00:00:00,4
3379,91817,DPW Maintained,Pistacia chinensis :: Chinese Pistache,2595 Harrison St,2.0,Sidewalk: Curb side : Cutout,DPW,3/7/07 0:00,3,3x3,37.75594577,-122.4121392,Pistacia,Pistacia chinensis,Chinese Pistache,2007,2007-03-07 00:00:00,17
3380,64657,DPW Maintained,Callistemon citrinus :: Lemon Bottlebrush,160 Boutwell St,1.0,Sidewalk: Curb side : Cutout,Private,9/12/88 0:00,11,,37.73509434,-122.4056635,Callistemon,Callistemon citrinus,Lemon Bottlebrush,1988,1988-09-12 00:00:00,36
3381,12083,Permitted Site,Tristaniopsis laurina :: Swamp Myrtle,1261X La Salle Ave,12.0,Sidewalk: Curb side : Cutout,Private,12/17/07 0:00,3,3X3,37.73206435,-122.3830687,Tristaniopsis,Tristaniopsis laurina,Swamp Myrtle,2007,2007-12-17 00:00:00,17
3387,103866,DPW Maintained,Magnolia grandiflora 'Little Gem' :: Little Gem Magnolia,1411 Polk St,1.0,Sidewalk: Curb side : Pot,DPW,8/21/13 0:00,3,3x3,37.78991854,-122.4207304,Magnolia,Magnolia grandiflora,Little Gem Magnolia,2013,2013-08-21 00:00:00,11
3400,27889,Permitted Site,Platanus x hispanica :: Sycamore: London Plane,280 The Embarcadero,19.0,Sidewalk: Curb side : Cutout,Port,1/31/01 0:00,12,,37.78323754,-122.3884251,Platanus,Platanus x,Sycamore: London Plane,2001,2001-01-31 00:00:00,23
3411,32572,Permitted Site,Lophostemon confertus :: Brisbane Box,3101 21st St,2.0,Sidewalk: Curb side : Cutout,Private,10/22/96 0:00,8,3x3,37.75709346,-122.4167456,Lophostemon,Lophostemon confertus,Brisbane Box,1996,1996-10-22 00:00:00,28
3416,3208,DPW Maintained,Platanus x hispanica :: Sycamore: London Plane,3800X California St,2.0,Sidewalk: Curb side : Cutout,Private,3/17/93 0:00,8,3X3,37.78605918,-122.4569084,Platanus,Platanus x,Sycamore: London Plane,1993,1993-03-17 00:00:00,31
3420,31048,DPW Maintained,Olea europaea :: Olive Tree,15 South Hill Blvd,1.0,Sidewalk: Curb side : Cutout,Private,3/13/95 0:00,5,,37.71201313,-122.43207,Olea,Olea europaea,Olive Tree,1995,1995-03-13 00:00:00,29
3429,60315,DPW Maintained,Platanus x hispanica :: Sycamore: London Plane,619 Central Ave,1.0,Sidewalk: Curb side : Cutout,Private,10/7/82 0:00,13,,37.775414,-122.4447259,Platanus,Platanus x,Sycamore: London Plane,1982,1982-10-07 00:00:00,42
3431,33319,DPW Maintained,Arbutus 'Marina' :: Hybrid Strawberry Tree,2929 Gough St,2.0,Sidewalk: Curb side : Cutout,Private,11/14/96 0:00,15,,37.80039335,-122.4277917,Arbutus,Arbutus 'Marina',Hybrid Strawberry Tree,1996,1996-11-14 00:00:00,28
3433,76185,DPW Maintained,Magnolia grandiflora :: Southern Magnolia,380 Webster St,11.0,Sidewalk: Curb side : Cutout,SFUSD,11/12/94 0:00,4,3x3,37.77400349,-122.4290514,Magnolia,Magnolia grandiflora,Southern Magnolia,1994,1994-11-12 00:00:00,30
3434,110524,DPW Maintained,Pyrus kawakamii :: Evergreen Pear,995X Grove St,2.0,Sidewalk: Curb side : Cutout,Private,4/21/15 0:00,3,,37.77665489,-122.4322065,Pyrus,Pyrus kawakamii,Evergreen Pear,2015,2015-04-21 00:00:00,9
3435,11317,DPW Maintained,Lophostemon confertus :: Brisbane Box,1216X Ingalls St,8.0,Sidewalk: Curb side : Cutout,DPW,3/6/97 0:00,3,3X3,37.73066535,-122.3815802,Lophostemon,Lophostemon confertus,Brisbane Box,1997,1997-03-06 00:00:00,27
3437,18059,DPW Maintained,Maytenus boaria :: Mayten,2895 Pine St,1.0,Sidewalk: Curb side : Cutout,Private,10/30/90 0:00,6,3x4,37.78663345,-122.4434012,Maytenus,Maytenus boaria,Mayten,1990,1990-10-30 00:00:00,34
3440,93470,DPW Maintained,Prunus serrulata :: Ornamental Cherry,1445 Taraval St,1.0,Sidewalk: Curb side : Cutout,DPW,2/26/09 0:00,3,3x3,37.7426876,-122.4818076,Prunus,Prunus serrulata,Ornamental Cherry,2009,2009-02-26 00:00:00,15
3452,109073,Permitted Site,Arbutus 'Marina' :: Hybrid Strawberry Tree,1366 16th Ave,1.0,Sidewalk: Curb side : Cutout,Private,1/23/15 0:00,3,3x3,37.7624975,-122.4736695,Arbutus,Arbutus 'Marina',Hybrid Strawberry Tree,2015,2015-01-23 00:00:00,9
3455,8041,DPW Maintained,Pittosporum undulatum :: Victorian Box,580 Fulton St,1.0,Sidewalk: Curb side : Cutout,DPW,7/18/15 14:16,3,3X3,37.7789601,-122.4250781,Pittosporum,Pittosporum undulatum,Victorian Box,2015,2015-07-18 14:16:00,9
3457,95919,DPW Maintained,Eriobotrya deflexa :: Bronze Loquat,701 15th Ave,1.0,Sidewalk: Curb side : Cutout,Private,7/29/11 0:00,1,3x3,37.77477437,-122.4736303,Eriobotrya,Eriobotrya deflexa,Bronze Loquat,2011,2011-07-29 00:00:00,13
3465,47494,DPW Maintained,Olea europaea :: Olive Tree,219 Cotter St,1.0,Sidewalk: Curb side : Cutout,Private,5/14/02 0:00,13,,37.72933206,-122.436476,Olea,Olea europaea,Olive Tree,2002,2002-05-14 00:00:00,22
3466,61649,DPW Maintained,Pittosporum undulatum :: Victorian Box,167 08th Ave,1.0,Sidewalk: Curb side : Cutout,Private,11/26/84 0:00,11,,37.78531527,-122.4668244,Pittosporum,Pittosporum undulatum,Victorian Box,1984,1984-11-26 00:00:00,40
3473,29879,DPW Maintained,Pittosporum undulatum :: Victorian Box,1710 Mission St,2.0,Sidewalk: Curb side : Cutout,DPW,10/6/12 0:00,3,3x3,37.76992496,-122.4202244,Pittosporum,Pittosporum undulatum,Victorian Box,2012,2012-10-06 00:00:00,12
3475,40635,DPW Maintained,Pyrus kawakamii :: Evergreen Pear,2577 Post St,1.0,Sidewalk: Curb side : Cutout,Private,8/10/99 0:00,1,,37.7836592,-122.4442071,Pyrus,Pyrus kawakamii,Evergreen Pear,1999,1999-08-10 00:00:00,25
3478,28915,DPW Maintained,Tristaniopsis laurina :: Swamp Myrtle,180 07th St,2.0,Sidewalk: Curb side : Cutout,Private,2/11/06 0:00,3,3x3,37.77821861,-122.4098508,Tristaniopsis,Tristaniopsis laurina,Swamp Myrtle,2006,2006-02-11 00:00:00,18
3481,8906,DPW Maintained,Metrosideros excelsa :: New Zealand Xmas Tree,4442 Geary Blvd,1.0,Sidewalk: Curb side : Cutout,DPW,11/17/94 0:00,3,2X2,37.78103606,-122.4671033,Metrosideros,Metrosideros excelsa,New Zealand Xmas Tree,1994,1994-11-17 00:00:00,30
3485,30803,DPW Maintained,Magnolia grandiflora :: Southern Magnolia,136 Chilton Ave,1.0,Sidewalk: Curb side : Cutout,Private,2/6/95 0:00,9,,37.73349501,-122.4369188,Magnolia,Magnolia grandiflora,Southern Magnolia,1995,1995-02-06 00:00:00,29
3487,264713,DPW Maintained,Ginkgo biloba :: Maidenhair Tree,1301 16th St,1.0,Sidewalk: Curb side : Cutout,Private,9/17/20 0:00,3,,37.7658429,-122.4002422,Ginkgo,Ginkgo biloba,Maidenhair Tree,2020,2020-09-17 00:00:00,4
3494,262366,DPW Maintained,Magnolia grandiflora 'Saint Mary' :: Saint Mary Magnolia,565 Grove St,1.0,Sidewalk: Curb side : Cutout,Private,9/14/20 0:00,3,3x3,37.77733981,-122.4259039,Magnolia,Magnolia grandiflora,Saint Mary Magnolia,2020,2020-09-14 00:00:00,4
3496,24736,DPW Maintained,Arbutus 'Marina' :: Hybrid Strawberry Tree,7630 Geary Blvd To Point Lobos Ave,1.0,Sidewalk: Curb side : Cutout,Private,4/15/15 0:00,1,3x3,37.77956943,-122.501444,Arbutus,Arbutus 'Marina',Hybrid Strawberry Tree,2015,2015-04-15 00:00:00,9
3501,48758,DPW Maintained,Platanus x hispanica :: Sycamore: London Plane,219 Brannan St,11.0,Sidewalk: Curb side : Cutout,Private,10/17/02 0:00,7,,37.78316322,-122.3902872,Platanus,Platanus x,Sycamore: London Plane,2002,2002-10-17 00:00:00,22
3502,86129,DPW Maintained,Tristaniopsis laurina :: Swamp Myrtle,1666 24th Ave,1.0,Sidewalk: Curb side : Cutout,DPW,1/18/07 0:00,3,3x3,37.75648307,-122.4819271,Tristaniopsis,Tristaniopsis laurina,Swamp Myrtle,2007,2007-01-18 00:00:00,17
3503,25595,DPW Maintained,Pittosporum undulatum :: Victorian Box,1615 Cortland Ave,2.0,Sidewalk: Curb side : Cutout,DPW,5/8/97 0:00,11,3X3,37.73972776,-122.4086616,Pittosporum,Pittosporum undulatum,Victorian Box,1997,1997-05-08 00:00:00,27
3509,27604,DPW Maintained,Pittosporum undulatum :: Victorian Box,988 Fulton St,4.0,Sidewalk: Curb side : Cutout,DPW,11/9/17 0:00,3,4X4,37.77765329,-122.4325252,Pittosporum,Pittosporum undulatum,Victorian Box,2017,2017-11-09 00:00:00,7
3513,12813,DPW Maintained,Corymbia ficifolia :: Red Flowering Gum,2122 Lake St,2.0,Sidewalk: Curb side : Cutout,Private,7/24/08 0:00,3,5,37.78594802,-122.4824288,Corymbia,Corymbia ficifolia,Red Flowering Gum,2008,2008-07-24 00:00:00,16
3515,92293,DPW Maintained,Prunus serrulata :: Ornamental Cherry,2551 21st Ave,2.0,Sidewalk: Curb side : Cutout,Private,7/27/09 0:00,2,3x3,37.74007801,-122.4777092,Prunus,Prunus serrulata,Ornamental Cherry,2009,2009-07-27 00:00:00,15
3526,95884,Permitted Site,Pinus radiata :: Monterey Pine,1501@Everglade Sloat Blvd,17.0,Sidewalk: Property side : Yard,Private,3/16/11 0:00,12,,37.73367082,-122.4897271,Pinus,Pinus radiata,Monterey Pine,2011,2011-03-16 00:00:00,13
3529,171365,DPW Maintained,Crataegus phaenopyrum :: Washington Hawthorn,12 Avalon Ave,1.0,Sidewalk: Curb side : Cutout,Private,11/27/19 0:00,3,Width 3ft,37.7275005,-122.4323055,Crataegus,Crataegus phaenopyrum,Washington Hawthorn,2019,2019-11-27 00:00:00,5
3530,29773,DPW Maintained,Lophostemon confertus :: Brisbane Box,1323 Columbus Ave,1.0,Sidewalk: Curb side : Cutout,DPW,8/19/06 0:00,8,3x3,37.80637005,-122.4191151,Lophostemon,Lophostemon confertus,Brisbane Box,2006,2006-08-19 00:00:00,18
3531,69025,DPW Maintained,Metrosideros excelsa :: New Zealand Xmas Tree,3724 Quintara St,1.0,Sidewalk: Curb side : Cutout,Private,1/5/94 0:00,9,,37.74742317,-122.5055009,Metrosideros,Metrosideros excelsa,New Zealand Xmas Tree,1994,1994-01-05 00:00:00,30
3532,41778,DPW Maintained,Crataegus phaenopyrum :: Washington Hawthorn,2237 Polk St,1.0,Sidewalk: Curb side : Cutout,Private,10/23/13 0:00,2,3x3,37.79751727,-122.4221727,Crataegus,Crataegus phaenopyrum,Washington Hawthorn,2013,2013-10-23 00:00:00,11
3536,160693,DPW Maintained,Tristaniopsis laurina 'Elegant' :: Small-leaf Tristania 'Elegant',700 Russia Ave,1.0,Sidewalk: Curb side : Cutout,Private,10/18/17 15:34,3,Width 0ft,37.71879813,-122.4314816,Tristaniopsis,Tristaniopsis laurina,Small-leaf Tristania 'Elegant',2017,2017-10-18 15:34:00,7
3547,30826,DPW Maintained,Pittosporum undulatum :: Victorian Box,151 Lippard Ave,5.0,Sidewalk: Curb side : Cutout,DPW,2/6/95 0:00,1,,37.73297401,-122.43607,Pittosporum,Pittosporum undulatum,Victorian Box,1995,1995-02-06 00:00:00,29
3548,32542,DPW Maintained,Crateagus spp :: Hawthorn,91 Palm Ave,1.0,Sidewalk: Curb side : Cutout,Private,6/4/90 0:00,6,,37.78416269,-122.4580849,Crateagus,Crateagus spp,Hawthorn,1990,1990-06-04 00:00:00,34
3550,49782,DPW Maintained,Geijera parviflora :: Australian Willow,327 Wheeler Ave,1.0,Sidewalk: Curb side : Cutout,Private,10/29/20 0:00,3,,37.71143508,-122.4000004,Geijera,Geijera parviflora,Australian Willow,2020,2020-10-29 00:00:00,4
3560,103899,DPW Maintained,Lophostemon confertus :: Brisbane Box,2121 03rd St,6.0,Sidewalk: Curb side : Cutout,Private,2/4/13 0:00,3,4x4,37.76277516,-122.3885732,Lophostemon,Lophostemon confertus,Brisbane Box,2013,2013-02-04 00:00:00,11
3563,24111,DPW Maintained,Melaleuca quinquenervia :: Cajeput,180X Whitney Young Cir,1.0,Sidewalk: Curb side : Cutout,DPW,6/6/97 0:00,6,3X3,37.73587766,-122.38591,Melaleuca,Melaleuca quinquenervia,Cajeput,1997,1997-06-06 00:00:00,27
3574,263637,Permitted Site,Prunus caroliniana :: Carolina Cherry Laurel,2919 Griffith St,1.0,Sidewalk: Curb side : Cutout,Private,9/2/20 0:00,3,3x6,37.71676621,-122.3893681,Prunus,Prunus caroliniana,Carolina Cherry Laurel,2020,2020-09-02 00:00:00,4
3579,122627,Planning Code 138.1 required,Arbutus 'Marina' :: Hybrid Strawberry Tree,34 Country Club Dr,1.0,Sidewalk: Property side : Cutout,Private,11/15/16 0:00,3,3x4,37.72996831,-122.495111,Arbutus,Arbutus 'Marina',Hybrid Strawberry Tree,2016,2016-11-15 00:00:00,8
3587,95728,DPW Maintained,Arbutus 'Marina' :: Hybrid Strawberry Tree,235 Dublin St,1.0,Sidewalk: Curb side : Cutout,Private,9/7/11 0:00,5,3x3,37.71641877,-122.4279346,Arbutus,Arbutus 'Marina',Hybrid Strawberry Tree,2011,2011-09-07 00:00:00,13
3590,29485,DPW Maintained,Tristania conferta ::,1608 Ingalls St,1.0,Sidewalk: Curb side : Cutout,Private,2/28/06 0:00,12,3x3,37.72897539,-122.3842147,Tristania,Tristania conferta,,2006,2006-02-28 00:00:00,18
3599,42867,DPW Maintained,Prunus cerasifera :: Cherry Plum,2642 31st Ave,1.0,Sidewalk: Curb side : Cutout,Private,7/3/00 0:00,6,,37.73809113,-122.4883167,Prunus,Prunus cerasifera,Cherry Plum,2000,2000-07-03 00:00:00,24
3607,53834,Permitted Site,Acacia baileyana 'Purpurea' :: Purple-leaf Acacia,1355 Masonic Ave,1.0,Sidewalk: Curb side : Cutout,Private,4/28/15 0:00,3,,37.76825464,-122.4449896,Acacia,Acacia baileyana,Purple-leaf Acacia,2015,2015-04-28 00:00:00,9
3610,74026,Private,Tristaniopsis laurina :: Swamp Myrtle,499 Illinois St,9.0,Sidewalk: Curb side : Cutout,Private,7/15/16 0:00,3,5x5,37.76620318,-122.3879866,Tristaniopsis,Tristaniopsis laurina,Swamp Myrtle,2016,2016-07-15 00:00:00,8
3611,19539,DPW Maintained,Tristaniopsis laurina :: Swamp Myrtle,210X Saint Joseph's Ave,1.0,Sidewalk: Curb side : Cutout,DPW,7/23/92 0:00,9,4x4,37.78137784,-122.4412805,Tristaniopsis,Tristaniopsis laurina,Swamp Myrtle,1992,1992-07-23 00:00:00,32
3613,13656,DPW Maintained,Platanus x hispanica :: Sycamore: London Plane,615 Market St,1.0,Sidewalk: Curb side : Cutout,DPW,9/28/93 0:00,9,4X4,37.78888436,-122.4016973,Platanus,Platanus x,Sycamore: London Plane,1993,1993-09-28 00:00:00,31
3616,66382,DPW Maintained,Eucalyptus sideroxylon :: Red Ironbark,661 Fillmore St,1.0,Sidewalk: Curb side : Cutout,Private,1/4/91 0:00,12,,37.77571051,-122.43166,Eucalyptus,Eucalyptus sideroxylon,Red Ironbark,1991,1991-01-04 00:00:00,33
3617,62964,DPW Maintained,Pittosporum undulatum :: Victorian Box,75 Glover St,1.0,Sidewalk: Curb side : Cutout,Private,8/21/86 0:00,7,,37.79710358,-122.4164688,Pittosporum,Pittosporum undulatum,Victorian Box,1986,1986-08-21 00:00:00,38
3621,91877,DPW Maintained,Prunus serrulata 'Kwanzan' :: Kwanzan Flowering Cherry,744 Irving St,1.0,Sidewalk: Curb side : Cutout,DPW,2/18/09 0:00,3,3x3,37.76411746,-122.4657305,Prunus,Prunus serrulata,Kwanzan Flowering Cherry,2009,2009-02-18 00:00:00,15
3624,271,DPW Maintained,Tristaniopsis laurina :: Swamp Myrtle,3201X 19th Ave,10.0,Sidewalk: Curb side : Cutout,DPW,3/18/06 0:00,6,3X3,37.72894649,-122.4750188,Tristaniopsis,Tristaniopsis laurina,Swamp Myrtle,2006,2006-03-18 00:00:00,18
3641,68235,DPW Maintained,Metrosideros excelsa :: New Zealand Xmas Tree,123 Alhambra St,1.0,Sidewalk: Curb side : Cutout,Private,8/9/93 0:00,11,,37.80220375,-122.4383413,Metrosideros,Metrosideros excelsa,New Zealand Xmas Tree,1993,1993-08-09 00:00:00,31
3647,96227,DPW Maintained,Quercus agrifolia :: Coast Live Oak,14X CAINE AVE,10.0,Median : Cutout,DPW,8/24/11 0:00,3,6x300,37.71795281,-122.4501442,Quercus,Quercus agrifolia,Coast Live Oak,2011,2011-08-24 00:00:00,13
3653,11738,DPW Maintained,Arbutus 'Marina' :: Hybrid Strawberry Tree,900X Junipero Serra Blvd,16.0,Sidewalk: Curb side : Cutout,DPW,3/1/00 0:00,3,2x2,37.72157896,-122.4724557,Arbutus,Arbutus 'Marina',Hybrid Strawberry Tree,2000,2000-03-01 00:00:00,24
3654,84616,DPW Maintained,Eriobotrya deflexa :: Bronze Loquat,65 Avila St,1.0,Sidewalk: Curb side : Cutout,Private,6/13/08 0:00,5,3x3,37.80114,-122.4405419,Eriobotrya,Eriobotrya deflexa,Bronze Loquat,2008,2008-06-13 00:00:00,16
3658,44033,DPW Maintained,Acacia baileyana :: Bailey's Acacia,230 Ashbury St,1.0,Sidewalk: Curb side : Cutout,Private,10/2/00 0:00,9,,37.77329867,-122.4475183,Acacia,Acacia baileyana,Bailey's Acacia,2000,2000-10-02 00:00:00,24
3661,112863,Planning Code 138.1 required,Arbutus 'Marina' :: Hybrid Strawberry Tree,2451 19TH AVE,1.0,Sidewalk: Curb side : Cutout,Private,8/25/15 0:00,3,3x3,37.74209311,-122.4757329,Arbutus,Arbutus 'Marina',Hybrid Strawberry Tree,2015,2015-08-25 00:00:00,9
3662,10879,DPW Maintained,Quercus suber :: Cork Oak,1175X Hudson Ave,12.0,Sidewalk: Curb side : Cutout,DPW,3/23/06 0:00,3,3X4,37.73299005,-122.3816988,Quercus,Quercus suber,Cork Oak,2006,2006-03-23 00:00:00,18
3665,62825,DPW Maintained,Pittosporum undulatum :: Victorian Box,1489 McAllister St,1.0,Sidewalk: Curb side : Cutout,Private,7/8/86 0:00,11,,37.77797172,-122.4363717,Pittosporum,Pittosporum undulatum,Victorian Box,1986,1986-07-08 00:00:00,38
3668,30878,DPW Maintained,Maytenus boaria :: Mayten,264 Fair Oaks St,2.0,Sidewalk: Curb side : Cutout,Private,3/8/95 0:00,6,,37.75242188,-122.4241026,Maytenus,Maytenus boaria,Mayten,1995,1995-03-08 00:00:00,29
3673,108019,DPW Maintained,Arbutus 'Marina' :: Hybrid Strawberry Tree,552 Hayes St,1.0,Sidewalk: Curb side : Cutout,Private,11/12/14 0:00,3,6x4,37.77666765,-122.4255162,Arbutus,Arbutus 'Marina',Hybrid Strawberry Tree,2014,2014-11-12 00:00:00,10
3677,65408,DPW Maintained,Lophostemon confertus :: Brisbane Box,945 Larkin St,1.0,Sidewalk: Curb side : Cutout,Private,11/3/89 0:00,11,,37.78686014,-122.4183312,Lophostemon,Lophostemon confertus,Brisbane Box,1989,1989-11-03 00:00:00,35
3678,29829,Permitted Site,Magnolia grandiflora :: Southern Magnolia,1695X Evans Ave,27.0,Sidewalk: Curb side : Cutout,Purchasing Dept,9/11/06 0:00,3,4x4,37.74391708,-122.3902499,Magnolia,Magnolia grandiflora,Southern Magnolia,2006,2006-09-11 00:00:00,18
3679,13452,DPW Maintained,Platanus x hispanica :: Sycamore: London Plane,2X Market St,20.0,Sidewalk: Curb side : Cutout,DPW,10/28/05 0:00,4,4x4,37.79379334,-122.3958229,Platanus,Platanus x,Sycamore: London Plane,2005,2005-10-28 00:00:00,19
3684,97703,DPW Maintained,Platanus x hispanica :: Sycamore: London Plane,900 North Point St,12.0,Sidewalk: Curb side : Cutout,Private,4/28/14 0:00,3,4x8,37.80547935,-122.4227979,Platanus,Platanus x,Sycamore: London Plane,2014,2014-04-28 00:00:00,10
3689,17716,DPW Maintained,Ligustrum lucidum :: Glossy Privet,1238 Pierce St,1.0,Sidewalk: Curb side : Cutout,DPW,9/13/89 0:00,6,3X3,37.78157421,-122.4356517,Ligustrum,Ligustrum lucidum,Glossy Privet,1989,1989-09-13 00:00:00,35
3691,91979,DPW Maintained,Prunus serrulata 'Kwanzan' :: Kwanzan Flowering Cherry,1262 09th Ave,1.0,Sidewalk: Curb side : Cutout,DPW,2/20/09 0:00,3,3x3,37.76474847,-122.466291,Prunus,Prunus serrulata,Kwanzan Flowering Cherry,2009,2009-02-20 00:00:00,15
3692,1214,DPW Maintained,Acer buergeranum :: Trident Maple,3435 Alemany Blvd,1.0,Sidewalk: Curb side : Cutout,DPW,3/8/05 0:00,3,3X3,37.71119014,-122.4632308,Acer,Acer buergeranum,Trident Maple,2005,2005-03-08 00:00:00,19
3693,31524,DPW Maintained,Ligustrum lucidum :: Glossy Privet,1326 San Bruno Ave,1.0,Sidewalk: Curb side : Cutout,Private,5/10/95 0:00,14,,37.75272792,-122.4044308,Ligustrum,Ligustrum lucidum,Glossy Privet,1995,1995-05-10 00:00:00,29
3699,23649,Permitted Site,Ulmus parvifolia :: Chinese Elm,213 Virginia Ave,1.0,Sidewalk: Curb side : Cutout,Private,3/18/98 0:00,12,3X3,37.74222514,-122.4191023,Ulmus,Ulmus parvifolia,Chinese Elm,1998,1998-03-18 00:00:00,26
3701,3647,DPW Maintained,Aesculus x carnea 'Briotii' :: Ruby Horse Chestnut,100X Cargo Way,83.0,Sidewalk: Curb side : Cutout,Port,5/31/96 0:00,3,3X3,37.74354633,-122.3823789,Aesculus,Aesculus x,Ruby Horse Chestnut,1996,1996-05-31 00:00:00,28
3702,63548,DPW Maintained,Prunus serrulata :: Ornamental Cherry,942 Central Ave,1.0,Sidewalk: Curb side : Cutout,Private,4/13/87 0:00,10,,37.77850668,-122.4451948,Prunus,Prunus serrulata,Ornamental Cherry,1987,1987-04-13 00:00:00,37
3706,16202,DPW Maintained,Trachycarpus fortunei :: Windmill Palm,500X Monterey Blvd,2.0,Median : Cutout,DPW,2/2/03 0:00,12,5,37.73161781,-122.4465566,Trachycarpus,Trachycarpus fortunei,Windmill Palm,2003,2003-02-02 00:00:00,21
3718,30542,DPW Maintained,Tristaniopsis laurina :: Swamp Myrtle,401 Tunnel Ave,1.0,Sidewalk: Curb side : Cutout,Private,1/25/95 0:00,3,,37.70878106,-122.4012616,Tristaniopsis,Tristaniopsis laurina,Swamp Myrtle,1995,1995-01-25 00:00:00,29
3719,91974,DPW Maintained,Prunus serrulata 'Kwanzan' :: Kwanzan Flowering Cherry,1332 09th Ave,1.0,Sidewalk: Curb side : Cutout,DPW,2/20/09 0:00,3,3x3,37.76341265,-122.4661977,Prunus,Prunus serrulata,Kwanzan Flowering Cherry,2009,2009-02-20 00:00:00,15
3727,244032,DPW Maintained,Prunus cerasifera :: Cherry Plum,501X Shrader St,4.0,Sidewalk: Curb side : Cutout,Private,11/18/99 0:00,7,Width 0ft,37.76984338,-122.4519606,Prunus,Prunus cerasifera,Cherry Plum,1999,1999-11-18 00:00:00,25
3728,32484,DPW Maintained,Prunus cerasifera :: Cherry Plum,203 States St,2.0,Sidewalk: Curb side : Cutout,Private,10/10/96 0:00,7,,37.76364194,-122.4395803,Prunus,Prunus cerasifera,Cherry Plum,1996,1996-10-10 00:00:00,28
3729,255283,Significant Tree,Olea europaea :: Olive Tree,320 Magellan Ave,4.0,Front Yard : Yard,Private,5/1/18 0:00,3,10x20,37.74584137,-122.462479,Olea,Olea europaea,Olive Tree,2018,2018-05-01 00:00:00,6
3738,12164,DPW Maintained,Tristaniopsis laurina :: Swamp Myrtle,1439X La Salle Ave,1.0,Sidewalk: Curb side : Cutout,DPW,3/11/06 0:00,3,3X3,37.73407987,-122.3858763,Tristaniopsis,Tristaniopsis laurina,Swamp Myrtle,2006,2006-03-11 00:00:00,18
3740,91100,DPW Maintained,Tristaniopsis laurina :: Swamp Myrtle,565 Oxford St,1.0,Sidewalk: Curb side : Cutout,Private,1/6/09 0:00,5,3x3,37.72303181,-122.4180117,Tristaniopsis,Tristaniopsis laurina,Swamp Myrtle,2009,2009-01-06 00:00:00,15
3743,60077,DPW Maintained,Maytenus boaria :: Mayten,1263 23rd Ave,1.0,Sidewalk: Curb side : Cutout,Private,3/16/82 0:00,6,,37.76405568,-122.4815364,Maytenus,Maytenus boaria,Mayten,1982,1982-03-16 00:00:00,42
3745,81522,DPW Maintained,Tristaniopsis laurina :: Swamp Myrtle,870 39th Ave,1.0,Sidewalk: Curb side : Cutout,Private,12/7/07 0:00,5,3x3,37.77247655,-122.4991473,Tristaniopsis,Tristaniopsis laurina,Swamp Myrtle,2007,2007-12-07 00:00:00,17
3748,32731,DPW Maintained,Metrosideros excelsa :: New Zealand Xmas Tree,431 Capitol Ave,1.0,Sidewalk: Curb side : Cutout,SFUSD,10/29/96 0:00,3,3x3,37.71479563,-122.4591082,Metrosideros,Metrosideros excelsa,New Zealand Xmas Tree,1996,1996-10-29 00:00:00,28
3749,6499,DPW Maintained,Ginkgo biloba :: Maidenhair Tree,1200X Evans Ave,41.0,Sidewalk: Curb side : Cutout,DPW,9/11/06 0:00,3,3X3,37.74054239,-122.3837586,Ginkgo,Ginkgo biloba,Maidenhair Tree,2006,2006-09-11 00:00:00,18
3757,14029,DPW Maintained,Platanus x hispanica :: Sycamore: London Plane,1234 Market St,1.0,Sidewalk: Curb side : Cutout,DPW,10/28/05 0:00,3,4x4,37.77832149,-122.4154311,Platanus,Platanus x,Sycamore: London Plane,2005,2005-10-28 00:00:00,19
3761,8015,Permitted Site,Pittosporum undulatum :: Victorian Box,440 Fulton St,3.0,Sidewalk: Curb side : Cutout,Private,4/24/90 0:00,10,3X3,37.77852926,-122.4240754,Pittosporum,Pittosporum undulatum,Victorian Box,1990,1990-04-24 00:00:00,34
3762,2463,DPW Maintained,Prunus cerasifera :: Cherry Plum,1826 Buchanan St,2.0,Sidewalk: Curb side : Cutout,DPW,7/23/97 0:00,3,4X4,37.7869402,-122.4299887,Prunus,Prunus cerasifera,Cherry Plum,1997,1997-07-23 00:00:00,27
3772,41590,DPW Maintained,Pittosporum undulatum :: Victorian Box,401 Euclid Ave,1.0,Sidewalk: Curb side : Cutout,Private,2/20/70 0:00,11,,37.78396334,-122.4528201,Pittosporum,Pittosporum undulatum,Victorian Box,1970,2070-02-20 00:00:00,-46
3781,109698,DPW Maintained,Acacia stenophylla :: Shoestring Acacia,600x GUERRERO ST,6.0,Median : Cutout,DPW,2/28/15 23:01,3,3x3,37.76131443,-122.4243127,Acacia,Acacia stenophylla,Shoestring Acacia,2015,2015-02-28 23:01:00,9
3782,4224,DPW Maintained,Syagrus romanzoffianum :: Queen Palm,3978 Cesar Chavez St,1.0,Sidewalk: Curb side : Cutout,Private,4/15/95 0:00,3,3X3,37.74765561,-122.4287074,Syagrus,Syagrus romanzoffianum,Queen Palm,1995,1995-04-15 00:00:00,29
3789,90932,DPW Maintained,Metrosideros excelsa :: New Zealand Xmas Tree,3942 Balboa St,1.0,Sidewalk: Curb side : Cutout,DPW,11/11/08 0:00,3,3x3,37.77560935,-122.5013599,Metrosideros,Metrosideros excelsa,New Zealand Xmas Tree,2008,2008-11-11 00:00:00,16
3793,89743,DPW Maintained,Arbutus 'Marina' :: Hybrid Strawberry Tree,1125 Anza St,1.0,Sidewalk: Curb side : Cutout,DPW,2/11/08 0:00,3,3x3,37.7791903,-122.4603343,Arbutus,Arbutus 'Marina',Hybrid Strawberry Tree,2008,2008-02-11 00:00:00,16
3796,119629,DPW Maintained,Olea europaea :: Olive Tree,715 Buena Vista Ave West,4.0,Sidewalk: Property side : Cutout,Private,7/29/16 0:00,3,,37.76775205,-122.4437156,Olea,Olea europaea,Olive Tree,2016,2016-07-29 00:00:00,8
3805,12783,DPW Maintained,Tristaniopsis laurina :: Swamp Myrtle,1918 Lake St,1.0,Sidewalk: Curb side : Cutout,Private,7/24/08 0:00,3,3X3,37.78604213,-122.4803524,Tristaniopsis,Tristaniopsis laurina,Swamp Myrtle,2008,2008-07-24 00:00:00,16
3807,38562,DPW Maintained,Acacia melanoxylon :: Blackwood Acacia,1630 McKinnon Ave,1.0,Sidewalk: Curb side : Cutout,Private,9/17/98 0:00,6,,37.73664027,-122.3898348,Acacia,Acacia melanoxylon,Blackwood Acacia,1998,1998-09-17 00:00:00,26
3811,87647,DPW Maintained,Magnolia grandiflora 'Samuel Sommer' :: Samuel Sommer Magnolia,1989X PINE ST,3.0,Sidewalk: Curb side : Cutout,DPW,1/30/08 0:00,3,3x3,37.78854886,-122.4284929,Magnolia,Magnolia grandiflora,Samuel Sommer Magnolia,2008,2008-01-30 00:00:00,16
3816,318,DPW Maintained,Metrosideros excelsa :: New Zealand Xmas Tree,3498X 19th Ave,3.0,Sidewalk: Curb side : Cutout,DPW,5/24/94 0:00,20,2,37.72504926,-122.474754,Metrosideros,Metrosideros excelsa,New Zealand Xmas Tree,1994,1994-05-24 00:00:00,30
3818,59675,DPW Maintained,Ficus microcarpa nitida 'Green Gem' :: Indian Laurel Fig Tree 'Green Gem',370 Hayes St,1.0,Sidewalk: Curb side : Cutout,Private,4/22/81 0:00,28,6x6,37.77701824,-122.4224248,Ficus,Ficus microcarpa,Indian Laurel Fig Tree 'Green Gem',1981,1981-04-22 00:00:00,43
3821,12935,Permitted Site,Arbutus 'Marina' :: Hybrid Strawberry Tree,6668X 03rd St,2.0,Sidewalk: Curb side : Cutout,Private,10/1/12 0:00,12,3X3,37.71868799,-122.3977885,Arbutus,Arbutus 'Marina',Hybrid Strawberry Tree,2012,2012-10-01 00:00:00,12
3823,29950,DPW Maintained,Tristaniopsis laurina :: Swamp Myrtle,271 Broad St,1.0,Sidewalk: Curb side : Cutout,Private,3/10/07 0:00,3,3x3,37.71307466,-122.4616175,Tristaniopsis,Tristaniopsis laurina,Swamp Myrtle,2007,2007-03-10 00:00:00,17
3828,49757,DPW Maintained,Celtis sinensis :: Chinese Hackberry,1360 Goettingen St,1.0,Sidewalk: Curb side : Cutout,Private,6/4/03 0:00,7,,37.71529513,-122.401853,Celtis,Celtis sinensis,Chinese Hackberry,2003,2003-06-04 00:00:00,21
3829,56860,DPW Maintained,Metrosideros excelsa :: New Zealand Xmas Tree,2650 Noriega St,1.0,Sidewalk: Curb side : Cutout,Private,8/7/74 0:00,12,,37.75365784,-122.492206,Metrosideros,Metrosideros excelsa,New Zealand Xmas Tree,1974,1974-08-07 00:00:00,50
3837,37636,DPW Maintained,Eriobotrya deflexa 'Coppertone' :: Coppertone Loquat,610 20th Ave,2.0,Sidewalk: Curb side : Cutout,Private,6/26/98 0:00,4,,37.77629783,-122.4790127,Eriobotrya,Eriobotrya deflexa,Coppertone Loquat,1998,1998-06-26 00:00:00,26
3838,27155,DPW Maintained,Callistemon viminalis :: Weeping Bottlebrush,1700X Silver Ave,4.0,Sidewalk: Curb side : Cutout,Rec/Park,1/29/00 0:00,6,3X3,37.73337066,-122.4038464,Callistemon,Callistemon viminalis,Weeping Bottlebrush,2000,2000-01-29 00:00:00,24
3846,2571,DPW Maintained,Pittosporum undulatum :: Victorian Box,1635 Bush St,2.0,Sidewalk: Curb side : Cutout,DPW,11/17/03 0:00,3,4X4,37.78811763,-122.4242186,Pittosporum,Pittosporum undulatum,Victorian Box,2003,2003-11-17 00:00:00,21
3859,62959,DPW Maintained,Eriobotrya deflexa :: Bronze Loquat,1175 Broadway,1.0,Sidewalk: Curb side : Cutout,Private,8/21/86 0:00,14,,37.79658605,-122.416345,Eriobotrya,Eriobotrya deflexa,Bronze Loquat,1986,1986-08-21 00:00:00,38
3861,79414,DPW Maintained,Prunus serrulata :: Ornamental Cherry,2635 37th Ave,1.0,Sidewalk: Curb side : Cutout,Private,7/29/09 0:00,2,3x3,37.73774473,-122.4947431,Prunus,Prunus serrulata,Ornamental Cherry,2009,2009-07-29 00:00:00,15
3862,94752,DPW Maintained,Eriobotrya deflexa :: Bronze Loquat,491 Bay Shore Blvd,5.0,Sidewalk: Curb side : Cutout,Private,10/28/10 0:00,4,3x3,37.74005415,-122.4067429,Eriobotrya,Eriobotrya deflexa,Bronze Loquat,2010,2010-10-28 00:00:00,14
3864,43754,DPW Maintained,Trachycarpus fortunei :: Windmill Palm,367 15th Ave,1.0,Sidewalk: Curb side : Cutout,Private,7/26/00 0:00,14,,37.78127279,-122.4741073,Trachycarpus,Trachycarpus fortunei,Windmill Palm,2000,2000-07-26 00:00:00,24
3874,6653,DPW Maintained,Ginkgo biloba :: Maidenhair Tree,1550 Evans Ave,1.0,Sidewalk: Curb side : Cutout,DPW,3/29/04 0:00,3,3X3,37.74256019,-122.3873168,Ginkgo,Ginkgo biloba,Maidenhair Tree,2004,2004-03-29 00:00:00,20
3875,5021,DPW Maintained,Metrosideros excelsa :: New Zealand Xmas Tree,5320 Diamond Heights Blvd,5.0,Sidewalk: Curb side : Cutout,DPW,1/6/92 0:00,3,2X2,37.74313697,-122.4372374,Metrosideros,Metrosideros excelsa,New Zealand Xmas Tree,1992,1992-01-06 00:00:00,32
3881,29959,DPW Maintained,Pittosporum tenuifolium :: Tawhiwhi Pittosporum,300x Junipero Serra Blvd,6.0,Median : Cutout,DPW,4/1/07 0:00,3,3x3,37.73078519,-122.4720715,Pittosporum,Pittosporum tenuifolium,Tawhiwhi Pittosporum,2007,2007-04-01 00:00:00,17
3882,26700,Permitted Site,Lophostemon confertus :: Brisbane Box,2648 03rd St,1.0,Sidewalk: Curb side : Cutout,Private,2/5/98 0:00,6,3x3,37.75605633,-122.3881929,Lophostemon,Lophostemon confertus,Brisbane Box,1998,1998-02-05 00:00:00,26
3890,2467,DPW Maintained,Prunus cerasifera :: Cherry Plum,1848 Buchanan St,1.0,Sidewalk: Curb side : Cutout,Private,9/13/89 0:00,12,4X4,37.78716777,-122.4300336,Prunus,Prunus cerasifera,Cherry Plum,1989,1989-09-13 00:00:00,35
3893,95615,DPW Maintained,Magnolia grandiflora :: Southern Magnolia,1536 Pacific Ave,1.0,Sidewalk: Curb side : Cutout,Private,3/4/11 0:00,15,3x3,37.79521995,-122.4205257,Magnolia,Magnolia grandiflora,Southern Magnolia,2011,2011-03-04 00:00:00,13
3899,117445,DPW Maintained,Ulmus parvifolia :: Chinese Elm,403 Francisco St,1.0,Sidewalk: Curb side : Cutout,Private,6/14/16 0:00,3,,37.80483123,-122.4118372,Ulmus,Ulmus parvifolia,Chinese Elm,2016,2016-06-14 00:00:00,8
3900,65737,DPW Maintained,Metrosideros excelsa :: New Zealand Xmas Tree,47 Brunswick St,1.0,Sidewalk: Curb side : Cutout,Private,5/9/94 0:00,10,,37.71173442,-122.4389381,Metrosideros,Metrosideros excelsa,New Zealand Xmas Tree,1994,1994-05-09 00:00:00,30
3907,25817,Permitted Site,Platanus x hispanica :: Sycamore: London Plane,1300X The Embarcadero,13.0,Sidewalk: Curb side : Cutout,Port,10/15/95 0:00,6,4X4,37.80608845,-122.4043754,Platanus,Platanus x,Sycamore: London Plane,1995,1995-10-15 00:00:00,29
3911,56856,DPW Maintained,Olea europaea :: Olive Tree,183 Vienna St,1.0,Sidewalk: Curb side : Cutout,Private,8/6/74 0:00,9,,37.72542632,-122.4266404,Olea,Olea europaea,Olive Tree,1974,1974-08-06 00:00:00,50
3923,42239,DPW Maintained,Prunus cerasifera :: Cherry Plum,526 Natoma St,1.0,Sidewalk: Curb side : Cutout,Private,6/23/00 0:00,5,,37.77969747,-122.4083613,Prunus,Prunus cerasifera,Cherry Plum,2000,2000-06-23 00:00:00,24
3928,18037,DPW Maintained,Maytenus boaria :: Mayten,2809 Pine St,1.0,Sidewalk: Curb side : Cutout,Private,8/24/93 0:00,6,3X3,37.78670137,-122.4424768,Maytenus,Maytenus boaria,Mayten,1993,1993-08-24 00:00:00,31
3935,252997,DPW Maintained,Magnolia grandiflora 'Saint Mary' :: Saint Mary Magnolia,1201 Tennessee St,6.0,Sidewalk: Curb side : Cutout,Private,7/10/17 0:00,3,,37.7563302,-122.3890342,Magnolia,Magnolia grandiflora,Saint Mary Magnolia,2017,2017-07-10 00:00:00,7
3941,46445,Permitted Site,Maytenus boaria :: Mayten,2407 Harrison St,1.0,Sidewalk: Curb side : Cutout,Private,2/27/15 0:00,12,3x3,37.75889358,-122.4123979,Maytenus,Maytenus boaria,Mayten,2015,2015-02-27 00:00:00,9
3945,265175,Section 806 (d),Magnolia grandiflora 'Little Gem' :: Little Gem Magnolia,1250 Eucalyptus Dr,7.0,Sidewalk: Property side : Yard,Private,1/20/21 0:00,3,5x10,37.73105825,-122.4850651,Magnolia,Magnolia grandiflora,Little Gem Magnolia,2021,2021-01-20 00:00:00,3
3948,141859,DPW Maintained,Tristaniopsis laurina 'Elegant' :: Small-leaf Tristania 'Elegant',1126 TURK ST,1.0,Sidewalk: Curb side : Cutout,DPW,5/1/19 0:00,3,Width 0ft,37.78111815,-122.4277892,Tristaniopsis,Tristaniopsis laurina,Small-leaf Tristania 'Elegant',2019,2019-05-01 00:00:00,5
3952,91779,DPW Maintained,Platanus x hispanica 'Yarwood' :: Yarwood Sycamore,1184 Harrison St,1.0,Sidewalk: Curb side : Cutout,DPW,3/7/07 0:00,3,3x3,37.77401094,-122.4082965,Platanus,Platanus x,Yarwood Sycamore,2007,2007-03-07 00:00:00,17
3953,60377,DPW Maintained,Magnolia grandiflora :: Southern Magnolia,1264 Palou Ave,1.0,Sidewalk: Curb side : Cutout,Private,10/26/82 0:00,4,,37.7304901,-122.3845807,Magnolia,Magnolia grandiflora,Southern Magnolia,1982,1982-10-26 00:00:00,42
3955,219179,DPW Maintained,Hymenosporum flavum :: Sweetshade,1785 07th Ave,1.0,Sidewalk: Curb side : Cutout,Private,8/30/02 0:00,9,Width 4ft,37.75514436,-122.4636696,Hymenosporum,Hymenosporum flavum,Sweetshade,2002,2002-08-30 00:00:00,22
3960,54046,DPW Maintained,Arbutus 'Marina' :: Hybrid Strawberry Tree,3545 Webster St,1.0,Sidewalk: Curb side : Cutout,Private,4/18/72 0:00,6,,37.80350103,-122.4351821,Arbutus,Arbutus 'Marina',Hybrid Strawberry Tree,1972,2072-04-18 00:00:00,-48
3967,68957,DPW Maintained,Acer palmatum :: Japanese Maple,896 24th Ave,2.0,Sidewalk: Curb side : Cutout,Private,12/29/93 0:00,1,,37.772888,-122.4830543,Acer,Acer palmatum,Japanese Maple,1993,1993-12-29 00:00:00,31
3970,7146,DPW Maintained,Tristaniopsis laurina :: Swamp Myrtle,685X Oak St,3.0,Sidewalk: Curb side : Cutout,DPW,2/18/98 0:00,3,3X3,37.77393906,-122.4305404,Tristaniopsis,Tristaniopsis laurina,Swamp Myrtle,1998,1998-02-18 00:00:00,26
3972,10104,DPW Maintained,Lophostemon confertus :: Brisbane Box,780 Guerrero St,2.0,Sidewalk: Curb side : Cutout,Private,8/11/94 0:00,13,3x5,37.75860767,-122.4236384,Lophostemon,Lophostemon confertus,Brisbane Box,1994,1994-08-11 00:00:00,30
3977,36185,DPW Maintained,Magnolia grandiflora :: Southern Magnolia,69 Palm Ave,1.0,Sidewalk: Curb side : Cutout,Private,5/4/98 0:00,11,,37.78446811,-122.4580552,Magnolia,Magnolia grandiflora,Southern Magnolia,1998,1998-05-04 00:00:00,26
3981,160541,DPW Maintained,Ulmus parvifolia 'Drake' :: Drake's Chinese Elm,795 Edinburgh St,1.0,Sidewalk: Curb side : Cutout,Private,10/11/17 9:01,3,Width 0ft,37.71664587,-122.4353902,Ulmus,Ulmus parvifolia,Drake's Chinese Elm,2017,2017-10-11 09:01:00,7
3985,24867,DPW Maintained,Acer x freemanii :: Freeman Maple,2695 San Bruno Ave,1.0,Sidewalk: Curb side : Cutout,Private,2/13/02 0:00,8,3X3,37.72782555,-122.4035824,Acer,Acer x,Freeman Maple,2002,2002-02-13 00:00:00,22
3994,5391,DPW Maintained,Magnolia grandiflora :: Southern Magnolia,344 Dolores St,1.0,Sidewalk: Curb side : Cutout,DPW,3/10/06 0:00,6,3x3,37.76383376,-122.4264538,Magnolia,Magnolia grandiflora,Southern Magnolia,2006,2006-03-10 00:00:00,18
3998,29768,DPW Maintained,Geijera parviflora :: Australian Willow,640 Francisco St,1.0,Sidewalk: Curb side : Cutout,DPW,1/1/91 0:00,6,6x6,37.80447477,-122.4155619,Geijera,Geijera parviflora,Australian Willow,1991,1991-01-01 00:00:00,33
3999,87401,,Pyrus kawakamii :: Evergreen Pear,400X Monterey Blvd,11.0,Median : Cutout,DPW,3/17/08 0:00,3,3x3,37.73160462,-122.444371,Pyrus,Pyrus kawakamii,Evergreen Pear,2008,2008-03-17 00:00:00,16
4003,30004,DPW Maintained,Trachycarpus fortunei :: Windmill Palm,610X San Jose Ave,16.0,Median : Cutout,DPW,3/24/07 0:00,3,3x3,37.74623246,-122.4218637,Trachycarpus,Trachycarpus fortunei,Windmill Palm,2007,2007-03-24 00:00:00,17
4004,92302,DPW Maintained,Tristaniopsis laurina :: Swamp Myrtle,1238 23rd Ave,1.0,Sidewalk: Curb side : Cutout,Private,7/27/09 0:00,2,3x3,37.76448065,-122.4814126,Tristaniopsis,Tristaniopsis laurina,Swamp Myrtle,2009,2009-07-27 00:00:00,15
4015,47118,Permitted Site,Ginkgo biloba :: Maidenhair Tree,111X Kingston St,2.0,Sidewalk: Curb side : Cutout,Private,5/3/02 0:00,3,3x3,37.74174096,-122.422278,Ginkgo,Ginkgo biloba,Maidenhair Tree,2002,2002-05-03 00:00:00,22
4019,56139,DPW Maintained,Myrica californica :: Pacific Wax Myrtle Tree,785 Carolina St,1.0,Sidewalk: Curb side : Cutout,Private,7/3/73 0:00,9,,37.75869046,-122.3999486,Myrica,Myrica californica,Pacific Wax Myrtle Tree,1973,2073-07-03 00:00:00,-49
4020,83411,DPW Maintained,Metrosideros excelsa :: New Zealand Xmas Tree,4417-4417 Lincoln Way,1.0,Sidewalk: Curb side : Cutout,Private,1/28/08 0:00,2,3x3,37.7641086,-122.505451,Metrosideros,Metrosideros excelsa,New Zealand Xmas Tree,2008,2008-01-28 00:00:00,16
4025,68467,DPW Maintained,Araucaria columnaris :: Coral reef araucaria,65 Badger St,1.0,Sidewalk: Curb side : Cutout,Private,10/4/93 0:00,2,,37.73100841,-122.4340264,Araucaria,Araucaria columnaris,Coral reef araucaria,1993,1993-10-04 00:00:00,31
4029,106484,DPW Maintained,Jacaranda mimosifolia :: Jacaranda,758 Arkansas St,1.0,Sidewalk: Curb side : Cutout,Private,1/4/16 0:00,1,3x3,37.75657404,-122.3979662,Jacaranda,Jacaranda mimosifolia,Jacaranda,2016,2016-01-04 00:00:00,8
4030,26294,DPW Maintained,Tristaniopsis laurina :: Swamp Myrtle,1900X San Jose Ave,13.0,Sidewalk: Curb side : Cutout,DPW,6/20/97 0:00,3,3X3,37.72676778,-122.4416782,Tristaniopsis,Tristaniopsis laurina,Swamp Myrtle,1997,1997-06-20 00:00:00,27
4031,43444,DPW Maintained,Quercus agrifolia :: Coast Live Oak,241 Oneida Ave,6.0,Sidewalk: Curb side : Cutout,DPW,7/18/00 0:00,2,,37.72220472,-122.4438595,Quercus,Quercus agrifolia,Coast Live Oak,2000,2000-07-18 00:00:00,24
4040,24729,DPW Maintained,Melaleuca linariifolia :: Flaxleaf Paperbark,7426 Geary Blvd,1.0,Sidewalk: Curb side : Cutout,DPW,12/11/02 0:00,3,3X3,37.77958076,-122.4991967,Melaleuca,Melaleuca linariifolia,Flaxleaf Paperbark,2002,2002-12-11 00:00:00,22
4046,18603,DPW Maintained,Rhamnus alaternus :: Italian Buckthorn,520 Randolph St,1.0,Sidewalk: Curb side : Cutout,DPW,7/25/96 0:00,6,3X3,37.71436268,-122.4674141,Rhamnus,Rhamnus alaternus,Italian Buckthorn,1996,1996-07-25 00:00:00,28
4049,7655,DPW Maintained,Ulmus parvifolia :: Chinese Elm,3331 Folsom St,1.0,Sidewalk: Curb side : Cutout,Private,6/22/11 0:00,3,4x4,37.74467207,-122.4132133,Ulmus,Ulmus parvifolia,Chinese Elm,2011,2011-06-22 00:00:00,13
4052,143978,DPW Maintained,Olea europaea 'Wilsonii' :: Wilson Olive Semi-fruitless,734 34th Ave,1.0,Sidewalk: Curb side : Cutout,Private,8/13/20 0:00,3,Width 4ft,37.77518732,-122.4939708,Olea,Olea europaea,Wilson Olive Semi-fruitless,2020,2020-08-13 00:00:00,4
4062,171265,DPW Maintained,Tristaniopsis laurina :: Swamp Myrtle,186 Edinburgh St,1.0,Sidewalk: Curb side : Cutout,Private,11/27/19 0:00,3,Width 3ft,37.72617803,-122.4284343,Tristaniopsis,Tristaniopsis laurina,Swamp Myrtle,2019,2019-11-27 00:00:00,5
4066,47408,DPW Maintained,Prunus cerasifera :: Cherry Plum,1232 Anza St,1.0,Sidewalk: Curb side : Cutout,Private,5/14/02 0:00,5,,37.77929572,-122.4615451,Prunus,Prunus cerasifera,Cherry Plum,2002,2002-05-14 00:00:00,22
4074,64502,DPW Maintained,Pittosporum undulatum :: Victorian Box,531 Broderick St,1.0,Sidewalk: Curb side : Cutout,Private,7/20/88 0:00,10,,37.77523718,-122.4396315,Pittosporum,Pittosporum undulatum,Victorian Box,1988,1988-07-20 00:00:00,36
4085,91254,DPW Maintained,Acacia stenophylla :: Shoestring Acacia,928x Guerrero St,1.0,Median : Cutout,DPW,11/20/08 0:00,3,3x100,37.75629151,-122.4233309,Acacia,Acacia stenophylla,Shoestring Acacia,2008,2008-11-20 00:00:00,16
4095,55803,DPW Maintained,Pittosporum undulatum :: Victorian Box,39 Atalaya Ter,1.0,Sidewalk: Curb side : Cutout,Private,3/30/73 0:00,21,,37.77598256,-122.4475592,Pittosporum,Pittosporum undulatum,Victorian Box,1973,2073-03-30 00:00:00,-49
4096,253345,DPW Maintained,Prunus serrulata :: Ornamental Cherry,1700 Buchanan St,3.0,Sidewalk: Curb side : Cutout,Private,5/26/19 21:49,3,Width 0ft,37.7856433,-122.4298186,Prunus,Prunus serrulata,Ornamental Cherry,2019,2019-05-26 21:49:00,5
4100,96219,DPW Maintained,Lophostemon confertus :: Brisbane Box,170 Fell St,3.0,Sidewalk: Curb side : Cutout,DPW,12/19/15 9:39,3,3x3,37.77672505,-122.420465,Lophostemon,Lophostemon confertus,Brisbane Box,2015,2015-12-19 09:39:00,9
4103,17627,DPW Maintained,Ulmus parvifolia :: Chinese Elm,1135 Persia Ave,2.0,Sidewalk: Curb side : Cutout,DPW,4/27/05 0:00,3,3X3,37.71886582,-122.4268623,Ulmus,Ulmus parvifolia,Chinese Elm,2005,2005-04-27 00:00:00,19
4104,11725,Permitted Site,Arbutus 'Marina' :: Hybrid Strawberry Tree,899X Junipero Serra Blvd,20.0,Sidewalk: Curb side : Cutout,PUC,1/18/08 0:00,3,3x3,37.72165289,-122.4722096,Arbutus,Arbutus 'Marina',Hybrid Strawberry Tree,2008,2008-01-18 00:00:00,16
4106,90991,DPW Maintained,Metrosideros excelsa :: New Zealand Xmas Tree,2801 Balboa St,3.0,Sidewalk: Curb side : Cutout,DPW,7/23/12 0:00,3,3x3,37.77601754,-122.4890004,Metrosideros,Metrosideros excelsa,New Zealand Xmas Tree,2012,2012-07-23 00:00:00,12
4108,235113,DPW Maintained,Pittosporum undulatum :: Victorian Box,200X Prospect Ave,3.0,Sidewalk: Curb side : Cutout,Private,4/7/20 9:12,3,5x5,37.74232657,-122.4195621,Pittosporum,Pittosporum undulatum,Victorian Box,2020,2020-04-07 09:12:00,4
4114,86264,DPW Maintained,Melaleuca quinquenervia :: Cajeput,1694 25th Ave,1.0,Sidewalk: Curb side : Cutout,DPW,12/12/06 0:00,3,3x3,37.75599763,-122.4829739,Melaleuca,Melaleuca quinquenervia,Cajeput,2006,2006-12-12 00:00:00,18
4116,5449,DPW Maintained,Magnolia grandiflora :: Southern Magnolia,513 Dolores St,1.0,Sidewalk: Curb side : Cutout,DPW,10/4/16 0:00,22,3X3,37.76113954,-122.4258947,Magnolia,Magnolia grandiflora,Southern Magnolia,2016,2016-10-04 00:00:00,8
4117,47804,DPW Maintained,Arbutus 'Marina' :: Hybrid Strawberry Tree,51 Escondido Ave,1.0,Sidewalk: Curb side : Cutout,Private,6/12/02 0:00,10,,37.73471299,-122.4900221,Arbutus,Arbutus 'Marina',Hybrid Strawberry Tree,2002,2002-06-12 00:00:00,22
4125,29405,DPW Maintained,Tristaniopsis laurina :: Swamp Myrtle,2901X Ingalls St,3.0,Sidewalk: Curb side : Cutout,Private,2/28/06 0:00,4,3x3,37.72080604,-122.3913783,Tristaniopsis,Tristaniopsis laurina,Swamp Myrtle,2006,2006-02-28 00:00:00,18
4133,41951,DPW Maintained,Acer buergeranum :: Trident Maple,780 09th Ave,1.0,Sidewalk: Curb side : Cutout,Private,6/20/00 0:00,2,3x3,37.77378684,-122.4669062,Acer,Acer buergeranum,Trident Maple,2000,2000-06-20 00:00:00,24
4137,147240,DPW Maintained,Eriobotrya deflexa :: Bronze Loquat,653 27th Ave,1.0,Sidewalk: Curb side : Cutout,Private,3/18/21 0:00,3,Width 4ft,37.77707321,-122.4867473,Eriobotrya,Eriobotrya deflexa,Bronze Loquat,2021,2021-03-18 00:00:00,3
4147,52595,DPW Maintained,Tristaniopsis laurina :: Swamp Myrtle,1609@ 3RD  ST Revere Ave,1.0,Sidewalk: Curb side : Cutout,Private,1/31/06 0:00,4,,37.73171473,-122.3904252,Tristaniopsis,Tristaniopsis laurina,Swamp Myrtle,2006,2006-01-31 00:00:00,18
4152,75946,DPW Maintained,Fraxinus spp :: Ash Spp,350 Broadway,3.0,Sidewalk: Curb side : Cutout,Private,10/7/95 0:00,13,,37.79840804,-122.4030963,Fraxinus,Fraxinus spp,Ash Spp,1995,1995-10-07 00:00:00,29
4160,42869,DPW Maintained,Prunus cerasifera :: Cherry Plum,2463 32nd Ave,1.0,Sidewalk: Curb side : Cutout,Private,7/3/00 0:00,6,,37.74127183,-122.4896206,Prunus,Prunus cerasifera,Cherry Plum,2000,2000-07-03 00:00:00,24
4161,52578,DPW Maintained,Pittosporum undulatum :: Victorian Box,131 07th Ave,1.0,Sidewalk: Curb side : Cutout,Private,1/13/06 0:00,5,,37.78600793,-122.4657998,Pittosporum,Pittosporum undulatum,Victorian Box,2006,2006-01-13 00:00:00,18
4165,56423,DPW Maintained,Metrosideros excelsa :: New Zealand Xmas Tree,275 18th Ave,1.0,Sidewalk: Curb side : Cutout,Private,8/20/73 0:00,22,,37.78281915,-122.4774966,Metrosideros,Metrosideros excelsa,New Zealand Xmas Tree,1973,2073-08-20 00:00:00,-49
4166,67477,DPW Maintained,Pyrus kawakamii :: Evergreen Pear,1543 McAllister St,1.0,Sidewalk: Curb side : Cutout,Private,9/8/92 0:00,8,,37.77783872,-122.4374778,Pyrus,Pyrus kawakamii,Evergreen Pear,1992,1992-09-08 00:00:00,32
4169,4033,DPW Maintained,Prunus serrulata :: Ornamental Cherry,2150 Cesar Chavez St,7.0,Sidewalk: Curb side : Cutout,DPW,3/23/06 0:00,3,3X3,37.74964025,-122.3991638,Prunus,Prunus serrulata,Ornamental Cherry,2006,2006-03-23 00:00:00,18
4170,46429,Permitted Site,Crataegus phaenopyrum :: Washington Hawthorn,71 Crescent Ave,1.0,Sidewalk: Curb side : Cutout,Private,1/28/16 0:00,3,,37.73532522,-122.4232802,Crataegus,Crataegus phaenopyrum,Washington Hawthorn,2016,2016-01-28 00:00:00,8
4176,28963,DPW Maintained,Lophostemon confertus :: Brisbane Box,121 09th St,2.0,Sidewalk: Curb side : Cutout,Private,2/17/06 0:00,7,3x3,37.77599576,-122.4142673,Lophostemon,Lophostemon confertus,Brisbane Box,2006,2006-02-17 00:00:00,18
4177,156905,Planning Code 138.1 required,Pittosporum undulatum :: Victorian Box,3201x 17th St,1.0,Sidewalk: Curb side : Cutout,Private,6/26/17 0:00,3,3x6,37.76332178,-122.4175095,Pittosporum,Pittosporum undulatum,Victorian Box,2017,2017-06-26 00:00:00,7
4186,32205,DPW Maintained,Ginkgo biloba :: Maidenhair Tree,1697 Alabama St,1.0,Sidewalk: Curb side : Cutout,Private,8/22/95 0:00,8,,37.74567254,-122.4103963,Ginkgo,Ginkgo biloba,Maidenhair Tree,1995,1995-08-22 00:00:00,29
4189,51522,DPW Maintained,Cinnamomum camphora :: Camphor Tree,45 Parker Ave,1.0,Sidewalk: Curb side : Cutout,Private,1/13/05 0:00,4,,37.78526403,-122.4547961,Cinnamomum,Cinnamomum camphora,Camphor Tree,2005,2005-01-13 00:00:00,19
4190,1191,DPW Maintained,Tristaniopsis laurina :: Swamp Myrtle,3044 Alemany Blvd,1.0,Sidewalk: Curb side : Cutout,Private,2/18/98 0:00,12,3X3,37.71096874,-122.4538957,Tristaniopsis,Tristaniopsis laurina,Swamp Myrtle,1998,1998-02-18 00:00:00,26
4191,30904,DPW Maintained,Lophostemon confertus :: Brisbane Box,2 Henry Adams St,3.0,Sidewalk: Curb side : Cutout,Private,3/13/95 0:00,19,,37.76917216,-122.4040306,Lophostemon,Lophostemon confertus,Brisbane Box,1995,1995-03-13 00:00:00,29
4192,91744,Permitted Site,Pistacia chinensis :: Chinese Pistache,2770 Harrison St,1.0,Sidewalk: Curb side : Cutout,Private,3/7/07 0:00,6,3x3,37.75310281,-122.4120128,Pistacia,Pistacia chinensis,Chinese Pistache,2007,2007-03-07 00:00:00,17
4194,151357,DPW Maintained,Ginkgo biloba 'Autumn Gold' :: Ginkgo: Autumn Gold,1301 Hampshire St,2.0,Sidewalk: Curb side : Cutout,Mission Verde,4/6/21 0:00,3,4x6,37.75111575,-122.4070476,Ginkgo,Ginkgo biloba,Ginkgo: Autumn Gold,2021,2021-04-06 00:00:00,3
4199,202633,DPW Maintained,Lophostemon confertus :: Brisbane Box,1400 07th St,5.0,Sidewalk: Curb side : Cutout,Private,3/20/18 0:00,3,Width 4ft,37.76673618,-122.3954491,Lophostemon,Lophostemon confertus,Brisbane Box,2018,2018-03-20 00:00:00,6
4222,38854,DPW Maintained,Dodonaea viscosa :: Hop Bush,1466 21st Ave,1.0,Sidewalk: Curb side : Cutout,Private,11/2/98 0:00,3,,37.76036209,-122.4789753,Dodonaea,Dodonaea viscosa,Hop Bush,1998,1998-11-02 00:00:00,26
4223,65899,DPW Maintained,Ligustrum lucidum :: Glossy Privet,166 Palm Ave,1.0,Sidewalk: Curb side : Cutout,Private,5/31/90 0:00,8,,37.78221969,-122.4577004,Ligustrum,Ligustrum lucidum,Glossy Privet,1990,1990-05-31 00:00:00,34
4228,63636,DPW Maintained,Prunus cerasifera :: Cherry Plum,709 Broderick St,1.0,Sidewalk: Curb side : Cutout,Private,5/22/87 0:00,4,,37.77702572,-122.4400118,Prunus,Prunus cerasifera,Cherry Plum,1987,1987-05-22 00:00:00,37
4234,70674,DPW Maintained,Syagrus romanzoffianum :: Queen Palm,33 Rausch St,2.0,Sidewalk: Curb side : Cutout,Private,5/1/15 0:00,3,,37.77668868,-122.4099074,Syagrus,Syagrus romanzoffianum,Queen Palm,2015,2015-05-01 00:00:00,9
4237,23531,DPW Maintained,Ficus microcarpa nitida 'Green Gem' :: Indian Laurel Fig Tree 'Green Gem',2750 Van Ness Ave,6.0,Sidewalk: Curb side : Cutout,DPW,2/2/91 0:00,12,3x14,37.80103575,-122.4242692,Ficus,Ficus microcarpa,Indian Laurel Fig Tree 'Green Gem',1991,1991-02-02 00:00:00,33
4241,256905,Planning Code 138.1 required,Tristaniopsis laurina :: Swamp Myrtle,338 Princeton St,1.0,Sidewalk: Curb side : Cutout,Private,1/3/19 0:00,3,3x3,37.7253622,-122.4151207,Tristaniopsis,Tristaniopsis laurina,Swamp Myrtle,2019,2019-01-03 00:00:00,5
4244,256910,Planning Code 138.1 required,Lophostemon confertus :: Brisbane Box,835 South Van Ness Ave,1.0,Sidewalk: Curb side : Cutout,Private,1/7/19 0:00,3,3x3,37.75982562,-122.416793,Lophostemon,Lophostemon confertus,Brisbane Box,2019,2019-01-07 00:00:00,5
4249,23120,DPW Maintained,Lophostemon confertus :: Brisbane Box,1497 Valencia St,1.0,Sidewalk: Curb side : Cutout,DPW,6/9/95 0:00,20,3x3,37.74903265,-122.4202575,Lophostemon,Lophostemon confertus,Brisbane Box,1995,1995-06-09 00:00:00,29
4251,88552,DPW Maintained,Pyrus kawakamii :: Evergreen Pear,649 15th Ave,,Sidewalk: Curb side : Cutout,Private,7/24/08 0:00,3,3x3,37.77590182,-122.4737096,Pyrus,Pyrus kawakamii,Evergreen Pear,2008,2008-07-24 00:00:00,16
4257,90648,DPW Maintained,Myoporum laetum :: Myoporum,3326 Cabrillo St,1.0,Sidewalk: Curb side : Cutout,DPW,4/7/08 0:00,3,3x3,37.77403698,-122.4942714,Myoporum,Myoporum laetum,Myoporum,2008,2008-04-07 00:00:00,16
4263,5380,DPW Maintained,Magnolia grandiflora :: Southern Magnolia,299 Dolores St,3.0,Sidewalk: Curb side : Cutout,DPW,7/11/15 14:59,3,4X4,37.7650091,-122.4262678,Magnolia,Magnolia grandiflora,Southern Magnolia,2015,2015-07-11 14:59:00,9
4264,41656,DPW Maintained,Magnolia grandiflora :: Southern Magnolia,1330 Polk St,1.0,Sidewalk: Curb side : Cutout,Private,10/13/69 0:00,3,,37.78925051,-122.4203335,Magnolia,Magnolia grandiflora,Southern Magnolia,1969,2069-10-13 00:00:00,-45
4267,225094,DPW Maintained,Ceratonia siliqua :: Carob,621 Waller St,1.0,Sidewalk: Curb side : Cutout,Private,11/9/17 0:00,3,Width 3ft,37.7706348,-122.4339411,Ceratonia,Ceratonia siliqua,Carob,2017,2017-11-09 00:00:00,7
4270,160919,DPW Maintained,Eriobotrya deflexa :: Bronze Loquat,656 Madrid St,1.0,Sidewalk: Curb side : Cutout,Private,10/25/17 11:14,3,Width 0ft,37.71922308,-122.4347036,Eriobotrya,Eriobotrya deflexa,Bronze Loquat,2017,2017-10-25 11:14:00,7
4271,30034,DPW Maintained,Tristaniopsis laurina :: Swamp Myrtle,1718X Alemany Blvd,6.0,Median : Cutout,DPW,3/8/07 0:00,3,3X3,37.72428606,-122.4373132,Tristaniopsis,Tristaniopsis laurina,Swamp Myrtle,2007,2007-03-08 00:00:00,17
4273,183245,DPW Maintained,Metrosideros excelsa :: New Zealand Xmas Tree,2706 Rivera St,4.0,Sidewalk: Curb side : Cutout,Private,7/25/17 0:00,3,3x3,37.7459805,-122.4959937,Metrosideros,Metrosideros excelsa,New Zealand Xmas Tree,2017,2017-07-25 00:00:00,7
4276,95992,DPW Maintained,Prunus serrulata 'Kwanzan' :: Kwanzan Flowering Cherry,858 31st Ave,1.0,Sidewalk: Curb side : Cutout,Private,7/29/11 0:00,2,3x3,37.77302423,-122.4905907,Prunus,Prunus serrulata,Kwanzan Flowering Cherry,2011,2011-07-29 00:00:00,13
4282,84893,Permitted Site,Acer rubrum :: Red Maple,1699X Valencia St,7.0,Sidewalk: Curb side : Cutout,Private,3/27/07 0:00,3,3x3,37.74590571,-122.4197376,Acer,Acer rubrum,Red Maple,2007,2007-03-27 00:00:00,17
4286,37986,DPW Maintained,Maytenus boaria :: Mayten,584 Texas St,1.0,Sidewalk: Curb side : Cutout,Private,7/8/98 0:00,3,,37.75901928,-122.3953234,Maytenus,Maytenus boaria,Mayten,1998,1998-07-08 00:00:00,26
4288,18600,DPW Maintained,Olea europaea :: Olive Tree,500 Randolph St,1.0,Sidewalk: Curb side : Cutout,Private,12/2/92 0:00,6,3X3,37.71435471,-122.4673062,Olea,Olea europaea,Olive Tree,1992,1992-12-02 00:00:00,32
4293,230549,DPW Maintained,Pistacia chinensis :: Chinese Pistache,39 Crescent Ave,1.0,Sidewalk: Curb side : Cutout,Private,11/25/20 0:00,3,Width 3ft,37.73536808,-122.4239055,Pistacia,Pistacia chinensis,Chinese Pistache,2020,2020-11-25 00:00:00,4
4309,24910,DPW Maintained,Acer x freemanii :: Freeman Maple,2950 San Bruno Ave,1.0,Sidewalk: Curb side : Cutout,Private,10/2/96 0:00,3,3X3,37.7245649,-122.4024199,Acer,Acer x,Freeman Maple,1996,1996-10-02 00:00:00,28
4311,25793,Permitted Site,Phoenix canariensis :: Canary Island Date Palm,800X The Embarcadero,7.0,Median : Cutout,Port,8/30/96 0:00,36,10,37.80219354,-122.40036,Phoenix,Phoenix canariensis,Canary Island Date Palm,1996,1996-08-30 00:00:00,28
4315,34193,DPW Maintained,Syagrus romanzoffianum :: Queen Palm,353 Mississippi St,1.0,Sidewalk: Curb side : Cutout,Private,6/10/97 0:00,11,,37.76166879,-122.3944055,Syagrus,Syagrus romanzoffianum,Queen Palm,1997,1997-06-10 00:00:00,27
4316,258410,Undocumented,Lophostemon confertus :: Brisbane Box,1711 Powell St,1.0,Sidewalk: Curb side : Cutout,Private,1/11/21 7:13,3,3x3,37.80041175,-122.4110071,Lophostemon,Lophostemon confertus,Brisbane Box,2021,2021-01-11 07:13:00,3
4324,70331,DPW Maintained,Magnolia grandiflora 'Little Gem' :: Little Gem Magnolia,73 Danton St,1.0,Sidewalk: Curb side : Cutout,Private,12/28/10 0:00,6,3x3,37.73127655,-122.4323786,Magnolia,Magnolia grandiflora,Little Gem Magnolia,2010,2010-12-28 00:00:00,14
4330,32218,DPW Maintained,Eucalyptus polyanthemos :: Silver Dollar Eucalyptus,531 Precita Ave,1.0,Sidewalk: Curb side : Cutout,Private,8/22/95 0:00,12,,37.74749434,-122.4098699,Eucalyptus,Eucalyptus polyanthemos,Silver Dollar Eucalyptus,1995,1995-08-22 00:00:00,29
4331,22064,DPW Maintained,Eucalyptus polyanthemos :: Silver Dollar Eucalyptus,2955 03rd St,2.0,Sidewalk: Curb side : Cutout,DPW,3/1/00 0:00,3,3X3,37.75186575,-122.3875129,Eucalyptus,Eucalyptus polyanthemos,Silver Dollar Eucalyptus,2000,2000-03-01 00:00:00,24
4332,25824,Permitted Site,Platanus x hispanica :: Sycamore: London Plane,1300X The Embarcadero,20.0,Sidewalk: Curb side : Cutout,Port,10/30/95 0:00,6,4X4,37.80608845,-122.4043754,Platanus,Platanus x,Sycamore: London Plane,1995,1995-10-30 00:00:00,29
4334,66585,DPW Maintained,Tristaniopsis laurina :: Swamp Myrtle,131 Paris St,1.0,Sidewalk: Curb side : Cutout,Private,4/15/91 0:00,7,,37.72654828,-122.4311697,Tristaniopsis,Tristaniopsis laurina,Swamp Myrtle,1991,1991-04-15 00:00:00,33
4340,254950,DPW Maintained,Tristaniopsis laurina :: Swamp Myrtle,2799X San Jose Ave,2.0,Sidewalk: Curb side : Cutout,Private,10/5/18 14:34,3,3x3,37.71318875,-122.4533774,Tristaniopsis,Tristaniopsis laurina,Swamp Myrtle,2018,2018-10-05 14:34:00,6
4342,27025,Permitted Site,Lagunaria patersonii :: Primrose Tree,1380X Silver Ave,2.0,Sidewalk: Curb side : Cutout,Private,1/29/09 0:00,12,3X3,37.73131819,-122.4090327,Lagunaria,Lagunaria patersonii,Primrose Tree,2009,2009-01-29 00:00:00,15
4343,21870,DPW Maintained,Washingtonia robusta :: Mexican Fan Palm,1900 03rd St,12.0,Sidewalk: Curb side : Cutout,DPW,1/25/95 0:00,3,3X3,37.76562276,-122.3891199,Washingtonia,Washingtonia robusta,Mexican Fan Palm,1995,1995-01-25 00:00:00,29
4345,109139,DPW Maintained,Syagrus romanzoffianum :: Queen Palm,741 34th Ave,1.0,Sidewalk: Curb side : Cutout,Private,1/29/15 0:00,3,3x3,37.77501223,-122.4941202,Syagrus,Syagrus romanzoffianum,Queen Palm,2015,2015-01-29 00:00:00,9
4347,40202,DPW Maintained,Melaleuca nesophila :: Pink Melaleuca,409 42nd Ave,1.0,Sidewalk: Curb side : Cutout,Private,4/30/99 0:00,7,,37.7808895,-122.503157,Melaleuca,Melaleuca nesophila,Pink Melaleuca,1999,1999-04-30 00:00:00,25
4348,86387,DPW Maintained,Prunus serrulata 'Kwanzan' :: Kwanzan Flowering Cherry,1515 26th Ave,2.0,Sidewalk: Curb side : Cutout,DPW,12/20/06 0:00,3,3x3,37.75919181,-122.4844128,Prunus,Prunus serrulata,Kwanzan Flowering Cherry,2006,2006-12-20 00:00:00,18
4351,147741,DPW Maintained,Melaleuca quinquenervia :: Cajeput,159 08th Ave,1.0,Sidewalk: Curb side : Cutout,Private,2/4/21 0:00,3,Width 4ft,37.78546398,-122.4668351,Melaleuca,Melaleuca quinquenervia,Cajeput,2021,2021-02-04 00:00:00,3
4354,90938,DPW Maintained,Dracaena draco :: Dragon Tree,4100X Balboa St,3.0,Sidewalk: Curb side : Cutout,DPW,11/11/08 0:00,3,3x3,37.77553511,-122.5029697,Dracaena,Dracaena draco,Dragon Tree,2008,2008-11-11 00:00:00,16
4356,4064,DPW Maintained,Platanus x hispanica :: Sycamore: London Plane,3068 Cesar Chavez St,1.0,Sidewalk: Curb side : Cutout,DPW,4/1/95 0:00,3,3X3,37.74843089,-122.410865,Platanus,Platanus x,Sycamore: London Plane,1995,1995-04-01 00:00:00,29
4358,6634,DPW Maintained,Ginkgo biloba :: Maidenhair Tree,1495 Evans Ave,2.0,Sidewalk: Curb side : Cutout,DPW,1/2/16 8:44,3,3X3,37.74140402,-122.3858744,Ginkgo,Ginkgo biloba,Maidenhair Tree,2016,2016-01-02 08:44:00,8
4362,5949,DPW Maintained,Pittosporum undulatum :: Victorian Box,1445 Eddy St,2.0,Sidewalk: Curb side : Cutout,Private,3/28/90 0:00,9,3x3,37.78148223,-122.4313979,Pittosporum,Pittosporum undulatum,Victorian Box,1990,1990-03-28 00:00:00,34
4363,107473,DPW Maintained,Lyonothamnus floribundus subsp. asplenifolius :: Santa Cruz Ironwood,1500 Page St,4.0,Sidewalk: Curb side : Cutout,Private,9/15/14 0:00,3,3x3,37.77120683,-122.4458915,Lyonothamnus,Lyonothamnus floribundus,Santa Cruz Ironwood,2014,2014-09-15 00:00:00,10
4366,37187,Permitted Site,Magnolia grandiflora :: Southern Magnolia,140 07th St,6.0,Sidewalk: Curb side : Cutout,Private,6/8/98 0:00,2,,37.77862185,-122.4103233,Magnolia,Magnolia grandiflora,Southern Magnolia,1998,1998-06-08 00:00:00,26
4367,1247,DPW Maintained,Acer buergeranum :: Trident Maple,3725 Alemany Blvd,1.0,Sidewalk: Curb side : Cutout,Private,4/22/08 0:00,3,3X3,37.71163616,-122.4657557,Acer,Acer buergeranum,Trident Maple,2008,2008-04-22 00:00:00,16
4370,22072,DPW Maintained,Lophostemon confertus :: Brisbane Box,3095 03rd St,1.0,Sidewalk: Curb side : Cutout,DPW,2/5/15 15:15,3,3X3,37.75049336,-122.38745,Lophostemon,Lophostemon confertus,Brisbane Box,2015,2015-02-05 15:15:00,9
4377,89617,DPW Maintained,Arbutus 'Marina' :: Hybrid Strawberry Tree,3849X Anza St,2.0,Sidewalk: Curb side : Cutout,DPW,3/21/08 0:00,3,3x3,37.7778634,-122.4896981,Arbutus,Arbutus 'Marina',Hybrid Strawberry Tree,2008,2008-03-21 00:00:00,16
4381,39854,DPW Maintained,Olea europaea :: Olive Tree,417-419 10th Ave,1.0,Sidewalk: Curb side : Cutout,Private,11/17/14 0:00,3,,37.78036442,-122.4686076,Olea,Olea europaea,Olive Tree,2014,2014-11-17 00:00:00,10
4382,99945,DPW Maintained,Lophostemon confertus :: Brisbane Box,499X FOLSOM ST,1.0,Sidewalk: Curb side : Cutout,Private,1/27/15 0:00,3,3x3,37.78702539,-122.3936853,Lophostemon,Lophostemon confertus,Brisbane Box,2015,2015-01-27 00:00:00,9
4391,253476,Planning Code 138.1 required,Acer rubrum 'Armstrong' :: Armstrong Red Maple,1222 Harrison St,2.0,Sidewalk: Curb side : Cutout,Private,9/12/17 0:00,3,3x6,37.77354286,-122.40889,Acer,Acer rubrum,Armstrong Red Maple,2017,2017-09-12 00:00:00,7
4395,68219,DPW Maintained,Prunus serrulata 'Kwanzan' :: Kwanzan Flowering Cherry,263 16th Ave,1.0,Sidewalk: Curb side : Cutout,Private,9/27/93 0:00,4,,37.78315187,-122.4753663,Prunus,Prunus serrulata,Kwanzan Flowering Cherry,1993,1993-09-27 00:00:00,31
4399,35780,Permitted Site,Lophostemon confertus :: Brisbane Box,3590X 17th St,3.0,Sidewalk: Curb side : Cutout,Private,12/21/98 0:00,10,3x3,37.76308987,-122.426091,Lophostemon,Lophostemon confertus,Brisbane Box,1998,1998-12-21 00:00:00,26
4400,5237,Permitted Site,Pittosporum undulatum :: Victorian Box,1100 Divisadero St,5.0,Sidewalk: Curb side : Cutout,Private,12/6/07 0:00,3,3X3,37.78006462,-122.4386387,Pittosporum,Pittosporum undulatum,Victorian Box,2007,2007-12-06 00:00:00,17
4406,157711,Section 806 (d),Magnolia grandiflora 'Little Gem' :: Little Gem Magnolia,916 Alvarado St,1.0,Sidewalk: Property side : Cutout,Private,8/23/21 0:00,3,3x3,37.75331549,-122.4416021,Magnolia,Magnolia grandiflora,Little Gem Magnolia,2021,2021-08-23 00:00:00,3
4411,66814,DPW Maintained,Maytenus boaria :: Mayten,282 20th Ave,1.0,Sidewalk: Curb side : Cutout,Private,11/4/91 0:00,8,,37.7826768,-122.4794824,Maytenus,Maytenus boaria,Mayten,1991,1991-11-04 00:00:00,33
4413,66844,DPW Maintained,Prunus cerasifera :: Cherry Plum,234 Ewing Ter,1.0,Sidewalk: Curb side : Cutout,Private,11/15/91 0:00,4,,37.78009949,-122.4490142,Prunus,Prunus cerasifera,Cherry Plum,1991,1991-11-15 00:00:00,33
4419,86450,DPW Maintained,Prunus serrulata :: Ornamental Cherry,2362 27th Ave,1.0,Sidewalk: Curb side : Cutout,DPW,12/29/06 0:00,3,3x3,37.74335086,-122.4842237,Prunus,Prunus serrulata,Ornamental Cherry,2006,2006-12-29 00:00:00,18
4421,5860,DPW Maintained,Platanus x hispanica :: Sycamore: London Plane,951 Eddy St,1.0,Sidewalk: Curb side : Cutout,DPW,9/16/93 0:00,12,4X4,37.78247732,-122.4235013,Platanus,Platanus x,Sycamore: London Plane,1993,1993-09-16 00:00:00,31
4422,40196,DPW Maintained,Agonis flexuosa :: Peppermint Willow,562 40th Ave,1.0,Sidewalk: Curb side : Cutout,Private,4/30/99 0:00,26,,37.77814231,-122.5006319,Agonis,Agonis flexuosa,Peppermint Willow,1999,1999-04-30 00:00:00,25
4423,1251,DPW Maintained,Acer buergeranum :: Trident Maple,3802X Alemany Blvd,1.0,Sidewalk: Curb side : Cutout,DPW,4/22/08 0:00,3,3X5,37.71181021,-122.4662563,Acer,Acer buergeranum,Trident Maple,2008,2008-04-22 00:00:00,16
4424,259747,DPW Maintained,Laurus nobilis :: Sweet Bay: Grecian Laurel,1674 Kirkwood Ave,1.0,Sidewalk: Curb side : Cutout,DPW,10/13/18 0:00,3,,37.73899637,-122.3913034,Laurus,Laurus nobilis,Sweet Bay: Grecian Laurel,2018,2018-10-13 00:00:00,6
4425,201607,DPW Maintained,Ginkgo biloba :: Maidenhair Tree,598 Innes Ave,2.0,Sidewalk: Curb side : Yard,Private,7/12/17 0:00,1,Width 3ft,37.72873964,-122.3698675,Ginkgo,Ginkgo biloba,Maidenhair Tree,2017,2017-07-12 00:00:00,7
4431,95446,DPW Maintained,Crataegus phaenopyrum :: Washington Hawthorn,2205 34th Ave,1.0,Sidewalk: Curb side : Cutout,Private,9/26/20 0:00,3,4x6,37.7458387,-122.4920938,Crataegus,Crataegus phaenopyrum,Washington Hawthorn,2020,2020-09-26 00:00:00,4
4433,288,DPW Maintained,Platanus x hispanica :: Sycamore: London Plane,3355 19th Ave,4.0,Sidewalk: Curb side : Cutout,DPW,11/15/95 0:00,18,2,37.72857632,-122.4750225,Platanus,Platanus x,Sycamore: London Plane,1995,1995-11-15 00:00:00,29
4434,60883,DPW Maintained,Maytenus boaria :: Mayten,770 Filbert St,1.0,Sidewalk: Curb side : Cutout,Private,5/12/83 0:00,12,,37.80104709,-122.4124546,Maytenus,Maytenus boaria,Mayten,1983,1983-05-12 00:00:00,41
4443,10139,DPW Maintained,Jacaranda mimosifolia :: Jacaranda,905 Guerrero St,1.0,Sidewalk: Curb side : Cutout,DPW,12/22/14 0:00,1,2X2,37.75666032,-122.4232042,Jacaranda,Jacaranda mimosifolia,Jacaranda,2014,2014-12-22 00:00:00,10
4448,38224,DPW Maintained,Eucalyptus sideroxylon :: Red Ironbark,1099 Mississippi St,1.0,Sidewalk: Curb side : Cutout,Private,7/21/98 0:00,14,,37.75261567,-122.3935431,Eucalyptus,Eucalyptus sideroxylon,Red Ironbark,1998,1998-07-21 00:00:00,26
4451,49345,DPW Maintained,Olea europaea :: Olive Tree,146 23rd Ave,1.0,Sidewalk: Curb side : Cutout,Private,3/4/03 0:00,4,,37.78496151,-122.4828586,Olea,Olea europaea,Olive Tree,2003,2003-03-04 00:00:00,21
4453,27756,DPW Maintained,Lophostemon confertus :: Brisbane Box,1299 Cesar Chavez St,9.0,Sidewalk: Curb side : Cutout,DPW,3/23/06 0:00,3,3X3,37.75005051,-122.3904013,Lophostemon,Lophostemon confertus,Brisbane Box,2006,2006-03-23 00:00:00,18
4455,38590,DPW Maintained,Crataegus laevigata :: English Hawthorn,1614 Quesada Ave,1.0,Sidewalk: Curb side : Cutout,Private,9/17/98 0:00,2,,37.73256032,-122.389906,Crataegus,Crataegus laevigata,English Hawthorn,1998,1998-09-17 00:00:00,26
4456,29785,DPW Maintained,Quercus suber :: Cork Oak,2000x Van Ness Ave,1.0,Median : Cutout,DPW,3/12/06 0:00,4,5x5,37.79392293,-122.4229563,Quercus,Quercus suber,Cork Oak,2006,2006-03-12 00:00:00,18
4457,86144,DPW Maintained,Arbutus 'Marina' :: Hybrid Strawberry Tree,1382 24th Ave,1.0,Sidewalk: Curb side : Cutout,DPW,1/22/07 0:00,3,3x3,37.76180274,-122.4823031,Arbutus,Arbutus 'Marina',Hybrid Strawberry Tree,2007,2007-01-22 00:00:00,17
4460,35358,DPW Maintained,Melaleuca quinquenervia :: Cajeput,861 Rhode Island St,1.0,Sidewalk: Curb side : Cutout,Private,6/14/17 0:00,3,,37.75890045,-122.4019141,Melaleuca,Melaleuca quinquenervia,Cajeput,2017,2017-06-14 00:00:00,7
4463,88460,DPW Maintained,Acacia melanoxylon :: Blackwood Acacia,2665 Baker St,3.0,Sidewalk: Curb side : Cutout,Private,7/16/08 0:00,22,3x3,37.79562282,-122.4454427,Acacia,Acacia melanoxylon,Blackwood Acacia,2008,2008-07-16 00:00:00,16
4468,2709,DPW Maintained,Platanus x hispanica :: Sycamore: London Plane,2142 Bush St,1.0,Sidewalk: Curb side : Cutout,DPW,5/17/94 0:00,18,3x3,37.78720048,-122.432628,Platanus,Platanus x,Sycamore: London Plane,1994,1994-05-17 00:00:00,30
4471,253544,DPW Maintained,Magnolia grandiflora 'Little Gem' :: Little Gem Magnolia,1000 Cayuga Ave,12.0,Back Yard : Yard,DPW,10/3/17 14:38,3,3x3,37.72207681,-122.4398369,Magnolia,Magnolia grandiflora,Little Gem Magnolia,2017,2017-10-03 14:38:00,7
4479,29847,DPW Maintained,Magnolia grandiflora :: Southern Magnolia,1800X Evans Ave,1.0,Sidewalk: Curb side : Cutout,DPW,9/11/06 0:00,3,4x4,37.74526656,-122.3922831,Magnolia,Magnolia grandiflora,Southern Magnolia,2006,2006-09-11 00:00:00,18
4482,94525,DPW Maintained,Platanus x hispanica :: Sycamore: London Plane,1545 Divisadero St,1.0,Sidewalk: Curb side : Cutout,Private,9/1/10 0:00,3,,37.78413959,-122.4397647,Platanus,Platanus x,Sycamore: London Plane,2010,2010-09-01 00:00:00,14
4483,94915,Undocumented,Acacia melanoxylon :: Blackwood Acacia,1922 09th Ave,1.0,Sidewalk: Curb side : Cutout,Private,10/5/10 0:00,16,,37.75237788,-122.4653417,Acacia,Acacia melanoxylon,Blackwood Acacia,2010,2010-10-05 00:00:00,14
4486,159210,DPW Maintained,Melaleuca linariifolia :: Flaxleaf Paperbark,221 Foote Ave,1.0,Sidewalk: Curb side : Cutout,Private,9/21/20 12:02,3,Width 0ft,37.7144322,-122.4470941,Melaleuca,Melaleuca linariifolia,Flaxleaf Paperbark,2020,2020-09-21 12:02:00,4
4492,52629,DPW Maintained,Tristaniopsis laurina :: Swamp Myrtle,77 Otsego Ave,1.0,Sidewalk: Curb side : Cutout,Private,3/1/06 0:00,5,,37.72621986,-122.4393727,Tristaniopsis,Tristaniopsis laurina,Swamp Myrtle,2006,2006-03-01 00:00:00,18
4498,261017,Planning Code 138.1 required,Ginkgo biloba :: Maidenhair Tree,79 Cragmont Ave,1.0,Sidewalk: Curb side : Cutout,Private,11/15/19 0:00,3,3x3,37.74956489,-122.4675215,Ginkgo,Ginkgo biloba,Maidenhair Tree,2019,2019-11-15 00:00:00,5
4500,39992,DPW Maintained,Arbutus 'Marina' :: Hybrid Strawberry Tree,744 Innes Ave,1.0,Sidewalk: Curb side : Cutout,Private,1/27/99 0:00,10,,37.73027835,-122.3725296,Arbutus,Arbutus 'Marina',Hybrid Strawberry Tree,1999,1999-01-27 00:00:00,25
4507,91898,DPW Maintained,Prunus serrulata 'Kwanzan' :: Kwanzan Flowering Cherry,1428 Irving St,1.0,Sidewalk: Curb side : Cutout,DPW,12/15/08 0:00,3,3x3,37.76379241,-122.4731289,Prunus,Prunus serrulata,Kwanzan Flowering Cherry,2008,2008-12-15 00:00:00,16
4508,72209,DPW Maintained,Metrosideros excelsa :: New Zealand Xmas Tree,315 Green St,1.0,Sidewalk: Curb side : Cutout,Private,10/16/19 0:00,3,,37.79999076,-122.4045987,Metrosideros,Metrosideros excelsa,New Zealand Xmas Tree,2019,2019-10-16 00:00:00,5
4513,115009,DPW Maintained,Magnolia champaca :: Champa,118 Hamilton St,1.0,Sidewalk: Curb side : Cutout,Private,1/4/16 0:00,2,,37.72941165,-122.4109895,Magnolia,Magnolia champaca,Champa,2016,2016-01-04 00:00:00,8
4520,85534,DPW Maintained,Eriobotrya deflexa :: Bronze Loquat,110 12th St,2.0,Sidewalk: Curb side : Cutout,Private,5/29/07 0:00,6,,37.77209537,-122.4179782,Eriobotrya,Eriobotrya deflexa,Bronze Loquat,2007,2007-05-29 00:00:00,17
4524,49872,DPW Maintained,Ulmus parvifolia :: Chinese Elm,1918 Webster St,1.0,Sidewalk: Curb side : Cutout,Private,10/12/07 0:00,6,3x3,37.7885694,-122.4319953,Ulmus,Ulmus parvifolia,Chinese Elm,2007,2007-10-12 00:00:00,17
4526,93347,DPW Maintained,Fraxinus americana 'Autumn Purple' :: American Autumn Purple Ash,2100X Turk Blvd,30.0,Sidewalk: Curb side : Cutout,DPW,11/21/08 0:00,3,3x3,37.77931477,-122.4437504,Fraxinus,Fraxinus americana,American Autumn Purple Ash,2008,2008-11-21 00:00:00,16
4535,57899,DPW Maintained,Ficus microcarpa nitida 'Green Gem' :: Indian Laurel Fig Tree 'Green Gem',1908 Green St,1.0,Sidewalk: Curb side : Cutout,Private,6/9/77 0:00,19,,37.79678887,-122.4308423,Ficus,Ficus microcarpa,Indian Laurel Fig Tree 'Green Gem',1977,1977-06-09 00:00:00,47
4536,23154,DPW Maintained,Lophostemon confertus :: Brisbane Box,41 Van Ness Ave,2.0,Sidewalk: Curb side : Cutout,DPW,7/3/90 0:00,6,3X3,37.77610099,-122.4196838,Lophostemon,Lophostemon confertus,Brisbane Box,1990,1990-07-03 00:00:00,34
4538,39580,DPW Maintained,Ginkgo biloba :: Maidenhair Tree,450 Rhode Island St,4.0,Sidewalk: Curb side : Cutout,Private,2/6/09 0:00,4,3x3,37.76438985,-122.402633,Ginkgo,Ginkgo biloba,Maidenhair Tree,2009,2009-02-06 00:00:00,15
4545,27335,DPW Maintained,Hymenosporum flavum :: Sweet Shade,398 Haight St,1.0,Sidewalk: Curb side : Cutout,DPW,10/29/05 0:00,12,3X3,37.77245082,-122.4286019,Hymenosporum,Hymenosporum flavum,Sweet Shade,2005,2005-10-29 00:00:00,19
4554,27998,Permitted Site,Phoenix canariensis :: Canary Island Date Palm,300 The Embarcadero,2.0,Median : Cutout,Port,2/5/01 0:00,24,4X4,37.79765286,-122.3959858,Phoenix,Phoenix canariensis,Canary Island Date Palm,2001,2001-02-05 00:00:00,23
4560,58303,Permitted Site,Prunus serrulata 'Kwanzan' :: Kwanzan Flowering Cherry,150 Delmar St,1.0,Sidewalk: Curb side : Cutout,Private,10/6/16 0:00,3,,37.76627832,-122.4452407,Prunus,Prunus serrulata,Kwanzan Flowering Cherry,2016,2016-10-06 00:00:00,8
4578,108995,DPW Maintained,Laurus nobilis :: Sweet Bay: Grecian Laurel,55 06th Ave,1.0,Sidewalk: Curb side : Cutout,Private,1/20/15 0:00,3,3x3,37.78759202,-122.4648386,Laurus,Laurus nobilis,Sweet Bay: Grecian Laurel,2015,2015-01-20 00:00:00,9
4579,65927,DPW Maintained,Prunus cerasifera :: Cherry Plum,47 Palm Ave,1.0,Sidewalk: Curb side : Cutout,Private,6/4/90 0:00,18,,37.78490807,-122.4580753,Prunus,Prunus cerasifera,Cherry Plum,1990,1990-06-04 00:00:00,34
4585,94625,Permitted Site,Alnus rhombifolia :: White Alder,1740 Bancroft Ave,2.0,Sidewalk: Property side : Cutout,Private,10/13/10 0:00,9,,37.72702022,-122.3936193,Alnus,Alnus rhombifolia,White Alder,2010,2010-10-13 00:00:00,14
4595,41532,Permitted Site,Lophostemon confertus :: Brisbane Box,75 Townsend St,6.0,Sidewalk: Curb side : Cutout,Private,4/20/00 0:00,6,3x3,37.78097417,-122.3899074,Lophostemon,Lophostemon confertus,Brisbane Box,2000,2000-04-20 00:00:00,24
4599,88475,DPW Maintained,Lagunaria patersonii :: Primrose Tree,2350 Jerrold Ave,2.0,Sidewalk: Curb side : Cutout,Private,7/18/08 0:00,3,3x3,37.74621912,-122.4022989,Lagunaria,Lagunaria patersonii,Primrose Tree,2008,2008-07-18 00:00:00,16
4602,117290,DPW Maintained,Melaleuca quinquenervia :: Cajeput,2559 25th Ave,1.0,Sidewalk: Curb side : Cutout,Private,3/20/18 0:00,3,3x3,37.73980234,-122.4820509,Melaleuca,Melaleuca quinquenervia,Cajeput,2018,2018-03-20 00:00:00,6
4603,86021,DPW Maintained,Arbutus 'Marina' :: Hybrid Strawberry Tree,1514 28th Ave,1.0,Sidewalk: Curb side : Cutout,DPW,1/4/07 0:00,3,3x3,37.75908895,-122.4864163,Arbutus,Arbutus 'Marina',Hybrid Strawberry Tree,2007,2007-01-04 00:00:00,17
4611,22291,DPW Maintained,Pyrus calleryana :: Ornamental Pear,4900 03rd St,1.0,Sidewalk: Curb side : Cutout,DPW,12/13/99 0:00,3,3x3,37.7339379,-122.3911471,Pyrus,Pyrus calleryana,Ornamental Pear,1999,1999-12-13 00:00:00,25
4614,90778,DPW Maintained,Agonis flexuosa :: Peppermint Willow,3801X Cabrillo St,3.0,Sidewalk: Curb side : Cutout,DPW,4/14/08 0:00,3,3x3,37.77366254,-122.4996056,Agonis,Agonis flexuosa,Peppermint Willow,2008,2008-04-14 00:00:00,16
4621,32101,DPW Maintained,Magnolia grandiflora :: Southern Magnolia,156 Hartford St,2.0,Sidewalk: Curb side : Cutout,Private,8/9/95 0:00,4,,37.76004137,-122.4338782,Magnolia,Magnolia grandiflora,Southern Magnolia,1995,1995-08-09 00:00:00,29
4636,37780,DPW Maintained,Platanus x hispanica :: Sycamore: London Plane,666 Felton St,1.0,Sidewalk: Curb side : Cutout,Private,7/6/98 0:00,11,,37.72833993,-122.4113417,Platanus,Platanus x,Sycamore: London Plane,1998,1998-07-06 00:00:00,26
4639,85766,DPW Maintained,Ulmus parvifolia :: Chinese Elm,1400X Folsom St,1.0,Sidewalk: Curb side : Cutout,DPW,1/11/12 0:00,3,3x3,37.77273761,-122.4130898,Ulmus,Ulmus parvifolia,Chinese Elm,2012,2012-01-11 00:00:00,12
4641,16311,DPW Maintained,Chamaerops humilis :: Mediterranean Fan Palm,700X Monterey Blvd,3.0,Median : Cutout,DPW,2/2/03 0:00,3,5,37.73153217,-122.4515203,Chamaerops,Chamaerops humilis,Mediterranean Fan Palm,2003,2003-02-02 00:00:00,21
4649,38064,DPW Maintained,Ceanothus Sps :: California lilac,1916 Lyon St,1.0,Sidewalk: Curb side : Cutout,Private,7/10/98 0:00,3,,37.78903424,-122.4456474,Ceanothus,Ceanothus Sps,California lilac,1998,1998-07-10 00:00:00,26
4652,9587,Permitted Site,Pittosporum undulatum :: Victorian Box,1311 Golden Gate Ave,1.0,Sidewalk: Curb side : Cutout,Private,3/23/93 0:00,10,3X3,37.77944576,-122.4322113,Pittosporum,Pittosporum undulatum,Victorian Box,1993,1993-03-23 00:00:00,31
4654,44490,DPW Maintained,Prunus serrulata 'Kwanzan' :: Kwanzan Flowering Cherry,49 Madison St,1.0,Sidewalk: Curb side : Cutout,Private,3/26/01 0:00,8,,37.72810844,-122.4233873,Prunus,Prunus serrulata,Kwanzan Flowering Cherry,2001,2001-03-26 00:00:00,23
4656,176523,Permitted Site,Ginkgo biloba :: Maidenhair Tree,852 Paris St,1.0,Sidewalk: Curb side : Cutout,Private,7/12/05 0:00,4,Width 2ft,37.71609705,-122.4392282,Ginkgo,Ginkgo biloba,Maidenhair Tree,2005,2005-07-12 00:00:00,19
4663,167009,DPW Maintained,Olea europaea :: Olive Tree,3865 18th St,1.0,Sidewalk: Curb side : Cutout,Private,5/23/17 0:00,3,3x3,37.761132,-122.4297662,Olea,Olea europaea,Olive Tree,2017,2017-05-23 00:00:00,7
4672,14177,DPW Maintained,Platanus x hispanica :: Sycamore: London Plane,1800 Market St,1.0,Sidewalk: Curb side : Cutout,Private,7/15/09 0:00,12,3x3,37.77169415,-122.42385,Platanus,Platanus x,Sycamore: London Plane,2009,2009-07-15 00:00:00,15
4676,52734,DPW Maintained,Magnolia grandiflora :: Southern Magnolia,475@ STILLMAN 04th St,2.0,Sidewalk: Curb side : Cutout,Private,4/26/06 0:00,1,,37.77999622,-122.3984358,Magnolia,Magnolia grandiflora,Southern Magnolia,2006,2006-04-26 00:00:00,18
4682,69362,DPW Maintained,Callistemon citrinus :: Lemon Bottlebrush,3521 Webster St,1.0,Sidewalk: Curb side : Cutout,Private,4/18/94 0:00,7,,37.80319752,-122.4351216,Callistemon,Callistemon citrinus,Lemon Bottlebrush,1994,1994-04-18 00:00:00,30
4695,58148,DPW Maintained,Ficus microcarpa nitida 'Green Gem' :: Indian Laurel Fig Tree 'Green Gem',1720 Pacific Ave,1.0,Sidewalk: Curb side : Cutout,Private,3/17/78 0:00,9,,37.79480786,-122.4237735,Ficus,Ficus microcarpa,Indian Laurel Fig Tree 'Green Gem',1978,1978-03-17 00:00:00,46
4698,64910,Permitted Site,Tristaniopsis laurina :: Swamp Myrtle,611 San Jose Ave,1.0,Sidewalk: Curb side : Cutout,Private,3/24/89 0:00,10,3x3,37.7461842,-122.4216958,Tristaniopsis,Tristaniopsis laurina,Swamp Myrtle,1989,1989-03-24 00:00:00,35
4701,27768,Permitted Site,Platanus x hispanica :: Sycamore: London Plane,199X The Embarcadero,1.0,Sidewalk: Curb side : Cutout,Rec/Park,12/10/00 0:00,6,,37.79658901,-122.3955269,Platanus,Platanus x,Sycamore: London Plane,2000,2000-12-10 00:00:00,24
4711,6223,DPW Maintained,Tristania conferta ::,1220 Ellis St,1.0,Sidewalk: Curb side : Cutout,DPW,5/13/97 0:00,12,3X4,37.78325405,-122.4259646,Tristania,Tristania conferta,,1997,1997-05-13 00:00:00,27
4715,85889,DPW Maintained,Tristaniopsis laurina :: Swamp Myrtle,2518 26th Ave,1.0,Sidewalk: Curb side : Cutout,DPW,12/20/06 0:00,3,3x3,37.74042212,-122.482953,Tristaniopsis,Tristaniopsis laurina,Swamp Myrtle,2006,2006-12-20 00:00:00,18
4716,183738,DPW Maintained,Metrosideros excelsa :: New Zealand Xmas Tree,2271 35th Ave,1.0,Sidewalk: Curb side : Yard,Private,9/26/20 0:00,3,4x6,37.7447213,-122.4930795,Metrosideros,Metrosideros excelsa,New Zealand Xmas Tree,2020,2020-09-26 00:00:00,4
4721,117020,Planning Code 138.1 required,Metrosideros excelsa :: New Zealand Xmas Tree,168 Hyde St,4.0,Sidewalk: Curb side : Cutout,Private,5/17/16 0:00,3,3x3,37.78240492,-122.4155752,Metrosideros,Metrosideros excelsa,New Zealand Xmas Tree,2016,2016-05-17 00:00:00,8
4722,43892,DPW Maintained,Callistemon viminalis :: Weeping Bottlebrush,1233 Howard St,2.0,Sidewalk: Curb side : Cutout,Private,8/3/00 0:00,6,,37.77574058,-122.4120535,Callistemon,Callistemon viminalis,Weeping Bottlebrush,2000,2000-08-03 00:00:00,24
4724,107665,Permitted Site,Arbutus 'Marina' :: Hybrid Strawberry Tree,1901 Pacific Ave,2.0,Sidewalk: Curb side : Cutout,Private,10/8/14 0:00,3,,37.79424768,-122.4266991,Arbutus,Arbutus 'Marina',Hybrid Strawberry Tree,2014,2014-10-08 00:00:00,10
4725,15720,Permitted Site,Tristaniopsis laurina :: Swamp Myrtle,4357X Mission St,12.0,Sidewalk: Curb side : Cutout,Private,5/3/95 0:00,6,3x3,37.72759546,-122.4323786,Tristaniopsis,Tristaniopsis laurina,Swamp Myrtle,1995,1995-05-03 00:00:00,29
4727,246906,DPW Maintained,Melaleuca quinquenervia :: Cajeput,491 Frederick St,4.0,Sidewalk: Curb side : Cutout,Private,11/23/10 0:00,3,Width 5ft,37.76637792,-122.4524278,Melaleuca,Melaleuca quinquenervia,Cajeput,2010,2010-11-23 00:00:00,14
4730,17888,DPW Maintained,Lagerstroemia indica 'Tuscarora' :: Tuscarora Crape Myrtle,2225 Pine St,2.0,Sidewalk: Curb side : Cutout,DPW,5/23/16 0:00,2,3x3,37.78803227,-122.4324599,Lagerstroemia,Lagerstroemia indica,Tuscarora Crape Myrtle,2016,2016-05-23 00:00:00,8
4732,82813,DPW Maintained,Tristaniopsis laurina :: Swamp Myrtle,2143 45th Ave,1.0,Sidewalk: Curb side : Cutout,Private,6/9/08 0:00,3,3x3,37.74660524,-122.5039615,Tristaniopsis,Tristaniopsis laurina,Swamp Myrtle,2008,2008-06-09 00:00:00,16
4744,91621,DPW Maintained,Pyrus calleryana 'Aristocrat' :: Aristocrat Callery Pear,1358 South Van Ness Ave,,Sidewalk: Curb side : Cutout,DPW,3/1/07 0:00,3,3x3,37.75142937,-122.4162419,Pyrus,Pyrus calleryana,Aristocrat Callery Pear,2007,2007-03-01 00:00:00,17
4746,25179,DPW Maintained,Laurus nobilis :: Sweet Bay: Grecian Laurel,3226 Market St,1.0,Sidewalk: Curb side : Cutout,DPW,4/18/96 0:00,6,3X3,37.75921743,-122.4450704,Laurus,Laurus nobilis,Sweet Bay: Grecian Laurel,1996,1996-04-18 00:00:00,28
4755,46161,DPW Maintained,Tristaniopsis laurina :: Swamp Myrtle,1596 Howard St,2.0,Sidewalk: Curb side : Cutout,Private,4/8/11 0:00,3,,37.77209055,-122.4167415,Tristaniopsis,Tristaniopsis laurina,Swamp Myrtle,2011,2011-04-08 00:00:00,13
4758,107892,Permitted Site,Magnolia grandiflora 'Little Gem' :: Little Gem Magnolia,162 Brewster St,,Front Yard : Cutout,Private,11/4/14 0:00,3,3x3,37.74407667,-122.4072785,Magnolia,Magnolia grandiflora,Little Gem Magnolia,2014,2014-11-04 00:00:00,10
4762,22005,DPW Maintained,Lophostemon confertus :: Brisbane Box,2700 03rd St,3.0,Sidewalk: Curb side : Cutout,Private,2/1/95 0:00,6,3X3,37.75505186,-122.388108,Lophostemon,Lophostemon confertus,Brisbane Box,1995,1995-02-01 00:00:00,29
4767,246499,DPW Maintained,Prunus serrulata :: Ornamental Cherry,311 Duncan St,1.0,Sidewalk: Curb side : Cutout,Private,4/27/17 0:00,3,Width 3ft,37.74599604,-122.4275205,Prunus,Prunus serrulata,Ornamental Cherry,2017,2017-04-27 00:00:00,7
4776,25899,Permitted Site,Platanus x hispanica :: Sycamore: London Plane,500X The Embarcadero,16.0,Sidewalk: Curb side : Cutout,Port,10/30/95 0:00,6,4X4,37.79928175,-122.3975678,Platanus,Platanus x,Sycamore: London Plane,1995,1995-10-30 00:00:00,29
4782,59205,Permitted Site,Pyrus calleryana :: Ornamental Pear,673 Castro St,1.0,Sidewalk: Curb side : Cutout,Private,6/17/80 0:00,8,3x3,37.75813979,-122.4346515,Pyrus,Pyrus calleryana,Ornamental Pear,1980,1980-06-17 00:00:00,44
4785,108779,DPW Maintained,Arbutus unedo :: Strawberry Tree,2055 Sunnydale Ave,1.0,Sidewalk: Curb side : Cutout,SFUSD,1/6/15 0:00,3,3x3,37.71369921,-122.4226431,Arbutus,Arbutus unedo,Strawberry Tree,2015,2015-01-06 00:00:00,9
4795,11514,DPW Maintained,Melaleuca quinquenervia :: Cajeput,101X Jennings St,4.0,Sidewalk: Curb side : Cutout,DPW,12/23/97 0:00,3,3X3,37.73793101,-122.3788156,Melaleuca,Melaleuca quinquenervia,Cajeput,1997,1997-12-23 00:00:00,27
4807,68918,DPW Maintained,Ligustrum lucidum :: Glossy Privet,1731 Mason St,1.0,Sidewalk: Curb side : Cutout,Private,12/29/93 0:00,13,,37.79953546,-122.4124608,Ligustrum,Ligustrum lucidum,Glossy Privet,1993,1993-12-29 00:00:00,31
4809,62590,DPW Maintained,Syagrus romanzoffianum :: Queen Palm,3550 Cabrillo St,1.0,Sidewalk: Curb side : Cutout,Private,2/7/86 0:00,12,,37.77394744,-122.496739,Syagrus,Syagrus romanzoffianum,Queen Palm,1986,1986-02-07 00:00:00,38
4810,285,DPW Maintained,Platanus x hispanica :: Sycamore: London Plane,3355 19th Ave,1.0,Sidewalk: Curb side : Cutout,DPW,2/27/98 0:00,20,2,37.72881184,-122.4750113,Platanus,Platanus x,Sycamore: London Plane,1998,1998-02-27 00:00:00,26
4815,60783,DPW Maintained,Syzygium paniculatum :: Brush Cherry,100 Ewing Ter,1.0,Sidewalk: Curb side : Cutout,Private,3/14/83 0:00,5,,37.78015779,-122.4478491,Syzygium,Syzygium paniculatum,Brush Cherry,1983,1983-03-14 00:00:00,41
4817,62321,DPW Maintained,Maytenus boaria :: Mayten,717 05th Ave,1.0,Sidewalk: Curb side : Cutout,Private,10/11/85 0:00,11,,37.77505432,-122.4628508,Maytenus,Maytenus boaria,Mayten,1985,1985-10-11 00:00:00,39
4822,9525,Permitted Site,Pittosporum undulatum :: Victorian Box,1069 Golden Gate Ave,3.0,Sidewalk: Curb side : Cutout,Private,5/14/92 0:00,3,3x3,37.78000761,-122.4281434,Pittosporum,Pittosporum undulatum,Victorian Box,1992,1992-05-14 00:00:00,32
4823,267052,Permitted Site,Magnolia grandiflora 'Little Gem' :: Little Gem Magnolia,225 Madison St,,Sidewalk: Curb side : Cutout,Private,1/20/22 0:00,3,3x5,37.7263015,-122.4226452,Magnolia,Magnolia grandiflora,Little Gem Magnolia,2022,2022-01-20 00:00:00,2
4826,85234,DPW Maintained,Koelreuteria paniculata :: Golden Rain Tree,355 Berry St,12.0,Sidewalk: Curb side : Cutout,Private,7/19/07 0:00,7,,37.7727864,-122.3970367,Koelreuteria,Koelreuteria paniculata,Golden Rain Tree,2007,2007-07-19 00:00:00,17
4828,249308,DPW Maintained,Ulmus parvifolia 'Drake' :: Drake's Chinese Elm,175 Boutwell St,1.0,Sidewalk: Curb side : Cutout,Private,6/21/18 0:00,3,3x3,37.73480976,-122.4054965,Ulmus,Ulmus parvifolia,Drake's Chinese Elm,2018,2018-06-21 00:00:00,6
4835,139643,DPW Maintained,Lyonothamnus floribundus subsp. asplenifolius :: Santa Cruz Ironwood,1100 DIVISADERO ST,3.0,Sidewalk: Curb side : Cutout,Private,10/10/17 9:46,3,Width 0ft,37.77996153,-122.4386912,Lyonothamnus,Lyonothamnus floribundus,Santa Cruz Ironwood,2017,2017-10-10 09:46:00,7
4836,42641,DPW Maintained,Hymenosporum flavum :: Sweetshade,1651 Union St,3.0,Sidewalk: Curb side : Cutout,SFUSD,11/7/20 12:11,3,5x5,37.7981687,-122.4264647,Hymenosporum,Hymenosporum flavum,Sweetshade,2020,2020-11-07 12:11:00,4
4839,160454,DPW Maintained,Agonis flexuosa :: Peppermint Willow,11 France Ave,1.0,Sidewalk: Curb side : Cutout,Private,10/5/19 0:00,0,Width 0ft,37.71990324,-122.4379665,Agonis,Agonis flexuosa,Peppermint Willow,2019,2019-10-05 00:00:00,5
4842,18638,DPW Maintained,Pyrus kawakamii :: Evergreen Pear,25 Reuel Ct,2.0,Sidewalk: Curb side : Cutout,DPW,2/4/98 0:00,3,3X4,37.73672597,-122.3832578,Pyrus,Pyrus kawakamii,Evergreen Pear,1998,1998-02-04 00:00:00,26
4847,48410,DPW Maintained,Tristaniopsis laurina :: Swamp Myrtle,2701X Greenwich St,1.0,Sidewalk: Curb side : Cutout,Private,7/24/02 0:00,4,,37.79779325,-122.4444942,Tristaniopsis,Tristaniopsis laurina,Swamp Myrtle,2002,2002-07-24 00:00:00,22
4848,25718,DPW Maintained,Platanus x hispanica :: Sycamore: London Plane,771 Grove St,1.0,Sidewalk: Curb side : Cutout,DPW,6/19/15 9:02,3,3X3,37.77696977,-122.429277,Platanus,Platanus x,Sycamore: London Plane,2015,2015-06-19 09:02:00,9
4854,64572,DPW Maintained,Elaeocarpus decipiens :: Japanese Blueberry Tree,1022 Powell St,1.0,Sidewalk: Curb side : Cutout,Private,7/26/88 0:00,3,,37.79423282,-122.409519,Elaeocarpus,Elaeocarpus decipiens,Japanese Blueberry Tree,1988,1988-07-26 00:00:00,36
4858,25186,DPW Maintained,Magnolia doltsopa :: Himalayan Magnolia,3644 Market St,1.0,Sidewalk: Curb side : Cutout,DPW,4/19/96 0:00,3,3X3,37.7554153,-122.4415276,Magnolia,Magnolia doltsopa,Himalayan Magnolia,1996,1996-04-19 00:00:00,28
4872,90318,DPW Maintained,Tristaniopsis laurina :: Swamp Myrtle,2127 Balboa St,1.0,Sidewalk: Curb side : Cutout,DPW,2/27/08 0:00,3,3x3,37.77634814,-122.481814,Tristaniopsis,Tristaniopsis laurina,Swamp Myrtle,2008,2008-02-27 00:00:00,16
4873,4035,DPW Maintained,Maytenus boaria :: Mayten,2300 Cesar Chavez St,1.0,Sidewalk: Curb side : Cutout,DPW,4/1/95 0:00,3,3X3,37.74957799,-122.4001964,Maytenus,Maytenus boaria,Mayten,1995,1995-04-01 00:00:00,29
4882,50471,Permitted Site,Acacia baileyana :: Bailey's Acacia,3010X Lyon St,5.0,Sidewalk: Curb side : Cutout,Private,10/21/03 0:00,5,3x3,37.79857955,-122.4469203,Acacia,Acacia baileyana,Bailey's Acacia,2003,2003-10-21 00:00:00,21
4883,46351,DPW Maintained,Magnolia grandiflora :: Southern Magnolia,2900 Washington St,4.0,Sidewalk: Curb side : Cutout,Private,2/27/02 0:00,6,,37.79077161,-122.4414182,Magnolia,Magnolia grandiflora,Southern Magnolia,2002,2002-02-27 00:00:00,22
4885,49959,Permitted Site,Ginkgo biloba :: Maidenhair Tree,1770X Laguna St,3.0,Sidewalk: Curb side : Cutout,Private,7/10/03 0:00,4,3x3,37.78762299,-122.4281742,Ginkgo,Ginkgo biloba,Maidenhair Tree,2003,2003-07-10 00:00:00,21
4887,239150,DPW Maintained,Pyrus calleryana 'Chanticleer' :: Ornamental Pear Tree 'Chanticleer',100 Octavia St,1.0,Sidewalk: Curb side : Cutout,DPW,3/26/21 0:00,4,Width 4ft,37.77312161,-122.4235923,Pyrus,Pyrus calleryana,Ornamental Pear Tree 'Chanticleer',2021,2021-03-26 00:00:00,3
4896,89649,DPW Maintained,Arbutus 'Marina' :: Hybrid Strawberry Tree,3143 Anza St,2.0,Sidewalk: Curb side : Cutout,DPW,3/21/08 0:00,3,3x3,37.77820439,-122.4820729,Arbutus,Arbutus 'Marina',Hybrid Strawberry Tree,2008,2008-03-21 00:00:00,16
4899,37812,DPW Maintained,Callistemon citrinus :: Lemon Bottlebrush,374 Athens St,1.0,Sidewalk: Curb side : Cutout,Private,7/1/03 0:00,6,,37.72209456,-122.4281883,Callistemon,Callistemon citrinus,Lemon Bottlebrush,2003,2003-07-01 00:00:00,21
4900,95413,Undocumented,Ficus nitida :: Laurel Fig,691 Chenery St,1.0,Sidewalk: Curb side : Cutout,Private,10/19/16 0:00,12,3x3,37.73444257,-122.4336917,Ficus,Ficus nitida,Laurel Fig,2016,2016-10-19 00:00:00,8
4901,108921,Permitted Site,Magnolia grandiflora 'Little Gem' :: Little Gem Magnolia,33 Prospect Ave,1.0,Sidewalk: Curb side : Cutout,Private,1/9/15 0:00,3,3x3,37.74467708,-122.4177596,Magnolia,Magnolia grandiflora,Little Gem Magnolia,2015,2015-01-09 00:00:00,9
4915,24495,DPW Maintained,Tristania conferta ::,647 Fell St,1.0,Sidewalk: Curb side : Cutout,DPW,6/24/95 0:00,12,3X3,37.77514326,-122.428575,Tristania,Tristania conferta,,1995,1995-06-24 00:00:00,29
4916,25539,DPW Maintained,Phoenix canariensis :: Canary Island Date Palm,2200X Market St,5.0,Median : Cutout,DPW,4/1/93 0:00,36,20,37.76504358,-122.4320389,Phoenix,Phoenix canariensis,Canary Island Date Palm,1993,1993-04-01 00:00:00,31
4919,95993,DPW Maintained,Arbutus 'Marina' :: Hybrid Strawberry Tree,801 26th Ave,1.0,Sidewalk: Curb side : Cutout,Private,7/29/11 0:00,4,3x3,37.77424909,-122.4854688,Arbutus,Arbutus 'Marina',Hybrid Strawberry Tree,2011,2011-07-29 00:00:00,13
4926,66180,DPW Maintained,Geijera parviflora :: Australian Willow,1409 20th St,1.0,Sidewalk: Curb side : Cutout,Private,9/6/90 0:00,12,,37.76000226,-122.3956002,Geijera,Geijera parviflora,Australian Willow,1990,1990-09-06 00:00:00,34
4928,49008,DPW Maintained,Magnolia grandiflora :: Southern Magnolia,3152 Washington St,1.0,Sidewalk: Curb side : Cutout,Private,12/17/02 0:00,15,4x4,37.7902976,-122.4450551,Magnolia,Magnolia grandiflora,Southern Magnolia,2002,2002-12-17 00:00:00,22
4936,42241,DPW Maintained,Tristaniopsis laurina 'Elegant' :: Small-leaf Tristania 'Elegant',543 Natoma St,1.0,Sidewalk: Curb side : Cutout,Private,6/23/00 0:00,2,,37.77933831,-122.4086996,Tristaniopsis,Tristaniopsis laurina,Small-leaf Tristania 'Elegant',2000,2000-06-23 00:00:00,24
4942,251737,DPW Maintained,Tristaniopsis laurina :: Swamp Myrtle,228 Chicago Way,1.0,Sidewalk: Curb side : Cutout,Private,10/11/17 8:13,3,3x3,37.71032973,-122.4318577,Tristaniopsis,Tristaniopsis laurina,Swamp Myrtle,2017,2017-10-11 08:13:00,7
4952,179076,DPW Maintained,Pittosporum undulatum :: Victorian Box,2 Edinburgh St,2.0,Sidewalk: Curb side : Cutout,Private,10/4/17 9:01,3,Width 3ft,37.72841712,-122.4267355,Pittosporum,Pittosporum undulatum,Victorian Box,2017,2017-10-04 09:01:00,7
4956,31364,DPW Maintained,Melaleuca quinquenervia :: Cajeput,2295 17th Ave,2.0,Sidewalk: Curb side : Cutout,Private,12/30/16 0:00,3,3x3,37.74529645,-122.4737848,Melaleuca,Melaleuca quinquenervia,Cajeput,2016,2016-12-30 00:00:00,8
4957,105853,DPW Maintained,Platanus x hispanica 'Columbia' :: Columbia Hybrid Plane Tree,3440 Sacramento St,1.0,Sidewalk: Curb side : Cutout,Private,3/5/14 0:00,2,3x3,37.78794034,-122.4494013,Platanus,Platanus x,Columbia Hybrid Plane Tree,2014,2014-03-05 00:00:00,10
4961,59347,DPW Maintained,Prunus cerasifera :: Cherry Plum,505 Lyon St,1.0,Sidewalk: Curb side : Cutout,Private,7/25/88 0:00,9,,37.77561863,-122.4430842,Prunus,Prunus cerasifera,Cherry Plum,1988,1988-07-25 00:00:00,36
4964,32962,DPW Maintained,Jacaranda mimosifolia :: Jacaranda,952 Minnesota St,1.0,Sidewalk: Curb side : Cutout,Private,11/1/96 0:00,12,6x12,37.75849994,-122.3903879,Jacaranda,Jacaranda mimosifolia,Jacaranda,1996,1996-11-01 00:00:00,28
4967,264849,DPW Maintained,Tilia cordata :: Littleleaf Linden,15 Hale St,2.0,Sidewalk: Curb side : Cutout,DPW,11/1/20 0:00,3,,37.73279028,-122.4064701,Tilia,Tilia cordata,Littleleaf Linden,2020,2020-11-01 00:00:00,4
4969,136981,DPW Maintained,Ulmus parvifolia 'Drake' :: Drake's Chinese Elm,318 Walnut St,1.0,Sidewalk: Curb side : Cutout,Private,4/8/20 0:00,3,Width 4ft,37.7882188,-122.4486378,Ulmus,Ulmus parvifolia,Drake's Chinese Elm,2020,2020-04-08 00:00:00,4
4974,87297,Permitted Site,Melaleuca nesophila :: Pink Melaleuca,4227 Lincoln Way,,Sidewalk: Curb side : Cutout,Private,10/16/14 0:00,3,3x3,37.76412922,-122.5034957,Melaleuca,Melaleuca nesophila,Pink Melaleuca,2014,2014-10-16 00:00:00,10
4983,88662,DPW Maintained,Cupaniopsis anacardioides :: Carrotwood,601 25th St,3.0,Sidewalk: Curb side : Cutout,Private,8/5/08 0:00,3,3x3,37.75286886,-122.3860943,Cupaniopsis,Cupaniopsis anacardioides,Carrotwood,2008,2008-08-05 00:00:00,16
4985,5419,DPW Maintained,Aesculus x carnea :: Red Horse Chestnut,431 Dolores St,1.0,Sidewalk: Curb side : Cutout,Private,4/2/98 0:00,12,4X4,37.76247834,-122.4260235,Aesculus,Aesculus x,Red Horse Chestnut,1998,1998-04-02 00:00:00,26
4992,193527,DPW Maintained,Aesculus x carnea 'Briotii' :: Ruby Horse Chestnut,2525 Phelps St,1.0,Sidewalk: Curb side : Cutout,Private,10/19/19 0:00,3,4x6,37.72965878,-122.4003265,Aesculus,Aesculus x,Ruby Horse Chestnut,2019,2019-10-19 00:00:00,5
5000,139860,DPW Maintained,Maytenus boaria :: Mayten,706 McAllister St,4.0,Sidewalk: Curb side : Cutout,DPW,5/12/16 0:00,8,Width 0ft,37.77971209,-122.423941,Maytenus,Maytenus boaria,Mayten,2016,2016-05-12 00:00:00,8
5002,29028,Permitted Site,Fraxinus oxycarpa 'Raywood' :: Raywood Ash,290X 10th St,3.0,Sidewalk: Curb side : Cutout,Private,12/27/05 0:00,6,3x3,37.77289555,-122.4130508,Fraxinus,Fraxinus oxycarpa,Raywood Ash,2005,2005-12-27 00:00:00,19
5004,87877,DPW Maintained,Rhamnus alaternus :: Italian Buckthorn,32 Mallorca Way,1.0,Sidewalk: Curb side : Cutout,Private,6/13/08 0:00,2,3x3,37.80118405,-122.4373389,Rhamnus,Rhamnus alaternus,Italian Buckthorn,2008,2008-06-13 00:00:00,16
5006,25744,Permitted Site,Phoenix canariensis :: Canary Island Date Palm,801X The Embarcadero,9.0,Median : Cutout,Port,8/15/96 0:00,24,10,37.80207103,-122.4004557,Phoenix,Phoenix canariensis,Canary Island Date Palm,1996,1996-08-15 00:00:00,28
5012,41952,DPW Maintained,Olea europaea :: Olive Tree,787 09th Ave,1.0,Sidewalk: Curb side : Cutout,Private,6/20/00 0:00,5,,37.7736168,-122.4670562,Olea,Olea europaea,Olive Tree,2000,2000-06-20 00:00:00,24
5018,26205,DPW Maintained,Laurus nobilis :: Sweet Bay: Grecian Laurel,750 San Jose Ave,2.0,Sidewalk: Curb side : Cutout,DPW,7/20/07 0:00,12,3X3,37.74310926,-122.4231346,Laurus,Laurus nobilis,Sweet Bay: Grecian Laurel,2007,2007-07-20 00:00:00,17
5019,31760,DPW Maintained,Metrosideros excelsa :: New Zealand Xmas Tree,2679 23rd Ave,1.0,Sidewalk: Curb side : Cutout,Private,6/19/95 0:00,5,,37.73768131,-122.479702,Metrosideros,Metrosideros excelsa,New Zealand Xmas Tree,1995,1995-06-19 00:00:00,29
5021,90496,DPW Maintained,Pyrus calleryana :: Ornamental Pear,301 25th Ave,2.0,Sidewalk: Curb side : Cutout,DPW,3/27/08 0:00,3,3x3,37.78361147,-122.485089,Pyrus,Pyrus calleryana,Ornamental Pear,2008,2008-03-27 00:00:00,16
5022,38045,DPW Maintained,Cinnamomum camphora :: Camphor Tree,1717 Baker St,2.0,Sidewalk: Curb side : Cutout,Private,7/10/98 0:00,4,,37.78718724,-122.4437574,Cinnamomum,Cinnamomum camphora,Camphor Tree,1998,1998-07-10 00:00:00,26
5023,28477,Permitted Site,Washingtonia robusta :: Mexican Fan Palm,2159X Ocean Ave,3.0,Sidewalk: Curb side : Cutout,Private,4/1/03 0:00,18,3X3,37.72728896,-122.4669054,Washingtonia,Washingtonia robusta,Mexican Fan Palm,2003,2003-04-01 00:00:00,21
5026,139882,DPW Maintained,Pittosporum undulatum :: Victorian Box,1585 TURK ST,3.0,Sidewalk: Curb side : Cutout,Private,4/23/90 0:00,14,Width 0ft,37.78005885,-122.4350169,Pittosporum,Pittosporum undulatum,Victorian Box,1990,1990-04-23 00:00:00,34
5027,93344,DPW Maintained,Fraxinus americana 'Autumn Purple' :: American Autumn Purple Ash,2100X Turk Blvd,27.0,Sidewalk: Curb side : Cutout,DPW,11/21/08 0:00,3,3x3,37.77931477,-122.4437504,Fraxinus,Fraxinus americana,American Autumn Purple Ash,2008,2008-11-21 00:00:00,16
5029,4566,DPW Maintained,Ulmus parvifolia :: Chinese Elm,106X Virginia Ave,2.0,Sidewalk: Curb side : Cutout,Private,7/1/16 0:00,12,3X3,37.74256377,-122.4202161,Ulmus,Ulmus parvifolia,Chinese Elm,2016,2016-07-01 00:00:00,8
5033,159336,DPW Maintained,Lagunaria patersonii :: Primrose Tree,523 Ellington Ave,1.0,Sidewalk: Curb side : Cutout,Private,10/5/17 10:36,3,Width 0ft,37.71081465,-122.4484377,Lagunaria,Lagunaria patersonii,Primrose Tree,2017,2017-10-05 10:36:00,7
5036,62656,Permitted Site,Prunus serrulata :: Ornamental Cherry,54 Carmelita St,1.0,Sidewalk: Curb side : Cutout,Private,4/21/86 0:00,8,,37.77027454,-122.4342388,Prunus,Prunus serrulata,Ornamental Cherry,1986,1986-04-21 00:00:00,38
5047,171237,DPW Maintained,Ginkgo biloba 'Autumn Gold' :: Ginkgo: Autumn Gold,33 Lisbon St,1.0,Sidewalk: Curb side : Cutout,Private,11/27/19 0:00,3,Width 3ft,37.72777621,-122.4291512,Ginkgo,Ginkgo biloba,Ginkgo: Autumn Gold,2019,2019-11-27 00:00:00,5
5048,49873,DPW Maintained,Lophostemon confertus :: Brisbane Box,1721@ 21st AVE Kirkham St,1.0,Sidewalk: Curb side : Cutout,Private,6/26/03 0:00,0,,37.75965565,-122.4792378,Lophostemon,Lophostemon confertus,Brisbane Box,2003,2003-06-26 00:00:00,21
5051,122626,Planning Code 138.1 required,Cordyline australis :: Dracena Palm,330 Country Club Dr,1.0,Sidewalk: Property side : Cutout,Private,11/15/16 0:00,3,3x5,37.73300093,-122.4956005,Cordyline,Cordyline australis,Dracena Palm,2016,2016-11-15 00:00:00,8
5059,22079,DPW Maintained,Lophostemon confertus :: Brisbane Box,3240 03rd St,3.0,Sidewalk: Curb side : Cutout,Port,2/7/95 0:00,3,3X3,37.74847508,-122.3875565,Lophostemon,Lophostemon confertus,Brisbane Box,1995,1995-02-07 00:00:00,29
5061,92119,DPW Maintained,Pyrus calleryana :: Ornamental Pear,1250 Missouri St,2.0,Sidewalk: Curb side : Cutout,Private,7/7/09 0:00,4,3x3,37.75071146,-122.3955181,Pyrus,Pyrus calleryana,Ornamental Pear,2009,2009-07-07 00:00:00,15
5064,90282,DPW Maintained,Metrosideros excelsa :: New Zealand Xmas Tree,4424 Balboa St,1.0,Sidewalk: Curb side : Cutout,DPW,4/24/08 0:00,3,3x3,37.77538664,-122.5063601,Metrosideros,Metrosideros excelsa,New Zealand Xmas Tree,2008,2008-04-24 00:00:00,16
5076,88172,DPW Maintained,Acer rubrum :: Red Maple,360 Clementina St,5.0,Sidewalk: Curb side : Cutout,Private,7/8/08 0:00,2,3x3,37.78137866,-122.4031195,Acer,Acer rubrum,Red Maple,2008,2008-07-08 00:00:00,16
5079,54758,DPW Maintained,Eucalyptus Spp :: Eucalyptus,324 Lathrop Ave,1.0,Sidewalk: Curb side : Cutout,Private,8/8/72 0:00,8,,37.71049012,-122.3989225,Eucalyptus,Eucalyptus Spp,Eucalyptus,1972,2072-08-08 00:00:00,-48
5093,37078,DPW Maintained,Prunus cerasifera :: Cherry Plum,1318 44th Ave,1.0,Sidewalk: Curb side : Cutout,Private,6/1/98 0:00,2,,37.76195194,-122.5038058,Prunus,Prunus cerasifera,Cherry Plum,1998,1998-06-01 00:00:00,26
5095,5028,DPW Maintained,Metrosideros excelsa :: New Zealand Xmas Tree,5320 Diamond Heights Blvd,12.0,Sidewalk: Curb side : Cutout,DPW,6/8/92 0:00,7,6x3,37.74268788,-122.4365582,Metrosideros,Metrosideros excelsa,New Zealand Xmas Tree,1992,1992-06-08 00:00:00,32
5100,52938,DPW Maintained,Olea europaea :: Olive Tree,46 Norton St,1.0,Sidewalk: Curb side : Cutout,Private,8/3/06 0:00,6,,37.72505657,-122.4357197,Olea,Olea europaea,Olive Tree,2006,2006-08-03 00:00:00,18
5102,94700,DPW Maintained,Maytenus boaria :: Mayten,162 11th Ave,1.0,Sidewalk: Curb side : Cutout,Private,10/28/10 0:00,5,3x3,37.78526079,-122.4698714,Maytenus,Maytenus boaria,Mayten,2010,2010-10-28 00:00:00,14
5104,84563,Permitted Site,Platanus x hispanica 'Yarwood' :: Yarwood Sycamore,1100X Sanchez St,2.0,Sidewalk: Curb side : Cutout,Private,12/27/12 0:00,5,4x4,37.75149563,-122.4297184,Platanus,Platanus x,Yarwood Sycamore,2012,2012-12-27 00:00:00,12
5115,35880,DPW Maintained,Pistacia chinensis :: Chinese Pistache,50 Elmira St,2.0,Sidewalk: Curb side : Cutout,Private,4/24/98 0:00,7,,37.73761032,-122.4039634,Pistacia,Pistacia chinensis,Chinese Pistache,1998,1998-04-24 00:00:00,26
5120,56136,DPW Maintained,Callistemon viminalis :: Weeping Bottlebrush,755 Carolina St,1.0,Sidewalk: Curb side : Cutout,Private,7/2/73 0:00,17,,37.75903557,-122.399964,Callistemon,Callistemon viminalis,Weeping Bottlebrush,1973,2073-07-02 00:00:00,-49
5128,88047,DPW Maintained,Prunus cerasifera :: Cherry Plum,1547 Jerrold Ave,3.0,Sidewalk: Curb side : Cutout,Private,6/24/08 0:00,4,3x3,37.73811949,-122.388383,Prunus,Prunus cerasifera,Cherry Plum,2008,2008-06-24 00:00:00,16
5134,28943,DPW Maintained,Lophostemon confertus :: Brisbane Box,479 09th St,1.0,Sidewalk: Curb side : Cutout,DPW,2/17/06 0:00,6,3x3,37.77164453,-122.4087857,Lophostemon,Lophostemon confertus,Brisbane Box,2006,2006-02-17 00:00:00,18
5135,42065,Permitted Site,Pittosporum undulatum :: Victorian Box,1X Mirabel Ave,2.0,Sidewalk: Curb side : Cutout,Private,7/14/09 0:00,3,3x3,37.74604764,-122.417779,Pittosporum,Pittosporum undulatum,Victorian Box,2009,2009-07-14 00:00:00,15
5137,34655,DPW Maintained,Arbutus unedo :: Strawberry Tree,2020 Kirkham St,1.0,Sidewalk: Curb side : Cutout,Private,7/28/97 0:00,8,,37.75965344,-122.4826853,Arbutus,Arbutus unedo,Strawberry Tree,1997,1997-07-28 00:00:00,27
5141,57075,DPW Maintained,Prunus cerasifera :: Cherry Plum,972 Minnesota St,1.0,Sidewalk: Curb side : Cutout,Private,10/22/74 0:00,10,,37.75823464,-122.3903465,Prunus,Prunus cerasifera,Cherry Plum,1974,1974-10-22 00:00:00,50
5142,90544,DPW Maintained,Eriobotrya deflexa :: Bronze Loquat,700 Cabrillo St,1.0,Sidewalk: Curb side : Cutout,DPW,2/14/08 0:00,3,3x3,37.77533759,-122.4662217,Eriobotrya,Eriobotrya deflexa,Bronze Loquat,2008,2008-02-14 00:00:00,16
5146,68981,DPW Maintained,Ligustrum lucidum :: Glossy Privet,2365 Francisco St,1.0,Sidewalk: Curb side : Cutout,Private,1/4/94 0:00,6,,37.8007144,-122.4440982,Ligustrum,Ligustrum lucidum,Glossy Privet,1994,1994-01-04 00:00:00,30
5150,253095,DPW Maintained,Magnolia grandiflora :: Southern Magnolia,1201 29th Ave,3.0,Sidewalk: Curb side : Cutout,Private,7/13/17 0:00,3,3x3,37.76491137,-122.4880327,Magnolia,Magnolia grandiflora,Southern Magnolia,2017,2017-07-13 00:00:00,7
5153,50910,Permitted Site,Ceanothus 'Ray Hartman' :: California Lilac 'Ray Hartman',2450 17th Ave,2.0,Sidewalk: Curb side : Cutout,Private,4/26/04 0:00,2,3x9,37.74219944,-122.4733972,Ceanothus,Ceanothus 'Ray,California Lilac 'Ray Hartman',2004,2004-04-26 00:00:00,20
5154,5348,DPW Maintained,Magnolia grandiflora 'Samuel Sommer' :: Samuel Sommer Magnolia,200X Dolores St,1.0,Sidewalk: Curb side : Cutout,Private,7/22/10 0:00,12,3x3,37.76613084,-122.4266725,Magnolia,Magnolia grandiflora,Samuel Sommer Magnolia,2010,2010-07-22 00:00:00,14
5155,208295,DPW Maintained,Lophostemon confertus :: Brisbane Box,720 Bosworth St,9.0,Sidewalk: Curb side : Cutout,DPW,10/11/94 0:00,7,Width 3ft,37.7339156,-122.4355664,Lophostemon,Lophostemon confertus,Brisbane Box,1994,1994-10-11 00:00:00,30
5156,51364,DPW Maintained,Crataegus phaenopyrum :: Washington Hawthorn,50 Pomona St,7.0,Sidewalk: Curb side : Cutout,SFUSD,10/12/04 0:00,3,3x3,37.73219766,-122.3934169,Crataegus,Crataegus phaenopyrum,Washington Hawthorn,2004,2004-10-12 00:00:00,20
5160,177791,DPW Maintained,Agonis flexuosa :: Peppermint Willow,400 Cordova St,1.0,Sidewalk: Curb side : Cutout,Private,8/14/21 0:00,3,Width 8ft,37.71009434,-122.435018,Agonis,Agonis flexuosa,Peppermint Willow,2021,2021-08-14 00:00:00,3
5164,46773,DPW Maintained,Lophostemon confertus :: Brisbane Box,35 San Juan Ave,2.0,Sidewalk: Curb side : Cutout,Private,4/3/17 0:00,3,,37.72434892,-122.436131,Lophostemon,Lophostemon confertus,Brisbane Box,2017,2017-04-03 00:00:00,7
5165,9497,Permitted Site,Maytenus boaria :: Mayten,915 Golden Gate Ave,1.0,Sidewalk: Curb side : Cutout,Private,5/14/92 0:00,3,CUT,37.7799367,-122.4252444,Maytenus,Maytenus boaria,Mayten,1992,1992-05-14 00:00:00,32
5167,26288,DPW Maintained,Tristaniopsis laurina :: Swamp Myrtle,1900X San Jose Ave,7.0,Sidewalk: Curb side : Cutout,DPW,6/20/97 0:00,3,3X3,37.72572486,-122.4425546,Tristaniopsis,Tristaniopsis laurina,Swamp Myrtle,1997,1997-06-20 00:00:00,27
5171,26068,DPW Maintained,Rhamnus alaternus :: Italian Buckthorn,282 Orizaba Ave,1.0,Sidewalk: Curb side : Cutout,Private,2/27/03 0:00,3,2X3,37.71384224,-122.46245,Rhamnus,Rhamnus alaternus,Italian Buckthorn,2003,2003-02-27 00:00:00,21
5176,26454,DPW Maintained,Eriobotrya deflexa 'Coppertone' :: Coppertone Loquat,401X Keith St,2.0,Sidewalk: Curb side : Cutout,DPW,6/13/97 0:00,12,3X3,37.73828383,-122.3812845,Eriobotrya,Eriobotrya deflexa,Coppertone Loquat,1997,1997-06-13 00:00:00,27
5182,115988,DPW Maintained,Laurus nobilis :: Sweet Bay: Grecian Laurel,499 Jackson St,3.0,Sidewalk: Curb side : Cutout,Private,6/9/16 0:00,3,3x3,37.79639951,-122.4032554,Laurus,Laurus nobilis,Sweet Bay: Grecian Laurel,2016,2016-06-09 00:00:00,8
5185,89652,DPW Maintained,Arbutus 'Marina' :: Hybrid Strawberry Tree,3049X Anza St,3.0,Sidewalk: Curb side : Cutout,DPW,4/18/08 0:00,3,3x3,37.77825524,-122.4810837,Arbutus,Arbutus 'Marina',Hybrid Strawberry Tree,2008,2008-04-18 00:00:00,16
5187,14711,DPW Maintained,Maytenus boaria :: Mayten,845 McAllister St,1.0,Sidewalk: Curb side : Cutout,DPW,5/21/92 0:00,24,4x4,37.7789601,-122.4250781,Maytenus,Maytenus boaria,Mayten,1992,1992-05-21 00:00:00,32
5188,86117,DPW Maintained,Prunus serrulata :: Ornamental Cherry,2478 24th Ave,1.0,Sidewalk: Curb side : Cutout,DPW,1/17/07 0:00,3,3x3,37.74139977,-122.4808686,Prunus,Prunus serrulata,Ornamental Cherry,2007,2007-01-17 00:00:00,17
5191,60245,DPW Maintained,Metrosideros excelsa :: New Zealand Xmas Tree,2501 Lincoln Way,1.0,Sidewalk: Curb side : Cutout,Private,8/23/82 0:00,15,,37.76500525,-122.4851269,Metrosideros,Metrosideros excelsa,New Zealand Xmas Tree,1982,1982-08-23 00:00:00,42
5196,91246,DPW Maintained,Acacia stenophylla :: Shoestring Acacia,876x Guerrero St,1.0,Median : Cutout,DPW,11/20/08 0:00,3,,37.75712289,-122.4235219,Acacia,Acacia stenophylla,Shoestring Acacia,2008,2008-11-20 00:00:00,16
5197,23035,DPW Maintained,Lophostemon confertus :: Brisbane Box,956 Valencia St,1.0,Sidewalk: Curb side : Cutout,DPW,5/8/97 0:00,18,3X3,37.7574996,-122.4213748,Lophostemon,Lophostemon confertus,Brisbane Box,1997,1997-05-08 00:00:00,27
5202,36182,DPW Maintained,Prunus cerasifera :: Cherry Plum,98 Jordan Ave,1.0,Sidewalk: Curb side : Cutout,Private,5/4/98 0:00,6,,37.78405739,-122.4567287,Prunus,Prunus cerasifera,Cherry Plum,1998,1998-05-04 00:00:00,26
5203,85677,DPW Maintained,Acer buergeranum :: Trident Maple,750 Bryant St,1.0,Sidewalk: Curb side : Cutout,DPW,4/23/07 0:00,3,3x3,37.7772337,-122.4011853,Acer,Acer buergeranum,Trident Maple,2007,2007-04-23 00:00:00,17
5206,108872,DPW Maintained,Tristaniopsis laurina 'Elegant' :: Small-leaf Tristania 'Elegant',1317 Grove St,,Sidewalk: Curb side : Cutout,Private,1/8/15 0:00,3,3x3,37.7758323,-122.4382847,Tristaniopsis,Tristaniopsis laurina,Small-leaf Tristania 'Elegant',2015,2015-01-08 00:00:00,9
5214,33335,DPW Maintained,Eriobotrya deflexa :: Bronze Loquat,3360 Octavia St,2.0,Sidewalk: Curb side : Cutout,Private,11/14/96 0:00,7,9x9,37.80336797,-122.4299337,Eriobotrya,Eriobotrya deflexa,Bronze Loquat,1996,1996-11-14 00:00:00,28
5217,30685,DPW Maintained,Platanus x hispanica :: Sycamore: London Plane,432 Buchanan St,1.0,Sidewalk: Curb side : Cutout,Private,1/31/95 0:00,18,,37.77415171,-122.4274064,Platanus,Platanus x,Sycamore: London Plane,1995,1995-01-31 00:00:00,29
5221,5959,Permitted Site,Pittosporum undulatum :: Victorian Box,1499X Eddy St,10.0,Sidewalk: Curb side : Cutout,Private,5/6/92 0:00,6,3X3,37.781453,-122.4315781,Pittosporum,Pittosporum undulatum,Victorian Box,1992,1992-05-06 00:00:00,32
5225,103518,DPW Maintained,Laurus nobilis :: Sweet Bay: Grecian Laurel,5234 Mission St,1.0,Sidewalk: Curb side : Cutout,Private,5/17/13 0:00,3,3x3,37.71527296,-122.4420651,Laurus,Laurus nobilis,Sweet Bay: Grecian Laurel,2013,2013-05-17 00:00:00,11
5229,37950,DPW Maintained,Eucalyptus polyanthemos :: Silver Dollar Eucalyptus,609 Connecticut St,1.0,Sidewalk: Curb side : Cutout,Private,7/8/98 0:00,17,,37.75860743,-122.3970376,Eucalyptus,Eucalyptus polyanthemos,Silver Dollar Eucalyptus,1998,1998-07-08 00:00:00,26
5231,54852,DPW Maintained,Maytenus boaria :: Mayten,220 Clayton St,1.0,Sidewalk: Curb side : Cutout,Private,8/10/72 0:00,17,,37.77314358,-122.4491785,Maytenus,Maytenus boaria,Mayten,1972,2072-08-10 00:00:00,-48
5232,23426,DPW Maintained,Platanus x hispanica :: Sycamore: London Plane,1999 Van Ness Ave,3.0,Sidewalk: Curb side : Cutout,DPW,5/6/02 0:00,10,3X3,37.7934792,-122.4231194,Platanus,Platanus x,Sycamore: London Plane,2002,2002-05-06 00:00:00,22
5249,158175,Permitted Site,Tristania conferta ::,300 Laidley St,1.0,Sidewalk: Curb side : Cutout,Private,1/30/18 0:00,3,3x3,37.73772775,-122.4283674,Tristania,Tristania conferta,,2018,2018-01-30 00:00:00,6
5250,37075,DPW Maintained,Metrosideros excelsa :: New Zealand Xmas Tree,1266 44th Ave,1.0,Sidewalk: Curb side : Cutout,Private,6/1/98 0:00,5,,37.76300829,-122.5038875,Metrosideros,Metrosideros excelsa,New Zealand Xmas Tree,1998,1998-06-01 00:00:00,26
5252,91488,DPW Maintained,Pinus radiata :: Monterey Pine,750x Brotherhood Way,22.0,Median : Cutout,DPW,3/15/07 0:00,3,,37.71298887,-122.4727931,Pinus,Pinus radiata,Monterey Pine,2007,2007-03-15 00:00:00,17
5253,58353,DPW Maintained,Prunus cerasifera :: Cherry Plum,1225 Taylor St,1.0,Sidewalk: Curb side : Cutout,Private,11/13/78 0:00,10,,37.79383746,-122.4129787,Prunus,Prunus cerasifera,Cherry Plum,1978,1978-11-13 00:00:00,46
5256,53439,DPW Maintained,Pittosporum undulatum :: Victorian Box,52 Palm Ave,1.0,Sidewalk: Curb side : Cutout,Private,6/4/90 0:00,4,,37.78478022,-122.457884,Pittosporum,Pittosporum undulatum,Victorian Box,1990,1990-06-04 00:00:00,34
5257,14451,DPW Maintained,Tristaniopsis laurina :: Swamp Myrtle,100 Masonic Ave,8.0,Sidewalk: Curb side : Cutout,DPW,5/12/12 0:00,3,3x3,37.78109818,-122.4474316,Tristaniopsis,Tristaniopsis laurina,Swamp Myrtle,2012,2012-05-12 00:00:00,12
5258,13037,DPW Maintained,Olea europaea :: Olive Tree,502X Lombard St,2.0,Sidewalk: Curb side : Cutout,DPW,12/16/15 7:44,3,3X3,37.80325889,-122.4099834,Olea,Olea europaea,Olive Tree,2015,2015-12-16 07:44:00,9
5259,7793,DPW Maintained,Lophostemon confertus :: Brisbane Box,601 Franklin St,6.0,Sidewalk: Curb side : Cutout,DPW,1/19/16 11:13,3,3X3,37.77989237,-122.4219798,Lophostemon,Lophostemon confertus,Brisbane Box,2016,2016-01-19 11:13:00,8
5260,198591,Planning Code 138.1 required,Ulmus parvifolia :: Chinese Elm,980 16th St,11.0,Sidewalk: Curb side : Cutout,Private,3/20/18 0:00,3,Width 4ft,37.76654385,-122.3966235,Ulmus,Ulmus parvifolia,Chinese Elm,2018,2018-03-20 00:00:00,6
5271,37506,DPW Maintained,Lophostemon confertus :: Brisbane Box,844 Jones St,5.0,Sidewalk: Curb side : Cutout,Private,6/22/98 0:00,6,,37.78936317,-122.4136125,Lophostemon,Lophostemon confertus,Brisbane Box,1998,1998-06-22 00:00:00,26
5272,255413,Planning Code 138.1 required,Acer rubrum :: Red Maple,199x Hayes St,9.0,Sidewalk: Curb side : Cutout,Private,5/21/18 0:00,3,3x3,37.77709167,-122.4193912,Acer,Acer rubrum,Red Maple,2018,2018-05-21 00:00:00,6
5275,117315,DPW Maintained,Arbutus 'Marina' :: Hybrid Strawberry Tree,1359 22nd Ave,1.0,Sidewalk: Curb side : Cutout,Private,6/6/16 0:00,3,,37.76225394,-122.480394,Arbutus,Arbutus 'Marina',Hybrid Strawberry Tree,2016,2016-06-06 00:00:00,8
5280,33126,DPW Maintained,Eriobotrya deflexa :: Bronze Loquat,2527 Greenwich St,1.0,Sidewalk: Curb side : Cutout,Private,11/12/14 0:00,3,,37.79821143,-122.4412763,Eriobotrya,Eriobotrya deflexa,Bronze Loquat,2014,2014-11-12 00:00:00,10
5282,117054,DPW Maintained,Ulmus americana :: American Elm,3570 Jackson St,2.0,Sidewalk: Curb side : Cutout,Private,7/6/16 0:00,3,4x4,37.7901066,-122.4536265,Ulmus,Ulmus americana,American Elm,2016,2016-07-06 00:00:00,8
5286,43820,DPW Maintained,Arbutus 'Marina' :: Hybrid Strawberry Tree,2820 34th Ave,1.0,Sidewalk: Curb side : Cutout,Private,7/27/00 0:00,6,,37.73495182,-122.4912436,Arbutus,Arbutus 'Marina',Hybrid Strawberry Tree,2000,2000-07-27 00:00:00,24
5288,27601,DPW Maintained,Pittosporum undulatum :: Victorian Box,988 Fulton St,1.0,Sidewalk: Curb side : Cutout,Private,11/9/17 0:00,3,4X4,37.77768458,-122.4323137,Pittosporum,Pittosporum undulatum,Victorian Box,2017,2017-11-09 00:00:00,7
5294,25516,DPW Maintained,Phoenix canariensis :: Canary Island Date Palm,2190X Market St,3.0,Median : Cutout,DPW,4/1/93 0:00,36,10,37.76624732,-122.4305194,Phoenix,Phoenix canariensis,Canary Island Date Palm,1993,1993-04-01 00:00:00,31
5302,88377,DPW Maintained,Prunus serrulata 'Kwanzan' :: Kwanzan Flowering Cherry,458 15th Ave,,Sidewalk: Curb side : Cutout,Private,7/10/08 0:00,5,3x3,37.77941768,-122.473805,Prunus,Prunus serrulata,Kwanzan Flowering Cherry,2008,2008-07-10 00:00:00,16
5305,82647,Permitted Site,Ginkgo biloba 'Autumn Gold' :: Ginkgo: Autumn Gold,56 Julian Ave,9.0,Sidewalk: Curb side : Cutout,Private,1/5/15 0:00,3,3x3,37.76729989,-122.4212139,Ginkgo,Ginkgo biloba,Ginkgo: Autumn Gold,2015,2015-01-05 00:00:00,9
5316,49811,DPW Maintained,Prunus cerasifera :: Cherry Plum,820 22nd St,2.0,Sidewalk: Curb side : Cutout,Private,6/11/03 0:00,6,,37.75791825,-122.3898826,Prunus,Prunus cerasifera,Cherry Plum,2003,2003-06-11 00:00:00,21
5324,89466,DPW Maintained,Fraxinus spp :: Ash Spp,3700 Anza St,2.0,Sidewalk: Curb side : Cutout,DPW,3/21/08 0:00,3,3x3,37.77809008,-122.4880704,Fraxinus,Fraxinus spp,Ash Spp,2008,2008-03-21 00:00:00,16
5326,47183,Permitted Site,Pittosporum crassifolium :: Karo Tree,212 26th Ave,2.0,Sidewalk: Curb side : Cutout,Private,5/8/02 0:00,4,3x3,37.7854308,-122.4861144,Pittosporum,Pittosporum crassifolium,Karo Tree,2002,2002-05-08 00:00:00,22
5328,91295,DPW Maintained,Ulmus parvifolia :: Chinese Elm,3065 Clay St,1.0,Sidewalk: Curb side : Cutout,Private,2/12/09 0:00,5,3x3,37.78947324,-122.4434605,Ulmus,Ulmus parvifolia,Chinese Elm,2009,2009-02-12 00:00:00,15
5330,25815,Permitted Site,Platanus x hispanica :: Sycamore: London Plane,1300X The Embarcadero,11.0,Sidewalk: Curb side : Cutout,Port,10/15/95 0:00,6,4X4,37.80608845,-122.4043754,Platanus,Platanus x,Sycamore: London Plane,1995,1995-10-15 00:00:00,29
5332,70277,DPW Maintained,Agonis flexuosa 'After Dark' :: Peppermint willow 'After Dark',481 34th Ave,1.0,Sidewalk: Curb side : Cutout,Private,3/6/12 0:00,2,,37.78011364,-122.4944966,Agonis,Agonis flexuosa,Peppermint willow 'After Dark',2012,2012-03-06 00:00:00,12
5333,43860,DPW Maintained,Arbutus 'Marina' :: Hybrid Strawberry Tree,500 Crestlake Dr,1.0,Sidewalk: Curb side : Cutout,Private,7/27/00 0:00,2,,37.73576086,-122.4903356,Arbutus,Arbutus 'Marina',Hybrid Strawberry Tree,2000,2000-07-27 00:00:00,24
5334,74771,DPW Maintained,Tristaniopsis laurina :: Swamp Myrtle,2350 Anza St,2.0,Sidewalk: Curb side : Cutout,DPW,3/27/18 11:52,3,,37.77874298,-122.4735615,Tristaniopsis,Tristaniopsis laurina,Swamp Myrtle,2018,2018-03-27 11:52:00,6
5338,59411,DPW Maintained,Ficus microcarpa nitida 'Green Gem' :: Indian Laurel Fig Tree 'Green Gem',2863 Washington St,1.0,Sidewalk: Curb side : Cutout,Private,12/2/80 0:00,18,,37.79076907,-122.440305,Ficus,Ficus microcarpa,Indian Laurel Fig Tree 'Green Gem',1980,1980-12-02 00:00:00,44
5339,6646,DPW Maintained,Ceratonia siliqua :: Carob,495X Newhall St,2.0,Sidewalk: Curb side : Cutout,DPW,4/1/90 0:00,18,3x3,37.74130212,-122.3870327,Ceratonia,Ceratonia siliqua,Carob,1990,1990-04-01 00:00:00,34
5340,43435,DPW Maintained,Quercus agrifolia :: Coast Live Oak,241 Oneida Ave,25.0,Sidewalk: Curb side : Cutout,DPW,7/18/00 0:00,14,,37.72176313,-122.4427111,Quercus,Quercus agrifolia,Coast Live Oak,2000,2000-07-18 00:00:00,24
5341,84558,Permitted Site,Platanus x hispanica 'Yarwood' :: Yarwood Sycamore,1111X Sanchez St,1.0,Sidewalk: Curb side : Cutout,Private,12/27/12 0:00,5,4x4,37.75150165,-122.4296186,Platanus,Platanus x,Yarwood Sycamore,2012,2012-12-27 00:00:00,12
5349,8734,Permitted Site,Tristaniopsis laurina :: Swamp Myrtle,3226 Geary Blvd,1.0,Sidewalk: Curb side : Cutout,Private,2/21/96 0:00,6,3X3,37.78182664,-122.4534575,Tristaniopsis,Tristaniopsis laurina,Swamp Myrtle,1996,1996-02-21 00:00:00,28
5351,40073,DPW Maintained,Lagunaria patersonii :: Primrose Tree,102 Thornton Ave,2.0,Sidewalk: Curb side : Cutout,Private,2/19/99 0:00,10,,37.73083801,-122.3931864,Lagunaria,Lagunaria patersonii,Primrose Tree,1999,1999-02-19 00:00:00,25
5356,9832,Permitted Site,Lophostemon confertus :: Brisbane Box,1103 Gough St,2.0,Sidewalk: Curb side : Cutout,Private,8/22/09 0:00,3,4X4,37.78372872,-122.4244994,Lophostemon,Lophostemon confertus,Brisbane Box,2009,2009-08-22 00:00:00,15
5357,88270,Permitted Site,Lagunaria patersonii :: Primrose Tree,288 States St,,Sidewalk: Curb side : Cutout,Private,7/8/08 0:00,5,3x3,37.76496971,-122.4420193,Lagunaria,Lagunaria patersonii,Primrose Tree,2008,2008-07-08 00:00:00,16
5364,36161,DPW Maintained,Prunus serrulata :: Ornamental Cherry,59 Cook St,1.0,Sidewalk: Curb side : Cutout,Private,5/4/98 0:00,2,,37.78281698,-122.4524008,Prunus,Prunus serrulata,Ornamental Cherry,1998,1998-05-04 00:00:00,26
5366,48960,DPW Maintained,Pyrus kawakamii :: Evergreen Pear,2038 Filbert St,1.0,Sidewalk: Curb side : Cutout,Private,11/26/02 0:00,10,,37.79840887,-122.4331552,Pyrus,Pyrus kawakamii,Evergreen Pear,2002,2002-11-26 00:00:00,22
5367,35762,Permitted Site,Melaleuca quinquenervia :: Cajeput,1312 Natoma St,2.0,Sidewalk: Curb side : Cutout,Private,4/20/98 0:00,11,3x3,37.76828258,-122.4186478,Melaleuca,Melaleuca quinquenervia,Cajeput,1998,1998-04-20 00:00:00,26
5377,138,DPW Maintained,Maytenus boaria :: Mayten,1025X 14th St,8.0,Sidewalk: Curb side : Cutout,DPW,5/4/90 0:00,8,3x3,37.76720741,-122.4362869,Maytenus,Maytenus boaria,Mayten,1990,1990-05-04 00:00:00,34
5379,58918,Permitted Site,Prunus cerasifera :: Cherry Plum,60 Clipper St,1.0,Sidewalk: Curb side : Cutout,Private,3/28/16 0:00,3,,37.74942287,-122.4262914,Prunus,Prunus cerasifera,Cherry Plum,2016,2016-03-28 00:00:00,8
5382,48032,DPW Maintained,Magnolia grandiflora :: Southern Magnolia,3065 Jackson St,1.0,Sidewalk: Curb side : Cutout,Private,7/8/02 0:00,5,,37.79099898,-122.4456438,Magnolia,Magnolia grandiflora,Southern Magnolia,2002,2002-07-08 00:00:00,22
5383,209632,Permitted Site,Maytenus boaria :: Mayten,1283 07th Ave,1.0,Sidewalk: Curb side : Cutout,Private,12/4/92 0:00,10,Width 4ft,37.76442605,-122.464283,Maytenus,Maytenus boaria,Mayten,1992,1992-12-04 00:00:00,32
5386,38142,DPW Maintained,Rhaphiolepis Majestic Beauty :: Indian Hawthorn  'Majestic Beau',100 Felton St,1.0,Sidewalk: Curb side : Cutout,Private,7/16/09 0:00,5,3x3,37.72979789,-122.4057574,Rhaphiolepis,Rhaphiolepis Majestic,Indian Hawthorn  'Majestic Beau',2009,2009-07-16 00:00:00,15
5389,50877,DPW Maintained,Acacia melanoxylon :: Blackwood Acacia,2601on STEINER Sacramento St,1.0,Sidewalk: Curb side : Cutout,Private,4/20/04 0:00,14,,37.78953527,-122.4358097,Acacia,Acacia melanoxylon,Blackwood Acacia,2004,2004-04-20 00:00:00,20
5394,23950,DPW Maintained,Acer buergeranum :: Trident Maple,2400X Sacramento St,6.0,Sidewalk: Curb side : Cutout,DPW,10/15/14 0:00,3,4x4,37.7900462,-122.4328887,Acer,Acer buergeranum,Trident Maple,2014,2014-10-15 00:00:00,10
5402,8095,DPW Maintained,Pyrus kawakamii :: Evergreen Pear,762 Fulton St,6.0,Sidewalk: Curb side : Cutout,Arts Commission,4/14/98 0:00,24,3X3,37.77807127,-122.4292676,Pyrus,Pyrus kawakamii,Evergreen Pear,1998,1998-04-14 00:00:00,26
5408,143510,Permitted Site,Ficus retusa nitida :: Banyan Fig,2026 UNION ST,1.0,Sidewalk: Curb side : Cutout,Private,8/21/06 0:00,14,Width 0ft,37.79754399,-122.4325651,Ficus,Ficus retusa,Banyan Fig,2006,2006-08-21 00:00:00,18
5409,38668,DPW Maintained,Metrosideros excelsa :: New Zealand Xmas Tree,917 Broderick St,1.0,Sidewalk: Curb side : Cutout,Private,10/1/98 0:00,9,,37.77882162,-122.4403559,Metrosideros,Metrosideros excelsa,New Zealand Xmas Tree,1998,1998-10-01 00:00:00,26
5411,108659,DPW Maintained,Magnolia grandiflora 'Russet' :: Russet Magnolia,233 Clayton St,,Sidewalk: Curb side : Cutout,Private,12/30/14 0:00,3,3x3,37.77319779,-122.4493327,Magnolia,Magnolia grandiflora,Russet Magnolia,2014,2014-12-30 00:00:00,10
5413,10518,DPW Maintained,Lophostemon confertus :: Brisbane Box,1827 Haight St,1.0,Sidewalk: Curb side : Cutout,DPW,2/2/16 10:10,3,3X3,37.76925478,-122.4523571,Lophostemon,Lophostemon confertus,Brisbane Box,2016,2016-02-02 10:10:00,8
5414,22705,Permitted Site,Pittosporum undulatum :: Victorian Box,1420 Turk St,2.0,Sidewalk: Curb side : Cutout,Private,8/1/91 0:00,6,3X3,37.78046139,-122.4330021,Pittosporum,Pittosporum undulatum,Victorian Box,1991,1991-08-01 00:00:00,33
5416,108838,Permitted Site,Arbutus 'Marina' :: Hybrid Strawberry Tree,267 Prague St,,Sidewalk: Curb side : Cutout,Private,1/6/15 0:00,3,3x3,37.71787816,-122.4279149,Arbutus,Arbutus 'Marina',Hybrid Strawberry Tree,2015,2015-01-06 00:00:00,9
5419,201588,DPW Maintained,Lophostemon confertus :: Brisbane Box,451 Donahue St,4.0,Sidewalk: Curb side : Cutout,Private,7/12/17 0:00,3,Width 4ft,37.72936326,-122.3695696,Lophostemon,Lophostemon confertus,Brisbane Box,2017,2017-07-12 00:00:00,7
5420,1964,Permitted Site,Olea europaea :: Olive Tree,45 Bertha Ln,2.0,Sidewalk: Curb side : Cutout,Private,3/11/06 0:00,3,3X4,37.73350347,-122.3812244,Olea,Olea europaea,Olive Tree,2006,2006-03-11 00:00:00,18
5422,25802,Permitted Site,Phoenix canariensis :: Canary Island Date Palm,1300X The Embarcadero,4.0,Median : Cutout,Port,8/30/96 0:00,36,10,37.80608845,-122.4043754,Phoenix,Phoenix canariensis,Canary Island Date Palm,1996,1996-08-30 00:00:00,28
5428,34804,DPW Maintained,Rhaphiolepis Majestic Beauty :: Indian Hawthorn  'Majestic Beau',122 Mount Vernon Ave,1.0,Sidewalk: Curb side : Cutout,Private,7/29/97 0:00,4,,37.71636948,-122.4448497,Rhaphiolepis,Rhaphiolepis Majestic,Indian Hawthorn  'Majestic Beau',1997,1997-07-29 00:00:00,27
5434,23787,DPW Maintained,Liquidambar styraciflua :: American Sweet Gum,1100X Webster St,2.0,Median : Cutout,DPW,4/21/08 0:00,3,20,37.78103341,-122.4304805,Liquidambar,Liquidambar styraciflua,American Sweet Gum,2008,2008-04-21 00:00:00,16
5435,30802,DPW Maintained,Ulmus parvifolia :: Chinese Elm,109 Chilton Ave,1.0,Sidewalk: Curb side : Cutout,Private,2/6/95 0:00,10,4x6,37.73380218,-122.4366951,Ulmus,Ulmus parvifolia,Chinese Elm,1995,1995-02-06 00:00:00,29
5439,239448,Permitted Site,Prunus serrulata 'Kwanzan' :: Kwanzan Flowering Cherry,224 Miguel St,1.0,Sidewalk: Curb side : Cutout,Private,7/15/97 0:00,11,Width 4ft,37.7374243,-122.4279928,Prunus,Prunus serrulata,Kwanzan Flowering Cherry,1997,1997-07-15 00:00:00,27
5441,133551,DPW Maintained,Platanus x hispanica :: Sycamore: London Plane,3498 Clay St,3.0,Sidewalk: Curb side : Cutout,Private,5/7/14 0:00,1,Width 3ft,37.78872872,-122.4502946,Platanus,Platanus x,Sycamore: London Plane,2014,2014-05-07 00:00:00,10
5444,39959,DPW Maintained,Lagunaria patersonii :: Primrose Tree,492 07th Ave,1.0,Sidewalk: Curb side : Cutout,Private,7/25/00 0:00,2,,37.77925989,-122.465147,Lagunaria,Lagunaria patersonii,Primrose Tree,2000,2000-07-25 00:00:00,24
5447,89731,DPW Maintained,Arbutus 'Marina' :: Hybrid Strawberry Tree,1345X Anza St,1.0,Sidewalk: Curb side : Cutout,DPW,2/8/08 0:00,3,3x3,37.77911012,-122.4624839,Arbutus,Arbutus 'Marina',Hybrid Strawberry Tree,2008,2008-02-08 00:00:00,16
5450,264991,DPW Maintained,Prunus cerasifera :: Cherry Plum,721 Irving St,2.0,Sidewalk: Curb side : Cutout,Private,12/7/20 0:00,3,Width 3ft,37.76398769,-122.4655353,Prunus,Prunus cerasifera,Cherry Plum,2020,2020-12-07 00:00:00,4
5455,94793,DPW Maintained,Prunus x yedoensis :: Yoshino Cherry,2 Laurel St,5.0,Sidewalk: Curb side : Cutout,Private,11/8/10 0:00,5,,37.79101087,-122.4508825,Prunus,Prunus x,Yoshino Cherry,2010,2010-11-08 00:00:00,14
5456,243660,Planning Code 138.1 required,Ginkgo biloba :: Maidenhair Tree,4471 23rd St,2.0,Sidewalk: Curb side : Cutout,Private,3/14/18 0:00,3,4x4,37.7523774,-122.4419086,Ginkgo,Ginkgo biloba,Maidenhair Tree,2018,2018-03-14 00:00:00,6
5459,64113,DPW Maintained,Magnolia grandiflora 'Russet' :: Russet Magnolia,155 Connecticut St,1.0,Sidewalk: Curb side : Cutout,Private,11/18/87 0:00,7,,37.76394065,-122.3975258,Magnolia,Magnolia grandiflora,Russet Magnolia,1987,1987-11-18 00:00:00,37
5461,39387,DPW Maintained,Liriodendron tulipifera :: Tulip Tree,2710 Broadway,3.0,Sidewalk: Curb side : Cutout,Private,12/21/98 0:00,7,,37.79346374,-122.4419565,Liriodendron,Liriodendron tulipifera,Tulip Tree,1998,1998-12-21 00:00:00,26
5466,59613,DPW Maintained,Liquidambar styraciflua :: American Sweet Gum,1025 Tennessee St,1.0,Sidewalk: Curb side : Cutout,Private,2/26/81 0:00,10,3x3,37.75886256,-122.3892343,Liquidambar,Liquidambar styraciflua,American Sweet Gum,1981,1981-02-26 00:00:00,43
5475,64386,DPW Maintained,Pyrus calleryana :: Ornamental Pear,39 Stillman St,1.0,Sidewalk: Curb side : Cutout,Private,4/21/88 0:00,6,3x3,37.78282323,-122.394922,Pyrus,Pyrus calleryana,Ornamental Pear,1988,1988-04-21 00:00:00,36
5483,31306,DPW Maintained,Melaleuca nesophila :: Pink Melaleuca,561 Birch St,2.0,Sidewalk: Curb side : Cutout,Private,4/12/95 0:00,0,,37.77787455,-122.425885,Melaleuca,Melaleuca nesophila,Pink Melaleuca,1995,1995-04-12 00:00:00,29
5484,6476,DPW Maintained,Ginkgo biloba :: Maidenhair Tree,1200X Evans Ave,18.0,Sidewalk: Curb side : Cutout,DPW,9/11/06 0:00,3,3X3,37.73956701,-122.3820546,Ginkgo,Ginkgo biloba,Maidenhair Tree,2006,2006-09-11 00:00:00,18
5488,20770,DPW Maintained,Metrosideros excelsa :: New Zealand Xmas Tree,1700X Sunset Blvd,1.0,Sidewalk: Curb side : Cutout,DPW,4/13/00 0:00,3,10,37.75528189,-122.49547,Metrosideros,Metrosideros excelsa,New Zealand Xmas Tree,2000,2000-04-13 00:00:00,24
5491,50484,Permitted Site,Pittosporum undulatum :: Victorian Box,175 Russ St,2.0,Sidewalk: Curb side : Cutout,Private,10/29/03 0:00,5,3x3,37.77799984,-122.4070633,Pittosporum,Pittosporum undulatum,Victorian Box,2003,2003-10-29 00:00:00,21
5503,105038,DPW Maintained,Magnolia grandiflora 'Little Gem' :: Little Gem Magnolia,46 Atalaya Ter,,Sidewalk: Curb side : Cutout,Private,3/5/15 0:00,3,3X4,37.77597,-122.4473523,Magnolia,Magnolia grandiflora,Little Gem Magnolia,2015,2015-03-05 00:00:00,9
5504,96758,DPW Maintained,Ulmus parvifolia :: Chinese Elm,54 05th Ave,1.0,Sidewalk: Curb side : Cutout,Private,3/10/14 0:00,24,4x4,37.78764511,-122.4636177,Ulmus,Ulmus parvifolia,Chinese Elm,2014,2014-03-10 00:00:00,10
5509,12383,DPW Maintained,Lophostemon confertus :: Brisbane Box,1435 Laguna St,4.0,Sidewalk: Curb side : Cutout,DPW,8/21/14 0:00,1,4x4,37.7842359,-122.4286805,Lophostemon,Lophostemon confertus,Brisbane Box,2014,2014-08-21 00:00:00,10
5514,10550,DPW Maintained,Fraxinus uhdei :: Shamel Ash: Evergreen Ash,217 Harbor Rd,1.0,Sidewalk: Curb side : Cutout,DPW,2/12/92 0:00,12,3X4,37.73287427,-122.3789142,Fraxinus,Fraxinus uhdei,Shamel Ash: Evergreen Ash,1992,1992-02-12 00:00:00,32
5521,51499,DPW Maintained,Agonis flexuosa :: Peppermint Willow,1518 42nd Ave,1.0,Sidewalk: Curb side : Cutout,Private,1/13/05 0:00,1,,37.75832999,-122.5013187,Agonis,Agonis flexuosa,Peppermint Willow,2005,2005-01-13 00:00:00,19
5522,264789,DPW Maintained,Lophostemon confertus :: Brisbane Box,1385 Utah St,1.0,Sidewalk: Curb side : Cutout,DPW,7/30/21 0:00,3,3x3,37.75200326,-122.40505,Lophostemon,Lophostemon confertus,Brisbane Box,2021,2021-07-30 00:00:00,3
5524,255734,Undocumented,Tristaniopsis laurina :: Swamp Myrtle,301x Congdon St,1.0,Sidewalk: Curb side : Cutout,Private,10/4/18 11:59,3,3x5,37.72891485,-122.425863,Tristaniopsis,Tristaniopsis laurina,Swamp Myrtle,2018,2018-10-04 11:59:00,6
5526,240637,DPW Maintained,Tristaniopsis laurina :: Swamp Myrtle,10 Guerrero St,1.0,Sidewalk: Curb side : Cutout,Private,8/13/20 0:00,3,3x3,37.7703227,-122.4247652,Tristaniopsis,Tristaniopsis laurina,Swamp Myrtle,2020,2020-08-13 00:00:00,4
5529,69157,DPW Maintained,Callistemon viminalis :: Weeping Bottlebrush,1259 42nd Ave,1.0,Sidewalk: Curb side : Cutout,Private,1/26/94 0:00,8,,37.76306029,-122.5018853,Callistemon,Callistemon viminalis,Weeping Bottlebrush,1994,1994-01-26 00:00:00,30
5531,264910,Section 806 (d),Magnolia grandiflora :: Southern Magnolia,1615 Wallace Ave,1.0,Front Yard : Cutout,Private,11/4/20 0:00,3,4x4,37.72759805,-122.3914421,Magnolia,Magnolia grandiflora,Southern Magnolia,2020,2020-11-04 00:00:00,4
5533,12670,DPW Maintained,Pyrus kawakamii :: Evergreen Pear,1128 Lake St,1.0,Sidewalk: Curb side : Cutout,DPW,4/7/98 0:00,6,3X3,37.78643917,-122.4717417,Pyrus,Pyrus kawakamii,Evergreen Pear,1998,1998-04-07 00:00:00,26
5534,38981,DPW Maintained,Rhaphiolepis Majestic Beauty :: Indian Hawthorn  'Majestic Beau',300x San Bruno Ave,1.0,Sidewalk: Curb side : Cutout,Private,11/17/98 0:00,6,3x3,37.76575776,-122.4056718,Rhaphiolepis,Rhaphiolepis Majestic,Indian Hawthorn  'Majestic Beau',1998,1998-11-17 00:00:00,26
5536,86288,DPW Maintained,Melaleuca quinquenervia :: Cajeput,1227 25th Ave,1.0,Sidewalk: Curb side : Cutout,DPW,12/5/06 0:00,3,3x3,37.76463143,-122.4837177,Melaleuca,Melaleuca quinquenervia,Cajeput,2006,2006-12-05 00:00:00,18
5540,106990,DPW Maintained,Prunus serrulata 'Kwanzan' :: Kwanzan Flowering Cherry,1737-1795 Post St,13.0,Sidewalk: Curb side : Cutout,DPW,10/24/14 14:15,3,,37.78513539,-122.4308185,Prunus,Prunus serrulata,Kwanzan Flowering Cherry,2014,2014-10-24 14:15:00,10
5543,18426,Permitted Site,Magnolia grandiflora :: Southern Magnolia,1001X Potrero Ave,1.0,Sidewalk: Property side : Cutout,Health Dept,1/20/16 0:00,30,3X3,37.75616405,-122.4065297,Magnolia,Magnolia grandiflora,Southern Magnolia,2016,2016-01-20 00:00:00,8
5544,99402,DPW Maintained,Afrocarpus gracilior :: Fern Pine,2201X Keith St,3.0,Sidewalk: Curb side : Cutout,Private,5/9/12 0:00,7,3x3,37.72748155,-122.3911666,Afrocarpus,Afrocarpus gracilior,Fern Pine,2012,2012-05-09 00:00:00,12
5545,51389,DPW Maintained,Lophostemon confertus :: Brisbane Box,1159 Howard St,2.0,Sidewalk: Curb side : Cutout,Private,10/13/04 0:00,12,,37.7768517,-122.410648,Lophostemon,Lophostemon confertus,Brisbane Box,2004,2004-10-13 00:00:00,20
5547,8038,DPW Maintained,Pittosporum undulatum :: Victorian Box,555 Fulton St,11.0,Sidewalk: Curb side : Cutout,DPW,9/18/15 0:00,12,3X3,37.77838979,-122.4256078,Pittosporum,Pittosporum undulatum,Victorian Box,2015,2015-09-18 00:00:00,9
5550,251534,Planning Code 138.1 required,Tristaniopsis laurina :: Swamp Myrtle,1818 42nd Ave,1.0,Sidewalk: Curb side : Cutout,Private,5/16/17 0:00,3,3x3,37.75273002,-122.5009291,Tristaniopsis,Tristaniopsis laurina,Swamp Myrtle,2017,2017-05-16 00:00:00,7
5561,171450,DPW Maintained,Arbutus 'Marina' :: Hybrid Strawberry Tree,170 Vienna St,1.0,Sidewalk: Curb side : Cutout,Private,3/8/18 0:00,3,Width 3ft,37.72563049,-122.4266247,Arbutus,Arbutus 'Marina',Hybrid Strawberry Tree,2018,2018-03-08 00:00:00,6
5572,28405,DPW Maintained,Washingtonia robusta :: Mexican Fan Palm,1735 Ocean Ave,1.0,Sidewalk: Curb side : Cutout,DPW,4/1/03 0:00,18,5X5,37.72455306,-122.4607874,Washingtonia,Washingtonia robusta,Mexican Fan Palm,2003,2003-04-01 00:00:00,21
5573,63512,DPW Maintained,Ligustrum lucidum :: Glossy Privet,1912 Golden Gate Ave,1.0,Sidewalk: Curb side : Cutout,Private,11/10/16 0:00,3,3x3,37.7782986,-122.4425133,Ligustrum,Ligustrum lucidum,Glossy Privet,2016,2016-11-10 00:00:00,8
5575,91801,DPW Maintained,Platanus x hispanica 'Yarwood' :: Yarwood Sycamore,3071 Harrison St,,Sidewalk: Curb side : Cutout,DPW,3/7/07 0:00,3,3x3,37.74859822,-122.4114434,Platanus,Platanus x,Yarwood Sycamore,2007,2007-03-07 00:00:00,17
5577,95898,DPW Maintained,Lagunaria patersonii :: Primrose Tree,1700 23rd Ave,2.0,Sidewalk: Curb side : Cutout,Private,7/27/11 0:00,1,3x3,37.75564886,-122.4807775,Lagunaria,Lagunaria patersonii,Primrose Tree,2011,2011-07-27 00:00:00,13
5579,90141,DPW Maintained,Tristaniopsis laurina 'Elegant' :: Small-leaf Tristania 'Elegant',314 Balboa St,1.0,Sidewalk: Curb side : Cutout,DPW,2/11/08 0:00,3,3x3,37.77737856,-122.4620484,Tristaniopsis,Tristaniopsis laurina,Small-leaf Tristania 'Elegant',2008,2008-02-11 00:00:00,16
5592,117123,DPW Maintained,Tristaniopsis laurina 'Elegant' :: Small-leaf Tristania 'Elegant',2550 34TH AVE,2.0,Sidewalk: Curb side : Cutout,Private,5/20/16 0:00,3,3x3,37.73951899,-122.4914102,Tristaniopsis,Tristaniopsis laurina,Small-leaf Tristania 'Elegant',2016,2016-05-20 00:00:00,8
5595,32220,DPW Maintained,Eucalyptus polyanthemos :: Silver Dollar Eucalyptus,564 Precita Ave,1.0,Sidewalk: Curb side : Cutout,Private,8/22/95 0:00,13,,37.74743372,-122.4096834,Eucalyptus,Eucalyptus polyanthemos,Silver Dollar Eucalyptus,1995,1995-08-22 00:00:00,29
5604,26750,Permitted Site,Ginkgo biloba 'Fairmont' :: Fairmont Ginkgo,2099X Post St,15.0,Sidewalk: Curb side : Cutout,Rec/Park,4/5/03 0:00,3,3X3,37.78454791,-122.4373234,Ginkgo,Ginkgo biloba,Fairmont Ginkgo,2003,2003-04-05 00:00:00,21
5615,90865,DPW Maintained,Pyrus calleryana 'Aristocrat' :: Aristocrat Callery Pear,2207 Cabrillo St,3.0,Sidewalk: Curb side : Cutout,DPW,2/19/08 0:00,3,3x3,37.77445409,-122.4824437,Pyrus,Pyrus calleryana,Aristocrat Callery Pear,2008,2008-02-19 00:00:00,16
5619,93352,DPW Maintained,Fraxinus americana 'Autumn Purple' :: American Autumn Purple Ash,2100X Turk Blvd,35.0,Sidewalk: Curb side : Cutout,DPW,11/21/08 0:00,3,3x3,37.77931477,-122.4437504,Fraxinus,Fraxinus americana,American Autumn Purple Ash,2008,2008-11-21 00:00:00,16
5620,103734,DPW Maintained,Ulmus parvifolia 'Drake' :: Drake's Chinese Elm,2121 FOLSOM ST,1.0,Sidewalk: Curb side : Cutout,DPW,5/4/07 0:00,8,3x3,37.76336525,-122.4146664,Ulmus,Ulmus parvifolia,Drake's Chinese Elm,2007,2007-05-04 00:00:00,17
5621,164271,DPW Maintained,Lyonothamnus floribundus subsp. asplenifolius :: Santa Cruz Ironwood,2438 18th Ave,1.0,Sidewalk: Curb side : Cutout,Private,3/6/17 0:00,3,3x3,37.74235128,-122.4744873,Lyonothamnus,Lyonothamnus floribundus,Santa Cruz Ironwood,2017,2017-03-06 00:00:00,7
5632,16245,DPW Maintained,Chamaerops humilis :: Mediterranean Fan Palm,601X Monterey Blvd,1.0,Median : Cutout,DPW,2/2/03 0:00,12,5,37.73154558,-122.4494033,Chamaerops,Chamaerops humilis,Mediterranean Fan Palm,2003,2003-02-02 00:00:00,21
5637,28959,DPW Maintained,Lophostemon confertus :: Brisbane Box,255 09th St,3.0,Sidewalk: Curb side : Cutout,DPW,2/3/10 0:00,3,3x3,37.77437333,-122.4122655,Lophostemon,Lophostemon confertus,Brisbane Box,2010,2010-02-03 00:00:00,14
5638,34707,DPW Maintained,Arbutus unedo :: Strawberry Tree,678 46th Ave,1.0,Sidewalk: Curb side : Cutout,Private,7/28/97 0:00,8,,37.77566542,-122.5069062,Arbutus,Arbutus unedo,Strawberry Tree,1997,1997-07-28 00:00:00,27
5642,114753,DPW Maintained,Magnolia grandiflora 'Little Gem' :: Little Gem Magnolia,10 Karen Ct,1.0,Sidewalk: Curb side : Cutout,Private,12/4/15 0:00,1,,37.72367365,-122.4058387,Magnolia,Magnolia grandiflora,Little Gem Magnolia,2015,2015-12-04 00:00:00,9
5643,92861,DPW Maintained,Corymbia ficifolia :: Red Flowering Gum,2245 Larkin St,1.0,Sidewalk: Curb side : Cutout,Private,11/12/09 0:00,11,3x3,37.79869697,-122.4207291,Corymbia,Corymbia ficifolia,Red Flowering Gum,2009,2009-11-12 00:00:00,15
5644,5014,Permitted Site,Tristaniopsis laurina 'Elegant' :: Small-leaf Tristania 'Elegant',5313 Diamond Heights Blvd,3.0,Sidewalk: Curb side : Cutout,Private,5/21/97 0:00,3,3,37.74348733,-122.4371937,Tristaniopsis,Tristaniopsis laurina,Small-leaf Tristania 'Elegant',1997,1997-05-21 00:00:00,27
5646,12701,DPW Maintained,Tristaniopsis laurina :: Swamp Myrtle,1403 Lake St,1.0,Sidewalk: Curb side : Cutout,Private,2/8/07 0:00,6,3X3,37.7861436,-122.4746136,Tristaniopsis,Tristaniopsis laurina,Swamp Myrtle,2007,2007-02-08 00:00:00,17
5648,47792,DPW Maintained,Lyonothamnus floribundus subsp. asplenifolius :: Santa Cruz Ironwood,2466 26th Ave,1.0,Sidewalk: Curb side : Cutout,Private,6/12/02 0:00,11,,37.74145701,-122.4830201,Lyonothamnus,Lyonothamnus floribundus,Santa Cruz Ironwood,2002,2002-06-12 00:00:00,22
5649,4282,DPW Maintained,Pinus thunbergii :: Japanese Black Pine,4301 Cesar Chavez St,1.0,Sidewalk: Curb side : Cutout,DPW,4/7/95 0:00,3,3X3,37.7470831,-122.4363169,Pinus,Pinus thunbergii,Japanese Black Pine,1995,1995-04-07 00:00:00,29
5652,105189,DPW Maintained,Myoporum laetum :: Myoporum,699X 46th Ave,1.0,Sidewalk: Curb side : Cutout,Private,10/24/16 0:00,3,3,37.77554632,-122.5070518,Myoporum,Myoporum laetum,Myoporum,2016,2016-10-24 00:00:00,8
5660,180016,DPW Maintained,Tristaniopsis laurina :: Swamp Myrtle,2901 Alemany Blvd,1.0,Sidewalk: Curb side : Cutout,Private,12/2/98 0:00,7,Width 3ft,37.71181314,-122.4520558,Tristaniopsis,Tristaniopsis laurina,Swamp Myrtle,1998,1998-12-02 00:00:00,26
5663,84747,DPW Maintained,Washingtonia robusta :: Mexican Fan Palm,170 King St,4.0,Sidewalk: Curb side : Cutout,Private,5/4/07 0:00,19,,37.77868611,-122.3913712,Washingtonia,Washingtonia robusta,Mexican Fan Palm,2007,2007-05-04 00:00:00,17
5664,29245,DPW Maintained,Arbutus 'Marina' :: Hybrid Strawberry Tree,3002X Quintara St,6.0,Sidewalk: Curb side : Cutout,DPW,3/18/06 0:00,3,3X3,37.74776575,-122.497569,Arbutus,Arbutus 'Marina',Hybrid Strawberry Tree,2006,2006-03-18 00:00:00,18
5678,30358,DPW Maintained,Ulmus parvifolia :: Chinese Elm,657 Arkansas St,1.0,Sidewalk: Curb side : Cutout,Private,8/15/74 0:00,14,,37.7579623,-122.3979308,Ulmus,Ulmus parvifolia,Chinese Elm,1974,1974-08-15 00:00:00,50
5679,254764,Planning Code 138.1 required,Magnolia grandiflora :: Southern Magnolia,77 Caine Ave,1.0,Sidewalk: Curb side : Cutout,Private,3/27/18 0:00,3,3x3,37.71703655,-122.4506015,Magnolia,Magnolia grandiflora,Southern Magnolia,2018,2018-03-27 00:00:00,6
5681,52007,DPW Maintained,Melaleuca linariifolia :: Flaxleaf Paperbark,1782 Revere Ave,1.0,Sidewalk: Curb side : Cutout,Private,6/11/08 0:00,15,3x3,37.7336095,-122.3934669,Melaleuca,Melaleuca linariifolia,Flaxleaf Paperbark,2008,2008-06-11 00:00:00,16
5685,15909,DPW Maintained,Tristaniopsis laurina :: Swamp Myrtle,5672 Mission St,1.0,Sidewalk: Curb side : Cutout,Private,2/23/95 0:00,6,3x3,37.71043562,-122.4484536,Tristaniopsis,Tristaniopsis laurina,Swamp Myrtle,1995,1995-02-23 00:00:00,29
5686,94744,DPW Maintained,Prunus serrulata 'Kwanzan' :: Kwanzan Flowering Cherry,1801 Green St,1.0,Sidewalk: Curb side : Cutout,Private,11/3/10 0:00,4,3x3,37.79685023,-122.429235,Prunus,Prunus serrulata,Kwanzan Flowering Cherry,2010,2010-11-03 00:00:00,14
5687,101942,Planning Code 138.1 required,Arbutus 'Marina' :: Hybrid Strawberry Tree,537 Natoma St,1.0,Sidewalk: Curb side : Cutout,Private,1/12/16 0:00,2,2x4,37.7794051,-122.4086105,Arbutus,Arbutus 'Marina',Hybrid Strawberry Tree,2016,2016-01-12 00:00:00,8
5697,33662,DPW Maintained,Ficus retusa nitida :: Banyan Fig,453 Linden St,1.0,Sidewalk: Curb side : Cutout,Private,10/11/16 0:00,3,,37.77606742,-122.4253888,Ficus,Ficus retusa,Banyan Fig,2016,2016-10-11 00:00:00,8
5703,49561,DPW Maintained,Metrosideros excelsa :: New Zealand Xmas Tree,1081@ JONES Pine St,4.0,Sidewalk: Curb side : Cutout,Private,5/5/03 0:00,6,,37.79043859,-122.4135229,Metrosideros,Metrosideros excelsa,New Zealand Xmas Tree,2003,2003-05-05 00:00:00,21
5704,81639,DPW Maintained,Corymbia ficifolia :: Red Flowering Gum,678 06th Ave,1.0,Sidewalk: Curb side : Cutout,Private,8/4/08 0:00,10,3x3,37.77578175,-122.4638284,Corymbia,Corymbia ficifolia,Red Flowering Gum,2008,2008-08-04 00:00:00,16
5709,17740,DPW Maintained,Olea europaea :: Olive Tree,1347 Pierce St,1.0,Sidewalk: Curb side : Cutout,Health Dept,12/1/82 0:00,6,3X3,37.78276633,-122.4360547,Olea,Olea europaea,Olive Tree,1982,1982-12-01 00:00:00,42
5714,50577,DPW Maintained,Magnolia grandiflora :: Southern Magnolia,258 16th Ave,1.0,Sidewalk: Curb side : Cutout,Private,12/1/03 0:00,4,,37.783163,-122.4752045,Magnolia,Magnolia grandiflora,Southern Magnolia,2003,2003-12-01 00:00:00,21
5716,38964,DPW Maintained,Ficus microcarpa nitida 'Green Gem' :: Indian Laurel Fig Tree 'Green Gem',1550 Bay St,6.0,Sidewalk: Curb side : Cutout,Private,11/17/98 0:00,5,,37.80328586,-122.4324776,Ficus,Ficus microcarpa,Indian Laurel Fig Tree 'Green Gem',1998,1998-11-17 00:00:00,26
5717,31417,DPW Maintained,Tristaniopsis laurina :: Swamp Myrtle,4042 21st St,1.0,Sidewalk: Curb side : Cutout,Private,5/1/95 0:00,6,,37.756054,-122.4363962,Tristaniopsis,Tristaniopsis laurina,Swamp Myrtle,1995,1995-05-01 00:00:00,29
5718,51916,DPW Maintained,Prunus blireiana :: Flowering Plum,1750 43rd Ave,1.0,Sidewalk: Curb side : Cutout,Private,7/19/05 0:00,2,,37.75399927,-122.5021752,Prunus,Prunus blireiana,Flowering Plum,2005,2005-07-19 00:00:00,19
5721,12800,DPW Maintained,Tristaniopsis laurina :: Swamp Myrtle,2034 Lake St,1.0,Sidewalk: Curb side : Cutout,Private,2/24/08 0:00,3,3X3,37.78599177,-122.4815226,Tristaniopsis,Tristaniopsis laurina,Swamp Myrtle,2008,2008-02-24 00:00:00,16
5722,82842,DPW Maintained,Gleditsia triacanthos :: Honey Locust,624 Natoma St,1.0,Sidewalk: Curb side : Cutout,Private,7/7/09 0:00,5,3x3,37.77794215,-122.4105924,Gleditsia,Gleditsia triacanthos,Honey Locust,2009,2009-07-07 00:00:00,15
5724,59835,DPW Maintained,Metrosideros excelsa :: New Zealand Xmas Tree,256 Mallorca Way,1.0,Sidewalk: Curb side : Cutout,Private,9/16/81 0:00,16,,37.80315276,-122.4389985,Metrosideros,Metrosideros excelsa,New Zealand Xmas Tree,1981,1981-09-16 00:00:00,43
5726,29953,DPW Maintained,Tristaniopsis laurina :: Swamp Myrtle,149 Broad St,1.0,Sidewalk: Curb side : Cutout,Private,3/10/07 0:00,3,3x3,37.7131069,-122.4578183,Tristaniopsis,Tristaniopsis laurina,Swamp Myrtle,2007,2007-03-10 00:00:00,17
5727,259659,Planning Code 138.1 required,Tristaniopsis laurina :: Swamp Myrtle,4061 Cesar Chavez St,1.0,Sidewalk: Curb side : Cutout,Private,7/29/19 0:00,3,3x3,37.74743407,-122.4306015,Tristaniopsis,Tristaniopsis laurina,Swamp Myrtle,2019,2019-07-29 00:00:00,5
5735,60061,DPW Maintained,Eriobotrya deflexa :: Bronze Loquat,1574 Innes Ave,1.0,Sidewalk: Curb side : Cutout,Private,3/15/82 0:00,3,,37.73919905,-122.3882806,Eriobotrya,Eriobotrya deflexa,Bronze Loquat,1982,1982-03-15 00:00:00,42
5739,30030,DPW Maintained,Tristaniopsis laurina :: Swamp Myrtle,1710X Alemany Blvd,2.0,Median : Cutout,DPW,3/8/07 0:00,3,3X3,37.72469315,-122.437017,Tristaniopsis,Tristaniopsis laurina,Swamp Myrtle,2007,2007-03-08 00:00:00,17
5741,38391,DPW Maintained,Ginkgo biloba :: Maidenhair Tree,305 Spruce St,1.0,Sidewalk: Curb side : Cutout,Private,8/17/98 0:00,4,,37.78802104,-122.4538108,Ginkgo,Ginkgo biloba,Maidenhair Tree,1998,1998-08-17 00:00:00,26
5749,31876,DPW Maintained,Prunus x yedoensis :: Yoshino Cherry,457 38th Ave,1.0,Sidewalk: Curb side : Cutout,Private,6/26/95 0:00,2,,37.7803202,-122.4988083,Prunus,Prunus x,Yoshino Cherry,1995,1995-06-26 00:00:00,29
5751,54835,DPW Maintained,Pinus radiata :: Monterey Pine,117 Ashbury St,1.0,Sidewalk: Curb side : Cutout,Private,8/9/72 0:00,15,,37.77430557,-122.4478825,Pinus,Pinus radiata,Monterey Pine,1972,2072-08-09 00:00:00,-48
5752,103825,DPW Maintained,Magnolia grandiflora :: Southern Magnolia,1000 Polk St,3.0,Sidewalk: Curb side : Cutout,Private,11/1/09 0:00,3,3x3,37.78612904,-122.4196922,Magnolia,Magnolia grandiflora,Southern Magnolia,2009,2009-11-01 00:00:00,15
5758,59963,DPW Maintained,Ficus nitida :: Laurel Fig,523 Octavia St,1.0,Sidewalk: Curb side : Cutout,Private,12/19/81 0:00,15,,37.77707757,-122.4247981,Ficus,Ficus nitida,Laurel Fig,1981,1981-12-19 00:00:00,43
5759,43019,Permitted Site,Tristaniopsis laurina 'Elegant' :: Small-leaf Tristania 'Elegant',247 Rose St,1.0,Sidewalk: Curb side : Cutout,Private,12/29/14 0:00,3,3x3,37.77324042,-122.4247227,Tristaniopsis,Tristaniopsis laurina,Small-leaf Tristania 'Elegant',2014,2014-12-29 00:00:00,10
5773,86394,DPW Maintained,Prunus serrulata :: Ornamental Cherry,1595 26th Ave,2.0,Sidewalk: Curb side : Cutout,DPW,12/15/06 0:00,3,3x3,37.75781712,-122.4843217,Prunus,Prunus serrulata,Ornamental Cherry,2006,2006-12-15 00:00:00,18
5776,63200,DPW Maintained,Prunus x yedoensis :: Yoshino Cherry,450 36th Ave,1.0,Sidewalk: Curb side : Cutout,Private,7/8/15 0:00,3,,37.78053989,-122.4965187,Prunus,Prunus x,Yoshino Cherry,2015,2015-07-08 00:00:00,9
5780,95713,DPW Maintained,Tristaniopsis laurina :: Swamp Myrtle,649 Avalon Ave,1.0,Sidewalk: Curb side : Cutout,Private,9/7/11 0:00,4,3x3,37.72525964,-122.4269991,Tristaniopsis,Tristaniopsis laurina,Swamp Myrtle,2011,2011-09-07 00:00:00,13
5782,85826,Permitted Site,Magnolia grandiflora 'Samuel Sommer' :: Samuel Sommer Magnolia,1399X Howard St,3.0,Sidewalk: Curb side : Cutout,Private,5/17/07 0:00,3,3x3,37.77401442,-122.4143062,Magnolia,Magnolia grandiflora,Samuel Sommer Magnolia,2007,2007-05-17 00:00:00,17
5784,4417,DPW Maintained,Magnolia grandiflora :: Southern Magnolia,1128 Church St,1.0,Sidewalk: Curb side : Cutout,DPW,5/8/97 0:00,6,3X3,37.7527465,-122.4276369,Magnolia,Magnolia grandiflora,Southern Magnolia,1997,1997-05-08 00:00:00,27
5789,8264,DPW Maintained,Acer rubrum :: Red Maple,1555 Galvez Ave,7.0,Sidewalk: Curb side : Cutout,DPW,3/26/04 0:00,3,3x3,37.74019958,-122.3870785,Acer,Acer rubrum,Red Maple,2004,2004-03-26 00:00:00,20
5791,44260,DPW Maintained,Prunus serrulata 'Kwanzan' :: Kwanzan Flowering Cherry,320 Excelsior Ave,1.0,Sidewalk: Curb side : Cutout,Private,2/20/01 0:00,6,,37.72483387,-122.4308165,Prunus,Prunus serrulata,Kwanzan Flowering Cherry,2001,2001-02-20 00:00:00,23
5799,27934,Permitted Site,Phoenix canariensis :: Canary Island Date Palm,799 The Embarcadero,6.0,Median : Cutout,Port,2/1/01 0:00,24,10,37.8020588,-122.4004449,Phoenix,Phoenix canariensis,Canary Island Date Palm,2001,2001-02-01 00:00:00,23
5805,57220,DPW Maintained,Fraxinus uhdei :: Shamel Ash: Evergreen Ash,2525 Judah St,1.0,Sidewalk: Curb side : Cutout,Private,1/9/75 0:00,8,,37.76107388,-122.4893053,Fraxinus,Fraxinus uhdei,Shamel Ash: Evergreen Ash,1975,1975-01-09 00:00:00,49
5806,84342,DPW Maintained,Magnolia grandiflora 'Saint Mary' :: Saint Mary Magnolia,1153 Bay St,1.0,Sidewalk: Curb side : Cutout,Private,6/13/08 0:00,3,3x3,37.8039463,-122.4260898,Magnolia,Magnolia grandiflora,Saint Mary Magnolia,2008,2008-06-13 00:00:00,16
5809,29007,Permitted Site,Fraxinus oxycarpa 'Raywood' :: Raywood Ash,135 10th St,1.0,Sidewalk: Curb side : Cutout,Private,12/27/05 0:00,3,3x3,37.77488145,-122.4152964,Fraxinus,Fraxinus oxycarpa,Raywood Ash,2005,2005-12-27 00:00:00,19
5810,369,DPW Maintained,Acacia melanoxylon :: Blackwood Acacia,3690X 19th Ave,16.0,Sidewalk: Curb side : Cutout,DPW,3/9/13 0:00,25,2,37.72122463,-122.4749612,Acacia,Acacia melanoxylon,Blackwood Acacia,2013,2013-03-09 00:00:00,11
5842,87665,DPW Maintained,Lophostemon confertus :: Brisbane Box,2300X Bay Shore Blvd,3.0,Sidewalk: Curb side : Cutout,DPW,12/10/15 8:16,3,3x3,37.71163408,-122.4035407,Lophostemon,Lophostemon confertus,Brisbane Box,2015,2015-12-10 08:16:00,9
5843,104274,DPW Maintained,Ficus microcarpa nitida 'Green Gem' :: Indian Laurel Fig Tree 'Green Gem',3675 Washington St,3.0,Sidewalk: Curb side : Cutout,Private,9/17/13 0:00,3,3x3,37.78909406,-122.4535719,Ficus,Ficus microcarpa,Indian Laurel Fig Tree 'Green Gem',2013,2013-09-17 00:00:00,11
5844,144327,DPW Maintained,Eriobotrya deflexa :: Bronze Loquat,718 47th Ave,1.0,Sidewalk: Curb side : Cutout,Private,2/18/21 0:00,3,Width 3ft,37.77485521,-122.507925,Eriobotrya,Eriobotrya deflexa,Bronze Loquat,2021,2021-02-18 00:00:00,3
5854,53178,DPW Maintained,Prunus cerasifera :: Cherry Plum,2420 REVISED Leavenworth St,1.0,Sidewalk: Curb side : Cutout,Private,11/14/06 0:00,5,,37.80350477,-122.4181496,Prunus,Prunus cerasifera,Cherry Plum,2006,2006-11-14 00:00:00,18
5861,106411,DPW Maintained,Tristaniopsis laurina 'Elegant' :: Small-leaf Tristania 'Elegant',2159 Chestnut St,2.0,Sidewalk: Curb side : Cutout,Private,4/28/14 0:00,1,,37.80043644,-122.4387401,Tristaniopsis,Tristaniopsis laurina,Small-leaf Tristania 'Elegant',2014,2014-04-28 00:00:00,10
5862,10863,Permitted Site,Callistemon viminalis :: Weeping Bottlebrush,1275X HUDSON AVE,2.0,Sidewalk: Curb side : Cutout,Private,4/28/16 0:00,6,3X4,37.73410745,-122.3826385,Callistemon,Callistemon viminalis,Weeping Bottlebrush,2016,2016-04-28 00:00:00,8
5865,65859,DPW Maintained,Maytenus boaria :: Mayten,3454 Scott St,1.0,Sidewalk: Curb side : Cutout,Private,5/8/90 0:00,7,,37.80192435,-122.4414523,Maytenus,Maytenus boaria,Mayten,1990,1990-05-08 00:00:00,34
5868,80749,DPW Maintained,Laurus nobilis :: Sweet Bay: Grecian Laurel,375 Munich St,1.0,Sidewalk: Curb side : Cutout,Private,7/1/09 0:00,3,3x3,37.71971212,-122.4276216,Laurus,Laurus nobilis,Sweet Bay: Grecian Laurel,2009,2009-07-01 00:00:00,15
5870,103962,DPW Maintained,Magnolia grandiflora :: Southern Magnolia,3240 Pacific Ave,2.0,Sidewalk: Curb side : Cutout,Private,6/28/17 0:00,3,,37.79164116,-122.4486807,Magnolia,Magnolia grandiflora,Southern Magnolia,2017,2017-06-28 00:00:00,7
5872,98849,DPW Maintained,Lagunaria patersonii :: Primrose Tree,1795X 31st Ave,2.0,Sidewalk: Curb side : Cutout,Private,4/11/12 0:00,1,3x3,37.75391761,-122.4896816,Lagunaria,Lagunaria patersonii,Primrose Tree,2012,2012-04-11 00:00:00,12
5876,39967,DPW Maintained,Metrosideros excelsa :: New Zealand Xmas Tree,500 Washington St,1.0,Sidewalk: Curb side : Cutout,Private,1/25/99 0:00,12,4x4,37.79574911,-122.4020429,Metrosideros,Metrosideros excelsa,New Zealand Xmas Tree,1999,1999-01-25 00:00:00,25
5879,103783,DPW Maintained,Magnolia grandiflora :: Southern Magnolia,1233 Polk St,1.0,Sidewalk: Curb side : Cutout,Private,11/1/09 0:00,3,3x3,37.78833313,-122.4203153,Magnolia,Magnolia grandiflora,Southern Magnolia,2009,2009-11-01 00:00:00,15
5881,89537,DPW Maintained,Cordyline australis :: Dracena Palm,5200 Anza St,2.0,Sidewalk: Curb side : Cutout,DPW,3/26/08 0:00,3,3x3,37.77735749,-122.5040753,Cordyline,Cordyline australis,Dracena Palm,2008,2008-03-26 00:00:00,16
5885,28914,DPW Maintained,Tristaniopsis laurina :: Swamp Myrtle,180 07th St,1.0,Sidewalk: Curb side : Cutout,Private,2/11/06 0:00,3,3x3,37.77827572,-122.4099302,Tristaniopsis,Tristaniopsis laurina,Swamp Myrtle,2006,2006-02-11 00:00:00,18
5888,50575,DPW Maintained,Leptospermum laevigatum :: Australian Tea Tree,1347 41st Ave,1.0,Sidewalk: Curb side : Cutout,Private,11/18/03 0:00,0,,37.76164125,-122.5007263,Leptospermum,Leptospermum laevigatum,Australian Tea Tree,2003,2003-11-18 00:00:00,21
5889,11110,DPW Maintained,Lophostemon confertus :: Brisbane Box,2027 Hyde St,1.0,Sidewalk: Curb side : Cutout,Private,1/14/16 0:00,5,3x3,37.7996325,-122.4192221,Lophostemon,Lophostemon confertus,Brisbane Box,2016,2016-01-14 00:00:00,8
5890,27519,DPW Maintained,Hymenosporum flavum :: Sweetshade,1212 Guerrero St,10.0,Sidewalk: Curb side : Cutout,DPW,6/8/00 0:00,8,3X3,37.75118791,-122.4229274,Hymenosporum,Hymenosporum flavum,Sweetshade,2000,2000-06-08 00:00:00,24
5896,19322,DPW Maintained,Tristaniopsis laurina :: Swamp Myrtle,145 Shields St,1.0,Sidewalk: Curb side : Cutout,DPW,8/24/94 0:00,6,3x3,37.71787723,-122.4642979,Tristaniopsis,Tristaniopsis laurina,Swamp Myrtle,1994,1994-08-24 00:00:00,30
5900,95889,DPW Maintained,Arbutus 'Marina' :: Hybrid Strawberry Tree,1658 21st Ave,1.0,Sidewalk: Curb side : Cutout,Private,7/27/11 0:00,2,3x3,37.75674943,-122.478723,Arbutus,Arbutus 'Marina',Hybrid Strawberry Tree,2011,2011-07-27 00:00:00,13
5902,52781,Permitted Site,Tristaniopsis laurina 'Elegant' :: Small-leaf Tristania 'Elegant',6X Murray St,2.0,Sidewalk: Curb side : Cutout,Private,5/24/06 0:00,3,3x3,37.73359373,-122.4263102,Tristaniopsis,Tristaniopsis laurina,Small-leaf Tristania 'Elegant',2006,2006-05-24 00:00:00,18
5904,91959,DPW Maintained,Pittosporum undulatum :: Victorian Box,203 IRVING ST,1.0,Sidewalk: Curb side : Cutout,DPW,12/11/08 0:00,3,3x3,37.76416956,-122.4601554,Pittosporum,Pittosporum undulatum,Victorian Box,2008,2008-12-11 00:00:00,16
5907,51005,DPW Maintained,Acacia melanoxylon :: Blackwood Acacia,674 03rd Ave,1.0,Sidewalk: Curb side : Cutout,Private,6/23/04 0:00,14,,37.77603009,-122.4606145,Acacia,Acacia melanoxylon,Blackwood Acacia,2004,2004-06-23 00:00:00,20
5910,26232,DPW Maintained,Tristaniopsis laurina :: Swamp Myrtle,705X San Jose Ave,1.0,Sidewalk: Curb side : Cutout,DPW,9/23/97 0:00,8,3X3,37.74380769,-122.4225672,Tristaniopsis,Tristaniopsis laurina,Swamp Myrtle,1997,1997-09-23 00:00:00,27
5911,86216,DPW Maintained,Arbutus 'Marina' :: Hybrid Strawberry Tree,2619 24th Ave,1.0,Sidewalk: Curb side : Cutout,DPW,6/18/15 15:11,3,3x3,37.7386431,-122.4808351,Arbutus,Arbutus 'Marina',Hybrid Strawberry Tree,2015,2015-06-18 15:11:00,9
5917,163010,DPW Maintained,Jacaranda mimosifolia :: Jacaranda,42 Bruce Ave,1.0,Sidewalk: Curb side : Cutout,Private,5/4/21 0:00,3,Width 0ft,37.72217692,-122.4519213,Jacaranda,Jacaranda mimosifolia,Jacaranda,2021,2021-05-04 00:00:00,3
5927,51891,DPW Maintained,Prunus cerasifera :: Cherry Plum,475 Tehama St,2.0,Sidewalk: Curb side : Cutout,Private,7/18/05 0:00,4,,37.77979979,-122.4059526,Prunus,Prunus cerasifera,Cherry Plum,2005,2005-07-18 00:00:00,19
5951,54436,DPW Maintained,Ficus microcarpa nitida 'Green Gem' :: Indian Laurel Fig Tree 'Green Gem',406 Mississippi St,1.0,Sidewalk: Curb side : Cutout,Private,6/8/72 0:00,17,,37.76124926,-122.3945609,Ficus,Ficus microcarpa,Indian Laurel Fig Tree 'Green Gem',1972,2072-06-08 00:00:00,-48
5954,27240,DPW Maintained,Arbutus 'Marina' :: Hybrid Strawberry Tree,261 Silver Ave,1.0,Sidewalk: Curb side : Cutout,Private,2/23/05 0:00,3,3X3,37.72918852,-122.4319906,Arbutus,Arbutus 'Marina',Hybrid Strawberry Tree,2005,2005-02-23 00:00:00,19
5956,115515,DPW Maintained,Acacia stenophylla :: Shoestring Acacia,200x Guerrero St,6.0,Median : Cutout,DPW,2/9/16 11:34,3,,37.76779574,-122.4245519,Acacia,Acacia stenophylla,Shoestring Acacia,2016,2016-02-09 11:34:00,8
5957,98063,DPW Maintained,Tristaniopsis laurina :: Swamp Myrtle,5235 Diamond Heights Blvd,3.0,Sidewalk: Curb side : Cutout,DPW,3/15/14 0:00,3,3x3,37.74454336,-122.4389401,Tristaniopsis,Tristaniopsis laurina,Swamp Myrtle,2014,2014-03-15 00:00:00,10
5960,90490,DPW Maintained,Olea europaea :: Olive Tree,163 25th Ave,2.0,Sidewalk: Curb side : Cutout,DPW,2/17/16 7:37,3,3x3,37.78639648,-122.4852912,Olea,Olea europaea,Olive Tree,2016,2016-02-17 07:37:00,8
5972,199715,DPW Maintained,Laurus x 'Saratoga' :: Hybrid Laurel,1303 Underwood Ave,2.0,Sidewalk: Curb side : Cutout,Private,12/18/21 0:00,3,Width 0ft,37.72685214,-122.3868438,Laurus,Laurus x,Hybrid Laurel,2021,2021-12-18 00:00:00,3
5977,251164,DPW Maintained,Magnolia grandiflora 'Samuel Sommer' :: Samuel Sommer Magnolia,1215 Fairfax Ave,10.0,Sidewalk: Curb side : Cutout,Private,4/10/17 13:46,3,3x3,37.73824763,-122.3820862,Magnolia,Magnolia grandiflora,Samuel Sommer Magnolia,2017,2017-04-10 13:46:00,7
5982,44512,Permitted Site,Prunus x yedoensis :: Yoshino Cherry,131 Fairmount St,1.0,Sidewalk: Curb side : Cutout,Private,3/26/01 0:00,10,4x4,37.73884935,-122.426321,Prunus,Prunus x,Yoshino Cherry,2001,2001-03-26 00:00:00,23
5983,15738,DPW Maintained,Washingtonia robusta :: Mexican Fan Palm,4516 Mission St,1.0,Sidewalk: Curb side : Cutout,Private,12/18/97 0:00,12,3X3,37.72555467,-122.4342628,Washingtonia,Washingtonia robusta,Mexican Fan Palm,1997,1997-12-18 00:00:00,27
5987,43328,DPW Maintained,Arbutus 'Marina' :: Hybrid Strawberry Tree,343 London St,1.0,Sidewalk: Curb side : Cutout,Private,7/13/00 0:00,12,,37.7236076,-122.4344832,Arbutus,Arbutus 'Marina',Hybrid Strawberry Tree,2000,2000-07-13 00:00:00,24
5989,26354,DPW Maintained,Tristaniopsis laurina :: Swamp Myrtle,2720 San Jose Ave,1.0,Sidewalk: Curb side : Cutout,DPW,6/26/97 0:00,7,3x3,37.71366992,-122.4528022,Tristaniopsis,Tristaniopsis laurina,Swamp Myrtle,1997,1997-06-26 00:00:00,27
5990,4983,DPW Maintained,Pinus radiata :: Monterey Pine,5300 Diamond Heights Blvd,2.0,Sidewalk: Curb side : Cutout,DPW,7/10/17 0:00,3,3X3,37.74335512,-122.4375467,Pinus,Pinus radiata,Monterey Pine,2017,2017-07-10 00:00:00,7
5991,9608,DPW Maintained,Maytenus boaria :: Mayten,1386 Golden Gate Ave,2.0,Sidewalk: Curb side : Cutout,DPW,11/11/94 0:00,6,3X3,37.77953035,-122.4333162,Maytenus,Maytenus boaria,Mayten,1994,1994-11-11 00:00:00,30
5994,90664,DPW Maintained,Callistemon citrinus :: Lemon Bottlebrush,3600X Cabrillo St,2.0,Sidewalk: Curb side : Cutout,DPW,4/7/08 0:00,3,3x3,37.77390998,-122.4975458,Callistemon,Callistemon citrinus,Lemon Bottlebrush,2008,2008-04-07 00:00:00,16
5997,26453,DPW Maintained,Lyonothamnus floribundus subsp. asplenifolius :: Santa Cruz Ironwood,401X Keith St,1.0,Sidewalk: Curb side : Cutout,DPW,6/4/98 0:00,3,3X3,37.73823537,-122.381325,Lyonothamnus,Lyonothamnus floribundus,Santa Cruz Ironwood,1998,1998-06-04 00:00:00,26
6007,41045,DPW Maintained,Platanus x hispanica :: Sycamore: London Plane,3035 Pacific Ave,1.0,Sidewalk: Curb side : Cutout,Private,10/22/99 0:00,9,,37.79194788,-122.4452384,Platanus,Platanus x,Sycamore: London Plane,1999,1999-10-22 00:00:00,25
6012,36716,Permitted Site,Magnolia grandiflora :: Southern Magnolia,217 Lexington St,1.0,Sidewalk: Curb side : Cutout,Private,2/18/15 0:00,3,,37.75985885,-122.4205418,Magnolia,Magnolia grandiflora,Southern Magnolia,2015,2015-02-18 00:00:00,9
6015,29694,DPW Maintained,Lophostemon confertus :: Brisbane Box,199X Hahn St,2.0,Sidewalk: Curb side : Cutout,DPW,3/17/06 0:00,3,3X3,37.71193929,-122.4158975,Lophostemon,Lophostemon confertus,Brisbane Box,2006,2006-03-17 00:00:00,18
6016,5735,DPW Maintained,Ginkgo biloba :: Maidenhair Tree,1731 Dolores St,1.0,Sidewalk: Curb side : Cutout,DPW,4/28/08 0:00,50,3x3,37.74183569,-122.4240501,Ginkgo,Ginkgo biloba,Maidenhair Tree,2008,2008-04-28 00:00:00,16
6017,159341,DPW Maintained,Pyrus kawakamii :: Evergreen Pear,40 Whipple Ave,1.0,Sidewalk: Curb side : Cutout,Private,10/5/17 13:44,3,Width 0ft,37.71105587,-122.447992,Pyrus,Pyrus kawakamii,Evergreen Pear,2017,2017-10-05 13:44:00,7
6019,61608,DPW Maintained,Pittosporum undulatum :: Victorian Box,46 Tamalpais Ter,1.0,Sidewalk: Curb side : Cutout,Private,9/7/84 0:00,10,,37.77771368,-122.4486759,Pittosporum,Pittosporum undulatum,Victorian Box,1984,1984-09-07 00:00:00,40
6037,254175,DPW Maintained,Laurus nobilis :: Sweet Bay: Grecian Laurel,1089 Chestnut St,5.0,Sidewalk: Curb side : Cutout,Private,1/17/18 0:00,3,3x3,37.80267,-122.4212566,Laurus,Laurus nobilis,Sweet Bay: Grecian Laurel,2018,2018-01-17 00:00:00,6
6038,265337,Permitted Site,Acer rubrum :: Red Maple,1401 Bryant St,3.0,Sidewalk: Curb side : Cutout,Private,2/22/21 0:00,3,6x6,37.76852429,-122.4106716,Acer,Acer rubrum,Red Maple,2021,2021-02-22 00:00:00,3
6039,112530,DPW Maintained,Rhamnus alaternus :: Italian Buckthorn,435 Broadway,1.0,Sidewalk: Curb side : Cutout,DPW,3/24/16 7:26,3,3x3,37.79804343,-122.4045839,Rhamnus,Rhamnus alaternus,Italian Buckthorn,2016,2016-03-24 07:26:00,8
6044,42898,DPW Maintained,Acacia baileyana :: Bailey's Acacia,2060 Wawona St,1.0,Sidewalk: Curb side : Cutout,Private,6/13/02 0:00,7,,37.7373732,-122.4891079,Acacia,Acacia baileyana,Bailey's Acacia,2002,2002-06-13 00:00:00,22
6048,84781,DPW Maintained,Pittosporum undulatum :: Victorian Box,227 16th Ave,1.0,Sidewalk: Curb side : Cutout,Private,4/9/07 0:00,10,3x3,37.78377464,-122.475412,Pittosporum,Pittosporum undulatum,Victorian Box,2007,2007-04-09 00:00:00,17
6049,28393,Permitted Site,Tristaniopsis laurina :: Swamp Myrtle,1800 Ocean Ave,1.0,Sidewalk: Curb side : Cutout,Private,4/1/03 0:00,3,3X3,37.72501894,-122.4611798,Tristaniopsis,Tristaniopsis laurina,Swamp Myrtle,2003,2003-04-01 00:00:00,21
6061,68254,DPW Maintained,Tristaniopsis laurina 'Elegant' :: Small-leaf Tristania 'Elegant',3835 Scott St,1.0,Sidewalk: Curb side : Cutout,Private,8/9/93 0:00,10,,37.80536839,-122.4423038,Tristaniopsis,Tristaniopsis laurina,Small-leaf Tristania 'Elegant',1993,1993-08-09 00:00:00,31
6067,1762,DPW Maintained,Eucalyptus nicholii :: Nichol's Willow-Leafed Peppermint,2000X Bay Shore Blvd,3.0,Sidewalk: Curb side : Cutout,DPW,12/27/91 0:00,12,3x3,37.71533476,-122.3991244,Eucalyptus,Eucalyptus nicholii,Nichol's Willow-Leafed Peppermint,1991,1991-12-27 00:00:00,33
6075,43384,DPW Maintained,Eucalyptus polyanthemos :: Silver Dollar Eucalyptus,127 06th Ave,1.0,Sidewalk: Curb side : Cutout,Private,7/24/00 0:00,16,,37.78612126,-122.4647385,Eucalyptus,Eucalyptus polyanthemos,Silver Dollar Eucalyptus,2000,2000-07-24 00:00:00,24
6076,59887,DPW Maintained,Acacia melanoxylon :: Blackwood Acacia,21 Atalaya Ter,1.0,Sidewalk: Curb side : Cutout,Private,11/7/81 0:00,23,,37.77625534,-122.4476123,Acacia,Acacia melanoxylon,Blackwood Acacia,1981,1981-11-07 00:00:00,43
6078,18384,DPW Maintained,Magnolia grandiflora :: Southern Magnolia,808 Potrero Ave,1.0,Sidewalk: Curb side : Cutout,Private,1/6/98 0:00,12,3x3,37.75902694,-122.4070543,Magnolia,Magnolia grandiflora,Southern Magnolia,1998,1998-01-06 00:00:00,26
6079,35583,DPW Maintained,Prunus blireiana :: Flowering Plum,3600 Fillmore St,2.0,Sidewalk: Curb side : Cutout,Private,3/25/98 0:00,7,,37.80292403,-122.4365988,Prunus,Prunus blireiana,Flowering Plum,1998,1998-03-25 00:00:00,26
6082,244299,DPW Maintained,Shrub :: Shrub,350 Octavia St,2.0,Sidewalk: Curb side : Cutout,DPW,4/20/17 11:32,3,Width 0ft,37.77541814,-122.4240981,Shrub,Shrub ::,Shrub,2017,2017-04-20 11:32:00,7
6083,22905,DPW Maintained,Lophostemon confertus :: Brisbane Box,245 Valencia St,4.0,Sidewalk: Curb side : Cutout,Private,5/8/97 0:00,16,,37.7689814,-122.4221654,Lophostemon,Lophostemon confertus,Brisbane Box,1997,1997-05-08 00:00:00,27
6089,145137,DPW Maintained,Podocarpus gracilor :: Fern Pine,320 10th Ave,1.0,Sidewalk: Curb side : Cutout,Private,2/4/21 0:00,3,Width 4ft,37.78234982,-122.4685995,Podocarpus,Podocarpus gracilor,Fern Pine,2021,2021-02-04 00:00:00,3
6094,118928,DPW Maintained,Myoporum laetum :: Myoporum,875 La Playa,4.0,Sidewalk: Curb side : Cutout,Private,3/29/18 0:00,3,Width 4ft,37.7716633,-122.5100073,Myoporum,Myoporum laetum,Myoporum,2018,2018-03-29 00:00:00,6
6097,213791,DPW Maintained,Pyrus kawakamii :: Evergreen Pear,209 Granada Ave,1.0,Sidewalk: Curb side : Cutout,Private,4/13/20 0:00,3,Width 3ft,37.72218082,-122.4572427,Pyrus,Pyrus kawakamii,Evergreen Pear,2020,2020-04-13 00:00:00,4
6111,9359,DPW Maintained,Pittosporum undulatum :: Victorian Box,248 Gold Mine Dr,1.0,Sidewalk: Curb side : Cutout,Private,3/11/06 0:00,3,2X2,37.74167211,-122.4390417,Pittosporum,Pittosporum undulatum,Victorian Box,2006,2006-03-11 00:00:00,18
6114,86505,DPW Maintained,Tristaniopsis laurina :: Swamp Myrtle,1374 27th Ave,1.0,Sidewalk: Curb side : Cutout,DPW,6/5/12 0:00,3,3x3,37.7618064,-122.4855301,Tristaniopsis,Tristaniopsis laurina,Swamp Myrtle,2012,2012-06-05 00:00:00,12
6117,117446,DPW Maintained,Magnolia grandiflora :: Southern Magnolia,1442 Sacramento St,1.0,Sidewalk: Curb side : Cutout,Private,6/14/16 0:00,3,,37.79206834,-122.4168013,Magnolia,Magnolia grandiflora,Southern Magnolia,2016,2016-06-14 00:00:00,8
6120,117599,DPW Maintained,Ginkgo biloba :: Maidenhair Tree,329x IVY ST,8.0,Sidewalk: Curb side : Cutout,Private,6/29/16 0:00,3,3x6,37.77683621,-122.4237729,Ginkgo,Ginkgo biloba,Maidenhair Tree,2016,2016-06-29 00:00:00,8
6123,6447,DPW Maintained,Ginkgo biloba :: Maidenhair Tree,1199 Evans Ave,1.0,Sidewalk: Curb side : Cutout,DPW,11/20/15 7:28,3,3X3,37.73859523,-122.3809042,Ginkgo,Ginkgo biloba,Maidenhair Tree,2015,2015-11-20 07:28:00,9
6124,61172,DPW Maintained,Callistemon viminalis :: Weeping Bottlebrush,346 21st Ave,1.0,Sidewalk: Curb side : Cutout,Private,7/24/89 0:00,11,,37.78134815,-122.4804492,Callistemon,Callistemon viminalis,Weeping Bottlebrush,1989,1989-07-24 00:00:00,35
6131,65517,DPW Maintained,Pyrus kawakamii :: Evergreen Pear,2028 Filbert St,1.0,Sidewalk: Curb side : Cutout,Private,2/9/90 0:00,9,,37.79844254,-122.4329233,Pyrus,Pyrus kawakamii,Evergreen Pear,1990,1990-02-09 00:00:00,34
6132,46647,DPW Maintained,Ginkgo biloba :: Maidenhair Tree,118 17th Ave,1.0,Sidewalk: Curb side : Cutout,Private,7/24/13 0:00,1,,37.78576351,-122.4764687,Ginkgo,Ginkgo biloba,Maidenhair Tree,2013,2013-07-24 00:00:00,11
6140,129941,DPW Maintained,Lophostemon confertus :: Brisbane Box,2300 Gough St,1.0,Sidewalk: Curb side : Cutout,Private,6/9/11 0:00,5,Width 4ft,37.79457337,-122.4264644,Lophostemon,Lophostemon confertus,Brisbane Box,2011,2011-06-09 00:00:00,13
6143,30698,DPW Maintained,Podocarpus macrophyllus :: Yew Pine,240 Lily St,2.0,Sidewalk: Curb side : Cutout,Private,1/31/95 0:00,6,,37.77427448,-122.4249618,Podocarpus,Podocarpus macrophyllus,Yew Pine,1995,1995-01-31 00:00:00,29
6152,108777,Permitted Site,Arbutus 'Marina' :: Hybrid Strawberry Tree,500X Lathrop Ave,16.0,Sidewalk: Curb side : Cutout,Private,1/6/15 0:00,3,,37.71019172,-122.3976987,Arbutus,Arbutus 'Marina',Hybrid Strawberry Tree,2015,2015-01-06 00:00:00,9
6155,96728,DPW Maintained,Magnolia champaca :: Champa,1512 Jerrold Ave,1.0,Sidewalk: Curb side : Cutout,Private,6/30/11 0:00,3,3x3,37.73802724,-122.3878772,Magnolia,Magnolia champaca,Champa,2011,2011-06-30 00:00:00,13
6156,33266,DPW Maintained,Platanus x hispanica :: Sycamore: London Plane,1000 California St,7.0,Sidewalk: Curb side : Cutout,Private,11/13/96 0:00,16,,37.79180707,-122.4117877,Platanus,Platanus x,Sycamore: London Plane,1996,1996-11-13 00:00:00,28
6160,54661,DPW Maintained,Prunus serrulata :: Ornamental Cherry,345 Peninsula Ave,1.0,Sidewalk: Curb side : Cutout,Private,7/27/72 0:00,2,,37.71094938,-122.3992458,Prunus,Prunus serrulata,Ornamental Cherry,1972,2072-07-27 00:00:00,-48
6161,89432,DPW Maintained,Laurus x 'Saratoga' :: Hybrid Laurel,2732 Anza St,1.0,Sidewalk: Curb side : Cutout,DPW,2/29/08 0:00,3,3x3,37.77854379,-122.4774631,Laurus,Laurus x,Hybrid Laurel,2008,2008-02-29 00:00:00,16
6162,115434,DPW Maintained,Magnolia doltsopa :: Himalayan Magnolia,563 Lisbon St,1.0,Sidewalk: Curb side : Cutout,Private,2/1/16 0:00,3,,37.71943661,-122.4354473,Magnolia,Magnolia doltsopa,Himalayan Magnolia,2016,2016-02-01 00:00:00,8
6163,46401,DPW Maintained,Metrosideros excelsa :: New Zealand Xmas Tree,2310 48th Ave,1.0,Sidewalk: Curb side : Cutout,Private,5/21/02 0:00,0,,37.74331284,-122.5067905,Metrosideros,Metrosideros excelsa,New Zealand Xmas Tree,2002,2002-05-21 00:00:00,22
6164,5105,DPW Maintained,Eriobotrya deflexa :: Bronze Loquat,2638 Diamond St,1.0,Sidewalk: Curb side : Cutout,DPW,6/10/02 0:00,3,3X3,37.73671499,-122.4346055,Eriobotrya,Eriobotrya deflexa,Bronze Loquat,2002,2002-06-10 00:00:00,22
6166,87920,DPW Maintained,Pyrus calleryana :: Ornamental Pear,1395 Lyon St,1.0,Sidewalk: Curb side : Cutout,Private,6/18/08 0:00,5,3x3,37.78353488,-122.4446973,Pyrus,Pyrus calleryana,Ornamental Pear,2008,2008-06-18 00:00:00,16
6171,144284,DPW Maintained,Agonis flexuosa :: Peppermint Willow,770 45th Ave,1.0,Sidewalk: Curb side : Cutout,Private,1/16/20 0:00,3,Width 3ft,37.77398775,-122.5057109,Agonis,Agonis flexuosa,Peppermint Willow,2020,2020-01-16 00:00:00,4
6173,853,DPW Maintained,Acer rubrum :: Red Maple,370 Alemany Blvd,1.0,Sidewalk: Curb side : Cutout,DPW,3/6/06 0:00,3,3X3,37.73352105,-122.4134644,Acer,Acer rubrum,Red Maple,2006,2006-03-06 00:00:00,18
6176,4894,DPW Maintained,Magnolia grandiflora 'Samuel Sommer' :: Samuel Sommer Magnolia,745X Mansell St,2.0,Sidewalk: Curb side : Cutout,DPW,3/29/07 0:00,3,3X3,37.71945584,-122.4083036,Magnolia,Magnolia grandiflora,Samuel Sommer Magnolia,2007,2007-03-29 00:00:00,17
6186,43031,DPW Maintained,Eriobotrya deflexa :: Bronze Loquat,2121 26th St,2.0,Sidewalk: Curb side : Cutout,Private,7/6/00 0:00,5,,37.75062278,-122.400644,Eriobotrya,Eriobotrya deflexa,Bronze Loquat,2000,2000-07-06 00:00:00,24
6188,147652,DPW Maintained,Metrosideros excelsa :: New Zealand Xmas Tree,375 16th Ave,1.0,Sidewalk: Curb side : Cutout,Private,5/22/21 0:00,3,Width 4ft,37.78081672,-122.4751953,Metrosideros,Metrosideros excelsa,New Zealand Xmas Tree,2021,2021-05-22 00:00:00,3
6190,15185,DPW Maintained,Lophostemon confertus :: Brisbane Box,1060 Mission St,2.0,Sidewalk: Curb side : Cutout,DPW,3/24/95 0:00,12,3X3,37.77995486,-122.4101182,Lophostemon,Lophostemon confertus,Brisbane Box,1995,1995-03-24 00:00:00,29
6204,49992,DPW Maintained,Pyrus kawakamii :: Evergreen Pear,300 Linden St,4.0,Sidewalk: Curb side : Cutout,Private,7/23/03 0:00,6,,37.77640966,-122.4231886,Pyrus,Pyrus kawakamii,Evergreen Pear,2003,2003-07-23 00:00:00,21
6205,46356,DPW Maintained,Ficus microcarpa nitida 'Green Gem' :: Indian Laurel Fig Tree 'Green Gem',1032 Broadway,5.0,Sidewalk: Curb side : Cutout,Private,5/16/02 0:00,9,,37.7969892,-122.4143415,Ficus,Ficus microcarpa,Indian Laurel Fig Tree 'Green Gem',2002,2002-05-16 00:00:00,22
6211,66463,DPW Maintained,Metrosideros excelsa :: New Zealand Xmas Tree,51 Wood St,1.0,Sidewalk: Curb side : Cutout,Private,1/9/91 0:00,10,,37.7830783,-122.4492912,Metrosideros,Metrosideros excelsa,New Zealand Xmas Tree,1991,1991-01-09 00:00:00,33
6214,57816,DPW Maintained,Cupaniopsis anacardioides :: Carrotwood,953 De Haro St,1.0,Sidewalk: Curb side : Cutout,Private,7/22/05 0:00,3,,37.75827051,-122.4008736,Cupaniopsis,Cupaniopsis anacardioides,Carrotwood,2005,2005-07-22 00:00:00,19
6216,32449,DPW Maintained,Crataegus phaenopyrum :: Washington Hawthorn,4351 17th St,1.0,Sidewalk: Curb side : Cutout,Private,10/10/96 0:00,4,,37.7620235,-122.4416693,Crataegus,Crataegus phaenopyrum,Washington Hawthorn,1996,1996-10-10 00:00:00,28
6217,14736,Permitted Site,Maytenus boaria :: Mayten,895 McAllister St,1.0,Sidewalk: Curb side : Cutout,Private,5/21/92 0:00,4,4x4,37.77913288,-122.4263116,Maytenus,Maytenus boaria,Mayten,1992,1992-05-21 00:00:00,32
6222,62127,DPW Maintained,Tristaniopsis laurina :: Swamp Myrtle,690 Cayuga Ave,1.0,Sidewalk: Curb side : Cutout,Private,8/29/85 0:00,7,,37.72749451,-122.436696,Tristaniopsis,Tristaniopsis laurina,Swamp Myrtle,1985,1985-08-29 00:00:00,39
6231,66232,Permitted Site,Eriobotrya deflexa :: Bronze Loquat,218 Lakeview Ave,1.0,Sidewalk: Curb side : Cutout,Private,10/24/90 0:00,12,,37.71711747,-122.4519963,Eriobotrya,Eriobotrya deflexa,Bronze Loquat,1990,1990-10-24 00:00:00,34
6233,32511,DPW Maintained,Crataegus phaenopyrum :: Washington Hawthorn,730 Moultrie St,1.0,Sidewalk: Curb side : Cutout,Private,10/15/96 0:00,6,2x3,37.73559766,-122.4161547,Crataegus,Crataegus phaenopyrum,Washington Hawthorn,1996,1996-10-15 00:00:00,28
6238,145174,DPW Maintained,Tristaniopsis laurina :: Swamp Myrtle,180 07th Ave,3.0,Sidewalk: Curb side : Cutout,Private,3/9/21 0:00,3,Width 3ft,37.78526773,-122.4655802,Tristaniopsis,Tristaniopsis laurina,Swamp Myrtle,2021,2021-03-09 00:00:00,3
6239,144820,DPW Maintained,Olea europaea 'Wilsonii' :: Wilson Olive Semi-fruitless,790 20th Ave,1.0,Sidewalk: Curb side : Cutout,DPW,11/18/19 0:00,0,Width 6ft,37.77307695,-122.4787841,Olea,Olea europaea,Wilson Olive Semi-fruitless,2019,2019-11-18 00:00:00,5
6241,87433,DPW Maintained,Acer rubrum :: Red Maple,598X Alemany Blvd,2.0,Sidewalk: Curb side : Cutout,DPW,4/22/08 0:00,3,3x3,37.73217056,-122.4212622,Acer,Acer rubrum,Red Maple,2008,2008-04-22 00:00:00,16
6244,31309,DPW Maintained,Melaleuca nesophila :: Pink Melaleuca,577 Birch St,2.0,Sidewalk: Curb side : Cutout,Private,4/12/95 0:00,0,,37.77784241,-122.4261372,Melaleuca,Melaleuca nesophila,Pink Melaleuca,1995,1995-04-12 00:00:00,29
6248,11664,DPW Maintained,Arbutus 'Marina' :: Hybrid Strawberry Tree,700X Junipero Serra Blvd,1.0,Sidewalk: Curb side : Cutout,DPW,1/18/08 0:00,3,2x2,37.72672368,-122.4722325,Arbutus,Arbutus 'Marina',Hybrid Strawberry Tree,2008,2008-01-18 00:00:00,16
6251,409,DPW Maintained,Tristaniopsis laurina :: Swamp Myrtle,3838 19th Ave,1.0,Sidewalk: Curb side : Cutout,Private,2/24/08 0:00,3,2X3,37.71897148,-122.4740214,Tristaniopsis,Tristaniopsis laurina,Swamp Myrtle,2008,2008-02-24 00:00:00,16
6252,46315,Permitted Site,Tristaniopsis laurina :: Swamp Myrtle,763 Andover St,1.0,Sidewalk: Curb side : Cutout,Private,2/6/02 0:00,3,,37.73357816,-122.4168538,Tristaniopsis,Tristaniopsis laurina,Swamp Myrtle,2002,2002-02-06 00:00:00,22
6253,50924,DPW Maintained,Magnolia grandiflora :: Southern Magnolia,360 04th St,6.0,Sidewalk: Curb side : Cutout,Private,9/8/05 0:00,14,,37.78120862,-122.4002974,Magnolia,Magnolia grandiflora,Southern Magnolia,2005,2005-09-08 00:00:00,19
6255,68698,DPW Maintained,Olea europaea :: Olive Tree,160 Funston Ave,1.0,Sidewalk: Curb side : Cutout,Private,11/2/93 0:00,3,,37.78524072,-122.4720204,Olea,Olea europaea,Olive Tree,1993,1993-11-02 00:00:00,31
6262,7336,DPW Maintained,Pyrus calleryana :: Ornamental Pear,2100 Fillmore St,1.0,Sidewalk: Curb side : Cutout,DPW,3/22/16 0:00,3,3X3,37.78908285,-122.4337918,Pyrus,Pyrus calleryana,Ornamental Pear,2016,2016-03-22 00:00:00,8
6264,2159,DPW Maintained,Metrosideros excelsa :: New Zealand Xmas Tree,700X Mansell St,1.0,Sidewalk: Curb side : Cutout,DPW,6/10/92 0:00,6,3x100,37.71983553,-122.4082327,Metrosideros,Metrosideros excelsa,New Zealand Xmas Tree,1992,1992-06-10 00:00:00,32
6270,89596,DPW Maintained,Tristaniopsis laurina 'Elegant' :: Small-leaf Tristania 'Elegant',4433 Anza St,1.0,Sidewalk: Curb side : Cutout,DPW,3/27/08 0:00,3,3x3,37.77757813,-122.495895,Tristaniopsis,Tristaniopsis laurina,Small-leaf Tristania 'Elegant',2008,2008-03-27 00:00:00,16
6290,108005,DPW Maintained,Jacaranda mimosifolia :: Jacaranda,520 Hayes St,3.0,Sidewalk: Curb side : Cutout,Private,11/1/20 0:00,3,3x3,37.77667734,-122.4251662,Jacaranda,Jacaranda mimosifolia,Jacaranda,2020,2020-11-01 00:00:00,4
6294,90231,DPW Maintained,Metrosideros excelsa :: New Zealand Xmas Tree,2738 Balboa St,1.0,Sidewalk: Curb side : Cutout,DPW,4/21/08 0:00,3,3x3,37.77620118,-122.4884542,Metrosideros,Metrosideros excelsa,New Zealand Xmas Tree,2008,2008-04-21 00:00:00,16
6300,47465,DPW Maintained,Lophostemon confertus :: Brisbane Box,1903 Broderick St,1.0,Sidewalk: Curb side : Cutout,Private,5/14/02 0:00,11,,37.78821889,-122.4422553,Lophostemon,Lophostemon confertus,Brisbane Box,2002,2002-05-14 00:00:00,22
6303,101850,DPW Maintained,Tristaniopsis laurina :: Swamp Myrtle,1001X Rhode Island St,4.0,Sidewalk: Property side : Cutout,Private,12/31/15 0:00,2,3x3,37.75694406,-122.4017048,Tristaniopsis,Tristaniopsis laurina,Swamp Myrtle,2015,2015-12-31 00:00:00,9
6304,25778,DPW Maintained,Arbutus 'Marina' :: Hybrid Strawberry Tree,1707 Geneva Ave,1.0,Sidewalk: Curb side : Cutout,DPW,4/18/97 0:00,18,2X3,37.71118613,-122.4264865,Arbutus,Arbutus 'Marina',Hybrid Strawberry Tree,1997,1997-04-18 00:00:00,27
6305,54817,DPW Maintained,Pyrus kawakamii :: Evergreen Pear,1414 Underwood Ave,1.0,Sidewalk: Curb side : Cutout,Private,12/6/07 0:00,5,3x3,37.72794281,-122.3884055,Pyrus,Pyrus kawakamii,Evergreen Pear,2007,2007-12-06 00:00:00,17
6306,195298,DPW Maintained,Platanus x hispanica :: Sycamore: London Plane,201 Market St,5.0,Sidewalk: Curb side : Cutout,DPW,10/28/05 0:00,3,Width 4ft,37.79255303,-122.3970495,Platanus,Platanus x,Sycamore: London Plane,2005,2005-10-28 00:00:00,19
6311,59099,DPW Maintained,Fraxinus spp :: Ash Spp,488 08th Ave,1.0,Sidewalk: Curb side : Cutout,Private,4/23/80 0:00,13,,37.77929826,-122.4662283,Fraxinus,Fraxinus spp,Ash Spp,1980,1980-04-23 00:00:00,44
6314,54972,DPW Maintained,Ligustrum lucidum :: Glossy Privet,566 09th Ave,1.0,Sidewalk: Curb side : Cutout,Private,9/11/72 0:00,6,,37.77773178,-122.4671955,Ligustrum,Ligustrum lucidum,Glossy Privet,1972,2072-09-11 00:00:00,-48
6315,97054,DPW Maintained,Eriobotrya deflexa :: Bronze Loquat,214 Gaven St,1.0,Sidewalk: Curb side : Cutout,Private,8/17/11 0:00,5,3x3,37.73303548,-122.4099487,Eriobotrya,Eriobotrya deflexa,Bronze Loquat,2011,2011-08-17 00:00:00,13
6318,56857,DPW Maintained,Maytenus boaria :: Mayten,2600 Noriega St,1.0,Sidewalk: Curb side : Cutout,Private,2/4/86 0:00,6,,37.75368113,-122.491644,Maytenus,Maytenus boaria,Mayten,1986,1986-02-04 00:00:00,38
6319,255711,Permitted Site,Magnolia grandiflora 'Russet' :: Russet Magnolia,280 32nd Ave,1.0,Sidewalk: Curb side : Cutout,Private,6/29/18 0:00,3,3x3,37.78391,-122.4924676,Magnolia,Magnolia grandiflora,Russet Magnolia,2018,2018-06-29 00:00:00,6
6322,25503,DPW Maintained,Phoenix canariensis :: Canary Island Date Palm,1900X Market St,3.0,Median : Cutout,DPW,4/1/93 0:00,36,8,37.77024805,-122.4254818,Phoenix,Phoenix canariensis,Canary Island Date Palm,1993,1993-04-01 00:00:00,31
6323,229982,DPW Maintained,Magnolia grandiflora :: Southern Magnolia,560 Chenery St,1.0,Sidewalk: Curb side : Cutout,Private,11/24/80 0:00,12,Width 2ft,37.73485373,-122.4314327,Magnolia,Magnolia grandiflora,Southern Magnolia,1980,1980-11-24 00:00:00,44
6324,144166,DPW Maintained,Tristaniopsis laurina :: Swamp Myrtle,656 41st Ave,1.0,Sidewalk: Curb side : Cutout,Private,1/25/20 11:23,0,Width 4ft,37.77636181,-122.5015842,Tristaniopsis,Tristaniopsis laurina,Swamp Myrtle,2020,2020-01-25 11:23:00,4
6326,91810,DPW Maintained,Platanus x hispanica 'Yarwood' :: Yarwood Sycamore,2701x Harrison St,1.0,Sidewalk: Curb side : Cutout,DPW,3/7/07 0:00,3,3x3,37.75418627,-122.4119738,Platanus,Platanus x,Yarwood Sycamore,2007,2007-03-07 00:00:00,17
6328,162247,DPW Maintained,Lophostemon confertus :: Brisbane Box,51 Olmstead St,1.0,Sidewalk: Curb side : Cutout,Private,10/23/20 0:00,3,Width 0ft,37.72259981,-122.4022847,Lophostemon,Lophostemon confertus,Brisbane Box,2020,2020-10-23 00:00:00,4
6333,29732,Permitted Site,Tristaniopsis laurina 'Elegant' :: Small-leaf Tristania 'Elegant',600X Green St,2.0,Sidewalk: Curb side : Cutout,Private,8/19/06 0:00,3,3x3,37.79952497,-122.4090707,Tristaniopsis,Tristaniopsis laurina,Small-leaf Tristania 'Elegant',2006,2006-08-19 00:00:00,18
6334,43904,Permitted Site,Prunus serrulata :: Ornamental Cherry,1050 York St,3.0,Sidewalk: Curb side : Cutout,SFUSD,4/26/02 0:00,6,3x3,37.75523289,-122.4085092,Prunus,Prunus serrulata,Ornamental Cherry,2002,2002-04-26 00:00:00,22
6337,53731,DPW Maintained,Callistemon citrinus :: Lemon Bottlebrush,137 Topeka Ave,1.0,Sidewalk: Curb side : Cutout,Private,1/7/72 0:00,11,3x3,37.73376323,-122.3987641,Callistemon,Callistemon citrinus,Lemon Bottlebrush,1972,2072-01-07 00:00:00,-48
6338,86576,DPW Maintained,Prunus serrulata :: Ornamental Cherry,2501 27th Ave,1.0,Sidewalk: Curb side : Cutout,DPW,1/5/07 0:00,3,3x3,37.74063688,-122.484198,Prunus,Prunus serrulata,Ornamental Cherry,2007,2007-01-05 00:00:00,17
6343,24172,DPW Maintained,Melaleuca quinquenervia :: Cajeput,101X Whitney Young Cir,5.0,Sidewalk: Curb side : Cutout,DPW,4/26/00 0:00,12,3x3,37.7345714,-122.3849101,Melaleuca,Melaleuca quinquenervia,Cajeput,2000,2000-04-26 00:00:00,24
6344,69003,DPW Maintained,Arbutus 'Marina' :: Hybrid Strawberry Tree,2063 44th Ave,1.0,Sidewalk: Curb side : Cutout,Private,1/5/94 0:00,5,,37.74816714,-122.5029986,Arbutus,Arbutus 'Marina',Hybrid Strawberry Tree,1994,1994-01-05 00:00:00,30
6348,48432,DPW Maintained,Ficus microcarpa nitida 'Green Gem' :: Indian Laurel Fig Tree 'Green Gem',1190 Sacramento St,3.0,Sidewalk: Curb side : Cutout,Private,7/26/02 0:00,11,,37.79262161,-122.412476,Ficus,Ficus microcarpa,Indian Laurel Fig Tree 'Green Gem',2002,2002-07-26 00:00:00,22
6357,86248,DPW Maintained,Prunus serrulata :: Ornamental Cherry,2286 25th Ave,1.0,Sidewalk: Curb side : Cutout,DPW,12/15/06 0:00,3,3x3,37.74492066,-122.4821984,Prunus,Prunus serrulata,Ornamental Cherry,2006,2006-12-15 00:00:00,18
6362,59931,DPW Maintained,Geijera parviflora :: Australian Willow,521 Central Ave,1.0,Sidewalk: Curb side : Cutout,Private,11/25/81 0:00,12,,37.7745243,-122.4445612,Geijera,Geijera parviflora,Australian Willow,1981,1981-11-25 00:00:00,43
6366,44126,DPW Maintained,Platanus x hispanica :: Sycamore: London Plane,1455 Market St,2.0,Sidewalk: Curb side : Cutout,Private,12/6/00 0:00,11,,37.77593026,-122.4180514,Platanus,Platanus x,Sycamore: London Plane,2000,2000-12-06 00:00:00,24
6368,13063,Planning Code 138.1 required,Olea europaea 'Fruitless' :: Fruitless Olive,590 Lombard St,2.0,Sidewalk: Curb side : Cutout,DPW,12/29/17 0:00,3,2X2,37.80312026,-122.411138,Olea,Olea europaea,Fruitless Olive,2017,2017-12-29 00:00:00,7
6373,57611,DPW Maintained,Prunus serrulata 'Kwanzan' :: Kwanzan Flowering Cherry,356 Connecticut St,1.0,Sidewalk: Curb side : Cutout,Private,11/12/76 0:00,13,,37.76180384,-122.397531,Prunus,Prunus serrulata,Kwanzan Flowering Cherry,1976,1976-11-12 00:00:00,48
6374,31868,DPW Maintained,Prunus cerasifera :: Cherry Plum,3633 Broderick St,1.0,Sidewalk: Curb side : Cutout,Private,11/29/99 0:00,7,,37.8040016,-122.4454543,Prunus,Prunus cerasifera,Cherry Plum,1999,1999-11-29 00:00:00,25
6377,128078,Permitted Site,Magnolia grandiflora 'Saint Mary' :: Saint Mary Magnolia,245 North Point St,11.0,Sidewalk: Curb side : Cutout,Private,1/17/20 12:25,3,Width 4ft,37.80681768,-122.4111125,Magnolia,Magnolia grandiflora,Saint Mary Magnolia,2020,2020-01-17 12:25:00,4
6385,52253,DPW Maintained,Eriobotrya deflexa :: Bronze Loquat,477 Harkness Ave,1.0,Sidewalk: Curb side : Cutout,Private,11/22/05 0:00,6,,37.7183143,-122.4065776,Eriobotrya,Eriobotrya deflexa,Bronze Loquat,2005,2005-11-22 00:00:00,19
6388,18280,DPW Maintained,Maytenus boaria :: Mayten,1970 Post St,2.0,Sidewalk: Curb side : Cutout,DPW,1/8/04 0:00,3,4X4,37.78507174,-122.4342667,Maytenus,Maytenus boaria,Mayten,2004,2004-01-08 00:00:00,20
6393,101974,DPW Maintained,Tristaniopsis laurina 'Elegant' :: Small-leaf Tristania 'Elegant',1230 19th St,1.0,Sidewalk: Curb side : Cutout,Private,12/11/12 0:00,3,3x3,37.76145654,-122.395089,Tristaniopsis,Tristaniopsis laurina,Small-leaf Tristania 'Elegant',2012,2012-12-11 00:00:00,12
6395,39598,DPW Maintained,Gleditsia triacanthos 'Sunburst' :: Sunburst Honey Locust,365 Vermont St,3.0,Sidewalk: Curb side : Cutout,Private,12/29/98 0:00,6,,37.76514628,-122.4044494,Gleditsia,Gleditsia triacanthos,Sunburst Honey Locust,1998,1998-12-29 00:00:00,26
6400,31754,DPW Maintained,Prunus cerasifera :: Cherry Plum,2412 22nd Ave,1.0,Sidewalk: Curb side : Cutout,Private,6/19/95 0:00,5,,37.74257066,-122.4787979,Prunus,Prunus cerasifera,Cherry Plum,1995,1995-06-19 00:00:00,29
6401,32350,DPW Maintained,Pyrus calleryana 'Aristocrat' :: Aristocrat Callery Pear,2180 Bryant St,5.0,Sidewalk: Curb side : Cutout,Private,10/3/96 0:00,11,,37.75936117,-122.4099649,Pyrus,Pyrus calleryana,Aristocrat Callery Pear,1996,1996-10-03 00:00:00,28
6404,24542,DPW Maintained,Ligustrum lucidum :: Glossy Privet,500X Cortland Ave,6.0,Sidewalk: Curb side : Cutout,Rec/Park,7/29/99 0:00,18,3X3,37.73893109,-122.4159489,Ligustrum,Ligustrum lucidum,Glossy Privet,1999,1999-07-29 00:00:00,25
6410,43305,DPW Maintained,Ficus microcarpa :: Chinese Banyan,693 Vermont St,10.0,Sidewalk: Curb side : Cutout,SFUSD,7/12/00 0:00,6,,37.76109571,-122.4040664,Ficus,Ficus microcarpa,Chinese Banyan,2000,2000-07-12 00:00:00,24
6414,37207,DPW Maintained,Arbutus 'Marina' :: Hybrid Strawberry Tree,1626 32nd Ave,2.0,Sidewalk: Curb side : Cutout,Private,6/12/98 0:00,8,,37.75684612,-122.4905618,Arbutus,Arbutus 'Marina',Hybrid Strawberry Tree,1998,1998-06-12 00:00:00,26
6415,9200,DPW Maintained,Olea europaea :: Olive Tree,6200 Geary Blvd,2.0,Sidewalk: Curb side : Cutout,Private,1/19/05 0:00,3,3X3,37.7802149,-122.4860178,Olea,Olea europaea,Olive Tree,2005,2005-01-19 00:00:00,19
6416,98454,DPW Maintained,Banksia integrifolia :: Coast Banksia,1565 Kirkwood Ave,2.0,Sidewalk: Curb side : Cutout,Private,2/15/12 0:00,5,3x3,37.73760801,-122.3891548,Banksia,Banksia integrifolia,Coast Banksia,2012,2012-02-15 00:00:00,12
6424,32977,DPW Maintained,Jacaranda mimosifolia :: Jacaranda,448 Pennsylvania Ave,1.0,Sidewalk: Curb side : Cutout,Private,7/25/03 0:00,4,,37.76079252,-122.3935532,Jacaranda,Jacaranda mimosifolia,Jacaranda,2003,2003-07-25 00:00:00,21
6428,15802,DPW Maintained,Pittosporum undulatum :: Victorian Box,4950 Mission St,8.0,Sidewalk: Curb side : Cutout,DPW,2/23/07 0:00,3,4x4,37.71934145,-122.4389462,Pittosporum,Pittosporum undulatum,Victorian Box,2007,2007-02-23 00:00:00,17
6430,139941,DPW Maintained,Maytenus boaria :: Mayten,900 GOLDEN GATE AVE,4.0,Sidewalk: Curb side : Cutout,Private,5/2/19 0:00,9,Width 0ft,37.78045078,-122.4257285,Maytenus,Maytenus boaria,Mayten,2019,2019-05-02 00:00:00,5
6432,43813,DPW Maintained,Ginkgo biloba :: Maidenhair Tree,193 18th Ave,1.0,Sidewalk: Curb side : Cutout,Private,6/3/08 0:00,3,3x3,37.78464853,-122.4776257,Ginkgo,Ginkgo biloba,Maidenhair Tree,2008,2008-06-03 00:00:00,16
6433,72366,DPW Maintained,Magnolia grandiflora 'Little Gem' :: Little Gem Magnolia,706 15th Ave,1.0,Sidewalk: Curb side : Cutout,Private,5/21/14 0:00,3,3x3,37.77470063,-122.4734662,Magnolia,Magnolia grandiflora,Little Gem Magnolia,2014,2014-05-21 00:00:00,10
6439,26491,Permitted Site,Callistemon viminalis :: Weeping Bottlebrush,912X Laguna St,2.0,Sidewalk: Curb side : Cutout,Private,6/4/98 0:00,6,4X4,37.77965965,-122.4268218,Callistemon,Callistemon viminalis,Weeping Bottlebrush,1998,1998-06-04 00:00:00,26
6444,218318,DPW Maintained,Acacia melanoxylon :: Blackwood Acacia,407 Castenada Ave,1.0,Sidewalk: Curb side : Yard,Private,3/7/19 0:00,3,Width 0ft,37.7456257,-122.4660213,Acacia,Acacia melanoxylon,Blackwood Acacia,2019,2019-03-07 00:00:00,5
6447,88156,DPW Maintained,Pyrus calleryana :: Ornamental Pear,353 Clementina St,1.0,Sidewalk: Curb side : Cutout,Private,7/8/08 0:00,3,3x3,37.78153751,-122.4027995,Pyrus,Pyrus calleryana,Ornamental Pear,2008,2008-07-08 00:00:00,16
6453,45627,DPW Maintained,Lyonothamnus floribundus subsp. asplenifolius :: Santa Cruz Ironwood,2525 Moraga St,1.0,Sidewalk: Curb side : Cutout,Private,8/1/01 0:00,6,,37.75544021,-122.4899301,Lyonothamnus,Lyonothamnus floribundus,Santa Cruz Ironwood,2001,2001-08-01 00:00:00,23
6459,34624,DPW Maintained,Pinus torreyana :: Torrey Pine,1440 24th Ave,1.0,Sidewalk: Curb side : Cutout,Private,7/28/97 0:00,12,,37.76069534,-122.4822081,Pinus,Pinus torreyana,Torrey Pine,1997,1997-07-28 00:00:00,27
6476,5490,DPW Maintained,Pistacia chinensis :: Chinese Pistache,714 Dolores St,1.0,Sidewalk: Curb side : Cutout,Private,12/28/15 0:00,1,4X4,37.757909,-122.425893,Pistacia,Pistacia chinensis,Chinese Pistache,2015,2015-12-28 00:00:00,9
6480,216808,DPW Maintained,Olea europaea 'Majestic Beauty' :: Majestic Beauty Fruitless Olive,201 Lobos St,7.0,Sidewalk: Curb side : Cutout,Private,10/6/17 13:53,3,Width 3ft,37.7148544,-122.4595566,Olea,Olea europaea,Majestic Beauty Fruitless Olive,2017,2017-10-06 13:53:00,7
6481,52767,DPW Maintained,Tristaniopsis laurina 'Elegant' :: Small-leaf Tristania 'Elegant',125 Trenton St,1.0,Sidewalk: Curb side : Cutout,Private,5/4/06 0:00,4,1x2,37.79615017,-122.4091848,Tristaniopsis,Tristaniopsis laurina,Small-leaf Tristania 'Elegant',2006,2006-05-04 00:00:00,18
6484,68732,DPW Maintained,Tristaniopsis laurina :: Swamp Myrtle,2245 Irving St,1.0,Sidewalk: Curb side : Cutout,Private,11/1/93 0:00,6,4x4,37.76326675,-122.4822218,Tristaniopsis,Tristaniopsis laurina,Swamp Myrtle,1993,1993-11-01 00:00:00,31
6492,43827,DPW Maintained,Prunus cerasifera :: Cherry Plum,2660 35th Ave,1.0,Sidewalk: Curb side : Cutout,Private,7/27/00 0:00,2,,37.73772792,-122.4924394,Prunus,Prunus cerasifera,Cherry Plum,2000,2000-07-27 00:00:00,24
6493,112025,DPW Maintained,Lagunaria patersonii :: Primrose Tree,2101x 22nd Ave,5.0,Sidewalk: Curb side : Cutout,SFUSD,7/23/15 0:00,3,5x5,37.75709345,-122.4023192,Lagunaria,Lagunaria patersonii,Primrose Tree,2015,2015-07-23 00:00:00,9
6494,30096,DPW Maintained,Tristania conferta ::,6190X 03rd St,6.0,Sidewalk: Curb side : Cutout,Private,7/7/11 0:00,6,3x3,37.72257798,-122.3957073,Tristania,Tristania conferta,,2011,2011-07-07 00:00:00,13
6500,113583,DPW Maintained,Tristaniopsis laurina :: Swamp Myrtle,466 London St,1.0,Sidewalk: Curb side : Cutout,Private,8/13/20 0:00,3,3x3,37.72177012,-122.4360431,Tristaniopsis,Tristaniopsis laurina,Swamp Myrtle,2020,2020-08-13 00:00:00,4
6501,90547,DPW Maintained,Prunus serrulata 'Kwanzan' :: Kwanzan Flowering Cherry,838 Cabrillo St,1.0,Sidewalk: Curb side : Cutout,DPW,2/14/08 0:00,3,3x3,37.77526884,-122.4677635,Prunus,Prunus serrulata,Kwanzan Flowering Cherry,2008,2008-02-14 00:00:00,16
6502,25596,DPW Maintained,Pittosporum undulatum :: Victorian Box,1525 Cortland Ave,2.0,Sidewalk: Curb side : Cutout,DPW,2/13/02 0:00,3,3X3,37.73977648,-122.409328,Pittosporum,Pittosporum undulatum,Victorian Box,2002,2002-02-13 00:00:00,22
6509,108048,Permitted Site,Magnolia grandiflora :: Southern Magnolia,535 Mission St,1.0,Sidewalk: Curb side : Cutout,Private,11/19/14 0:00,3,3x3,37.78898905,-122.398293,Magnolia,Magnolia grandiflora,Southern Magnolia,2014,2014-11-19 00:00:00,10
6517,69452,DPW Maintained,Arbutus 'Marina' :: Hybrid Strawberry Tree,458 33rd Ave,1.0,Sidewalk: Curb side : Cutout,Private,11/26/07 0:00,4,3x3,37.78053904,-122.4932854,Arbutus,Arbutus 'Marina',Hybrid Strawberry Tree,2007,2007-11-26 00:00:00,17
6519,34677,DPW Maintained,Pittosporum undulatum :: Victorian Box,2000 Filbert St,3.0,Sidewalk: Curb side : Cutout,Private,7/28/97 0:00,11,,37.79847218,-122.4326804,Pittosporum,Pittosporum undulatum,Victorian Box,1997,1997-07-28 00:00:00,27
6521,31407,DPW Maintained,Ginkgo biloba :: Maidenhair Tree,4305 20th St,1.0,Sidewalk: Curb side : Cutout,Private,5/1/95 0:00,4,,37.75753699,-122.4360454,Ginkgo,Ginkgo biloba,Maidenhair Tree,1995,1995-05-01 00:00:00,29
6522,5093,Permitted Site,Yucca elephantipes :: Giant Yucca,2607 Diamond St,1.0,Sidewalk: Curb side : Cutout,Private,6/19/00 0:00,45,3x3,37.73710738,-122.434567,Yucca,Yucca elephantipes,Giant Yucca,2000,2000-06-19 00:00:00,24
6523,43854,DPW Maintained,Prunus cerasifera :: Cherry Plum,2750 36th Ave,2.0,Sidewalk: Curb side : Cutout,Private,7/27/00 0:00,5,,37.73576084,-122.493398,Prunus,Prunus cerasifera,Cherry Plum,2000,2000-07-27 00:00:00,24
6526,89673,DPW Maintained,Laurus nobilis :: Sweet Bay: Grecian Laurel,2605 Anza St,1.0,Sidewalk: Curb side : Cutout,DPW,2/29/08 0:00,3,3x3,37.77845852,-122.4764339,Laurus,Laurus nobilis,Sweet Bay: Grecian Laurel,2008,2008-02-29 00:00:00,16
6527,108053,DPW Maintained,Magnolia grandiflora :: Southern Magnolia,535X Mission St,2.0,Sidewalk: Curb side : Cutout,Private,11/19/14 0:00,3,3x3,37.78904296,-122.3983372,Magnolia,Magnolia grandiflora,Southern Magnolia,2014,2014-11-19 00:00:00,10
6531,68178,DPW Maintained,Tristaniopsis laurina :: Swamp Myrtle,72 Rossi Ave,1.0,Sidewalk: Curb side : Cutout,Private,6/3/93 0:00,2,,37.77824913,-122.4561457,Tristaniopsis,Tristaniopsis laurina,Swamp Myrtle,1993,1993-06-03 00:00:00,31
6544,24222,Section 806 (d),Quercus suber :: Cork Oak,54 Whitney Young Cir,1.0,Sidewalk: Curb side : Cutout,Private,5/7/10 0:00,3,4x4,37.73341541,-122.3828829,Quercus,Quercus suber,Cork Oak,2010,2010-05-07 00:00:00,14
6549,95752,DPW Maintained,Lophostemon confertus :: Brisbane Box,260 Madrid St,3.0,Sidewalk: Curb side : Cutout,SFUSD,10/25/17 15:47,3,3x3,37.72531458,-122.4301088,Lophostemon,Lophostemon confertus,Brisbane Box,2017,2017-10-25 15:47:00,7
6554,28629,Permitted Site,Tristaniopsis laurina :: Swamp Myrtle,1299 Ocean Ave,9.0,Sidewalk: Curb side : Cutout,Private,4/3/03 0:00,3,3X3,37.72368051,-122.4558827,Tristaniopsis,Tristaniopsis laurina,Swamp Myrtle,2003,2003-04-03 00:00:00,21
6557,49822,DPW Maintained,Melaleuca ericifolia :: Heath Melaleuca,1600X 18th St,3.0,Sidewalk: Curb side : Cutout,Private,6/11/03 0:00,7,,37.76250693,-122.3988071,Melaleuca,Melaleuca ericifolia,Heath Melaleuca,2003,2003-06-11 00:00:00,21
6559,15928,DPW Maintained,Metrosideros excelsa :: New Zealand Xmas Tree,5750 Mission St,1.0,Sidewalk: Curb side : Cutout,DPW,12/15/97 0:00,6,3X3,37.70971035,-122.4503006,Metrosideros,Metrosideros excelsa,New Zealand Xmas Tree,1997,1997-12-15 00:00:00,27
6563,93299,DPW Maintained,Magnolia grandiflora 'Saint Mary' :: Saint Mary Magnolia,801X Church St,6.0,Sidewalk: Curb side : Cutout,DPW,12/12/08 0:00,3,3x3,37.75777421,-122.4278245,Magnolia,Magnolia grandiflora,Saint Mary Magnolia,2008,2008-12-12 00:00:00,16
6566,90543,DPW Maintained,Eriobotrya deflexa :: Bronze Loquat,642 Cabrillo St,1.0,Sidewalk: Curb side : Cutout,Private,2/14/08 0:00,5,3x3,37.77535634,-122.4658435,Eriobotrya,Eriobotrya deflexa,Bronze Loquat,2008,2008-02-14 00:00:00,16
6579,69238,DPW Maintained,Platanus x hispanica :: Sycamore: London Plane,3065 Pacific Ave,1.0,Sidewalk: Curb side : Cutout,Private,2/9/94 0:00,8,,37.79189844,-122.4456518,Platanus,Platanus x,Sycamore: London Plane,1994,1994-02-09 00:00:00,30
6585,253117,DPW Maintained,Lophostemon confertus :: Brisbane Box,1000 Cayuga Ave,27.0,Sidewalk: Curb side : Cutout,Private,10/4/17 13:31,3,Width 0ft,37.71978341,-122.442046,Lophostemon,Lophostemon confertus,Brisbane Box,2017,2017-10-04 13:31:00,7
6586,34594,DPW Maintained,Lophostemon confertus :: Brisbane Box,3196 Pacific Ave,2.0,Sidewalk: Curb side : Cutout,Private,7/28/97 0:00,7,,37.79182786,-122.4472443,Lophostemon,Lophostemon confertus,Brisbane Box,1997,1997-07-28 00:00:00,27
6592,86396,DPW Maintained,Prunus serrulata :: Ornamental Cherry,1615 26th Ave,1.0,Sidewalk: Curb side : Cutout,DPW,12/15/06 0:00,3,3x3,37.75729776,-122.4842805,Prunus,Prunus serrulata,Ornamental Cherry,2006,2006-12-15 00:00:00,18
6601,6217,DPW Maintained,Pittosporum undulatum :: Victorian Box,1295X Pierce St,4.0,Sidewalk: Curb side : Cutout,DPW,5/29/91 0:00,12,4X4,37.7816881,-122.4357886,Pittosporum,Pittosporum undulatum,Victorian Box,1991,1991-05-29 00:00:00,33
6604,229995,DPW Maintained,Magnolia grandiflora :: Southern Magnolia,120 Miguel St,1.0,Sidewalk: Curb side : Cutout,Private,4/8/19 0:00,3,Width 3ft,37.73818043,-122.42877,Magnolia,Magnolia grandiflora,Southern Magnolia,2019,2019-04-08 00:00:00,5
6606,89357,DPW Maintained,Syagrus romanzoffianum :: Queen Palm,228 Connecticut St,1.0,Sidewalk: Curb side : Cutout,Private,11/18/08 0:00,15,3x3,37.76337271,-122.3976824,Syagrus,Syagrus romanzoffianum,Queen Palm,2008,2008-11-18 00:00:00,16
6616,10065,DPW Maintained,Tristaniopsis laurina :: Swamp Myrtle,519 Guerrero St,1.0,Sidewalk: Curb side : Cutout,Private,3/30/06 0:00,3,2X3,37.76280631,-122.4238022,Tristaniopsis,Tristaniopsis laurina,Swamp Myrtle,2006,2006-03-30 00:00:00,18
6620,64373,DPW Maintained,Ficus microcarpa nitida 'Green Gem' :: Indian Laurel Fig Tree 'Green Gem',376 Green St,1.0,Sidewalk: Curb side : Cutout,Private,4/21/88 0:00,9,,37.80001237,-122.4054837,Ficus,Ficus microcarpa,Indian Laurel Fig Tree 'Green Gem',1988,1988-04-21 00:00:00,36
6631,231331,Landmark tree,Metrosideros excelsa :: New Zealand Xmas Tree,1221 Stanyan St,1.0,Sidewalk: Curb side : Cutout,Private,4/21/88 0:00,25,Width 4ft,37.76159243,-122.4520672,Metrosideros,Metrosideros excelsa,New Zealand Xmas Tree,1988,1988-04-21 00:00:00,36
6632,87276,DPW Maintained,Lophostemon confertus :: Brisbane Box,200X 08th St,1.0,Sidewalk: Curb side : Cutout,DPW,2/7/13 0:00,3,3x3,37.77616975,-122.411639,Lophostemon,Lophostemon confertus,Brisbane Box,2013,2013-02-07 00:00:00,11
6633,31523,DPW Maintained,Prunus cerasifera :: Cherry Plum,1320 San Bruno Ave,1.0,Sidewalk: Curb side : Cutout,Private,5/10/95 0:00,9,,37.75279787,-122.4044396,Prunus,Prunus cerasifera,Cherry Plum,1995,1995-05-10 00:00:00,29
6635,58968,DPW Maintained,Metrosideros excelsa :: New Zealand Xmas Tree,209 03rd Ave,1.0,Sidewalk: Curb side : Cutout,Private,4/2/80 0:00,15,,37.78458778,-122.4614065,Metrosideros,Metrosideros excelsa,New Zealand Xmas Tree,1980,1980-04-02 00:00:00,44
6640,57615,DPW Maintained,Tristaniopsis laurina :: Swamp Myrtle,443 Connecticut St,1.0,Sidewalk: Curb side : Cutout,Private,11/12/76 0:00,9,6x6,37.76065636,-122.3972174,Tristaniopsis,Tristaniopsis laurina,Swamp Myrtle,1976,1976-11-12 00:00:00,48
6641,43849,DPW Maintained,Prunus serrulata :: Ornamental Cherry,2638 36th Ave,1.0,Sidewalk: Curb side : Cutout,Private,7/27/00 0:00,4,,37.7377832,-122.4935367,Prunus,Prunus serrulata,Ornamental Cherry,2000,2000-07-27 00:00:00,24
6647,67320,DPW Maintained,Tristaniopsis laurina 'Elegant' :: Small-leaf Tristania 'Elegant',641 Balboa St,1.0,Sidewalk: Curb side : Cutout,Private,7/15/92 0:00,1,,37.7770693,-122.465903,Tristaniopsis,Tristaniopsis laurina,Small-leaf Tristania 'Elegant',1992,1992-07-15 00:00:00,32
6650,68345,DPW Maintained,Pittosporum undulatum :: Victorian Box,476 15th Ave,1.0,Sidewalk: Curb side : Cutout,Private,8/9/93 0:00,9,,37.77916285,-122.4737872,Pittosporum,Pittosporum undulatum,Victorian Box,1993,1993-08-09 00:00:00,31
6652,89453,DPW Maintained,Pyrus calleryana :: Ornamental Pear,3342 Anza St,3.0,Sidewalk: Curb side : Cutout,DPW,3/19/08 0:00,3,3x3,37.77826505,-122.4843171,Pyrus,Pyrus calleryana,Ornamental Pear,2008,2008-03-19 00:00:00,16
6654,90745,DPW Maintained,Yucca gloriosa :: Spanish Dagger,4345 Cabrillo St,1.0,Sidewalk: Curb side : Cutout,DPW,4/7/08 0:00,3,3x3,37.77339894,-122.5055434,Yucca,Yucca gloriosa,Spanish Dagger,2008,2008-04-07 00:00:00,16
6655,30072,DPW Maintained,Pinus radiata :: Monterey Pine,410X Brotherhood Way,6.0,Median : Cutout,DPW,3/10/07 0:00,3,M,37.71172889,-122.4634421,Pinus,Pinus radiata,Monterey Pine,2007,2007-03-10 00:00:00,17
6663,105424,Undocumented,Pinus radiata :: Monterey Pine,2 GARFIELD ST,2.0,Sidewalk: Property side : Yard,Private,2/28/14 0:00,30,,37.72011064,-122.4628735,Pinus,Pinus radiata,Monterey Pine,2014,2014-02-28 00:00:00,10
6674,22645,Permitted Site,Pittosporum undulatum :: Victorian Box,1244 Turk St,1.0,Sidewalk: Curb side : Cutout,Private,4/7/05 0:00,3,3X3,37.78088713,-122.4295132,Pittosporum,Pittosporum undulatum,Victorian Box,2005,2005-04-07 00:00:00,19
6681,30518,DPW Maintained,Lophostemon confertus :: Brisbane Box,409 Eddy St,1.0,Sidewalk: Curb side : Cutout,Private,1/9/95 0:00,5,,37.78361428,-122.4145472,Lophostemon,Lophostemon confertus,Brisbane Box,1995,1995-01-09 00:00:00,29
6682,41912,DPW Maintained,Pyrus calleryana 'Aristocrat' :: Aristocrat Callery Pear,642 12th Ave,2.0,Sidewalk: Curb side : Cutout,Private,6/20/00 0:00,8,,37.77613467,-122.4703015,Pyrus,Pyrus calleryana,Aristocrat Callery Pear,2000,2000-06-20 00:00:00,24
6683,65026,DPW Maintained,Lophostemon confertus :: Brisbane Box,271 Missouri St,1.0,Sidewalk: Curb side : Cutout,Private,4/28/89 0:00,13,,37.7629699,-122.3964605,Lophostemon,Lophostemon confertus,Brisbane Box,1989,1989-04-28 00:00:00,35
6692,93632,DPW Maintained,Acacia baileyana 'Purpurea' :: Purple-leaf Acacia,151X Palm Ave,2.0,Sidewalk: Curb side : Cutout,SFUSD,1/31/18 0:00,3,3x3,37.78276752,-122.4579346,Acacia,Acacia baileyana,Purple-leaf Acacia,2018,2018-01-31 00:00:00,6
6693,109107,DPW Maintained,Pittosporum tobira :: Japanese Mockorange,461X Cherry St,3.0,Sidewalk: Curb side : Cutout,Private,1/28/15 0:00,3,,37.78646411,-122.4567798,Pittosporum,Pittosporum tobira,Japanese Mockorange,2015,2015-01-28 00:00:00,9
6704,7950,DPW Maintained,Prunus serrulata 'Kwanzan' :: Kwanzan Flowering Cherry,1735 Franklin St,1.0,Sidewalk: Curb side : Cutout,Private,1/28/08 0:00,3,3X3,37.79068151,-122.4241712,Prunus,Prunus serrulata,Kwanzan Flowering Cherry,2008,2008-01-28 00:00:00,16
6709,94232,Permitted Site,Pinus canariensis :: Canary Island Pine,1501@Ocean Sloat Blvd,12.0,Sidewalk: Property side : Yard,Private,6/28/10 0:00,14,,37.73406014,-122.4889745,Pinus,Pinus canariensis,Canary Island Pine,2010,2010-06-28 00:00:00,14
6710,15529,DPW Maintained,Pittosporum undulatum :: Victorian Box,2796 Mission St,1.0,Sidewalk: Curb side : Cutout,DPW,6/1/92 0:00,11,3X3,37.75240457,-122.4185503,Pittosporum,Pittosporum undulatum,Victorian Box,1992,1992-06-01 00:00:00,32
6711,37364,DPW Maintained,Prunus cerasifera :: Cherry Plum,66 Madison St,1.0,Sidewalk: Curb side : Cutout,Private,6/15/98 0:00,8,,37.72800378,-122.4234968,Prunus,Prunus cerasifera,Cherry Plum,1998,1998-06-15 00:00:00,26
6719,25922,DPW Maintained,Melaleuca quinquenervia :: Cajeput,1900 Oakdale Ave,3.0,Sidewalk: Curb side : Cutout,DPW,4/22/97 0:00,12,3x3,37.73797885,-122.3961226,Melaleuca,Melaleuca quinquenervia,Cajeput,1997,1997-04-22 00:00:00,27
6722,35599,DPW Maintained,Pittosporum undulatum :: Victorian Box,251 18th Ave,1.0,Sidewalk: Curb side : Cutout,Private,3/27/98 0:00,5,,37.78339003,-122.4775437,Pittosporum,Pittosporum undulatum,Victorian Box,1998,1998-03-27 00:00:00,26
6728,91400,DPW Maintained,Acacia melanoxylon :: Blackwood Acacia,222 Maple St,4.0,Sidewalk: Curb side : Cutout,Private,3/31/09 0:00,7,3x3,37.7886371,-122.4554671,Acacia,Acacia melanoxylon,Blackwood Acacia,2009,2009-03-31 00:00:00,15
6729,63470,DPW Maintained,Pittosporum undulatum :: Victorian Box,2247 Turk Blvd,1.0,Sidewalk: Curb side : Cutout,Private,3/19/87 0:00,7,,37.77861661,-122.4462231,Pittosporum,Pittosporum undulatum,Victorian Box,1987,1987-03-19 00:00:00,37
6730,29291,DPW Maintained,Lophostemon confertus :: Brisbane Box,400X Portola Dr,12.0,Median : Cutout,DPW,10/14/05 0:00,3,3X3,37.74598309,-122.4499083,Lophostemon,Lophostemon confertus,Brisbane Box,2005,2005-10-14 00:00:00,19
6733,108228,Planning Code 138.1 required,Tristaniopsis laurina :: Swamp Myrtle,390x TREAT AVE,1.0,Sidewalk: Curb side : Cutout,Private,12/28/16 0:00,3,3x3,37.7638737,-122.4138041,Tristaniopsis,Tristaniopsis laurina,Swamp Myrtle,2016,2016-12-28 00:00:00,8
6740,94348,DPW Maintained,Platanus x hispanica :: Sycamore: London Plane,1160 Battery St,5.0,Sidewalk: Curb side : Cutout,Private,7/19/10 0:00,15,3x3,37.80189345,-122.4016326,Platanus,Platanus x,Sycamore: London Plane,2010,2010-07-19 00:00:00,14
6749,47491,DPW Maintained,Tristaniopsis laurina 'Elegant' :: Small-leaf Tristania 'Elegant',158 Cayuga Ave,1.0,Sidewalk: Curb side : Cutout,Private,12/28/10 0:00,4,3x3,37.73087265,-122.4320685,Tristaniopsis,Tristaniopsis laurina,Small-leaf Tristania 'Elegant',2010,2010-12-28 00:00:00,14
6756,23364,DPW Maintained,Platanus x hispanica :: Sycamore: London Plane,1336 Van Ness Ave,1.0,Sidewalk: Curb side : Cutout,Private,9/29/15 0:00,12,4x4,37.78818543,-122.4217033,Platanus,Platanus x,Sycamore: London Plane,2015,2015-09-29 00:00:00,9
6758,26271,Permitted Site,Platanus x hispanica 'Yarwood' :: Yarwood Sycamore,16 Virginia Ave,2.0,Sidewalk: Curb side : Cutout,Private,2/21/04 0:00,3,3X3,37.74298721,-122.4213409,Platanus,Platanus x,Yarwood Sycamore,2004,2004-02-21 00:00:00,20
6761,31527,DPW Maintained,Prunus cerasifera :: Cherry Plum,1364 San Bruno Ave,1.0,Sidewalk: Curb side : Cutout,Private,5/10/95 0:00,6,,37.75232633,-122.4043884,Prunus,Prunus cerasifera,Cherry Plum,1995,1995-05-10 00:00:00,29
6763,24438,DPW Maintained,Melaleuca quinquenervia :: Cajeput,99X Peter Yorke Way,6.0,Sidewalk: Curb side : Cutout,DPW,5/20/95 0:00,6,3X3,37.78645014,-122.4233015,Melaleuca,Melaleuca quinquenervia,Cajeput,1995,1995-05-20 00:00:00,29
6766,39530,DPW Maintained,Platanus x hispanica :: Sycamore: London Plane,88x Arkansas St,4.0,Sidewalk: Curb side : Cutout,Private,12/28/98 0:00,11,,37.7653441,-122.3988425,Platanus,Platanus x,Sycamore: London Plane,1998,1998-12-28 00:00:00,26
6768,254270,Permitted Site,Tristaniopsis laurina :: Swamp Myrtle,399 Melrose Ave,3.0,Sidewalk: Curb side : Cutout,Private,1/30/18 0:00,3,3x3,37.73374669,-122.4511466,Tristaniopsis,Tristaniopsis laurina,Swamp Myrtle,2018,2018-01-30 00:00:00,6
6770,18470,DPW Maintained,Syagrus romanzoffianum :: Queen Palm,1221 Potrero Ave,1.0,Sidewalk: Curb side : Cutout,Private,11/21/03 0:00,12,3X3,37.75268334,-122.406155,Syagrus,Syagrus romanzoffianum,Queen Palm,2003,2003-11-21 00:00:00,21
6783,36989,DPW Maintained,Tristaniopsis laurina 'Elegant' :: Small-leaf Tristania 'Elegant',711 Lake St,1.0,Sidewalk: Curb side : Cutout,Private,5/29/98 0:00,9,,37.78649199,-122.4670616,Tristaniopsis,Tristaniopsis laurina,Small-leaf Tristania 'Elegant',1998,1998-05-29 00:00:00,26
6787,57950,DPW Maintained,Arbutus 'Marina' :: Hybrid Strawberry Tree,18 Byron Ct,1.0,Sidewalk: Curb side : Cutout,Private,8/11/10 0:00,7,,37.70956262,-122.4444722,Arbutus,Arbutus 'Marina',Hybrid Strawberry Tree,2010,2010-08-11 00:00:00,14
6788,90211,DPW Maintained,Tristaniopsis laurina 'Elegant' :: Small-leaf Tristania 'Elegant',2349X Balboa St,1.0,Sidewalk: Curb side : Cutout,DPW,4/10/08 0:00,3,3x3,37.77627221,-122.4839111,Tristaniopsis,Tristaniopsis laurina,Small-leaf Tristania 'Elegant',2008,2008-04-10 00:00:00,16
6789,38276,DPW Maintained,Jacaranda mimosifolia :: Jacaranda,651 Texas St,10.0,Sidewalk: Curb side : Cutout,Private,7/27/98 0:00,3,,37.75786429,-122.3948525,Jacaranda,Jacaranda mimosifolia,Jacaranda,1998,1998-07-27 00:00:00,26
6790,86898,DPW Maintained,Tristaniopsis laurina 'Elegant' :: Small-leaf Tristania 'Elegant',1515 Greenwich St,3.0,Sidewalk: Curb side : Cutout,Private,10/26/07 0:00,5,3x3,37.80027812,-122.4249778,Tristaniopsis,Tristaniopsis laurina,Small-leaf Tristania 'Elegant',2007,2007-10-26 00:00:00,17
6792,260852,DPW Maintained,Laurus nobilis :: Sweet Bay: Grecian Laurel,629 33rd Ave,,Sidewalk: Curb side : Cutout,DPW,8/13/20 0:00,3,,37.77721472,-122.4932,Laurus,Laurus nobilis,Sweet Bay: Grecian Laurel,2020,2020-08-13 00:00:00,4
6798,27912,Permitted Site,Platanus x hispanica :: Sycamore: London Plane,100 The Embarcadero,6.0,Sidewalk: Curb side : Cutout,Port,2/1/01 0:00,12,3X3,37.78126372,-122.3885764,Platanus,Platanus x,Sycamore: London Plane,2001,2001-02-01 00:00:00,23
6800,4061,DPW Maintained,Prunus serrulata 'Kwanzan' :: Kwanzan Flowering Cherry,3045 Cesar Chavez St,1.0,Sidewalk: Curb side : Cutout,Private,4/1/95 0:00,12,3x3,37.7482038,-122.4103568,Prunus,Prunus serrulata,Kwanzan Flowering Cherry,1995,1995-04-01 00:00:00,29
6807,213107,DPW Maintained,Prunus cerasifera :: Cherry Plum,133 Cresta Vista Dr,1.0,Sidewalk: Curb side : Cutout,Private,7/6/88 0:00,4,Width 3ft,37.73560203,-122.4566651,Prunus,Prunus cerasifera,Cherry Plum,1988,1988-07-06 00:00:00,36
6810,22396,DPW Maintained,Tristania conferta ::,5700 03rd St,5.0,Sidewalk: Curb side : Cutout,Private,2/17/95 0:00,6,3X3,37.72592195,-122.394195,Tristania,Tristania conferta,,1995,1995-02-17 00:00:00,29
6812,109099,Permitted Site,Prunus serrulata 'Kwanzan' :: Kwanzan Flowering Cherry,605 Arguello Blvd,1.0,Sidewalk: Curb side : Cutout,Private,1/27/15 0:00,3,3x3,37.77913524,-122.458912,Prunus,Prunus serrulata,Kwanzan Flowering Cherry,2015,2015-01-27 00:00:00,9
6813,56386,DPW Maintained,Callistemon citrinus :: Lemon Bottlebrush,1310 Thomas Ave,1.0,Sidewalk: Curb side : Cutout,Private,8/17/73 0:00,13,,37.72746446,-122.3858928,Callistemon,Callistemon citrinus,Lemon Bottlebrush,1973,2073-08-17 00:00:00,-49
6819,5159,DPW Maintained,Pyrus calleryana :: Ornamental Pear,280 Divisadero St,1.0,Sidewalk: Curb side : Cutout,DPW,4/4/14 0:00,3,3x3,37.77177024,-122.437024,Pyrus,Pyrus calleryana,Ornamental Pear,2014,2014-04-04 00:00:00,10
6825,65039,DPW Maintained,Prunus cerasifera :: Cherry Plum,900 Green St,1.0,Sidewalk: Curb side : Cutout,Private,5/19/89 0:00,6,,37.79894241,-122.4140673,Prunus,Prunus cerasifera,Cherry Plum,1989,1989-05-19 00:00:00,35
6830,37209,DPW Maintained,Crataegus phaenopyrum :: Washington Hawthorn,1915 32nd Ave,1.0,Sidewalk: Curb side : Cutout,Private,6/12/98 0:00,3,,37.7513993,-122.4903164,Crataegus,Crataegus phaenopyrum,Washington Hawthorn,1998,1998-06-12 00:00:00,26
6834,9596,DPW Maintained,Tristania conferta ::,1340 Golden Gate Ave,2.0,Sidewalk: Curb side : Cutout,DPW,1/2/91 0:00,11,3X3,37.77954004,-122.432699,Tristania,Tristania conferta,,1991,1991-01-02 00:00:00,33
6843,42141,DPW Maintained,Magnolia grandiflora :: Southern Magnolia,662 15th Ave,1.0,Sidewalk: Curb side : Cutout,Private,6/21/00 0:00,9,,37.77565081,-122.473541,Magnolia,Magnolia grandiflora,Southern Magnolia,2000,2000-06-21 00:00:00,24
6846,117441,DPW Maintained,Myoporum laetum :: Myoporum,1204 20th Ave,1.0,Sidewalk: Curb side : Cutout,Private,11/7/16 0:00,3,3x3,37.76522116,-122.4782216,Myoporum,Myoporum laetum,Myoporum,2016,2016-11-07 00:00:00,8
6855,111193,Section 143,Eriobotrya deflexa :: Bronze Loquat,890x JARBOE AVE,1.0,Sidewalk: Curb side : Cutout,Private,11/30/15 0:00,1,3x3,37.73804345,-122.4109839,Eriobotrya,Eriobotrya deflexa,Bronze Loquat,2015,2015-11-30 00:00:00,9
6859,38100,DPW Maintained,Eriobotrya deflexa :: Bronze Loquat,1265 27th Ave,1.0,Sidewalk: Curb side : Cutout,Private,7/13/98 0:00,4,,37.76385123,-122.4858358,Eriobotrya,Eriobotrya deflexa,Bronze Loquat,1998,1998-07-13 00:00:00,26
6863,66120,DPW Maintained,Prunus serrulata 'Kwanzan' :: Kwanzan Flowering Cherry,474 10th Ave,1.0,Sidewalk: Curb side : Cutout,Private,8/15/90 0:00,11,6x9,37.77938311,-122.46838,Prunus,Prunus serrulata,Kwanzan Flowering Cherry,1990,1990-08-15 00:00:00,34
6865,253546,DPW Maintained,Olea europaea :: Olive Tree,1000 Cayuga Ave,14.0,Back Yard : Yard,DPW,9/27/17 11:50,3,3x3,37.72207681,-122.4398369,Olea,Olea europaea,Olive Tree,2017,2017-09-27 11:50:00,7
6866,127506,DPW Maintained,Ficus microcarpa nitida 'Green Gem' :: Indian Laurel Fig Tree 'Green Gem',281 Geary St,4.0,Sidewalk: Curb side : Cutout,Private,8/17/18 0:00,3,Width 4ft,37.78735425,-122.4076213,Ficus,Ficus microcarpa,Indian Laurel Fig Tree 'Green Gem',2018,2018-08-17 00:00:00,6
6867,54763,DPW Maintained,Corymbia ficifolia :: Red Flowering Gum,158 Nueva Ave,1.0,Sidewalk: Curb side : Cutout,Private,8/9/72 0:00,18,,37.71191135,-122.3971458,Corymbia,Corymbia ficifolia,Red Flowering Gum,1972,2072-08-09 00:00:00,-48
6870,125204,DPW Maintained,Magnolia grandiflora 'Little Gem' :: Little Gem Magnolia,2000 Washington St,1.0,Sidewalk: Curb side : Cutout,Private,3/4/19 0:00,3,Width 3ft,37.79267897,-122.4263111,Magnolia,Magnolia grandiflora,Little Gem Magnolia,2019,2019-03-04 00:00:00,5
6874,116632,DPW Maintained,Tristaniopsis laurina :: Swamp Myrtle,2332 Anza St,1.0,Sidewalk: Curb side : Cutout,DPW,3/27/18 11:42,3,3x3,37.77875804,-122.4733292,Tristaniopsis,Tristaniopsis laurina,Swamp Myrtle,2018,2018-03-27 11:42:00,6
6879,30094,DPW Maintained,Lophostemon confertus :: Brisbane Box,6190X 03rd St,4.0,Sidewalk: Curb side : Cutout,DPW,2/14/14 0:00,3,3X3,37.72268339,-122.3956567,Lophostemon,Lophostemon confertus,Brisbane Box,2014,2014-02-14 00:00:00,10
6881,171157,DPW Maintained,Lyonothamnus floribundus subsp. asplenifolius :: Santa Cruz Ironwood,2 Naples St,1.0,Sidewalk: Curb side : Cutout,Private,8/28/21 0:00,3,Width 3ft,37.7284933,-122.4255199,Lyonothamnus,Lyonothamnus floribundus,Santa Cruz Ironwood,2021,2021-08-28 00:00:00,3
6882,29523,DPW Maintained,Lophostemon confertus :: Brisbane Box,2000X Ingalls St,6.0,Sidewalk: Curb side : Cutout,DPW,2/28/06 0:00,6,3X3,37.72662745,-122.386329,Lophostemon,Lophostemon confertus,Brisbane Box,2006,2006-02-28 00:00:00,18
6885,90373,DPW Maintained,Tristaniopsis laurina 'Elegant' :: Small-leaf Tristania 'Elegant',399X Balboa St,3.0,Sidewalk: Curb side : Cutout,DPW,2/12/08 0:00,3,3x3,37.77722936,-122.4629046,Tristaniopsis,Tristaniopsis laurina,Small-leaf Tristania 'Elegant',2008,2008-02-12 00:00:00,16
6891,43701,DPW Maintained,Prunus cerasifera :: Cherry Plum,3342 Fulton St,1.0,Sidewalk: Curb side : Cutout,Private,7/25/00 0:00,5,,37.77339904,-122.4677282,Prunus,Prunus cerasifera,Cherry Plum,2000,2000-07-25 00:00:00,24
6892,42695,DPW Maintained,Pittosporum undulatum :: Victorian Box,1610 Leavenworth St,1.0,Sidewalk: Curb side : Cutout,Private,6/26/00 0:00,11,,37.79586759,-122.4166134,Pittosporum,Pittosporum undulatum,Victorian Box,2000,2000-06-26 00:00:00,24
6893,85748,DPW Maintained,Ulmus parvifolia 'Drake' :: Drake's Chinese Elm,900 Folsom St,3.0,Sidewalk: Curb side : Cutout,DPW,5/7/07 0:00,3,3x3,37.78028675,-122.4034394,Ulmus,Ulmus parvifolia,Drake's Chinese Elm,2007,2007-05-07 00:00:00,17
6894,30428,DPW Maintained,Pittosporum undulatum :: Victorian Box,434 Union St,1.0,Sidewalk: Curb side : Cutout,Private,5/11/56 0:00,13,7x3,37.80082159,-122.4066028,Pittosporum,Pittosporum undulatum,Victorian Box,1956,2056-05-11 00:00:00,-32
6897,41123,DPW Maintained,Prunus serrulata :: Ornamental Cherry,1941 Grove St,1.0,Sidewalk: Curb side : Cutout,Private,5/23/12 0:00,3,,37.7745166,-122.4485789,Prunus,Prunus serrulata,Ornamental Cherry,2012,2012-05-23 00:00:00,12
6900,4530,DPW Maintained,Pinus canariensis :: Canary Island Pine,45 Cleary Ct,1.0,Sidewalk: Curb side : Cutout,Private,6/7/18 0:00,3,3X3,37.78400273,-122.4265366,Pinus,Pinus canariensis,Canary Island Pine,2018,2018-06-07 00:00:00,6
6902,259370,DPW Maintained,Jacaranda mimosifolia :: Jacaranda,1466 Shafter Ave,1.0,Sidewalk: Curb side : Cutout,DPW,9/23/21 0:00,3,,37.72966735,-122.3881845,Jacaranda,Jacaranda mimosifolia,Jacaranda,2021,2021-09-23 00:00:00,3
6903,11714,Permitted Site,Arbutus 'Marina' :: Hybrid Strawberry Tree,899X Junipero Serra Blvd,1.0,Sidewalk: Curb side : Cutout,PUC,1/18/08 0:00,3,3x3,37.72165289,-122.4722096,Arbutus,Arbutus 'Marina',Hybrid Strawberry Tree,2008,2008-01-18 00:00:00,16
6909,44809,DPW Maintained,Callistemon viminalis :: Weeping Bottlebrush,1371 31st Ave,2.0,Sidewalk: Curb side : Cutout,Private,4/12/01 0:00,3,,37.76164943,-122.4899583,Callistemon,Callistemon viminalis,Weeping Bottlebrush,2001,2001-04-12 00:00:00,23
6912,84879,DPW Maintained,Brachychiton populneus :: Bottle Tree,2042 Grove St,1.0,Sidewalk: Curb side : Cutout,Private,3/20/07 0:00,2,,37.77442916,-122.4502517,Brachychiton,Brachychiton populneus,Bottle Tree,2007,2007-03-20 00:00:00,17
6913,45374,DPW Maintained,Magnolia grandiflora :: Southern Magnolia,1883 25th Ave,1.0,Sidewalk: Curb side : Cutout,Private,7/6/01 0:00,2,,37.75240896,-122.4828751,Magnolia,Magnolia grandiflora,Southern Magnolia,2001,2001-07-06 00:00:00,23
6914,102959,DPW Maintained,Tristaniopsis laurina :: Swamp Myrtle,1299X Junipero Serra Blvd,1.0,Sidewalk: Curb side : Yard,DPW,3/9/13 0:00,2,,37.71497174,-122.4715998,Tristaniopsis,Tristaniopsis laurina,Swamp Myrtle,2013,2013-03-09 00:00:00,11
6924,49549,DPW Maintained,Pyrus kawakamii :: Evergreen Pear,2434@ TARAVAL 21st Ave,1.0,Sidewalk: Curb side : Cutout,Private,4/29/03 0:00,3,,37.74224976,-122.477703,Pyrus,Pyrus kawakamii,Evergreen Pear,2003,2003-04-29 00:00:00,21
6930,16228,DPW Maintained,Trachycarpus fortunei :: Windmill Palm,564X Monterey Blvd,2.0,Median : Cutout,DPW,2/2/03 0:00,12,5,37.73165714,-122.448079,Trachycarpus,Trachycarpus fortunei,Windmill Palm,2003,2003-02-02 00:00:00,21
6939,214730,DPW Maintained,Prunus serrulata 'Kwanzan' :: Kwanzan Flowering Cherry,706 Faxon Ave,1.0,Sidewalk: Curb side : Cutout,Private,6/3/99 0:00,8,Width 2ft,37.726071,-122.4598556,Prunus,Prunus serrulata,Kwanzan Flowering Cherry,1999,1999-06-03 00:00:00,25
6945,255407,Planning Code 138.1 required,Acer rubrum :: Red Maple,199x Hayes St,3.0,Sidewalk: Curb side : Cutout,Private,5/21/18 0:00,3,3x3,37.77709167,-122.4193912,Acer,Acer rubrum,Red Maple,2018,2018-05-21 00:00:00,6
6947,19379,DPW Maintained,Platanus x hispanica :: Sycamore: London Plane,532X 06th St,1.0,Sidewalk: Curb side : Cutout,DPW,2/9/93 0:00,6,3X3,37.77552104,-122.4020374,Platanus,Platanus x,Sycamore: London Plane,1993,1993-02-09 00:00:00,31
6953,24300,DPW Maintained,Pyrus calleryana :: Ornamental Pear,10 Young Ct,1.0,Sidewalk: Curb side : Cutout,Private,12/16/92 0:00,3,3X3,37.73625178,-122.3861993,Pyrus,Pyrus calleryana,Ornamental Pear,1992,1992-12-16 00:00:00,32
6957,117017,Planning Code 138.1 required,Metrosideros excelsa :: New Zealand Xmas Tree,168 Hyde St,1.0,Sidewalk: Curb side : Cutout,Private,5/17/16 0:00,3,3x3,37.78225418,-122.415528,Metrosideros,Metrosideros excelsa,New Zealand Xmas Tree,2016,2016-05-17 00:00:00,8
6961,158242,DPW Maintained,Agonis flexuosa :: Peppermint Willow,225 Bemis St,4.0,Sidewalk: Curb side : Cutout,Private,1/22/18 0:00,3,3x3,37.73643034,-122.4315437,Agonis,Agonis flexuosa,Peppermint Willow,2018,2018-01-22 00:00:00,6
6962,31354,DPW Maintained,Leptospermum scoparium :: New Zealand Tea Tree,2324 14th Ave,1.0,Sidewalk: Curb side : Cutout,Private,4/21/95 0:00,6,,37.74460611,-122.4702433,Leptospermum,Leptospermum scoparium,New Zealand Tea Tree,1995,1995-04-21 00:00:00,29
6963,39246,Planning Code 138.1 required,Arbutus 'Marina' :: Hybrid Strawberry Tree,3524 Jackson St,2.0,Sidewalk: Curb side : Cutout,Private,8/22/02 0:00,1,,37.79019989,-122.4529105,Arbutus,Arbutus 'Marina',Hybrid Strawberry Tree,2002,2002-08-22 00:00:00,22
6966,89094,DPW Maintained,Laurus nobilis :: Sweet Bay: Grecian Laurel,543 18th Ave,1.0,Sidewalk: Curb side : Cutout,DPW,3/20/08 0:00,3,3x3,37.7776644,-122.4771185,Laurus,Laurus nobilis,Sweet Bay: Grecian Laurel,2008,2008-03-20 00:00:00,16
6968,103095,Section 806 (d),Fagus sylvatica :: European Beech,1540 Jones St,5.0,Sidewalk: Curb side : Cutout,Private,3/20/13 0:00,3,3x3,37.79569033,-122.4148858,Fagus,Fagus sylvatica,European Beech,2013,2013-03-20 00:00:00,11
6971,65270,DPW Maintained,Lophostemon confertus :: Brisbane Box,632 Commercial St,1.0,Sidewalk: Curb side : Cutout,Private,8/14/89 0:00,7,,37.79416831,-122.4036588,Lophostemon,Lophostemon confertus,Brisbane Box,1989,1989-08-14 00:00:00,35
6972,29500,DPW Maintained,Lophostemon confertus :: Brisbane Box,1750X Ingalls St,3.0,Sidewalk: Curb side : Cutout,DPW,2/28/06 0:00,8,3X3,37.72812029,-122.3849621,Lophostemon,Lophostemon confertus,Brisbane Box,2006,2006-02-28 00:00:00,18
6980,91967,DPW Maintained,Prunus serrulata 'Kwanzan' :: Kwanzan Flowering Cherry,1372 09th Ave,1.0,Sidewalk: Curb side : Cutout,DPW,2/20/09 0:00,3,3x3,37.76269828,-122.4661478,Prunus,Prunus serrulata,Kwanzan Flowering Cherry,2009,2009-02-20 00:00:00,15
6983,34626,DPW Maintained,Acacia baileyana :: Bailey's Acacia,1474 24th Ave,1.0,Sidewalk: Curb side : Cutout,Private,7/28/97 0:00,0,,37.76008592,-122.4821654,Acacia,Acacia baileyana,Bailey's Acacia,1997,1997-07-28 00:00:00,27
6987,84662,Permitted Site,Arbutus 'Marina' :: Hybrid Strawberry Tree,4010 24th St,1.0,Sidewalk: Curb side : Cutout,Private,12/27/12 0:00,5,3x3,37.75149155,-122.4321621,Arbutus,Arbutus 'Marina',Hybrid Strawberry Tree,2012,2012-12-27 00:00:00,12
7006,22781,DPW Maintained,Tristaniopsis laurina :: Swamp Myrtle,1860 Turk St,1.0,Sidewalk: Curb side : Cutout,DPW,3/21/97 0:00,6,3X3,37.77959467,-122.4398005,Tristaniopsis,Tristaniopsis laurina,Swamp Myrtle,1997,1997-03-21 00:00:00,27
7013,67660,DPW Maintained,Prunus cerasifera :: Cherry Plum,37 Lucy St,1.0,Sidewalk: Curb side : Cutout,Private,11/5/92 0:00,6,,37.73022206,-122.3933086,Prunus,Prunus cerasifera,Cherry Plum,1992,1992-11-05 00:00:00,32
7014,6809,DPW Maintained,Hymenosporum flavum :: Sweetshade,1400X Fairfax Ave,1.0,Sidewalk: Curb side : Cutout,Fire Dept,12/19/00 0:00,6,3X3,37.74039397,-122.385361,Hymenosporum,Hymenosporum flavum,Sweetshade,2000,2000-12-19 00:00:00,24
7017,6550,DPW Maintained,Ginkgo biloba :: Maidenhair Tree,1225X Evans Ave,7.0,Sidewalk: Curb side : Cutout,DPW,3/28/13 0:00,3,4x4,37.7389388,-122.3815695,Ginkgo,Ginkgo biloba,Maidenhair Tree,2013,2013-03-28 00:00:00,11
7018,24515,DPW Maintained,Lophostemon confertus :: Brisbane Box,2030 Fell St,1.0,Sidewalk: Curb side : Cutout,DPW,4/7/16 7:40,3,3X3,37.77238102,-122.4513341,Lophostemon,Lophostemon confertus,Brisbane Box,2016,2016-04-07 07:40:00,8
7020,265550,DPW Maintained,Melaleuca quinquenervia :: Cajeput,2000 Carroll Ave,1.0,Sidewalk: Curb side : Cutout,DPW,3/30/21 0:00,3,3x3,37.7293785,-122.4008662,Melaleuca,Melaleuca quinquenervia,Cajeput,2021,2021-03-30 00:00:00,3
7021,66146,DPW Maintained,Photinia fraseri :: Photinia: Chinese photinia,1870 Jefferson St,1.0,Sidewalk: Curb side : Cutout,Private,8/20/90 0:00,7,,37.80477279,-122.4432302,Photinia,Photinia fraseri,Photinia: Chinese photinia,1990,1990-08-20 00:00:00,34
7026,104834,DPW Maintained,Tristaniopsis laurina :: Swamp Myrtle,1202X Arguello Blvd,1.0,Median : Cutout,DPW,5/27/14 0:00,1,1x4,37.76565788,-122.4575258,Tristaniopsis,Tristaniopsis laurina,Swamp Myrtle,2014,2014-05-27 00:00:00,10
7031,93712,DPW Maintained,Arbutus 'Marina' :: Hybrid Strawberry Tree,1200 Silver Ave,3.0,Sidewalk: Curb side : Cutout,Private,3/22/10 0:00,2,3x3,37.7302979,-122.4120482,Arbutus,Arbutus 'Marina',Hybrid Strawberry Tree,2010,2010-03-22 00:00:00,14
7032,97690,DPW Maintained,Washingtonia robusta :: Mexican Fan Palm,290X Granada Ave,3.0,Sidewalk: Curb side : Cutout,DPW,4/1/03 0:00,15,3x3,37.72380785,-122.4570903,Washingtonia,Washingtonia robusta,Mexican Fan Palm,2003,2003-04-01 00:00:00,21
7036,24821,DPW Maintained,Tristaniopsis laurina 'Elegant' :: Small-leaf Tristania 'Elegant',400X Alemany Blvd,13.0,Sidewalk: Curb side : Cutout,DPW,3/6/06 0:00,12,3x3,37.73276839,-122.4151029,Tristaniopsis,Tristaniopsis laurina,Small-leaf Tristania 'Elegant',2006,2006-03-06 00:00:00,18
7038,113508,DPW Maintained,Callistemon citrinus :: Lemon Bottlebrush,203 WILLOW ST,1.0,Sidewalk: Curb side : Cutout,DPW,2/2/16 10:06,3,4x4,37.78315353,-122.4212819,Callistemon,Callistemon citrinus,Lemon Bottlebrush,2016,2016-02-02 10:06:00,8
7050,173775,Planning Code 138.1 required,Jacaranda mimosifolia :: Jacaranda,1057 Florida St,1.0,Sidewalk: Curb side : Cutout,Private,2/26/18 0:00,3,4x4,37.75503784,-122.4102174,Jacaranda,Jacaranda mimosifolia,Jacaranda,2018,2018-02-26 00:00:00,6
7059,9635,DPW Maintained,Pittosporum undulatum :: Victorian Box,1455 Golden Gate Ave,4.0,Sidewalk: Curb side : Cutout,DPW,12/11/97 0:00,3,3X3,37.77918932,-122.4343009,Pittosporum,Pittosporum undulatum,Victorian Box,1997,1997-12-11 00:00:00,27
7069,30446,DPW Maintained,Pittosporum undulatum :: Victorian Box,357 Union St,1.0,Sidewalk: Curb side : Cutout,Private,5/11/56 0:00,12,,37.80084204,-122.4054014,Pittosporum,Pittosporum undulatum,Victorian Box,1956,2056-05-11 00:00:00,-32
7070,29131,DPW Maintained,Lophostemon confertus :: Brisbane Box,223 Leavenworth St,1.0,Sidewalk: Curb side : Cutout,DPW,11/19/05 0:00,8,3x3,37.78311728,-122.4142169,Lophostemon,Lophostemon confertus,Brisbane Box,2005,2005-11-19 00:00:00,19
7073,21733,DPW Maintained,Lophostemon confertus :: Brisbane Box,1967 Sutter St,1.0,Sidewalk: Curb side : Cutout,DPW,12/19/15 8:18,3,3X3,37.7861011,-122.4326005,Lophostemon,Lophostemon confertus,Brisbane Box,2015,2015-12-19 08:18:00,9
7078,53443,DPW Maintained,Prunus cerasifera :: Cherry Plum,1955 Leavenworth St,1.0,Sidewalk: Curb side : Cutout,Private,5/20/86 0:00,5,,37.7992631,-122.4174742,Prunus,Prunus cerasifera,Cherry Plum,1986,1986-05-20 00:00:00,38
7081,65279,DPW Maintained,Pyrus calleryana :: Ornamental Pear,431 Tehama St,1.0,Sidewalk: Curb side : Cutout,Private,7/8/08 0:00,1,3x3,37.78046805,-122.4051027,Pyrus,Pyrus calleryana,Ornamental Pear,2008,2008-07-08 00:00:00,16
7082,51308,DPW Maintained,Ginkgo biloba :: Maidenhair Tree,455 09th St,4.0,Sidewalk: Curb side : Cutout,Private,9/13/04 0:00,1,,37.77195279,-122.4091677,Ginkgo,Ginkgo biloba,Maidenhair Tree,2004,2004-09-13 00:00:00,20
7085,14874,DPW Maintained,Lophostemon confertus :: Brisbane Box,6625X 03rd St,1.0,Sidewalk: Curb side : Cutout,Private,2/20/07 0:00,3,3x3,37.71834579,-122.3977394,Lophostemon,Lophostemon confertus,Brisbane Box,2007,2007-02-20 00:00:00,17
7086,28560,DPW Maintained,Washingtonia robusta :: Mexican Fan Palm,4631 Mission St,1.0,Sidewalk: Curb side : Cutout,Private,8/8/03 0:00,12,3x3,37.72398717,-122.4351907,Washingtonia,Washingtonia robusta,Mexican Fan Palm,2003,2003-08-08 00:00:00,21
7088,239740,DPW Maintained,Schinus terebinthifolius :: Brazilian Pepper,1314 Noe St,3.0,Sidewalk: Curb side : Cutout,Private,11/15/17 0:00,3,6x6,37.74783099,-122.4316189,Schinus,Schinus terebinthifolius,Brazilian Pepper,2017,2017-11-15 00:00:00,7
7089,51368,DPW Maintained,Celtis sinensis :: Chinese Hackberry,50 Pomona St,2.0,Sidewalk: Curb side : Cutout,SFUSD,10/12/04 0:00,3,3x3,37.73248114,-122.39335,Celtis,Celtis sinensis,Chinese Hackberry,2004,2004-10-12 00:00:00,20
7090,91987,DPW Maintained,Prunus serrulata 'Kwanzan' :: Kwanzan Flowering Cherry,1327 09th Ave,1.0,Sidewalk: Curb side : Cutout,DPW,2/23/09 0:00,3,3x3,37.76351373,-122.4663434,Prunus,Prunus serrulata,Kwanzan Flowering Cherry,2009,2009-02-23 00:00:00,15
7096,28418,DPW Maintained,Washingtonia robusta :: Mexican Fan Palm,1942 Ocean Ave,1.0,Sidewalk: Curb side : Cutout,DPW,4/1/03 0:00,18,3X3,37.72583941,-122.4634543,Washingtonia,Washingtonia robusta,Mexican Fan Palm,2003,2003-04-01 00:00:00,21
7098,253000,DPW Maintained,Magnolia grandiflora 'Saint Mary' :: Saint Mary Magnolia,1201 Tennessee St,9.0,Sidewalk: Curb side : Cutout,Private,7/10/17 0:00,3,,37.7563302,-122.3890342,Magnolia,Magnolia grandiflora,Saint Mary Magnolia,2017,2017-07-10 00:00:00,7
7099,27517,DPW Maintained,Prunus serrulata 'Kwanzan' :: Kwanzan Flowering Cherry,1212 Guerrero St,8.0,Sidewalk: Curb side : Cutout,Private,6/8/00 0:00,8,3X3,37.75128266,-122.4229431,Prunus,Prunus serrulata,Kwanzan Flowering Cherry,2000,2000-06-08 00:00:00,24
7100,15607,DPW Maintained,Platanus x hispanica :: Sycamore: London Plane,3350 Mission St,2.0,Sidewalk: Curb side : Cutout,Private,1/22/05 0:00,3,3x3,37.74297758,-122.4216902,Platanus,Platanus x,Sycamore: London Plane,2005,2005-01-22 00:00:00,19
7107,68256,DPW Maintained,Agonis flexuosa :: Peppermint Willow,243 Holyoke St,1.0,Sidewalk: Curb side : Cutout,Private,8/9/93 0:00,16,,37.7281816,-122.4092192,Agonis,Agonis flexuosa,Peppermint Willow,1993,1993-08-09 00:00:00,31
7108,28254,DPW Maintained,Prunus serrulata 'Kwanzan' :: Kwanzan Flowering Cherry,3410 San Bruno Ave,1.0,Sidewalk: Curb side : Cutout,DPW,2/23/02 0:00,8,3X3,37.718938,-122.400476,Prunus,Prunus serrulata,Kwanzan Flowering Cherry,2002,2002-02-23 00:00:00,22
7111,25776,DPW Maintained,Arbutus 'Marina' :: Hybrid Strawberry Tree,1927 Geneva Ave,1.0,Sidewalk: Curb side : Cutout,Private,2/7/97 0:00,18,2X3,37.70909366,-122.4224183,Arbutus,Arbutus 'Marina',Hybrid Strawberry Tree,1997,1997-02-07 00:00:00,27
7112,265022,Section 806 (d),Lophostemon confertus :: Brisbane Box,99 Harlan Pl,1.0,Sidewalk: Curb side : Cutout,Private,3/17/21 0:00,3,6x6,37.79003311,-122.4054579,Lophostemon,Lophostemon confertus,Brisbane Box,2021,2021-03-17 00:00:00,3
7115,32058,DPW Maintained,Lophostemon confertus :: Brisbane Box,3632 17th St,1.0,Sidewalk: Curb side : Cutout,Private,8/9/95 0:00,13,,37.76303723,-122.4270489,Lophostemon,Lophostemon confertus,Brisbane Box,1995,1995-08-09 00:00:00,29
7126,30759,DPW Maintained,Crataegus laevigata :: English Hawthorn,1563 Thomas Ave,1.0,Sidewalk: Curb side : Cutout,Private,10/31/05 0:00,5,,37.72994943,-122.3906539,Crataegus,Crataegus laevigata,English Hawthorn,2005,2005-10-31 00:00:00,19
7128,266065,DPW Maintained,Eriobotrya deflexa :: Bronze Loquat,16 Lisbon St,19.0,Sidewalk: Curb side : Cutout,Private,7/7/21 0:00,3,Width 3ft,37.72695701,-122.4299548,Eriobotrya,Eriobotrya deflexa,Bronze Loquat,2021,2021-07-07 00:00:00,3
7136,38371,DPW Maintained,Metrosideros excelsa :: New Zealand Xmas Tree,4245 Lawton St,1.0,Sidewalk: Curb side : Cutout,Private,2/2/11 0:00,1,,37.75648082,-122.5087216,Metrosideros,Metrosideros excelsa,New Zealand Xmas Tree,2011,2011-02-02 00:00:00,13
7138,14869,Permitted Site,Ulmus parvifolia :: Chinese Elm,1399 McAllister St,6.0,Sidewalk: Curb side : Cutout,Private,4/10/11 0:00,3,3x3,37.77813559,-122.4346677,Ulmus,Ulmus parvifolia,Chinese Elm,2011,2011-04-10 00:00:00,13
7141,28946,DPW Maintained,Lophostemon confertus :: Brisbane Box,367 09th St,1.0,Sidewalk: Curb side : Cutout,Private,2/17/06 0:00,6,3x3,37.77299238,-122.4104855,Lophostemon,Lophostemon confertus,Brisbane Box,2006,2006-02-17 00:00:00,18
7142,85991,DPW Maintained,Prunus serrulata 'Kwanzan' :: Kwanzan Flowering Cherry,2222 28th Ave,1.0,Sidewalk: Curb side : Cutout,DPW,1/12/07 0:00,3,3x3,37.74590853,-122.4854967,Prunus,Prunus serrulata,Kwanzan Flowering Cherry,2007,2007-01-12 00:00:00,17
7143,42892,DPW Maintained,Melaleuca quinquenervia :: Cajeput,2338 Ulloa St,1.0,Sidewalk: Curb side : Cutout,Private,7/3/00 0:00,0,,37.74100022,-122.4813456,Melaleuca,Melaleuca quinquenervia,Cajeput,2000,2000-07-03 00:00:00,24
7154,10358,Permitted Site,Lophostemon confertus :: Brisbane Box,1061 Haight St,1.0,Sidewalk: Curb side : Cutout,Private,11/24/92 0:00,30,3X3,37.77086214,-122.4396933,Lophostemon,Lophostemon confertus,Brisbane Box,1992,1992-11-24 00:00:00,32
7155,43179,DPW Maintained,Acacia baileyana :: Bailey's Acacia,2299 Sutter St,1.0,Sidewalk: Curb side : Cutout,Private,7/11/00 0:00,5,3x3,37.78539276,-122.4380915,Acacia,Acacia baileyana,Bailey's Acacia,2000,2000-07-11 00:00:00,24
7162,50493,Permitted Site,Pittosporum undulatum :: Victorian Box,639 Edinburg St,1.0,Sidewalk: Curb side : Cutout,Private,5/17/16 0:00,3,3x3,37.71903041,-122.4335693,Pittosporum,Pittosporum undulatum,Victorian Box,2016,2016-05-17 00:00:00,8
7167,86823,DPW Maintained,Ginkgo biloba :: Maidenhair Tree,290 Alhambra St,1.0,Sidewalk: Curb side : Cutout,Private,10/12/07 0:00,1,3x3,37.80124375,-122.4410037,Ginkgo,Ginkgo biloba,Maidenhair Tree,2007,2007-10-12 00:00:00,17
7169,39523,DPW Maintained,Melaleuca quinquenervia :: Cajeput,1330 16th St,5.0,Sidewalk: Curb side : Cutout,Private,12/28/98 0:00,9,,37.76629829,-122.4003389,Melaleuca,Melaleuca quinquenervia,Cajeput,1998,1998-12-28 00:00:00,26
7171,6755,DPW Maintained,Magnolia grandiflora 'Little Gem' :: Little Gem Magnolia,1215 Fairfax Ave,9.0,Sidewalk: Curb side : Cutout,DPW,1/3/17 6:41,3,3x3,37.73824043,-122.3819127,Magnolia,Magnolia grandiflora,Little Gem Magnolia,2017,2017-01-03 06:41:00,7
7173,93274,DPW Maintained,Magnolia grandiflora 'Samuel Sommer' :: Samuel Sommer Magnolia,1613 Church St,1.0,Sidewalk: Curb side : Cutout,DPW,12/4/08 0:00,3,3x3,37.74509613,-122.4267598,Magnolia,Magnolia grandiflora,Samuel Sommer Magnolia,2008,2008-12-04 00:00:00,16
7174,48683,DPW Maintained,Acacia melanoxylon :: Blackwood Acacia,3839 Washington St,3.0,Sidewalk: Curb side : Cutout,Private,9/11/02 0:00,24,,37.78875378,-122.4560043,Acacia,Acacia melanoxylon,Blackwood Acacia,2002,2002-09-11 00:00:00,22
7175,79013,DPW Maintained,Tristaniopsis laurina :: Swamp Myrtle,1719 20th Ave,1.0,Sidewalk: Curb side : Cutout,Private,10/29/07 0:00,2,3x3,37.75566968,-122.4777507,Tristaniopsis,Tristaniopsis laurina,Swamp Myrtle,2007,2007-10-29 00:00:00,17
7187,50660,DPW Maintained,Tristaniopsis laurina :: Swamp Myrtle,629 Chestnut St,1.0,Sidewalk: Curb side : Cutout,Private,10/18/07 0:00,4,3x3,37.80363478,-122.4137055,Tristaniopsis,Tristaniopsis laurina,Swamp Myrtle,2007,2007-10-18 00:00:00,17
7192,4879,DPW Maintained,Ginkgo biloba :: Maidenhair Tree,72 Crags Ct,1.0,Sidewalk: Curb side : Cutout,Private,5/22/92 0:00,20,3X3,37.74058321,-122.4395406,Ginkgo,Ginkgo biloba,Maidenhair Tree,1992,1992-05-22 00:00:00,32
7196,39582,DPW Maintained,Ginkgo biloba :: Maidenhair Tree,450 Rhode Island St,6.0,Sidewalk: Curb side : Cutout,Private,2/6/09 0:00,3,3x3,37.76424784,-122.4026172,Ginkgo,Ginkgo biloba,Maidenhair Tree,2009,2009-02-06 00:00:00,15
7203,63614,DPW Maintained,Metrosideros excelsa :: New Zealand Xmas Tree,2087 Golden Gate Ave,1.0,Sidewalk: Curb side : Cutout,Private,5/31/89 0:00,10,,37.77785311,-122.4448098,Metrosideros,Metrosideros excelsa,New Zealand Xmas Tree,1989,1989-05-31 00:00:00,35
7204,43613,DPW Maintained,Hakea suaveolens :: Sweet Hakea Tree,2278 33rd Ave,1.0,Sidewalk: Curb side : Cutout,Private,7/20/00 0:00,3,,37.74467374,-122.4907612,Hakea,Hakea suaveolens,Sweet Hakea Tree,2000,2000-07-20 00:00:00,24
7213,8686,DPW Maintained,Olea europaea :: Olive Tree,2925 Geary Blvd,2.0,Sidewalk: Curb side : Cutout,DPW,3/30/11 0:00,3,3x3,37.78194829,-122.4503144,Olea,Olea europaea,Olive Tree,2011,2011-03-30 00:00:00,13
7214,92301,DPW Maintained,Arbutus 'Marina' :: Hybrid Strawberry Tree,2630 22nd Ave,1.0,Sidewalk: Curb side : Cutout,Private,7/27/09 0:00,2,3x3,37.73856578,-122.4785233,Arbutus,Arbutus 'Marina',Hybrid Strawberry Tree,2009,2009-07-27 00:00:00,15
7220,29362,DPW Maintained,Arbutus unedo :: Strawberry Tree,1600X Portola Dr,4.0,Median : Cutout,DPW,4/4/09 0:00,3,3X3,37.73598535,-122.4701852,Arbutus,Arbutus unedo,Strawberry Tree,2009,2009-04-04 00:00:00,15
7223,5446,DPW Maintained,Phoenix canariensis :: Canary Island Date Palm,500X Dolores St,14.0,Median : Cutout,DPW,3/20/90 0:00,90,6,37.76141276,-122.4261813,Phoenix,Phoenix canariensis,Canary Island Date Palm,1990,1990-03-20 00:00:00,34
7226,58694,DPW Maintained,Pyrus kawakamii :: Evergreen Pear,3633 Jackson St,1.0,Sidewalk: Curb side : Cutout,Private,7/2/79 0:00,4,,37.78984319,-122.4547526,Pyrus,Pyrus kawakamii,Evergreen Pear,1979,1979-07-02 00:00:00,45
7233,44471,DPW Maintained,Callistemon citrinus :: Lemon Bottlebrush,133 Harvard St,1.0,Sidewalk: Curb side : Cutout,Private,3/26/01 0:00,7,,37.72787613,-122.421107,Callistemon,Callistemon citrinus,Lemon Bottlebrush,2001,2001-03-26 00:00:00,23
7240,16980,DPW Maintained,Tristaniopsis laurina :: Swamp Myrtle,830X Oak St,2.0,Sidewalk: Curb side : Cutout,DPW,2/22/08 0:00,3,3X3,37.77375884,-122.4330022,Tristaniopsis,Tristaniopsis laurina,Swamp Myrtle,2008,2008-02-22 00:00:00,16
7241,112972,Planning Code 138.1 required,Arbutus 'Marina' :: Hybrid Strawberry Tree,4099x ULLOA ST,1.0,Sidewalk: Property side : Cutout,Private,10/20/15 0:00,1,3x3,37.7399635,-122.5000353,Arbutus,Arbutus 'Marina',Hybrid Strawberry Tree,2015,2015-10-20 00:00:00,9
7250,221998,DPW Maintained,Albizia julibrissin :: Mimosa Silk Tree,171 Liberty St,1.0,Sidewalk: Curb side : Cutout,Private,4/27/17 0:00,3,Width 3ft,37.7574213,-122.4249171,Albizia,Albizia julibrissin,Mimosa Silk Tree,2017,2017-04-27 00:00:00,7
7256,44741,DPW Maintained,Prunus serrulata 'Kwanzan' :: Kwanzan Flowering Cherry,271 Saint Charles Ave,1.0,Sidewalk: Curb side : Cutout,Private,4/3/01 0:00,3,,37.70900134,-122.4692259,Prunus,Prunus serrulata,Kwanzan Flowering Cherry,2001,2001-04-03 00:00:00,23
7262,22707,Permitted Site,Tristaniopsis laurina 'Elegant' :: Small-leaf Tristania 'Elegant',1420 Turk St,4.0,Sidewalk: Curb side : Cutout,Private,1/19/01 0:00,6,3X3,37.78042036,-122.4332368,Tristaniopsis,Tristaniopsis laurina,Small-leaf Tristania 'Elegant',2001,2001-01-19 00:00:00,23
7265,50472,Permitted Site,Acacia baileyana :: Bailey's Acacia,3010X Lyon St,4.0,Sidewalk: Curb side : Cutout,Private,10/21/03 0:00,5,3x3,37.79857955,-122.4469203,Acacia,Acacia baileyana,Bailey's Acacia,2003,2003-10-21 00:00:00,21
7271,72131,DPW Maintained,Pyrus calleryana :: Ornamental Pear,975 Wisconsin St,1.0,Sidewalk: Curb side : Cutout,Private,6/2/14 0:00,1,,37.75516197,-122.3986472,Pyrus,Pyrus calleryana,Ornamental Pear,2014,2014-06-02 00:00:00,10
7274,11666,DPW Maintained,Corymbia ficifolia :: Red Flowering Gum,700X Junipero Serra Blvd,5.0,Sidewalk: Curb side : Cutout,DPW,12/8/92 0:00,12,4X4,37.72672368,-122.4722325,Corymbia,Corymbia ficifolia,Red Flowering Gum,1992,1992-12-08 00:00:00,32
7276,104454,DPW Maintained,Acer rubrum 'Armstrong' :: Armstrong Red Maple,616 20th St,1.0,Sidewalk: Curb side : Cutout,Private,10/7/13 0:00,2,3x3,37.76059662,-122.3879269,Acer,Acer rubrum,Armstrong Red Maple,2013,2013-10-07 00:00:00,11
7281,6942,DPW Maintained,Lophostemon confertus :: Brisbane Box,556 Fell St,1.0,Sidewalk: Curb side : Cutout,DPW,10/17/12 0:00,3,3X3,37.77548912,-122.4269734,Lophostemon,Lophostemon confertus,Brisbane Box,2012,2012-10-17 00:00:00,12
7285,120502,DPW Maintained,Acer palmatum :: Japanese Maple,50X Ecker St,5.0,Sidewalk: Curb side : Cutout,Private,10/13/16 0:00,3,3x3,37.78929349,-122.3985083,Acer,Acer palmatum,Japanese Maple,2016,2016-10-13 00:00:00,8
7290,42352,DPW Maintained,Callistemon citrinus :: Lemon Bottlebrush,380X Flood Ave,11.0,Sidewalk: Curb side : Cutout,SFUSD,6/23/00 0:00,5,3x3,37.73029437,-122.4487679,Callistemon,Callistemon citrinus,Lemon Bottlebrush,2000,2000-06-23 00:00:00,24
7298,35258,DPW Maintained,Acacia baileyana :: Bailey's Acacia,1304 Lombard St,1.0,Sidewalk: Curb side : Cutout,Private,2/17/98 0:00,11,,37.80159232,-122.423173,Acacia,Acacia baileyana,Bailey's Acacia,1998,1998-02-17 00:00:00,26
7301,99282,DPW Maintained,Pyrus calleryana :: Ornamental Pear,1500 Fillmore St,1.0,Sidewalk: Curb side : Cutout,DPW,12/14/13 0:00,3,,37.78492343,-122.4332991,Pyrus,Pyrus calleryana,Ornamental Pear,2013,2013-12-14 00:00:00,11
7308,14624,DPW Maintained,Prunus serrulata 'Kwanzan' :: Kwanzan Flowering Cherry,14 Matthew Ct,1.0,Sidewalk: Curb side : Cutout,DPW,2/12/98 0:00,6,3X4,37.73141354,-122.3800824,Prunus,Prunus serrulata,Kwanzan Flowering Cherry,1998,1998-02-12 00:00:00,26
7309,52337,DPW Maintained,Tristaniopsis laurina :: Swamp Myrtle,19 Clementina St,2.0,Sidewalk: Curb side : Cutout,Private,12/6/05 0:00,2,,37.78716921,-122.3956076,Tristaniopsis,Tristaniopsis laurina,Swamp Myrtle,2005,2005-12-06 00:00:00,19
7311,29058,DPW Maintained,Magnolia grandiflora :: Southern Magnolia,428X 11th St,1.0,Sidewalk: Curb side : Cutout,DPW,12/27/05 0:00,3,3x3,37.7700333,-122.4118919,Magnolia,Magnolia grandiflora,Southern Magnolia,2005,2005-12-27 00:00:00,19
7316,27246,DPW Maintained,Eriobotrya deflexa :: Bronze Loquat,1840X Oakdale Ave,2.0,Sidewalk: Curb side : Cutout,Private,3/11/06 0:00,3,3X3,37.73722522,-122.3947622,Eriobotrya,Eriobotrya deflexa,Bronze Loquat,2006,2006-03-11 00:00:00,18
7321,252906,Planning Code 138.1 required,Pittosporum undulatum :: Victorian Box,600 South Van Ness Ave,2.0,Sidewalk: Curb side : Cutout,Private,6/26/17 0:00,3,3x3,37.76351931,-122.4173968,Pittosporum,Pittosporum undulatum,Victorian Box,2017,2017-06-26 00:00:00,7
7323,114096,DPW Maintained,Magnolia doltsopa :: Himalayan Magnolia,424 Ellington Ave,2.0,Sidewalk: Curb side : Cutout,Private,10/30/15 0:00,3,3x3,37.71186706,-122.4472503,Magnolia,Magnolia doltsopa,Himalayan Magnolia,2015,2015-10-30 00:00:00,9
7328,121798,Undocumented,Myoporum laetum :: Myoporum,310 Miguel St,2.0,Sidewalk: Curb side : Cutout,Private,11/22/16 0:00,3,3x3,37.73704317,-122.4277028,Myoporum,Myoporum laetum,Myoporum,2016,2016-11-22 00:00:00,8
7329,102167,Permitted Site,Jacaranda mimosifolia :: Jacaranda,677 Castro St,1.0,Sidewalk: Curb side : Cutout,Private,12/31/12 0:00,4,3x3,37.75813732,-122.4345659,Jacaranda,Jacaranda mimosifolia,Jacaranda,2012,2012-12-31 00:00:00,12
7334,28575,Permitted Site,Tristaniopsis laurina 'Elegant' :: Small-leaf Tristania 'Elegant',1250 Capitol Ave,1.0,Sidewalk: Curb side : Cutout,Private,4/1/03 0:00,3,3X3,37.72420158,-122.4590485,Tristaniopsis,Tristaniopsis laurina,Small-leaf Tristania 'Elegant',2003,2003-04-01 00:00:00,21
7335,11672,DPW Maintained,Corymbia ficifolia :: Red Flowering Gum,710X Junipero Serra Blvd,9.0,Median : Cutout,DPW,3/9/13 0:00,3,6X6,37.72644069,-122.4722609,Corymbia,Corymbia ficifolia,Red Flowering Gum,2013,2013-03-09 00:00:00,11
7338,5961,DPW Maintained,Pittosporum undulatum :: Victorian Box,1510 Eddy St,2.0,Sidewalk: Curb side : Cutout,DPW,2/2/90 0:00,6,3X3,37.78143815,-122.4326961,Pittosporum,Pittosporum undulatum,Victorian Box,1990,1990-02-02 00:00:00,34
7340,84851,DPW Maintained,Magnolia grandiflora :: Southern Magnolia,1218 Leavenworth St,1.0,Sidewalk: Curb side : Cutout,Private,4/24/07 0:00,3,,37.79249886,-122.4159368,Magnolia,Magnolia grandiflora,Southern Magnolia,2007,2007-04-24 00:00:00,17
7342,52583,DPW Maintained,Tristaniopsis laurina :: Swamp Myrtle,1047 Clay St,1.0,Sidewalk: Curb side : Cutout,Private,1/24/06 0:00,4,3x3,37.7936866,-122.4104824,Tristaniopsis,Tristaniopsis laurina,Swamp Myrtle,2006,2006-01-24 00:00:00,18
7345,904,DPW Maintained,Tristaniopsis laurina 'Elegant' :: Small-leaf Tristania 'Elegant',1179 Alemany Blvd,1.0,Sidewalk: Curb side : Cutout,DPW,2/22/16 0:00,3,2X2,37.73064187,-122.4304926,Tristaniopsis,Tristaniopsis laurina,Small-leaf Tristania 'Elegant',2016,2016-02-22 00:00:00,8
7348,69395,DPW Maintained,Prunus serrulata 'Kwanzan' :: Kwanzan Flowering Cherry,1075 Munich St,1.0,Sidewalk: Curb side : Cutout,Private,5/9/94 0:00,4,,37.71105819,-122.434662,Prunus,Prunus serrulata,Kwanzan Flowering Cherry,1994,1994-05-09 00:00:00,30
7349,30701,DPW Maintained,Podocarpus macrophyllus :: Yew Pine,241 Lily St,1.0,Sidewalk: Curb side : Cutout,Private,1/31/95 0:00,4,,37.77421908,-122.4248784,Podocarpus,Podocarpus macrophyllus,Yew Pine,1995,1995-01-31 00:00:00,29
7352,90691,DPW Maintained,Agonis flexuosa :: Peppermint Willow,4030 Cabrillo St,1.0,Sidewalk: Curb side : Cutout,DPW,4/7/08 0:00,3,3x3,37.77370203,-122.5020892,Agonis,Agonis flexuosa,Peppermint Willow,2008,2008-04-07 00:00:00,16
7354,61387,DPW Maintained,Magnolia grandiflora :: Southern Magnolia,1907 Buchanan St,1.0,Sidewalk: Curb side : Cutout,Private,4/10/84 0:00,8,,37.78789798,-122.4303505,Magnolia,Magnolia grandiflora,Southern Magnolia,1984,1984-04-10 00:00:00,40
7369,100339,DPW Maintained,Lophostemon confertus :: Brisbane Box,1190 Mission St,2.0,Sidewalk: Curb side : Cutout,Private,8/6/12 0:00,2,3x3,37.77789539,-122.412734,Lophostemon,Lophostemon confertus,Brisbane Box,2012,2012-08-06 00:00:00,12
7372,253025,DPW Maintained,Tristaniopsis laurina 'Elegant' :: Small-leaf Tristania 'Elegant',1754 09th Ave,1.0,Sidewalk: Curb side : Cutout,DPW,7/11/17 0:00,3,,37.75555875,-122.4656508,Tristaniopsis,Tristaniopsis laurina,Small-leaf Tristania 'Elegant',2017,2017-07-11 00:00:00,7
7375,55863,Permitted Site,Zelkova serrata :: Sawleaf Zelkova,261 Fair Oaks St,1.0,Sidewalk: Curb side : Cutout,Private,4/25/73 0:00,12,3x3,37.75254447,-122.423957,Zelkova,Zelkova serrata,Sawleaf Zelkova,1973,2073-04-25 00:00:00,-49
7378,201819,DPW Maintained,Lagunaria patersonii :: Primrose Tree,100 Friedell St,3.0,Sidewalk: Curb side : Yard,Private,7/12/17 0:00,3,Width 4ft,37.72898313,-122.3693992,Lagunaria,Lagunaria patersonii,Primrose Tree,2017,2017-07-12 00:00:00,7
7379,67638,DPW Maintained,Tristaniopsis laurina :: Swamp Myrtle,55 Del Monte St,1.0,Sidewalk: Curb side : Cutout,Private,10/30/92 0:00,8,,37.71587575,-122.4434125,Tristaniopsis,Tristaniopsis laurina,Swamp Myrtle,1992,1992-10-30 00:00:00,32
7380,58129,DPW Maintained,Tristaniopsis laurina 'Elegant' :: Small-leaf Tristania 'Elegant',2632 Bush St,1.0,Sidewalk: Curb side : Cutout,Private,2/20/18 0:00,3,,37.78617882,-122.4407168,Tristaniopsis,Tristaniopsis laurina,Small-leaf Tristania 'Elegant',2018,2018-02-20 00:00:00,6
7381,225872,Permitted Site,Fraxinus uhdei :: Shamel Ash: Evergreen Ash,918 Alabama St,1.0,Sidewalk: Curb side : Cutout,Private,1/31/83 0:00,17,Width 3ft,37.75680079,-122.411433,Fraxinus,Fraxinus uhdei,Shamel Ash: Evergreen Ash,1983,1983-01-31 00:00:00,41
7383,28320,DPW Maintained,Acer buergeranum :: Trident Maple,461 Cortland Ave,1.0,Sidewalk: Curb side : Cutout,Private,11/22/03 0:00,4,3X3,37.73913868,-122.4166954,Acer,Acer buergeranum,Trident Maple,2003,2003-11-22 00:00:00,21
7402,94328,DPW Maintained,Acacia cognata :: River Wattle,599X Wisconsin St,5.0,Sidewalk: Property side : Yard,Private,7/15/10 0:00,6,8x6,37.76013605,-122.3990804,Acacia,Acacia cognata,River Wattle,2010,2010-07-15 00:00:00,14
7404,6831,Permitted Site,Magnolia grandiflora :: Southern Magnolia,1450X Fairfax Ave,14.0,Sidewalk: Curb side : Cutout,Fire Dept,3/30/06 0:00,3,3X3,37.74083447,-122.3861797,Magnolia,Magnolia grandiflora,Southern Magnolia,2006,2006-03-30 00:00:00,18
7405,40650,DPW Maintained,Crataegus phaenopyrum :: Washington Hawthorn,201 Congdon St,3.0,Sidewalk: Curb side : Cutout,Private,8/10/99 0:00,7,,37.72994746,-122.4260078,Crataegus,Crataegus phaenopyrum,Washington Hawthorn,1999,1999-08-10 00:00:00,25
7420,59473,DPW Maintained,Prunus cerasifera :: Cherry Plum,1615 Fulton St,1.0,Sidewalk: Curb side : Cutout,Private,6/19/08 0:00,5,3x3,37.77610925,-122.4435311,Prunus,Prunus cerasifera,Cherry Plum,2008,2008-06-19 00:00:00,16
7423,15210,DPW Maintained,Lophostemon confertus :: Brisbane Box,1142 Mission St,5.0,Sidewalk: Curb side : Cutout,DPW,1/16/95 0:00,12,3X3,37.77850613,-122.4119525,Lophostemon,Lophostemon confertus,Brisbane Box,1995,1995-01-16 00:00:00,29
7429,65706,DPW Maintained,Tristaniopsis laurina :: Swamp Myrtle,230 Allison St,1.0,Sidewalk: Curb side : Cutout,Private,4/18/90 0:00,10,,37.71198139,-122.4415121,Tristaniopsis,Tristaniopsis laurina,Swamp Myrtle,1990,1990-04-18 00:00:00,34
7431,114108,Undocumented,Grevillea robusta :: Silk Oak Tree,2650 21st St,2.0,Sidewalk: Curb side : Cutout,Private,5/2/16 0:00,3,6x10,37.75782744,-122.4079094,Grevillea,Grevillea robusta,Silk Oak Tree,2016,2016-05-02 00:00:00,8
7433,69407,DPW Maintained,Schinus terebinthifolius :: Brazilian Pepper,795 Prague St,1.0,Sidewalk: Curb side : Cutout,Private,5/9/94 0:00,12,,37.71085719,-122.4334565,Schinus,Schinus terebinthifolius,Brazilian Pepper,1994,1994-05-09 00:00:00,30
7435,59236,DPW Maintained,Ficus microcarpa nitida 'Green Gem' :: Indian Laurel Fig Tree 'Green Gem',2252 Filbert St,1.0,Sidewalk: Curb side : Cutout,Private,7/14/80 0:00,13,,37.79797431,-122.4365806,Ficus,Ficus microcarpa,Indian Laurel Fig Tree 'Green Gem',1980,1980-07-14 00:00:00,44
7437,13650,DPW Maintained,Platanus x hispanica :: Sycamore: London Plane,595 Market St,3.0,Sidewalk: Curb side : Cutout,DPW,10/28/05 0:00,3,4x4,37.78951553,-122.4008566,Platanus,Platanus x,Sycamore: London Plane,2005,2005-10-28 00:00:00,19
7439,112021,DPW Maintained,Lagunaria patersonii :: Primrose Tree,2101x 22nd Ave,1.0,Sidewalk: Curb side : Cutout,SFUSD,7/23/15 0:00,3,5x5,37.75709345,-122.4023192,Lagunaria,Lagunaria patersonii,Primrose Tree,2015,2015-07-23 00:00:00,9
7442,99298,DPW Maintained,Leptospermum scoparium :: New Zealand Tea Tree,50 Norton St,1.0,Sidewalk: Curb side : Cutout,Private,5/1/12 0:00,4,3x3,37.7250894,-122.4357964,Leptospermum,Leptospermum scoparium,New Zealand Tea Tree,2012,2012-05-01 00:00:00,12
7450,62239,DPW Maintained,Tristaniopsis laurina :: Swamp Myrtle,480 Capistrano Ave,1.0,Sidewalk: Curb side : Cutout,Private,10/3/85 0:00,9,,37.72461649,-122.4393224,Tristaniopsis,Tristaniopsis laurina,Swamp Myrtle,1985,1985-10-03 00:00:00,39
7455,30977,Permitted Site,Arbutus 'Marina' :: Hybrid Strawberry Tree,1950 Jackson St,4.0,Sidewalk: Curb side : Cutout,Private,3/13/95 0:00,28,6x12,37.79348082,-122.4271893,Arbutus,Arbutus 'Marina',Hybrid Strawberry Tree,1995,1995-03-13 00:00:00,29
7462,29305,DPW Maintained,Lophostemon confertus :: Brisbane Box,1000X Portola Dr,8.0,Median : Cutout,DPW,10/14/05 0:00,3,3X3,37.7416859,-122.4564821,Lophostemon,Lophostemon confertus,Brisbane Box,2005,2005-10-14 00:00:00,19
7465,38094,DPW Maintained,Prunus cerasifera :: Cherry Plum,2624 Sutter St,1.0,Sidewalk: Curb side : Cutout,Private,7/10/98 0:00,6,,37.78476501,-122.4442406,Prunus,Prunus cerasifera,Cherry Plum,1998,1998-07-10 00:00:00,26
7483,42625,DPW Maintained,Olea europaea :: Olive Tree,1844 Laguna St,1.0,Sidewalk: Curb side : Cutout,Private,6/26/00 0:00,7,,37.78829009,-122.4285655,Olea,Olea europaea,Olive Tree,2000,2000-06-26 00:00:00,24
7486,261997,Planning Code 138.1 required,Platanus x hispanica :: Sycamore: London Plane,607X Florida St,3.0,Sidewalk: Curb side : Cutout,Private,4/7/20 0:00,3,4x4,37.76159237,-122.4110119,Platanus,Platanus x,Sycamore: London Plane,2020,2020-04-07 00:00:00,4
7487,43976,Permitted Site,Aesculus x carnea 'Briotii' :: Ruby Horse Chestnut,39 Homestead St,2.0,Sidewalk: Curb side : Cutout,Private,8/24/00 0:00,3,,37.75033816,-122.4393957,Aesculus,Aesculus x,Ruby Horse Chestnut,2000,2000-08-24 00:00:00,24
7489,45642,DPW Maintained,Ligustrum japonicum :: Japanese Privet,557 27th Ave,1.0,Sidewalk: Curb side : Cutout,Private,8/14/01 0:00,3,,37.77889492,-122.4868787,Ligustrum,Ligustrum japonicum,Japanese Privet,2001,2001-08-14 00:00:00,23
7496,21798,Permitted Site,Platanus x hispanica :: Sycamore: London Plane,2600X Taylor St,3.0,Sidewalk: Curb side : Cutout,Private,1/22/16 0:00,12,3X3,37.80691155,-122.414701,Platanus,Platanus x,Sycamore: London Plane,2016,2016-01-22 00:00:00,8
7503,57909,DPW Maintained,Tristaniopsis laurina :: Swamp Myrtle,900 Pine St,1.0,Sidewalk: Curb side : Cutout,Private,6/10/77 0:00,3,,37.79091287,-122.4109101,Tristaniopsis,Tristaniopsis laurina,Swamp Myrtle,1977,1977-06-10 00:00:00,47
7504,108416,Permitted Site,Arbutus 'Marina' :: Hybrid Strawberry Tree,2835-2899X 26th St,3.0,Sidewalk: Curb side : Cutout,Private,12/22/14 0:00,3,3x3,37.74853714,-122.4256382,Arbutus,Arbutus 'Marina',Hybrid Strawberry Tree,2014,2014-12-22 00:00:00,10
7508,163649,Private,Magnolia grandiflora 'Little Gem' :: Little Gem Magnolia,226 Sagamore St,1.0,Sidewalk: Curb side : Cutout,Private,7/1/20 0:00,3,3x4,37.71149519,-122.4600166,Magnolia,Magnolia grandiflora,Little Gem Magnolia,2020,2020-07-01 00:00:00,4
7509,53664,DPW Maintained,Magnolia grandiflora :: Southern Magnolia,1541 Polk St,1.0,Sidewalk: Curb side : Cutout,Private,12/30/69 0:00,3,,37.79114186,-122.4208863,Magnolia,Magnolia grandiflora,Southern Magnolia,1969,2069-12-30 00:00:00,-45
7512,43131,DPW Maintained,Melaleuca linariifolia :: Flaxleaf Paperbark,10 Athens St,1.0,Sidewalk: Curb side : Cutout,Private,7/11/00 0:00,13,,37.72802172,-122.4237162,Melaleuca,Melaleuca linariifolia,Flaxleaf Paperbark,2000,2000-07-11 00:00:00,24
7517,93414,DPW Maintained,Podocarpus macrophyllus :: Yew Pine,1722 Taraval St,1.0,Sidewalk: Curb side : Cutout,DPW,2/19/15 15:10,3,3x3,37.74274949,-122.4847421,Podocarpus,Podocarpus macrophyllus,Yew Pine,2015,2015-02-19 15:10:00,9
7518,111007,DPW Maintained,Platanus x hispanica :: Sycamore: London Plane,600X Beach St,1.0,Sidewalk: Curb side : Cutout,Private,7/15/15 0:00,3,,37.80689292,-122.4191851,Platanus,Platanus x,Sycamore: London Plane,2015,2015-07-15 00:00:00,9
7521,250075,Planning Code 138.1 required,Pittosporum undulatum :: Victorian Box,1599X Bush St,4.0,Sidewalk: Curb side : Cutout,Private,4/5/17 0:00,3,Width 4ft,37.78838405,-122.422774,Pittosporum,Pittosporum undulatum,Victorian Box,2017,2017-04-05 00:00:00,7
7525,34979,Permitted Site,Jacaranda mimosifolia :: Jacaranda,204 Fair Oaks St,2.0,Sidewalk: Curb side : Cutout,Private,12/18/97 0:00,4,4.5x5.5,37.75338898,-122.4242158,Jacaranda,Jacaranda mimosifolia,Jacaranda,1997,1997-12-18 00:00:00,27
7536,25226,DPW Maintained,Tristaniopsis laurina :: Swamp Myrtle,1941 Ocean Ave,1.0,Sidewalk: Curb side : Cutout,Private,4/26/96 0:00,6,3x3,37.72552423,-122.463186,Tristaniopsis,Tristaniopsis laurina,Swamp Myrtle,1996,1996-04-26 00:00:00,28
7537,75248,Undocumented,Ulmus parvifolia :: Chinese Elm,199X RUSS ST,2.0,Sidewalk: Curb side : Cutout,Private,9/9/95 0:00,2,5x5,37.77824337,-122.4074984,Ulmus,Ulmus parvifolia,Chinese Elm,1995,1995-09-09 00:00:00,29
7540,67004,DPW Maintained,Pittosporum undulatum :: Victorian Box,3700 Divisadero St,1.0,Sidewalk: Curb side : Cutout,Private,2/20/92 0:00,8,,37.80383756,-122.4435354,Pittosporum,Pittosporum undulatum,Victorian Box,1992,1992-02-20 00:00:00,32
7542,65017,DPW Maintained,Ceanothus Sps :: California lilac,773 15th Ave,1.0,Sidewalk: Curb side : Cutout,Private,4/28/89 0:00,4,,37.77361215,-122.4735481,Ceanothus,Ceanothus Sps,California lilac,1989,1989-04-28 00:00:00,35
7544,84220,DPW Maintained,Arbutus 'Marina' :: Hybrid Strawberry Tree,1622 39th Ave,1.0,Sidewalk: Curb side : Cutout,Private,7/29/09 0:00,3,3x3,37.75656094,-122.4980512,Arbutus,Arbutus 'Marina',Hybrid Strawberry Tree,2009,2009-07-29 00:00:00,15
7545,31100,DPW Maintained,Olea europaea :: Olive Tree,23 Congo St,1.0,Sidewalk: Curb side : Cutout,Private,3/21/95 0:00,9,,37.72960014,-122.4420665,Olea,Olea europaea,Olive Tree,1995,1995-03-21 00:00:00,29
7551,15212,DPW Maintained,Lophostemon confertus :: Brisbane Box,1167 Mission St,1.0,Sidewalk: Curb side : Cutout,DPW,3/8/95 0:00,12,3X3,37.77789747,-122.4124329,Lophostemon,Lophostemon confertus,Brisbane Box,1995,1995-03-08 00:00:00,29
7552,54376,DPW Maintained,Ficus microcarpa nitida 'Green Gem' :: Indian Laurel Fig Tree 'Green Gem',2369 Jackson St,1.0,Sidewalk: Curb side : Cutout,Private,6/5/72 0:00,17,3x3,37.79247463,-122.4340001,Ficus,Ficus microcarpa,Indian Laurel Fig Tree 'Green Gem',1972,2072-06-05 00:00:00,-48
7553,15682,DPW Maintained,Tristaniopsis laurina :: Swamp Myrtle,4046X Mission St,1.0,Sidewalk: Curb side : Cutout,DPW,4/19/95 0:00,6,3x3,37.73233658,-122.4278308,Tristaniopsis,Tristaniopsis laurina,Swamp Myrtle,1995,1995-04-19 00:00:00,29
7554,22698,Permitted Site,Tristaniopsis laurina 'Elegant' :: Small-leaf Tristania 'Elegant',1390 Turk St,3.0,Sidewalk: Curb side : Cutout,Private,2/28/97 0:00,6,3X3,37.78058752,-122.4319704,Tristaniopsis,Tristaniopsis laurina,Small-leaf Tristania 'Elegant',1997,1997-02-28 00:00:00,27
7556,109710,DPW Maintained,Prunus serrulata :: Ornamental Cherry,274 Trumbull St,1.0,Sidewalk: Curb side : Cutout,Private,3/2/15 0:00,3,3x3,37.73088098,-122.4244909,Prunus,Prunus serrulata,Ornamental Cherry,2015,2015-03-02 00:00:00,9
7557,39235,DPW Maintained,Metrosideros excelsa :: New Zealand Xmas Tree,450 Golden Gate Ave,6.0,Sidewalk: Curb side : Cutout,Private,12/4/98 0:00,9,,37.78142429,-122.4179345,Metrosideros,Metrosideros excelsa,New Zealand Xmas Tree,1998,1998-12-04 00:00:00,26
7558,51291,DPW Maintained,Prunus serrulata 'Kwanzan' :: Kwanzan Flowering Cherry,2020 Clement St,1.0,Sidewalk: Curb side : Cutout,Private,8/26/04 0:00,1,,37.78227143,-122.4810853,Prunus,Prunus serrulata,Kwanzan Flowering Cherry,2004,2004-08-26 00:00:00,20
7567,9084,DPW Maintained,Metrosideros excelsa :: New Zealand Xmas Tree,5637 Geary Blvd,1.0,Sidewalk: Curb side : Cutout,Private,11/16/94 0:00,6,3X3,37.78017142,-122.4799502,Metrosideros,Metrosideros excelsa,New Zealand Xmas Tree,1994,1994-11-16 00:00:00,30
7576,29083,Permitted Site,Tristaniopsis laurina :: Swamp Myrtle,2230 Bryant St,4.0,Sidewalk: Curb side : Cutout,Private,2/8/06 0:00,3,3x3,37.75869586,-122.4097333,Tristaniopsis,Tristaniopsis laurina,Swamp Myrtle,2006,2006-02-08 00:00:00,18
7580,41342,DPW Maintained,Ulmus parvifolia :: Chinese Elm,965 Folsom St,1.0,Sidewalk: Curb side : Cutout,Private,5/20/02 0:00,4,3x3,37.77909378,-122.4047123,Ulmus,Ulmus parvifolia,Chinese Elm,2002,2002-05-20 00:00:00,22
7584,22960,DPW Maintained,Lophostemon confertus :: Brisbane Box,480 Valencia St,3.0,Sidewalk: Curb side : Cutout,Private,11/13/02 0:00,8,3x6,37.76541605,-122.4220507,Lophostemon,Lophostemon confertus,Brisbane Box,2002,2002-11-13 00:00:00,22
7594,90650,DPW Maintained,Myoporum laetum :: Myoporum,3350 Cabrillo St,2.0,Sidewalk: Curb side : Cutout,DPW,4/7/08 0:00,3,3x3,37.7740257,-122.4945179,Myoporum,Myoporum laetum,Myoporum,2008,2008-04-07 00:00:00,16
7596,59922,DPW Maintained,Eriobotrya deflexa :: Bronze Loquat,1501 Mason St,1.0,Sidewalk: Curb side : Cutout,Private,11/24/81 0:00,13,3x3,37.79746287,-122.4120371,Eriobotrya,Eriobotrya deflexa,Bronze Loquat,1981,1981-11-24 00:00:00,43
7597,90961,DPW Maintained,Metrosideros excelsa :: New Zealand Xmas Tree,4449X Balboa St,1.0,Sidewalk: Curb side : Cutout,DPW,11/12/08 0:00,3,3x3,37.7752146,-122.5066725,Metrosideros,Metrosideros excelsa,New Zealand Xmas Tree,2008,2008-11-12 00:00:00,16
7634,31106,DPW Maintained,Ligustrum lucidum :: Glossy Privet,101 Edna St,2.0,Sidewalk: Curb side : Cutout,Private,3/21/95 0:00,18,,37.72759347,-122.4466346,Ligustrum,Ligustrum lucidum,Glossy Privet,1995,1995-03-21 00:00:00,29
7636,89711,DPW Maintained,Arbutus 'Marina' :: Hybrid Strawberry Tree,1825 Anza St,1.0,Sidewalk: Curb side : Cutout,DPW,2/7/08 0:00,3,3x3,37.77885232,-122.4678636,Arbutus,Arbutus 'Marina',Hybrid Strawberry Tree,2008,2008-02-07 00:00:00,16
7637,1813,DPW Maintained,Eucalyptus nicholii :: Nichol's Willow-Leafed Peppermint,2082 Bay Shore Blvd,1.0,Sidewalk: Curb side : Cutout,DPW,12/13/91 0:00,12,3X3,37.71392777,-122.4000458,Eucalyptus,Eucalyptus nicholii,Nichol's Willow-Leafed Peppermint,1991,1991-12-13 00:00:00,33
7645,178826,DPW Maintained,Magnolia grandiflora 'Little Gem' :: Little Gem Magnolia,927 Brazil Ave,2.0,Sidewalk: Curb side : Cutout,Private,10/13/17 13:53,4,Width 3ft,37.72102481,-122.4270007,Magnolia,Magnolia grandiflora,Little Gem Magnolia,2017,2017-10-13 13:53:00,7
7646,87582,DPW Maintained,Tristaniopsis laurina :: Swamp Myrtle,3438X 19th Ave,1.0,Sidewalk: Curb side : Cutout,DPW,2/24/08 0:00,3,,37.72504948,-122.4747713,Tristaniopsis,Tristaniopsis laurina,Swamp Myrtle,2008,2008-02-24 00:00:00,16
7647,58086,DPW Maintained,Callistemon citrinus :: Lemon Bottlebrush,3001 Webster St,1.0,Sidewalk: Curb side : Cutout,Private,11/16/77 0:00,7,,37.79837508,-122.4341524,Callistemon,Callistemon citrinus,Lemon Bottlebrush,1977,1977-11-16 00:00:00,47
7653,70255,DPW Maintained,Magnolia grandiflora :: Southern Magnolia,235 Vienna St,1.0,Sidewalk: Curb side : Cutout,Private,10/29/15 0:00,1,3x3,37.72456577,-122.4272772,Magnolia,Magnolia grandiflora,Southern Magnolia,2015,2015-10-29 00:00:00,9
7655,47831,DPW Maintained,Metrosideros excelsa :: New Zealand Xmas Tree,883 46th Ave,1.0,Sidewalk: Curb side : Cutout,Private,10/15/07 0:00,6,3x3,37.77191255,-122.5067992,Metrosideros,Metrosideros excelsa,New Zealand Xmas Tree,2007,2007-10-15 00:00:00,17
7657,30911,DPW Maintained,Ligustrum lucidum :: Glossy Privet,500 Faxon Ave,1.0,Sidewalk: Curb side : Cutout,Private,3/13/95 0:00,13,,37.72375004,-122.4601183,Ligustrum,Ligustrum lucidum,Glossy Privet,1995,1995-03-13 00:00:00,29
7672,109743,Permitted Site,Agonis flexuosa :: Peppermint Willow,142 Hartford St,1.0,Sidewalk: Curb side : Cutout,Private,3/3/15 0:00,3,3x3,37.76025977,-122.433953,Agonis,Agonis flexuosa,Peppermint Willow,2015,2015-03-03 00:00:00,9
7675,47512,DPW Maintained,Tristaniopsis laurina :: Swamp Myrtle,200 Santa Rosa Ave,2.0,Sidewalk: Curb side : Cutout,Private,5/14/02 0:00,7,,37.72800034,-122.4382185,Tristaniopsis,Tristaniopsis laurina,Swamp Myrtle,2002,2002-05-14 00:00:00,22
7678,225029,DPW Maintained,Ficus nitida :: Laurel Fig,4543 18th St,1.0,Sidewalk: Curb side : Cutout,Private,4/14/17 0:00,3,Width 3ft,37.76051819,-122.4403535,Ficus,Ficus nitida,Laurel Fig,2017,2017-04-14 00:00:00,7
7684,90636,DPW Maintained,Arbutus 'Marina' :: Hybrid Strawberry Tree,3112 Cabrillo St,1.0,Sidewalk: Curb side : Cutout,DPW,4/7/08 0:00,3,3x3,37.77414161,-122.4919843,Arbutus,Arbutus 'Marina',Hybrid Strawberry Tree,2008,2008-04-07 00:00:00,16
7686,60121,Permitted Site,Magnolia grandiflora :: Southern Magnolia,235 30th St,1.0,Sidewalk: Curb side : Cutout,Private,4/3/82 0:00,12,3x3,37.74209849,-122.4253261,Magnolia,Magnolia grandiflora,Southern Magnolia,1982,1982-04-03 00:00:00,42
7690,54831,DPW Maintained,Ficus retusa nitida :: Banyan Fig,79 Terra Vista Ave,1.0,Sidewalk: Curb side : Cutout,Private,9/20/72 0:00,8,,37.78136629,-122.4433433,Ficus,Ficus retusa,Banyan Fig,1972,2072-09-20 00:00:00,-48
7692,86368,DPW Maintained,Prunus serrulata :: Ornamental Cherry,1235 26th Ave,1.0,Sidewalk: Curb side : Cutout,DPW,12/20/06 0:00,3,3x3,37.76437234,-122.484786,Prunus,Prunus serrulata,Ornamental Cherry,2006,2006-12-20 00:00:00,18
7694,115622,Undocumented,Ginkgo biloba :: Maidenhair Tree,100x CAROLINA ST,3.0,Sidewalk: Curb side : Cutout,Private,2/17/16 0:00,3,3x3,37.7674443,-122.4009268,Ginkgo,Ginkgo biloba,Maidenhair Tree,2016,2016-02-17 00:00:00,8
7699,110625,DPW Maintained,Acacia stenophylla :: Shoestring Acacia,400X GUERRERO ST,8.0,Median : Cutout,DPW,4/29/15 10:13,3,3x3,37.76449805,-122.4243841,Acacia,Acacia stenophylla,Shoestring Acacia,2015,2015-04-29 10:13:00,9
7703,15710,Permitted Site,Tristaniopsis laurina :: Swamp Myrtle,4357X Mission St,2.0,Sidewalk: Curb side : Cutout,Private,5/3/95 0:00,6,3x3,37.72759546,-122.4323786,Tristaniopsis,Tristaniopsis laurina,Swamp Myrtle,1995,1995-05-03 00:00:00,29
7709,27845,Permitted Site,Phoenix canariensis :: Canary Island Date Palm,280 The Embarcadero,6.0,Median : Cutout,Port,7/15/94 0:00,36,,37.79748662,-122.3958332,Phoenix,Phoenix canariensis,Canary Island Date Palm,1994,1994-07-15 00:00:00,30
7735,84504,Undocumented,Crataegus laevigata :: English Hawthorn,650X Clementina St,2.0,Sidewalk: Curb side : Cutout,Private,10/14/06 0:00,3,3x3,37.77557558,-122.4106686,Crataegus,Crataegus laevigata,English Hawthorn,2006,2006-10-14 00:00:00,18
7742,67957,DPW Maintained,Prunus cerasifera :: Cherry Plum,886 27th Ave,1.0,Sidewalk: Curb side : Cutout,Private,3/22/93 0:00,5,,37.77273094,-122.4862742,Prunus,Prunus cerasifera,Cherry Plum,1993,1993-03-22 00:00:00,31
7751,107666,Undocumented,Quillaja saponaria :: Chilean Soapbark,140 STRATFORD DR,1.0,Front Yard : Yard,Private,12/17/14 0:00,3,,37.72234814,-122.4736366,Quillaja,Quillaja saponaria,Chilean Soapbark,2014,2014-12-17 00:00:00,10
7752,256689,Planning Code 138.1 required,Magnolia grandiflora :: Southern Magnolia,2825 Lake St,1.0,Sidewalk: Curb side : Cutout,Private,11/21/18 0:00,3,,37.78503088,-122.4896731,Magnolia,Magnolia grandiflora,Southern Magnolia,2018,2018-11-21 00:00:00,6
7755,5803,DPW Maintained,Acacia melanoxylon :: Blackwood Acacia,218X Cashmere St,3.0,Sidewalk: Curb side : Cutout,DPW,8/26/20 0:00,3,3X4,37.73667248,-122.3867489,Acacia,Acacia melanoxylon,Blackwood Acacia,2020,2020-08-26 00:00:00,4
7758,43287,DPW Maintained,Prunus cerasifera :: Cherry Plum,2210 19th St,1.0,Sidewalk: Curb side : Cutout,Private,7/12/00 0:00,6,,37.76088879,-122.4043427,Prunus,Prunus cerasifera,Cherry Plum,2000,2000-07-12 00:00:00,24
7759,196544,DPW Maintained,Prunus x yedoensis :: Yoshino Cherry,1200x Kansas St,1.0,Median : Cutout,DPW,5/15/18 12:10,4,Width 5ft,37.75435734,-122.4025468,Prunus,Prunus x,Yoshino Cherry,2018,2018-05-15 12:10:00,6
7793,65105,DPW Maintained,Pittosporum undulatum :: Victorian Box,63 20th Ave,1.0,Sidewalk: Curb side : Cutout,Private,7/24/89 0:00,12,,37.78642219,-122.479896,Pittosporum,Pittosporum undulatum,Victorian Box,1989,1989-07-24 00:00:00,35
7799,21713,DPW Maintained,Ginkgo biloba :: Maidenhair Tree,1900 Sutter St,5.0,Sidewalk: Curb side : Cutout,Private,2/26/04 0:00,3,4X4,37.78630914,-122.4321832,Ginkgo,Ginkgo biloba,Maidenhair Tree,2004,2004-02-26 00:00:00,20
7809,63910,Prune Opt Out,Ficus retusa nitida :: Banyan Fig,2135 Powell St,1.0,Sidewalk: Curb side : Cutout,Private,12/18/91 0:00,14,,37.80449754,-122.4117585,Ficus,Ficus retusa,Banyan Fig,1991,1991-12-18 00:00:00,33
7812,107813,DPW Maintained,Pittosporum undulatum :: Victorian Box,406 CENTRAL AVE,1.0,Sidewalk: Curb side : Cutout,Private,1/6/15 0:00,3,3x6,37.77343959,-122.4441029,Pittosporum,Pittosporum undulatum,Victorian Box,2015,2015-01-06 00:00:00,9
7813,10132,DPW Maintained,Geijera parviflora :: Australian Willow,899 Guerrero St,3.0,Sidewalk: Curb side : Cutout,DPW,2/4/92 0:00,6,3X3,37.75699676,-122.4232381,Geijera,Geijera parviflora,Australian Willow,1992,1992-02-04 00:00:00,32
7816,13228,Permitted Site,Lophostemon confertus :: Brisbane Box,2300 Lombard St,1.0,Sidewalk: Curb side : Cutout,Private,2/14/97 0:00,30,3X3,37.79951218,-122.4395464,Lophostemon,Lophostemon confertus,Brisbane Box,1997,1997-02-14 00:00:00,27
7818,59138,DPW Maintained,Prunus serrulata 'Kwanzan' :: Kwanzan Flowering Cherry,531 12th Ave,1.0,Sidewalk: Curb side : Cutout,Private,4/23/80 0:00,1,,37.77816029,-122.4706057,Prunus,Prunus serrulata,Kwanzan Flowering Cherry,1980,1980-04-23 00:00:00,44
7821,28769,Permitted Site,Lophostemon confertus :: Brisbane Box,600X Willow St,7.0,Sidewalk: Curb side : Cutout,Private,11/19/04 0:00,3,3X3,37.78258454,-122.4275533,Lophostemon,Lophostemon confertus,Brisbane Box,2004,2004-11-19 00:00:00,20
7827,28648,DPW Maintained,Prunus serrulata :: Ornamental Cherry,1600X Webster St,10.0,Median : Cutout,DPW,4/21/08 0:00,3,6,37.7859256,-122.4314819,Prunus,Prunus serrulata,Ornamental Cherry,2008,2008-04-21 00:00:00,16
7828,159902,DPW Maintained,Arbutus 'Marina' :: Hybrid Strawberry Tree,30 Niagara Ave,1.0,Sidewalk: Curb side : Cutout,DPW,11/10/18 5:26,3,Width 0ft,37.71609156,-122.4422566,Arbutus,Arbutus 'Marina',Hybrid Strawberry Tree,2018,2018-11-10 05:26:00,6
7829,106,DPW Maintained,Jacaranda mimosifolia :: Jacaranda,927 14th St,1.0,Sidewalk: Curb side : Cutout,DPW,3/7/20 0:00,3,3x3,37.76735388,-122.434101,Jacaranda,Jacaranda mimosifolia,Jacaranda,2020,2020-03-07 00:00:00,4
7831,24550,DPW Maintained,Acer buergeranum :: Trident Maple,322 Cortland Ave,1.0,Sidewalk: Curb side : Cutout,Private,11/22/03 0:00,12,3X3,37.73915263,-122.4180168,Acer,Acer buergeranum,Trident Maple,2003,2003-11-22 00:00:00,21
7842,31077,DPW Maintained,Ulmus parvifolia :: Chinese Elm,1700X 15th St,3.0,Sidewalk: Curb side : Cutout,Private,3/21/95 0:00,8,,37.76656365,-122.4224965,Ulmus,Ulmus parvifolia,Chinese Elm,1995,1995-03-21 00:00:00,29
7845,65101,DPW Maintained,Prunus cerasifera :: Cherry Plum,2 20th Ave,1.0,Sidewalk: Curb side : Cutout,Private,7/24/89 0:00,5,,37.78670066,-122.4797654,Prunus,Prunus cerasifera,Cherry Plum,1989,1989-07-24 00:00:00,35
7850,251477,DPW Maintained,Pittosporum undulatum :: Victorian Box,1590 Lyon St,1.0,Sidewalk: Curb side : Cutout,Private,2/21/18 0:00,3,3x3,37.78544554,-122.4448391,Pittosporum,Pittosporum undulatum,Victorian Box,2018,2018-02-21 00:00:00,6
7855,60882,DPW Maintained,Maytenus boaria :: Mayten,763 Filbert St,1.0,Sidewalk: Curb side : Cutout,Private,5/12/83 0:00,10,,37.80093003,-122.412387,Maytenus,Maytenus boaria,Mayten,1983,1983-05-12 00:00:00,41
7862,90559,DPW Maintained,Pyrus calleryana :: Ornamental Pear,1544X Cabrillo St,1.0,Sidewalk: Curb side : Cutout,DPW,2/14/08 0:00,3,3x3,37.77491997,-122.4755355,Pyrus,Pyrus calleryana,Ornamental Pear,2008,2008-02-14 00:00:00,16
7872,35735,DPW Maintained,Olea europaea :: Olive Tree,322 Hale St,1.0,Sidewalk: Curb side : Cutout,Private,4/14/98 0:00,10,,37.73138053,-122.4112837,Olea,Olea europaea,Olive Tree,1998,1998-04-14 00:00:00,26
7876,65046,Permitted Site,Ficus nitida :: Laurel Fig,2498 Harrison St,1.0,Sidewalk: Curb side : Cutout,Private,5/19/89 0:00,18,,37.75747206,-122.4124423,Ficus,Ficus nitida,Laurel Fig,1989,1989-05-19 00:00:00,35
7882,25622,Permitted Site,Platanus x hispanica :: Sycamore: London Plane,800 The Embarcadero,8.0,Sidewalk: Curb side : Cutout,Port,12/18/00 0:00,12,4X4,37.79311463,-122.3919877,Platanus,Platanus x,Sycamore: London Plane,2000,2000-12-18 00:00:00,24
7885,85887,DPW Maintained,Tristaniopsis laurina :: Swamp Myrtle,2550 26th Ave,1.0,Sidewalk: Curb side : Cutout,DPW,12/20/06 0:00,3,3x3,37.7399086,-122.4829169,Tristaniopsis,Tristaniopsis laurina,Swamp Myrtle,2006,2006-12-20 00:00:00,18
7886,40380,DPW Maintained,Schinus terebinthifolius :: Brazilian Pepper,1700 Jones St,2.0,Sidewalk: Curb side : Cutout,Private,6/2/99 0:00,6,,37.79702582,-122.4151591,Schinus,Schinus terebinthifolius,Brazilian Pepper,1999,1999-06-02 00:00:00,25
7887,102349,Undocumented,Arbutus 'Marina' :: Hybrid Strawberry Tree,401X Shotwell St,15.0,Sidewalk: Curb side : Cutout,Private,10/7/13 0:00,3,3x3,37.7619901,-122.4160046,Arbutus,Arbutus 'Marina',Hybrid Strawberry Tree,2013,2013-10-07 00:00:00,11
7891,7127,DPW Maintained,Afrocarpus gracilior :: Fern Pine,300X Fern St,6.0,Sidewalk: Curb side : Cutout,DPW,2/2/90 0:00,6,3x3,37.78777015,-122.4240779,Afrocarpus,Afrocarpus gracilior,Fern Pine,1990,1990-02-02 00:00:00,34
7897,26,DPW Maintained,Prunus cerasifera :: Cherry Plum,736 14th St,1.0,Sidewalk: Curb side : Cutout,DPW,3/12/92 0:00,12,3X3,37.7677538,-122.4298434,Prunus,Prunus cerasifera,Cherry Plum,1992,1992-03-12 00:00:00,32
7898,21860,DPW Maintained,Tristaniopsis laurina :: Swamp Myrtle,1900 03rd St,2.0,Sidewalk: Curb side : Cutout,DPW,1/15/08 0:00,3,3X3,37.76510103,-122.3891085,Tristaniopsis,Tristaniopsis laurina,Swamp Myrtle,2008,2008-01-15 00:00:00,16
7904,25865,Permitted Site,Platanus x hispanica :: Sycamore: London Plane,800X The Embarcadero,29.0,Sidewalk: Curb side : Cutout,Port,10/30/95 0:00,6,4X4,37.80238487,-122.400694,Platanus,Platanus x,Sycamore: London Plane,1995,1995-10-30 00:00:00,29
7905,89448,DPW Maintained,Arbutus 'Marina' :: Hybrid Strawberry Tree,3150X Anza St,1.0,Sidewalk: Curb side : Cutout,DPW,3/19/08 0:00,3,3x3,37.7783573,-122.4822513,Arbutus,Arbutus 'Marina',Hybrid Strawberry Tree,2008,2008-03-19 00:00:00,16
7909,115921,DPW Maintained,Pittosporum undulatum :: Victorian Box,50 Beale St,5.0,Sidewalk: Curb side : Cutout,Private,4/15/16 0:00,3,3x3,37.79131115,-122.3961676,Pittosporum,Pittosporum undulatum,Victorian Box,2016,2016-04-15 00:00:00,8
7919,34999,DPW Maintained,Corymbia ficifolia :: Red Flowering Gum,825 Central Ave,1.0,Sidewalk: Curb side : Cutout,Private,7/19/00 0:00,14,6x10,37.77718795,-122.4451046,Corymbia,Corymbia ficifolia,Red Flowering Gum,2000,2000-07-19 00:00:00,24
7921,50650,DPW Maintained,Tristania conferta ::,821 Folsom St,4.0,Sidewalk: Curb side : Cutout,Private,1/19/12 0:00,2,,37.78164977,-122.4014833,Tristania,Tristania conferta,,2012,2012-01-19 00:00:00,12
7924,31236,DPW Maintained,Maytenus boaria :: Mayten,2626 16th Ave,1.0,Sidewalk: Curb side : Cutout,Private,4/4/95 0:00,10,,37.73889261,-122.4721007,Maytenus,Maytenus boaria,Mayten,1995,1995-04-04 00:00:00,29
7926,26572,DPW Maintained,Eriobotrya deflexa :: Bronze Loquat,353 Bay Shore Blvd,2.0,Sidewalk: Curb side : Cutout,DPW,1/22/98 0:00,6,3X3,37.74208066,-122.4057478,Eriobotrya,Eriobotrya deflexa,Bronze Loquat,1998,1998-01-22 00:00:00,26
7930,26705,DPW Maintained,Quercus suber :: Cork Oak,1200X Hudson Ave,5.0,Sidewalk: Curb side : Cutout,DPW,3/23/06 0:00,3,3x4,37.7327861,-122.3811005,Quercus,Quercus suber,Cork Oak,2006,2006-03-23 00:00:00,18
7932,41947,DPW Maintained,Prunus serrulata 'Kwanzan' :: Kwanzan Flowering Cherry,690 08th Ave,2.0,Sidewalk: Curb side : Cutout,Private,6/20/00 0:00,9,,37.77558322,-122.4659564,Prunus,Prunus serrulata,Kwanzan Flowering Cherry,2000,2000-06-20 00:00:00,24
7939,45389,DPW Maintained,Cercis occidentalis :: Western Redbud,1630 Pacific Ave,1.0,Sidewalk: Curb side : Cutout,Private,9/4/13 0:00,1,,37.79502547,-122.4220721,Cercis,Cercis occidentalis,Western Redbud,2013,2013-09-04 00:00:00,11
7940,27909,Permitted Site,Platanus x hispanica :: Sycamore: London Plane,100 The Embarcadero,3.0,Sidewalk: Curb side : Cutout,Port,2/1/01 0:00,12,3X3,37.78146649,-122.3885703,Platanus,Platanus x,Sycamore: London Plane,2001,2001-02-01 00:00:00,23
7944,1459,DPW Maintained,Pittosporum undulatum :: Victorian Box,170 Arguello Blvd,1.0,Sidewalk: Curb side : Cutout,DPW,3/29/18 0:00,3,3X3,37.78714318,-122.4591992,Pittosporum,Pittosporum undulatum,Victorian Box,2018,2018-03-29 00:00:00,6
7948,44756,Permitted Site,Myoporum laetum :: Myoporum,256 Pennsylvania Ave,2.0,Sidewalk: Curb side : Cutout,Private,7/22/15 0:00,3,,37.76331271,-122.3937543,Myoporum,Myoporum laetum,Myoporum,2015,2015-07-22 00:00:00,9
7950,46434,Planning Code 138.1 required,Lagunaria patersonii :: Primrose Tree,2St. Ankeny St,2.0,Sidewalk: Curb side : Cutout,Private,10/30/03 0:00,1,,37.71854744,-122.4036314,Lagunaria,Lagunaria patersonii,Primrose Tree,2003,2003-10-30 00:00:00,21
7953,35676,Permitted Site,Ulmus parvifolia :: Chinese Elm,490 Pacific Ave,1.0,Sidewalk: Curb side : Cutout,Private,4/3/98 0:00,8,4x4,37.79738638,-122.4035475,Ulmus,Ulmus parvifolia,Chinese Elm,1998,1998-04-03 00:00:00,26
7956,254806,Permitted Site,Acer buergeranum :: Trident Maple,1199 Sanchez St,,Sidewalk: Curb side : Cutout,Private,3/28/18 0:00,3,3x3,37.74999258,-122.4294334,Acer,Acer buergeranum,Trident Maple,2018,2018-03-28 00:00:00,6
7960,13094,DPW Maintained,Tristania conferta ::,1450 Lombard St,2.0,Sidewalk: Curb side : Cutout,Private,4/13/95 0:00,12,3X3,37.80126575,-122.4256475,Tristania,Tristania conferta,,1995,1995-04-13 00:00:00,29
7963,66480,DPW Maintained,Acacia melanoxylon :: Blackwood Acacia,127 05th Ave,1.0,Sidewalk: Curb side : Cutout,Private,5/1/91 0:00,30,,37.78625391,-122.4636674,Acacia,Acacia melanoxylon,Blackwood Acacia,1991,1991-05-01 00:00:00,33
7974,59132,DPW Maintained,Ficus microcarpa nitida 'Green Gem' :: Indian Laurel Fig Tree 'Green Gem',723 11th Ave,1.0,Sidewalk: Curb side : Cutout,Private,4/23/80 0:00,11,,37.77465338,-122.469278,Ficus,Ficus microcarpa,Indian Laurel Fig Tree 'Green Gem',1980,1980-04-23 00:00:00,44
7976,254491,Permitted Site,Tristaniopsis laurina 'Elegant' :: Small-leaf Tristania 'Elegant',2696 Bush St,1.0,Sidewalk: Curb side : Cutout,Private,2/21/18 0:00,3,3x3,37.78603239,-122.4416554,Tristaniopsis,Tristaniopsis laurina,Small-leaf Tristania 'Elegant',2018,2018-02-21 00:00:00,6
7980,83564,Permitted Site,Arbutus 'Marina' :: Hybrid Strawberry Tree,623 London St,1.0,Sidewalk: Curb side : Cutout,Private,12/3/05 0:00,5,6x9,37.71924463,-122.4378058,Arbutus,Arbutus 'Marina',Hybrid Strawberry Tree,2005,2005-12-03 00:00:00,19
7984,87601,DPW Maintained,Arbutus 'Marina' :: Hybrid Strawberry Tree,400X Junipero Serra Blvd,4.0,Sidewalk: Curb side : Cutout,DPW,1/18/08 0:00,3,3x3,37.72962153,-122.4721207,Arbutus,Arbutus 'Marina',Hybrid Strawberry Tree,2008,2008-01-18 00:00:00,16
7985,118727,DPW Maintained,Laurus nobilis :: Sweet Bay: Grecian Laurel,744 44th Ave,2.0,Sidewalk: Curb side : Yard,Private,1/16/20 0:00,3,Width 4ft,37.77451152,-122.5046792,Laurus,Laurus nobilis,Sweet Bay: Grecian Laurel,2020,2020-01-16 00:00:00,4
7986,98810,DPW Maintained,Tristaniopsis laurina :: Swamp Myrtle,290 Napoleon St,6.0,Sidewalk: Curb side : Cutout,Private,3/19/12 0:00,3,3x3,37.74614158,-122.401725,Tristaniopsis,Tristaniopsis laurina,Swamp Myrtle,2012,2012-03-19 00:00:00,12
7988,4020,DPW Maintained,Prunus serrulata 'Kwanzan' :: Kwanzan Flowering Cherry,1760 Cesar Chavez St,3.0,Sidewalk: Curb side : Cutout,DPW,4/1/95 0:00,3,2X3,37.74991622,-122.3945374,Prunus,Prunus serrulata,Kwanzan Flowering Cherry,1995,1995-04-01 00:00:00,29
7989,86558,DPW Maintained,Arbutus unedo :: Strawberry Tree,1867 27th Ave,1.0,Sidewalk: Curb side : Cutout,DPW,12/28/06 0:00,7,3x3,37.75259766,-122.485044,Arbutus,Arbutus unedo,Strawberry Tree,2006,2006-12-28 00:00:00,18
7990,27744,DPW Maintained,Lophostemon confertus :: Brisbane Box,1399 Cesar Chavez St,5.0,Sidewalk: Curb side : Cutout,DPW,4/15/15 8:09,3,3x3,37.75007129,-122.3913913,Lophostemon,Lophostemon confertus,Brisbane Box,2015,2015-04-15 08:09:00,9
7994,22096,Permitted Site,Lophostemon confertus :: Brisbane Box,3400X 03rd St,9.0,Sidewalk: Curb side : Cutout,Port,3/16/95 0:00,3,3X3,37.74525249,-122.3872998,Lophostemon,Lophostemon confertus,Brisbane Box,1995,1995-03-16 00:00:00,29
7995,46208,DPW Maintained,Callistemon citrinus :: Lemon Bottlebrush,297 Wheeler Ave,1.0,Sidewalk: Curb side : Cutout,Private,1/3/02 0:00,12,,37.71190808,-122.3998236,Callistemon,Callistemon citrinus,Lemon Bottlebrush,2002,2002-01-03 00:00:00,22
8003,94571,DPW Maintained,Acer palmatum :: Japanese Maple,376 31st Ave,2.0,Sidewalk: Curb side : Cutout,Private,9/20/10 0:00,1,3x3,37.7821794,-122.4912608,Acer,Acer palmatum,Japanese Maple,2010,2010-09-20 00:00:00,14
8004,143036,DPW Maintained,Olea europaea 'Swan Hill' :: Olive,502 Lombard St,1.0,Sidewalk: Curb side : Cutout,DPW,12/16/15 7:41,2,Width 0ft,37.80327525,-122.4099094,Olea,Olea europaea,Olive,2015,2015-12-16 07:41:00,9
8007,65623,DPW Maintained,Olea europaea :: Olive Tree,185 Ney St,1.0,Sidewalk: Curb side : Cutout,Private,2/7/90 0:00,18,3x3,37.73016228,-122.4264961,Olea,Olea europaea,Olive Tree,1990,1990-02-07 00:00:00,34
8008,90575,DPW Maintained,Pyrus calleryana 'Aristocrat' :: Aristocrat Callery Pear,2008 Cabrillo St,1.0,Sidewalk: Curb side : Cutout,DPW,2/15/08 0:00,3,3x3,37.77469825,-122.4803426,Pyrus,Pyrus calleryana,Aristocrat Callery Pear,2008,2008-02-15 00:00:00,16
8010,192598,DPW Maintained,Lophostemon confertus :: Brisbane Box,104 09th St,2.0,Sidewalk: Curb side : Cutout,Private,8/30/17 0:00,3,Width 4ft,37.775938,-122.4145206,Lophostemon,Lophostemon confertus,Brisbane Box,2017,2017-08-30 00:00:00,7
8012,54558,DPW Maintained,Callistemon citrinus :: Lemon Bottlebrush,50 Maddux Ave,1.0,Sidewalk: Curb side : Cutout,Private,7/18/72 0:00,8,,37.73447811,-122.398385,Callistemon,Callistemon citrinus,Lemon Bottlebrush,1972,2072-07-18 00:00:00,-48
8023,92117,DPW Maintained,Tristania conferta ::,2012 Pine St,2.0,Sidewalk: Curb side : Cutout,Private,7/7/09 0:00,3,3x3,37.78859166,-122.4292748,Tristania,Tristania conferta,,2009,2009-07-07 00:00:00,15
8025,90576,DPW Maintained,Pyrus calleryana 'Aristocrat' :: Aristocrat Callery Pear,2020 Cabrillo St,1.0,Sidewalk: Curb side : Cutout,DPW,2/15/08 0:00,3,3x3,37.77469239,-122.4805205,Pyrus,Pyrus calleryana,Aristocrat Callery Pear,2008,2008-02-15 00:00:00,16
8026,24262,DPW Maintained,Tristania conferta ::,600X Willow St,6.0,Sidewalk: Curb side : Cutout,DPW,11/19/04 0:00,3,3X3,37.7824786,-122.4280512,Tristania,Tristania conferta,,2004,2004-11-19 00:00:00,20
8033,28550,DPW Maintained,Washingtonia robusta :: Mexican Fan Palm,4919 Mission St,1.0,Sidewalk: Curb side : Cutout,Private,8/8/03 0:00,12,3X3,37.71961479,-122.4385216,Washingtonia,Washingtonia robusta,Mexican Fan Palm,2003,2003-08-08 00:00:00,21
8040,226341,DPW Maintained,Albizia julibrissin :: Mimosa Silk Tree,41 Bartlett St,2.0,Sidewalk: Curb side : Cutout,Private,4/1/19 0:00,3,3x6,37.75594632,-122.4198348,Albizia,Albizia julibrissin,Mimosa Silk Tree,2019,2019-04-01 00:00:00,5
8041,30065,DPW Maintained,Pinus radiata :: Monterey Pine,510X Brotherhood Way,10.0,Median : Cutout,DPW,3/10/07 0:00,6,M,37.71247053,-122.4674296,Pinus,Pinus radiata,Monterey Pine,2007,2007-03-10 00:00:00,17
8046,232659,DPW Maintained,Metrosideros excelsa :: New Zealand Xmas Tree,15 Eugenia Ave,1.0,Sidewalk: Curb side : Cutout,Private,2/23/73 0:00,24,Width 4ft,37.74194959,-122.4213988,Metrosideros,Metrosideros excelsa,New Zealand Xmas Tree,1973,2073-02-23 00:00:00,-49
8047,4735,DPW Maintained,Liquidambar styraciflua 'Festival' :: Festival Sweet Gum,1100X Columbus Ave,6.0,Median : Cutout,DPW,8/19/06 0:00,6,3x3,37.80442359,-122.4160175,Liquidambar,Liquidambar styraciflua,Festival Sweet Gum,2006,2006-08-19 00:00:00,18
8048,66532,DPW Maintained,Melaleuca quinquenervia :: Cajeput,3722 Ulloa St,1.0,Sidewalk: Curb side : Cutout,Private,4/8/91 0:00,18,3x3,37.74035023,-122.4963365,Melaleuca,Melaleuca quinquenervia,Cajeput,1991,1991-04-08 00:00:00,33
8055,111187,DPW Maintained,Lophostemon confertus :: Brisbane Box,8 10th St,5.0,Sidewalk: Curb side : Cutout,Private,2/3/17 0:00,3,3x6,37.77608926,-122.4171048,Lophostemon,Lophostemon confertus,Brisbane Box,2017,2017-02-03 00:00:00,7
8058,90594,DPW Maintained,Arbutus 'Marina' :: Hybrid Strawberry Tree,2400X Cabrillo St,3.0,Sidewalk: Curb side : Cutout,DPW,2/15/08 0:00,3,3x3,37.77450632,-122.4847285,Arbutus,Arbutus 'Marina',Hybrid Strawberry Tree,2008,2008-02-15 00:00:00,16
8062,27719,Permitted Site,Lophostemon confertus :: Brisbane Box,1300X Cesar Chavez St,1.0,Sidewalk: Curb side : Cutout,Private,5/10/03 0:00,3,3X3,37.75018763,-122.3904601,Lophostemon,Lophostemon confertus,Brisbane Box,2003,2003-05-10 00:00:00,21
8070,87887,DPW Maintained,Olea europaea :: Olive Tree,3750 Webster St,3.0,Sidewalk: Curb side : Cutout,Private,6/13/08 0:00,4,3x3,37.80542031,-122.4354142,Olea,Olea europaea,Olive Tree,2008,2008-06-13 00:00:00,16
8073,265453,DPW Maintained,Quercus agrifolia :: Coast Live Oak,500x Mansell St,8.0,Median : Cutout,DPW,6/4/21 0:00,3,Width 0ft,37.72046253,-122.4052318,Quercus,Quercus agrifolia,Coast Live Oak,2021,2021-06-04 00:00:00,3
8079,62484,DPW Maintained,Taxus baccata :: Irish Yew,81 Delano Ave,1.0,Sidewalk: Curb side : Cutout,Private,1/8/86 0:00,10,,37.72666781,-122.4402602,Taxus,Taxus baccata,Irish Yew,1986,1986-01-08 00:00:00,38
8080,10171,DPW Maintained,Tristaniopsis laurina 'Elegant' :: Small-leaf Tristania 'Elegant',1032 Guerrero St,1.0,Sidewalk: Curb side : Cutout,Private,8/23/17 0:00,3,7x4,37.75462553,-122.42324,Tristaniopsis,Tristaniopsis laurina,Small-leaf Tristania 'Elegant',2017,2017-08-23 00:00:00,7
8085,119253,Undocumented,Myoporum laetum :: Myoporum,465 Alvarado St,1.0,Sidewalk: Curb side : Cutout,Private,8/3/16 0:00,3,3x3,37.75375187,-122.4312812,Myoporum,Myoporum laetum,Myoporum,2016,2016-08-03 00:00:00,8
8087,257897,Permitted Site,Arbutus 'Marina' :: Hybrid Strawberry Tree,1920 41st Ave,,: Cutout,Private,1/15/19 0:00,3,3x3,37.75092388,-122.4998165,Arbutus,Arbutus 'Marina',Hybrid Strawberry Tree,2019,2019-01-15 00:00:00,5
8089,236917,Permitted Site,Prunus cerasifera :: Cherry Plum,825 Moultrie St,1.0,Sidewalk: Curb side : Cutout,Private,5/18/98 0:00,7,Width 3ft,37.73438192,-122.4161737,Prunus,Prunus cerasifera,Cherry Plum,1998,1998-05-18 00:00:00,26
8091,103858,DPW Maintained,Syagrus romanzoffianum :: Queen Palm,1475 Polk St,2.0,Sidewalk: Curb side : Pot,DPW,11/1/09 0:00,3,3x3,37.79031588,-122.4207182,Syagrus,Syagrus romanzoffianum,Queen Palm,2009,2009-11-01 00:00:00,15
8095,86608,DPW Maintained,Acer rubrum 'Red Sunset' :: Red Swamp Maple,1320 Bryant St,1.0,Sidewalk: Curb side : Cutout,DPW,4/13/07 0:00,3,3x3,37.76931289,-122.410952,Acer,Acer rubrum,Red Swamp Maple,2007,2007-04-13 00:00:00,17
8098,46624,DPW Maintained,Quercus agrifolia :: Coast Live Oak,1601 Lane St,2.0,Sidewalk: Curb side : Cutout,Private,7/2/09 0:00,4,3x3,37.73177598,-122.3899628,Quercus,Quercus agrifolia,Coast Live Oak,2009,2009-07-02 00:00:00,15
8100,1194,DPW Maintained,Tristaniopsis laurina :: Swamp Myrtle,3051 Alemany Blvd,1.0,Sidewalk: Curb side : Cutout,Private,12/2/98 0:00,6,3X3,37.71070357,-122.4538063,Tristaniopsis,Tristaniopsis laurina,Swamp Myrtle,1998,1998-12-02 00:00:00,26
8105,52909,DPW Maintained,Tristaniopsis laurina 'Elegant' :: Small-leaf Tristania 'Elegant',618 16th Ave,1.0,Sidewalk: Curb side : Cutout,Private,7/27/06 0:00,1,,37.77630291,-122.4747093,Tristaniopsis,Tristaniopsis laurina,Small-leaf Tristania 'Elegant',2006,2006-07-27 00:00:00,18
8114,36794,DPW Maintained,Tristania conferta ::,1350 Donner Ave,1.0,Sidewalk: Curb side : Cutout,Private,5/26/98 0:00,5,3x3,37.72180219,-122.3892511,Tristania,Tristania conferta,,1998,1998-05-26 00:00:00,26
8116,60224,DPW Maintained,Ficus microcarpa nitida 'Green Gem' :: Indian Laurel Fig Tree 'Green Gem',24 Rausch St,1.0,Sidewalk: Curb side : Cutout,Private,7/12/82 0:00,20,,37.77669857,-122.410085,Ficus,Ficus microcarpa,Indian Laurel Fig Tree 'Green Gem',1982,1982-07-12 00:00:00,42
8123,1027,DPW Maintained,Ulmus pumila :: Siberian Elm,1965X Alemany Blvd,1.0,Sidewalk: Curb side : Cutout,DPW,6/15/92 0:00,31,3X3,37.72045926,-122.4391976,Ulmus,Ulmus pumila,Siberian Elm,1992,1992-06-15 00:00:00,32
8137,96633,DPW Maintained,Olea europaea :: Olive Tree,2827 Noriega St,1.0,Sidewalk: Curb side : Cutout,Private,6/14/11 0:00,1,3x3,37.7533623,-122.4941269,Olea,Olea europaea,Olive Tree,2011,2011-06-14 00:00:00,13
8139,90917,DPW Maintained,Pyrus calleryana :: Ornamental Pear,3342 Anza St,2.0,Sidewalk: Curb side : Cutout,DPW,11/10/08 0:00,3,3x3,37.77826982,-122.4841873,Pyrus,Pyrus calleryana,Ornamental Pear,2008,2008-11-10 00:00:00,16
8142,86453,DPW Maintained,Prunus serrulata :: Ornamental Cherry,2330 27th Ave,1.0,Sidewalk: Curb side : Cutout,DPW,12/29/06 0:00,3,3x3,37.74393761,-122.4842699,Prunus,Prunus serrulata,Ornamental Cherry,2006,2006-12-29 00:00:00,18
8144,34717,DPW Maintained,Arbutus 'Marina' :: Hybrid Strawberry Tree,527 47th Ave,1.0,Sidewalk: Curb side : Cutout,Private,7/28/97 0:00,16,,37.77840365,-122.5083349,Arbutus,Arbutus 'Marina',Hybrid Strawberry Tree,1997,1997-07-28 00:00:00,27
8151,39293,Permitted Site,Arbutus 'Marina' :: Hybrid Strawberry Tree,399X Treat Ave,3.0,Sidewalk: Curb side : Cutout,Private,12/21/98 0:00,8,3x3,37.76460553,-122.4131317,Arbutus,Arbutus 'Marina',Hybrid Strawberry Tree,1998,1998-12-21 00:00:00,26
8154,22146,DPW Maintained,Tristania conferta ::,3800 03rd St,1.0,Sidewalk: Curb side : Cutout,DPW,2/21/08 0:00,12,3x3,37.74259242,-122.3881126,Tristania,Tristania conferta,,2008,2008-02-21 00:00:00,16
8160,49944,DPW Maintained,Olea europaea :: Olive Tree,2514@ ULLOA 32nd Ave,1.0,Sidewalk: Curb side : Cutout,Private,7/2/03 0:00,5,,37.74024094,-122.4893862,Olea,Olea europaea,Olive Tree,2003,2003-07-02 00:00:00,21
8164,7714,Permitted Site,Lophostemon confertus :: Brisbane Box,101X Franklin St,2.0,Sidewalk: Curb side : Cutout,Private,11/18/97 0:00,6,3X3,37.77523536,-122.4210481,Lophostemon,Lophostemon confertus,Brisbane Box,1997,1997-11-18 00:00:00,27
8166,176249,DPW Maintained,Eriobotrya deflexa :: Bronze Loquat,3500 San Bruno Ave,2.0,Sidewalk: Curb side : Cutout,DPW,3/8/14 0:00,1,Width 3ft,37.71769406,-122.4001773,Eriobotrya,Eriobotrya deflexa,Bronze Loquat,2014,2014-03-08 00:00:00,10
8168,95130,DPW Maintained,Syagrus romanzoffianum :: Queen Palm,2200 Beach St,5.0,Sidewalk: Curb side : Cutout,Private,1/8/08 0:00,12,,37.80351252,-122.445577,Syagrus,Syagrus romanzoffianum,Queen Palm,2008,2008-01-08 00:00:00,16
8170,90255,DPW Maintained,Metrosideros excelsa :: New Zealand Xmas Tree,3220 Balboa St,1.0,Sidewalk: Curb side : Cutout,DPW,4/22/08 0:00,5,3x3,37.77596998,-122.4934887,Metrosideros,Metrosideros excelsa,New Zealand Xmas Tree,2008,2008-04-22 00:00:00,16
8172,90695,DPW Maintained,Yucca gloriosa :: Spanish Dagger,4100X Cabrillo St,1.0,Sidewalk: Curb side : Cutout,DPW,4/7/08 0:00,3,3x3,37.7736734,-122.5027102,Yucca,Yucca gloriosa,Spanish Dagger,2008,2008-04-07 00:00:00,16
8176,90752,DPW Maintained,Agonis flexuosa :: Peppermint Willow,4139 Cabrillo St,2.0,Sidewalk: Curb side : Cutout,DPW,4/7/08 0:00,3,3x3,37.77349688,-122.5033412,Agonis,Agonis flexuosa,Peppermint Willow,2008,2008-04-07 00:00:00,16
8178,50453,DPW Maintained,Pistacia chinensis :: Chinese Pistache,2645 Baker St,1.0,Sidewalk: Curb side : Cutout,Private,10/21/03 0:00,5,,37.79551286,-122.445431,Pistacia,Pistacia chinensis,Chinese Pistache,2003,2003-10-21 00:00:00,21
8179,59984,DPW Maintained,Ficus microcarpa nitida 'Green Gem' :: Indian Laurel Fig Tree 'Green Gem',1562 Innes Ave,1.0,Sidewalk: Curb side : Cutout,Private,1/11/82 0:00,20,,37.73909808,-122.3880975,Ficus,Ficus microcarpa,Indian Laurel Fig Tree 'Green Gem',1982,1982-01-11 00:00:00,42
8182,6357,DPW Maintained,Platanus racemosa :: California Sycamore,2020X Ellis St,1.0,Sidewalk: Curb side : Cutout,Private,2/14/12 0:00,12,4X4,37.78152574,-122.4395877,Platanus,Platanus racemosa,California Sycamore,2012,2012-02-14 00:00:00,12
8186,144172,DPW Maintained,Tristaniopsis laurina :: Swamp Myrtle,626 41st Ave,1.0,Sidewalk: Curb side : Cutout,Private,1/25/20 11:19,0,Width 4ft,37.77685011,-122.501612,Tristaniopsis,Tristaniopsis laurina,Swamp Myrtle,2020,2020-01-25 11:19:00,4
8188,88747,DPW Maintained,Magnolia grandiflora :: Southern Magnolia,986 Polk St,4.0,Sidewalk: Curb side : Cutout,Private,8/19/08 0:00,5,3x3,37.78573697,-122.4196178,Magnolia,Magnolia grandiflora,Southern Magnolia,2008,2008-08-19 00:00:00,16
8189,25829,Permitted Site,Platanus x hispanica :: Sycamore: London Plane,1100X The Embarcadero,5.0,Sidewalk: Curb side : Cutout,Port,10/30/95 0:00,6,4X4,37.80414513,-122.4019184,Platanus,Platanus x,Sycamore: London Plane,1995,1995-10-30 00:00:00,29
8193,21920,DPW Maintained,Lophostemon confertus :: Brisbane Box,2210X 03rd St,5.0,Sidewalk: Curb side : Cutout,DPW,1/20/95 0:00,10,2X3,37.76160753,-122.3888235,Lophostemon,Lophostemon confertus,Brisbane Box,1995,1995-01-20 00:00:00,29
8194,243397,Section 806 (d),Jacaranda mimosifolia :: Jacaranda,253 Chattanooga St,1.0,Sidewalk: Curb side : Cutout,Private,10/15/21 0:00,3,3x12,37.75252387,-122.4263372,Jacaranda,Jacaranda mimosifolia,Jacaranda,2021,2021-10-15 00:00:00,3
8199,15672,DPW Maintained,Tristaniopsis laurina :: Swamp Myrtle,3950X Mission St,1.0,Sidewalk: Curb side : Cutout,DPW,4/18/95 0:00,6,3X3,37.73451074,-122.425699,Tristaniopsis,Tristaniopsis laurina,Swamp Myrtle,1995,1995-04-18 00:00:00,29
8202,37619,DPW Maintained,Olea europaea :: Olive Tree,522 17th Ave,1.0,Sidewalk: Curb side : Cutout,Private,5/14/02 0:00,9,,37.7780627,-122.4759147,Olea,Olea europaea,Olive Tree,2002,2002-05-14 00:00:00,22
8204,156715,DPW Maintained,Cassia leptophylla :: Gold Medallion Tree,501 Capp St,1.0,Sidewalk: Curb side : Cutout,Private,8/18/18 0:00,3,Width 3ft,37.75846889,-122.4178716,Cassia,Cassia leptophylla,Gold Medallion Tree,2018,2018-08-18 00:00:00,6
8208,31629,DPW Maintained,Myoporum laetum :: Myoporum,2667 47th Ave,1.0,Sidewalk: Curb side : Cutout,Private,5/22/95 0:00,12,,37.73673005,-122.5054154,Myoporum,Myoporum laetum,Myoporum,1995,1995-05-22 00:00:00,29
8211,3851,Permitted Site,Lophostemon confertus :: Brisbane Box,201X Cashmere St,8.0,Sidewalk: Curb side : Cutout,Private,8/16/96 0:00,3,3X3,37.73658386,-122.3861908,Lophostemon,Lophostemon confertus,Brisbane Box,1996,1996-08-16 00:00:00,28
8213,59117,DPW Maintained,Prunus cerasifera :: Cherry Plum,530 10th Ave,1.0,Sidewalk: Curb side : Cutout,Private,7/18/08 0:00,4,3x3,37.7782838,-122.4682692,Prunus,Prunus cerasifera,Cherry Plum,2008,2008-07-18 00:00:00,16
8217,22013,DPW Maintained,Lophostemon confertus :: Brisbane Box,2799 03rd St,2.0,Sidewalk: Curb side : Cutout,DPW,2/14/95 0:00,6,3X3,37.75411643,-122.3877791,Lophostemon,Lophostemon confertus,Brisbane Box,1995,1995-02-14 00:00:00,29
8234,17663,DPW Maintained,Tristaniopsis laurina :: Swamp Myrtle,890X Oak St,1.0,Sidewalk: Curb side : Cutout,Private,6/22/98 0:00,6,3X3,37.77365522,-122.4338792,Tristaniopsis,Tristaniopsis laurina,Swamp Myrtle,1998,1998-06-22 00:00:00,26
8237,17686,DPW Maintained,Lophostemon confertus :: Brisbane Box,1090 Pierce St,6.0,Sidewalk: Curb side : Cutout,DPW,11/30/16 0:00,18,4X4,37.78000347,-122.4353399,Lophostemon,Lophostemon confertus,Brisbane Box,2016,2016-11-30 00:00:00,8
8238,40097,DPW Maintained,Metrosideros excelsa :: New Zealand Xmas Tree,1936 McAllister St,1.0,Sidewalk: Curb side : Cutout,Private,3/18/99 0:00,10,,37.77714679,-122.4439753,Metrosideros,Metrosideros excelsa,New Zealand Xmas Tree,1999,1999-03-18 00:00:00,25
8249,29294,DPW Maintained,Lophostemon confertus :: Brisbane Box,400X Portola Dr,15.0,Median : Cutout,DPW,10/14/05 0:00,3,3X3,37.74595104,-122.4501899,Lophostemon,Lophostemon confertus,Brisbane Box,2005,2005-10-14 00:00:00,19
8250,52133,DPW Maintained,Tristaniopsis laurina :: Swamp Myrtle,827 Pierce St,4.0,Sidewalk: Curb side : Cutout,Private,10/26/05 0:00,4,,37.7779545,-122.4350687,Tristaniopsis,Tristaniopsis laurina,Swamp Myrtle,2005,2005-10-26 00:00:00,19
8251,28977,Permitted Site,Lophostemon confertus :: Brisbane Box,300X 09th St,1.0,Sidewalk: Curb side : Cutout,Private,2/17/06 0:00,3,3x3,37.77370819,-122.4116558,Lophostemon,Lophostemon confertus,Brisbane Box,2006,2006-02-17 00:00:00,18
8254,86692,Permitted Site,Acer rubrum 'Red Sunset' :: Red Swamp Maple,799 Bryant St,1.0,Sidewalk: Curb side : Cutout,Private,4/9/07 0:00,3,3x3,37.77601331,-122.4024589,Acer,Acer rubrum,Red Swamp Maple,2007,2007-04-09 00:00:00,17
8257,122701,Planning Code 138.1 required,Acer rubrum :: Red Maple,2895 San Bruno Ave,5.0,Sidewalk: Curb side : Cutout,Private,11/16/16 0:00,3,3x9,37.72533436,-122.4025691,Acer,Acer rubrum,Red Maple,2016,2016-11-16 00:00:00,8
8258,42885,DPW Maintained,Callistemon citrinus :: Lemon Bottlebrush,2546 34th Ave,1.0,Sidewalk: Curb side : Cutout,Private,7/3/00 0:00,4,,37.73960987,-122.4914982,Callistemon,Callistemon citrinus,Lemon Bottlebrush,2000,2000-07-03 00:00:00,24
8260,49703,Permitted Site,Platanus x hispanica :: Sycamore: London Plane,3375 17th St,1.0,Sidewalk: Curb side : Cutout,Private,6/3/03 0:00,3,3x3,37.76329368,-122.4216407,Platanus,Platanus x,Sycamore: London Plane,2003,2003-06-03 00:00:00,21
8261,35351,DPW Maintained,Acacia baileyana :: Bailey's Acacia,1274 De Haro St,2.0,Sidewalk: Curb side : Cutout,Private,2/23/98 0:00,11,5x5,37.75364778,-122.4006401,Acacia,Acacia baileyana,Bailey's Acacia,1998,1998-02-23 00:00:00,26
8267,34477,DPW Maintained,Arbutus unedo :: Strawberry Tree,1818 Taylor St,1.0,Sidewalk: Curb side : Cutout,Private,7/15/97 0:00,11,,37.79920587,-122.4139165,Arbutus,Arbutus unedo,Strawberry Tree,1997,1997-07-15 00:00:00,27
8268,254279,DPW Maintained,Cupressus macrocarpa :: Monterey Cypress,80X Junipero Serra Blvd,3.0,Median : Yard,Private,12/24/20 13:32,3,3x3,37.73363503,-122.4718997,Cupressus,Cupressus macrocarpa,Monterey Cypress,2020,2020-12-24 13:32:00,4
8269,5297,DPW Maintained,Ginkgo biloba :: Maidenhair Tree,1600 Divisadero St,3.0,Sidewalk: Curb side : Cutout,DPW,12/7/95 0:00,3,2X3,37.78497847,-122.4397165,Ginkgo,Ginkgo biloba,Maidenhair Tree,1995,1995-12-07 00:00:00,29
8274,50677,DPW Maintained,Prunus cerasifera :: Cherry Plum,320 Clementina St,2.0,Sidewalk: Curb side : Cutout,Private,12/17/09 0:00,6,3x3,37.78207986,-122.4022275,Prunus,Prunus cerasifera,Cherry Plum,2009,2009-12-17 00:00:00,15
8275,33926,DPW Maintained,Magnolia grandiflora :: Southern Magnolia,2050 Divisadero St,1.0,Sidewalk: Curb side : Cutout,Private,3/25/97 0:00,7,,37.78884219,-122.4404764,Magnolia,Magnolia grandiflora,Southern Magnolia,1997,1997-03-25 00:00:00,27
8277,173686,DPW Maintained,Acacia melanoxylon :: Blackwood Acacia,2211 Palou Ave,1.0,Sidewalk: Curb side : Cutout,Private,1/12/17 0:00,3,,37.74047755,-122.402136,Acacia,Acacia melanoxylon,Blackwood Acacia,2017,2017-01-12 00:00:00,7
8281,93051,DPW Maintained,Pittosporum undulatum :: Victorian Box,1555X Fairfax Ave,1.0,Sidewalk: Curb side : Cutout,DPW,1/9/10 0:00,3,3x3,37.74202412,-122.3889676,Pittosporum,Pittosporum undulatum,Victorian Box,2010,2010-01-09 00:00:00,14
8287,10198,DPW Maintained,Eriobotrya deflexa :: Bronze Loquat,1209 Guerrero St,1.0,Sidewalk: Curb side : Cutout,Private,1/25/91 0:00,3,2X2,37.75166612,-122.4227317,Eriobotrya,Eriobotrya deflexa,Bronze Loquat,1991,1991-01-25 00:00:00,33
8289,5345,DPW Maintained,Magnolia grandiflora :: Southern Magnolia,185 Dolores St,1.0,Sidewalk: Curb side : Cutout,DPW,3/21/97 0:00,25,3X3,37.76654486,-122.4264271,Magnolia,Magnolia grandiflora,Southern Magnolia,1997,1997-03-21 00:00:00,27
8290,65965,DPW Maintained,Magnolia grandiflora :: Southern Magnolia,2647 23rd Ave,1.0,Sidewalk: Curb side : Cutout,Private,6/21/90 0:00,7,,37.73825118,-122.4797532,Magnolia,Magnolia grandiflora,Southern Magnolia,1990,1990-06-21 00:00:00,34
8292,29278,DPW Maintained,Lophostemon confertus :: Brisbane Box,300X Portola Dr,22.0,Median : Cutout,DPW,10/14/05 0:00,3,3X3,37.74655273,-122.4473916,Lophostemon,Lophostemon confertus,Brisbane Box,2005,2005-10-14 00:00:00,19
8299,116003,Undocumented,Acacia melanoxylon :: Blackwood Acacia,945 FRONT ST,2.0,Sidewalk: Curb side : Cutout,Private,6/8/16 0:00,3,3x3,37.80014252,-122.4002996,Acacia,Acacia melanoxylon,Blackwood Acacia,2016,2016-06-08 00:00:00,8
8304,86362,DPW Maintained,Arbutus 'Marina' :: Hybrid Strawberry Tree,2515 25th Ave,1.0,Sidewalk: Curb side : Cutout,DPW,12/18/06 0:00,3,3x3,37.74057455,-122.4820492,Arbutus,Arbutus 'Marina',Hybrid Strawberry Tree,2006,2006-12-18 00:00:00,18
8313,43969,DPW Maintained,Pittosporum undulatum :: Victorian Box,460 Natoma St,2.0,Sidewalk: Curb side : Cutout,Private,8/24/00 0:00,4,,37.78079971,-122.4069534,Pittosporum,Pittosporum undulatum,Victorian Box,2000,2000-08-24 00:00:00,24
8314,7660,DPW Maintained,Ulmus parvifolia :: Chinese Elm,3340 Folsom St,1.0,Sidewalk: Curb side : Cutout,DPW,9/23/15 13:35,3,4x4,37.74444126,-122.4134105,Ulmus,Ulmus parvifolia,Chinese Elm,2015,2015-09-23 13:35:00,9
8316,52448,DPW Maintained,Prunus cerasifera :: Cherry Plum,431 11th Ave,1.0,Sidewalk: Curb side : Cutout,Private,12/22/05 0:00,4,,37.78010265,-122.4696633,Prunus,Prunus cerasifera,Cherry Plum,2005,2005-12-22 00:00:00,19
8320,14551,Permitted Site,Maytenus boaria :: Mayten,836 Masonic Ave,1.0,Sidewalk: Curb side : Cutout,Private,3/17/92 0:00,45,3X3,37.77344779,-122.4457625,Maytenus,Maytenus boaria,Mayten,1992,1992-03-17 00:00:00,32
8325,86551,DPW Maintained,Arbutus 'Marina' :: Hybrid Strawberry Tree,1801X 27th Ave,1.0,Sidewalk: Curb side : Cutout,DPW,12/28/06 0:00,8,3x3,37.75380377,-122.4851099,Arbutus,Arbutus 'Marina',Hybrid Strawberry Tree,2006,2006-12-28 00:00:00,18
8334,69477,Permitted Site,Tristaniopsis laurina :: Swamp Myrtle,1630 16th Ave,1.0,Sidewalk: Curb side : Cutout,Private,12/23/14 0:00,3,,37.75742938,-122.4735214,Tristaniopsis,Tristaniopsis laurina,Swamp Myrtle,2014,2014-12-23 00:00:00,10
8336,30442,DPW Maintained,Ficus microcarpa nitida 'Green Gem' :: Indian Laurel Fig Tree 'Green Gem',350 Union St,4.0,Sidewalk: Curb side : Cutout,Private,5/11/56 0:00,14,,37.80101206,-122.405142,Ficus,Ficus microcarpa,Indian Laurel Fig Tree 'Green Gem',1956,2056-05-11 00:00:00,-32
8337,29057,DPW Maintained,Magnolia grandiflora :: Southern Magnolia,400X 11th St,3.0,Sidewalk: Curb side : Cutout,DPW,12/27/05 0:00,3,3x3,37.77054452,-122.4124944,Magnolia,Magnolia grandiflora,Southern Magnolia,2005,2005-12-27 00:00:00,19
8346,115755,DPW Maintained,Arbutus 'Marina' :: Hybrid Strawberry Tree,30 Brunswick St,1.0,Sidewalk: Curb side : Cutout,Private,2/24/16 0:00,3,,37.71191656,-122.4386809,Arbutus,Arbutus 'Marina',Hybrid Strawberry Tree,2016,2016-02-24 00:00:00,8
8349,51630,DPW Maintained,Ginkgo biloba :: Maidenhair Tree,3100ON LYON ST Pacific Ave,1.0,Sidewalk: Curb side : Cutout,Private,7/8/10 0:00,3,,37.79191482,-122.4465266,Ginkgo,Ginkgo biloba,Maidenhair Tree,2010,2010-07-08 00:00:00,14
8351,90290,DPW Maintained,Metrosideros excelsa :: New Zealand Xmas Tree,4825X Balboa St,3.0,Sidewalk: Curb side : Cutout,DPW,4/24/08 0:00,3,3x3,37.77470249,-122.5111315,Metrosideros,Metrosideros excelsa,New Zealand Xmas Tree,2008,2008-04-24 00:00:00,16
8364,93572,DPW Maintained,Agonis flexuosa 'After Dark' :: Peppermint willow 'After Dark',757 04th Ave,1.0,Sidewalk: Curb side : Cutout,Private,3/12/10 0:00,14,,37.7745306,-122.4617453,Agonis,Agonis flexuosa,Peppermint willow 'After Dark',2010,2010-03-12 00:00:00,14
8366,31509,DPW Maintained,Prunus cerasifera :: Cherry Plum,2426 24th St,1.0,Sidewalk: Curb side : Cutout,Private,5/10/95 0:00,6,,37.75321758,-122.4039038,Prunus,Prunus cerasifera,Cherry Plum,1995,1995-05-10 00:00:00,29
8372,13111,DPW Maintained,Ficus retusa nitida :: Banyan Fig,1599 Lombard St,3.0,Sidewalk: Curb side : Cutout,DPW,6/22/94 0:00,24,3X3,37.80085103,-122.427239,Ficus,Ficus retusa,Banyan Fig,1994,1994-06-22 00:00:00,30
8374,258205,Permitted Site,Melaleuca nesophila :: Pink Melaleuca,2434 41st Ave,,Sidewalk: Curb side : Cutout,Private,4/16/19 0:00,3,3x3,37.74134651,-122.4991465,Melaleuca,Melaleuca nesophila,Pink Melaleuca,2019,2019-04-16 00:00:00,5
8376,90926,DPW Maintained,Arbutus 'Marina' :: Hybrid Strawberry Tree,3835 Anza St,1.0,Sidewalk: Curb side : Cutout,DPW,11/10/08 0:00,3,3x3,37.7778655,-122.4894524,Arbutus,Arbutus 'Marina',Hybrid Strawberry Tree,2008,2008-11-10 00:00:00,16
8377,86307,DPW Maintained,Melaleuca quinquenervia :: Cajeput,1491 25th Ave,1.0,Sidewalk: Curb side : Cutout,DPW,12/12/06 0:00,3,3x3,37.75979469,-122.4833825,Melaleuca,Melaleuca quinquenervia,Cajeput,2006,2006-12-12 00:00:00,18
8379,27151,DPW Maintained,Tristaniopsis laurina :: Swamp Myrtle,1725 Silver Ave,1.0,Sidewalk: Curb side : Cutout,DPW,1/2/13 0:00,3,3X3,37.7334939,-122.4039783,Tristaniopsis,Tristaniopsis laurina,Swamp Myrtle,2013,2013-01-02 00:00:00,11
8380,140071,Undocumented,Ceanothus 'Ray Hartman' :: California Lilac 'Ray Hartman',601X Octavia St,2.0,Sidewalk: Curb side : Cutout,Private,11/1/20 0:00,3,Width 0ft,37.77783486,-122.4248578,Ceanothus,Ceanothus 'Ray,California Lilac 'Ray Hartman',2020,2020-11-01 00:00:00,4
8381,85888,DPW Maintained,Tristaniopsis laurina :: Swamp Myrtle,2538 26th Ave,1.0,Sidewalk: Curb side : Cutout,DPW,12/20/06 0:00,3,3x3,37.74009398,-122.4829267,Tristaniopsis,Tristaniopsis laurina,Swamp Myrtle,2006,2006-12-20 00:00:00,18
8385,31954,DPW Maintained,Metrosideros excelsa :: New Zealand Xmas Tree,376 Larkin St,1.0,Sidewalk: Curb side : Cutout,Private,12/28/16 0:00,3,,37.78105077,-122.4169857,Metrosideros,Metrosideros excelsa,New Zealand Xmas Tree,2016,2016-12-28 00:00:00,8
8387,108498,Permitted Site,Prunus serrulata 'Kwanzan' :: Kwanzan Flowering Cherry,762 10th Ave,,Sidewalk: Curb side : Cutout,Private,12/23/14 0:00,3,3x3,37.77400884,-122.4680053,Prunus,Prunus serrulata,Kwanzan Flowering Cherry,2014,2014-12-23 00:00:00,10
8390,26175,DPW Maintained,Tristaniopsis laurina 'Elegant' :: Small-leaf Tristania 'Elegant',1780X Turk St,3.0,Sidewalk: Curb side : Cutout,DPW,3/14/97 0:00,3,4X4,37.78025101,-122.437837,Tristaniopsis,Tristaniopsis laurina,Small-leaf Tristania 'Elegant',1997,1997-03-14 00:00:00,27
8391,14046,DPW Maintained,Platanus x hispanica :: Sycamore: London Plane,1355 Market St,12.0,Sidewalk: Curb side : Cutout,DPW,9/25/89 0:00,12,4x4,37.77728031,-122.4163653,Platanus,Platanus x,Sycamore: London Plane,1989,1989-09-25 00:00:00,35
